3155200;3156240;"03";chegue, não prometo.
3156700;3158920;"03";Quero te agradecer muito, quero agradecer a todo mundo,
3158940;3160660;"03";que fez a migração
3160660;3162660;"03";pro Apoia-se, né, ou pra outro,
3163100;3164620;"03";que não seja mais o PicPay.
3165000;3166840;"03";Falta ainda bastante gente, hein? Estou
3166840;3169120;"03";preocupadíssimo. Façam
3169120;3171180;"03";a migração. Beijo no coração
3171180;3172900;"03";de todos vocês, RPG. Eu acho que só existe porque
3172900;3174900;"03";vocês existem. E Caio,
3175340;3176360;"03";o guachaverso existe?
3176840;3178800;"00, 03";Então, eu recebi um documento aqui
3178800;3181340;"00";e ele afirma que o guachaverso
3181340;3182260;"00";não existe.
3182820;3185040;"00, 03";Obrigado. Talvez, talvez
3185040;3187140;"00, 03";o lucro ainda tenha salvação. Beijo,
3187140;3187400;"03";gente.
3188940;3190940;"unknown";Tchau.
3218940;3220140;"03";Se estiver falando de mim, tu me avisa.
3222080;3222980;"03";Eu ia revisar
3222980;3224760;"03";o texto, mas fiquei vendo anime. Então, torcer
3224760;3225860;"03";que esteja tudo certo.
3227380;3228840;"03";Em um barco nas proximidades
3228840;3230900;"03";de Samoa, por pecadores...
3230900;3231700;"03";Pecadores, ó.
3233180;3234900;"03";Por pescadores...
3234900;3236980;"03";Vocês podem sentir o aroma salgado do mar
3236980;3238700;"03";misturado com fragrâncias...
3238700;3240620;"03";Porra, eu odeio essa palavra. Por que eu uso ela tanto?
3241900;3242300;"04";Aromas.
3244020;3244840;"04";Aromas, ótimo.
3245600;3246400;"03";Você pode
3246400;3248660;"03";sentir o aroma salgado
3248660;3250980;"03";do mar misturado com fragrâncias...
3250980;3252740;"03";Fragrâncias. É porque já tem
3252740;3254680;"03, 02";aroma antes. Misturado com
3254680;3256600;"03, 02";fragrâncias... Vamos lá, Rosal, me faz
3256600;3258580;"03";parecer inteligente. Do mar
3258580;3260820;"03";misturado com fragrâncias...
3260820;3263040;"03";Com fragrâncias...
3263040;3263620;"03";Ficou bom ou não?
3264240;3265540;"04, 03";O Rosal, o que vai dizer?
3266860;3268720;"03";Fragrâncias. Pode sentir
3268720;3270460;"03";o aroma salgado do mar misturado...
3270460;3272420;"03";Cheiros. É final da tarde.
3272540;3274720;"03";Vocês vão ficar no barco e vão dormir pro dia seguinte.
3274940;3276060;"01, 03";Entendi que já tava noite.
3276300;3278620;"03";Eu entendi que era noite. Porra, a descrição tá lá.
3278620;3279100;"03";Ah, desculpa.
3280000;3282560;"03";O pôr do sol se aproxima
3282560;3284620;"01, 03, 02";do horizonte, marcando que o dia está perto do fim.
3284960;3286380;"03";É o primeiro parágrafo da descrição.
3286560;3288020;"01, 03";Ah, desculpa. Bom,
3288440;3290520;"01";a gente tem o barco, mas lá chove.
3290780;3292180;"03";Tem a parte de dentro do barco, né?
3292420;3294040;"01, 03";Ah, eu não sei como é que é o nosso barco.
3294200;3296200;"01, 03, 02";Não é a canoa. Mas é que assim,
3296340;3298620;"01";é que daí...
3300300;3302660;"01, 03";Nossa, eu tava pronta pra dormir e eu entro.
3304140;3305080;"01, 03";Não, não, é um barco.
3305080;3307580;"01, 03";Não, é que assim, eu tenho cabelo e não sei se eles vão ter.
3307580;3308080;"01, 03";Tem cozinha, é.
3308620;3309540;"03";Tem, tem.
3311560;3313580;"01";Agora eu tô com sua mente por amor na cabeça.
3313720;3315140;"01, 03";Só gostaria de dizer isso. Eu também.
3315880;3316520;"01, 04";Parabéns.
3319420;3322060;"04";Chato GPT, nome de mulher...
3322060;3322720;"01, 04";Calma, dois dados.
3323840;3324980;"04";Como é que tu falou pra ela?
3325280;3327360;"01";Eu apontei pra mim e disse, Zaira.
3327980;3328860;"01";E apontei pra ela.
3329400;3330660;"03";Tô enrolando vocês, calma.
3331220;3332960;"01, 00, 04";Você tá fazendo uns suspensos, né?
3333300;3335700;"00, 04";Eu por um segundo olhei pra minha internet aqui.
3335700;3337460;"00, 04, 02";Porque eu tô assim, nossa, caiu.
3338620;3342680;"04";Eu posso ajudar.
3342840;3343820;"04";Tô vendo o que ela tá tentando.
3343920;3345240;"04";Eu posso ajudar e fazer a mesma coisa.
3345380;3348400;"04, 03";Não, não, o erro não é dos personagens, é do mestre.
3349700;3350700;"01";Se for ruim, né?
3350700;3352620;"01";Eu fingi que eu não falei com ela e você...
3353300;3354600;"03";Eu devia ter preparado o nome.
3354840;3355860;"03";Eu sou burro.
3358540;3359560;"01, 03";Nome Samoanos.
3359580;3360960;"01, 03";Ou o nome da novela.
3361960;3363240;"01, 03";Como é que era o nome da mãe?
3363360;3364480;"01, 03";Não, porque ele não batizou a própria esposa.
3364480;3366480;"01, 03";Seria muito bizarro.
3368620;3373800;"04, 03";É, se ela chamasse Jade, eu ia ficar bem preocupado.
3374000;3375360;"03";Voltando, voltando, editor.
3376100;3379940;"00";O Próspero, ele já levanta, assim, enquanto o pessoal for olhar as outras coisas.
3380000;3381760;"00";Ele vai procurar alguém da nossa tripulação.
3381880;3383140;"00, 03";A tripulação são vocês três, né?
3383160;3384960;"00";Não tinha ninguém guiando o barco pra gente?
3385080;3386160;"00";Não tinha, o Bodas.
3386240;3386760;"00";Eu que guiava.
3386780;3387360;"00";Ah, verdade.
3388020;3389560;"00, 02";Você escolheu guiar o barco, ótimo.
3392460;3395760;"00";Tipo, tenta se dar um soco, assim, na perna.
3395960;3397060;"00";E bate, e olha.
3397060;3398440;"00";Na perna dele ou da criança?
3398620;3399740;"01, 00, 03";Na perna dele mesmo.
3399960;3401000;"00, 02";Pra ver se ele tá dormindo.
3401580;3402880;"00";Não, não tá dormindo.
