start	end	text
0	9460	Se eu pegar essa ilha e esse helicóptero, e aí tudo faz sentido, porque aqui tem um zumbi e ali não tinha, e agora?
10120	15000	É isso! É isso! Eu sabia! Eu sabia! O Guaxaverso existe!
15120	15960	Como assim?
16180	18000	Você entendeu a referência do último episódio?
18240	18980	Olha só, faz tudo!
18980	20020	Não, o Guaxaverso sabe o que faz!
20020	20960	Espera, o que é o Guaxaverso?
21000	22980	Era só uma questão de tempo.
23080	24520	O Guaxaverso sempre existiu!
24520	27180	Eu quero entender o Guaxaverso!
27220	28560	Alguém me explica o que é o Guaxaverso?
28560	32020	É, pessoal, não existe o Guaxaverso.
32080	33720	Eu acredito no Guaxaverso!
33760	36560	Mas, supondo que ele exista...
37880	41520	Guaxaverso, onde o que não existe é debatido.
45180	50720	Olá, eu sou Marcelo Guaxinim, narrador, produtor, idealizador, podcast, tradutor de palavras do Guaxinim e...
50720	53620	Andrei, Andrei, Andrei, Andrei...
53620	55900	Pra quem não sabe, o Guaxaverso é o nosso antigo escudo-mestre.
56380	58540	Aqui vamos ler os comentários e discutir as teorias do último episódio.
58560	63120	Que, no caso, foi Metallica e Raccoon, o grande show.
63540	64460	Fique registrado.
64820	65820	Escolha dos jogadores.
66160	67820	Se o bardo aparecer, me xingando de novo.
68240	70020	Não tem nada a ver com isso.
70520	72040	Estou aqui com um dos jogadores.
72180	74900	A prioridade, porque ela está há mais tempo sem gravar, era Rebel.
75580	76580	Mas a Rebel está com tosse.
76700	78260	Manda em xarope, né?
78320	81460	Mas, torçam pela recuperação dela logo.
83420	85540	Infelizmente, vou ter que chamar ela para jogar um outro episódio.
85960	87640	Para ela poder gravar um Guaxaverso.
87640	88160	Olha que triste.
88560	92360	Mas, o nosso convidado aqui, que é a segunda opção, porque a Ranjal gravou há pouco tempo.
92740	93700	E eu não preciso convidar mais.
93960	95120	É o nosso querido amigo Andrei.
95500	95960	Boa noite.
96440	97680	Aoba, boa noite, Guaxa.
97860	98580	Tudo certo?
99040	99640	Tudo certo.
100240	104500	Queria dizer que quem não é padrinho, a gente está gravando agora no Discord só para quem é padrinho.
104940	105920	Para eu não ter que ligar a câmera.
106080	108780	Para desespero do pessoal do Instagram que gostava de fazer os shorts.
109320	110240	E agora está frio, inclusive.
110320	111860	Eu estou vestido contra a minha vontade.
112580	114300	Mas, porra, é tão bom gravar aqui.
114380	115240	Então, a gente fez aqui...
115240	116900	A gente fez um podcast de música.
116900	118400	Tipo, eu e o Andrei ficamos falando sobre música.
118560	119260	A música velha aqui.
119760	123500	E daí o Andrei contou sobre o trauma dele na época da primeira versão de Pantanal.
124040	127820	Que a gente usava o Andei, Andei, Andei até encontrar o Rei do Gado.
128200	129700	E daí virou Andrei, Andrei, Andrei.
130100	131600	Espero que ele tenha superado isso.
131920	134000	Mas, que não fique chateado comigo.
134880	137140	Não, só tem pavor do Vale a Pena Ver De Novo.
137820	138560	Fora isso.
139040	139940	Mas já teve, né?
139980	140380	Recente.
140520	142000	Então, está tranquilo por enquanto.
142160	143940	Pelo menos de dois em dois anos tem, cara.
144660	145200	Rei do Gado...
145200	148540	Mas, assim, tu já está grande o suficiente para as pessoas não ficarem cantando Andei.
148560	149880	Andrei, Andrei, Andrei para você, né?
149900	150420	Ah, não.
150520	151000	Com certeza.
151180	154060	Ninguém mais cita Marcelo Martelo Marmelo para mim.
154320	154920	Não mais.
156020	156420	Realmente.
156560	159540	Tem gente com nome que tem música pior para falar assim, né?
159760	160760	Se pensar desse jeito.
161680	162260	É, porra.
162920	164560	Juliana tem um funk maravilhoso.
164760	165080	É.
165460	166400	Imagina a época da...
166400	167420	Exceto se você chamar Juliana.
167620	169080	Imagina a época da Jennifer, né?
169560	170640	Porra, na Júlia.
170880	171420	Na Júlia.
171820	172160	Paula.
172520	173840	Paula é um funk meio besta.
173980	174680	Não dá para cantar aqui.
174760	177200	Mas, você, Paula, sabe que você sofreu.
177200	178360	Ah, e fora meme.
178360	179940	Porque, tipo, já acabou, Jéssica.
180100	182280	Porra, Jéssica, eles sofreram para caramba.
182800	183200	Exatamente.
183680	185840	Porra, pensando bem, meu nome está de boa.
186120	186580	É, porra.
186600	188260	Eu, graças a Deus, só sofri a gordofobia.
188400	188740	É isso.
188980	191240	Nesse clima bacana, Andrei, como é que as pessoas te acham na internet?
191760	196280	Cara, pode me achar no Instagram como Andrei Brás.
196780	200400	Eu também, há algum tempo, já estou ajudando...
200400	205740	Estou gravando uns áudios para o Luco, que ele está com o podcast dele, o Naus, né?
206500	207020	Procurem lá.
207020	207940	Naus do arquivo.
207940	210220	Procurem, já tem dois episódios, né?
210700	211180	Exatamente.
211360	212520	Eu apareço no segundo.
213000	213220	Isso.
213300	214540	Mas, escuta, tem o primeiro também, gente.
214780	215020	Isso.
215520	216240	É três.
216600	217620	O Luco mandou aqui.
218000	219440	O primeiro não conta, né?
219480	221280	O primeiro era um teaser.
221840	222300	Ele conta.
222560	224040	Vamos ver a resposta de Luco.
225840	227800	Dois arquivos de audiodrama e de RPG.
227880	228380	Estou atrasado.
228440	229880	Eu troquei de celular recentemente.
230220	231200	Vou usar isso como desculpa.
231420	232060	Eu estou atrasado.
232440	234160	Eu não ouvi ainda o do Buraco Atrás do Posto.
234260	236280	E a nossa amiga Agatha Sofia também.
236280	237320	O de Kotor.
237320	239020	Porque sempre que eu chego nele, eu olho.
239140	240700	Puta, quatro horas e meia, né?
241100	242700	De um jogo que eu não joguei.
242820	243320	Aí eu jogo.
243680	246600	Eu clico nele e jogo para o final da fila.
247100	248420	E fora que, né?
248740	249220	Porra.
249660	253820	Os institutos federais, as universidades federais, no momento desta gravação, estão em greve.
254300	255780	Então eu tenho...
255780	257240	Eu tinha ouvido menos podcast.
257600	257880	É isso.
257940	259180	Fiquei em greve do podcast também.
259440	263740	Eu estou escutando o Buraco Atrás do Pôster do Resident Evil 6.
264320	264720	Nossa.
265260	265680	Realmente.
265680	266340	Esse eu ouvi.
266440	266820	Esse eu ouvi.
267320	268760	Para mim, falta o do Kotor só.
268840	269620	Falta o do Kotor.
270120	270400	Acho.
270540	271380	Falta só o do Kotor.
272180	274900	Tanto que eu pulei e eu ouvi o depois dele.
275400	277180	Que eles fazem recomendações e tal.
277400	277960	Ah, muito bom.
278060	279640	Fala de Pluto, etc e tal.
280060	281820	Mas deu de propaganda os outros.
281880	283100	Não estamos recebendo para isso.
284180	286620	E eu queria, falando em propaganda, eu queria fazer um programa de mim.
287080	291880	O aniversário da RPG Guaxa foi na sexta-feira, dia 26...
291880	293160	5, 4, sei lá.
293580	294640	5, acho.
295060	295760	Fez 6 anos.
296000	297160	E porra, eu pensei.
297160	299460	Eu vou preparar um post no Twitter.
299980	306500	Vou lá no Telegram pedir para o pessoal fazer aquela corrida para mais apoio, né?
306520	308560	Porque o Padrim já não vem no mês que vem.
308640	310120	Então a gente vai ter uma queda aí na produção.
310820	312640	E o Zorzal recebeu um pequeno aumento.
312740	313840	Ele merecia mais, inclusive.
314700	319160	Mas, assim, chegamos a um ótimo acordo, né?
319560	320520	Ele falou que está o tanto.
320580	321000	Eu falei, ok.
321180	322120	Esse foi o acordo que a gente fez.
322180	323200	Eu sou um péssimo negociador.
325000	325360	Mas...
325360	326520	Então, assim, peço.
326700	327140	Peço para todos.
327160	327800	Para todos vocês.
328340	332120	O pessoal que não migrou ainda, pelo amor de Deus, vai lá.
332500	332860	Migra.
333520	336180	Eu pensei, assim, deixar para quem já é padrinho.
336300	337300	Continuar os 10 pila.
337780	339080	E, sei lá, para novos padrinhos.
339280	341740	Eu estou vendo os outros podcasts cobrar 15, 12 no mínimo.
342320	344260	Tem podcast, porra, 20, sei lá.
344700	349800	Para ser um curuja ouro no Felipe Neto é 15, 14, 90.
350160	352220	Nem sei o que ganha sendo um curuja ouro.
352640	353380	Então, assim...
353380	354780	Então, porra, está defasado.
355140	356160	Mas, porra, eu fico com preguiça.
356160	356700	Eu fico com preguiça.
357160	358940	Porra, será que você não vai afastar as pessoas novas?
359300	362260	É tão legal a vibe que a gente tem lá no grupo de padrinhos, né?
362260	365900	Sempre entrando uma pessoa, trazendo uma dinâmica diferente e tal.
366480	367600	Então, porra, peço.
368060	370400	Assim, grupo de padrinhos que está com muita gente.
370920	373160	E eu olho o número de apoiadores do Apoia-se.
373660	375640	E do Somo com Orelho e etc e tal.
376120	381500	Porra, tem muita gente lá que não estava nem no padrinho para migrar.
381640	383220	Que ele só esqueceu faz um tempo.
383600	384600	Não estou cobrando.
384600	386680	Não estou dizendo que tem controle.
387160	390460	Que vou fazer um controle para expulsar todo mundo por enquanto.
391560	393700	Embora não tenha, sei lá, não tenha pretensão disso.
393940	395580	Por enquanto, vamos manter a ameaça.
395940	397280	Mas, porra, mantém lá.
397520	399860	Se não consegue dar os 10 pilas, quer continuar no grupo?
400260	401480	Põe 5, põe 1 real.
402160	404440	Você, você que não pode apoiar 10 reais, põe 1 real.
404520	405300	Todo mundo põe 1 real.
405380	406620	Vai lá no Apoia-se.
407100	408240	Tu pode pôr 1 real, gente.
408300	408860	Põe 1 real.
408940	409460	1 real só.
409760	410440	1 real já ajuda.
410800	413800	Porque se eu ganhasse 1 real de cada ouvinte que eu tenho, eu vejo aqui os números.
414260	416560	Porra, estava mais tranquilo aqui o negócio.
416920	417000	Então...
417000	417120	Então...
417120	417140	Então...
417160	417760	Então, porra, 1 real.
418120	420220	Você que apoia com 10, se você quiser.
420380	421100	Não estou cobrando.
421260	421880	Já é maravilhoso.
422260	424480	Então, no Apoia-se, trocar de 10 para 11.
424840	425420	Porra, show.
425880	426020	Show.
426460	430720	Quem assina pelo Apoia-se, no próprio Apoia-se tem um post com o link para o Telegram.
430780	434500	Você não precisa esperar eu mandar e-mail, porque eu demoro anos para mandar e-mail.
436140	438760	Eu acho que está um mês já de demora atual.
439240	441720	Então, assim, porra, quer entrar no grupo direto?
442040	442880	Vai pelo Apoia-se.
443120	446040	Se por algum motivo você já tem conta na Aurelo, você pode assinar pela Aurelo.
446280	447080	Eu vou te mandar.
447080	448840	Vou te mandar por e-mail o link do grupo, né?
449440	452080	Onde eu sei não dá para mandar diretamente pela Aurelo.
452140	453080	Vou dar uma olhada nisso.
453540	456000	Mas, vou te mandar no e-mail.
456160	458020	E se eu demorar muito, me xinga lá no...
458020	458500	Me xinga não.
458920	460940	Me marca no Twitter, que eu olho.
461460	462640	No arroba Marcel Gostininho.
462720	463280	Estou sempre olhando.
463760	465340	Duas, três no máximo.
466020	468680	Eu estou te colocando lá, mandando e-mail para te entrar no grupo.
469000	469480	É isso aí.
469480	470240	Outra maneira...
470240	472400	O Andrei, por exemplo, é nosso padrinho, não é verdade, Andrei?
473080	473940	Cinco anos já.
474340	474780	Cinco anos.
474840	476000	Nem tem tudo isso em podcast.
476300	476840	Fez seis.
476840	477420	Fez seis recentemente.
477780	478540	Então, porra.
478620	481340	Eu chuto cinco, mas eu nunca lembro a data certa.
481500	485140	Eu sei que eu entrei um pouquinho antes ou quase junto com a Ju.
485580	486120	Olha só.
486600	488060	A Ju onde chegou e tu está aí.
488520	488760	É.
489700	490420	É isso aí.
490440	490780	Muita porra.
490800	491640	Tu gravou o episódio.
492100	494440	Tanta gente que entrou e nem, porra...
494440	495260	Eu nem lembro o nome.
495420	497240	O teu, porra, eu não lembro o nome, mas te chamo para gravar.
497320	497900	Olha que bonito.
498260	498500	É.
498660	499980	O meu até que foi...
499980	502660	Agora eu sempre vou lembrar do...
502660	504520	Eu vi um berrante e eu vou lembrar do teu nome.
506840	510120	Porra, eu não sei se isso é bom ou é ruim, mas eu vou interpretar como bom.
511180	514540	Assim, outra maneira de você ajudar o RP Guaxa é seguir a gente nas redes sociais.
515020	516680	Arroba Marcelo Guaxinim, arroba RP Guaxa.
517160	521440	No Blue Sky, no X e no Instagram.
522440	526100	Preferencialmente, assim, se tu tiver que escolher um, Instagram, arroba RP Guaxa.
526460	527520	Porque as meninas são incríveis.
527660	529260	É o nosso principal carro-chefe ali.
529780	531400	E também...
531400	532940	Ah, escuta pelo Spotify.
532940	535280	Não sei porquê, acho horrível aquela...
535280	536400	Aí o ah, tá dele?
536840	540700	Mas se tu escuta pelo Spotify, porque tem que ouvir pelo menos um pedaço do episódio.
541040	543520	Ou se não escuta, baixa o Spotify e deixa tocando um episódio.
544000	545400	E daí tu vai lá e dá cinco estrelas.
545920	546840	Deixa um comentário.
546920	548400	Acho que pra deixar comentário não precisa nem ouvir.
548920	553620	E os melhores comentários eu vou aprovando, é que eles não dão muito spoiler, nem tem algum problema.
554840	558180	Então eu vou aprovando, você pode aparecer lá como recomendação pras outras pessoas.
558480	562340	E a sua estrelinha acaba ajudando muito o RP Guaxa.
562340	564840	Acho que o que eu tinha pra dizer era isso.
565400	566340	E vamos à leitura de...
566840	567840	Comentários.
568120	568440	Bora.
568480	570720	Primeiro comentário, Jorge Marcos Santos Silva.
571200	574940	Esse final foi um daqueles que me fez querer muito saber como continua.
574940	577520	Talvez a gente cite um dia o que acontece depois.
578080	580120	Mas dificilmente...
580120	584060	Ou não, assim, existe um caminho que talvez eu possa seguir pra esses personagens.
584680	585980	Talvez uma redenção.
586440	586820	Talvez.
587340	589660	Mas, por enquanto, não está planejado.
590080	590860	Pô, André, quando...
590860	592080	Olá, senhor Guaxa, que sou eu.
592520	593740	Convidados, que é o André.
593840	594300	Olá, André.
594540	594960	Aúba.
595920	596800	E Guaxual.
596800	597940	Tudo bem, queridos?
598200	598640	Tudo bem comigo?
598720	599320	Tudo bem contigo, André?
599660	600980	Tudo certo, graças a Deus.
601520	602800	A gente tem que fazer um miçanga sobre...
603980	604800	Sanejo Antigo, hein?
605880	606380	Muito bom.
606400	607020	Me lembra disso.
607140	608120	Me lembra disso que a gente faz.
608240	608700	Pode deixar.
609200	611020	Minha média está realmente muito ruim.
611320	611940	Ele continua.
612380	613580	Mas lembro do episódio...
613580	614120	Não, de novo.
614460	615100	É minha média.
615640	616400	Deve ser memória.
616540	617720	E o corretor dele saca nele.
618280	620360	Minha memória está realmente muito ruim.
620620	622000	Mas lembro do episódio da música.
622440	624340	Só não lembro se tinha ligação com o Tulo e Azul.
624440	624700	Tinha?
624700	624780	Tinha.
625360	625880	Tinha.
625880	626940	Porque a pesquisa...
626940	628680	Assim, tinha aquela leve, né?
629160	636360	A pesquisa foi feita com materiais do mesmo lugar que veio o ritual do episódio de Tulo e Azul.
636540	637200	Pelo que eu lembro.
637780	644880	Esse antigo é o mesmo da vila de aposentados que estava usando para fazer o outro corpo do Cuco?
645240	645500	Não.
645980	647440	O que aconteceu depois desse show?
647540	649120	Digo, uma quantidade enorme de pessoas morreram.
649200	649460	Isso.
649800	651200	Como isso ficou para o resto do mundo?
651640	653500	Talvez a gente aborde isso num episódio futuro.
653500	655800	Mas, assim, não tem como esconder.
655880	658860	Tipo, é muita gente que se perdeu ali.
659320	663200	Foi, sabe, um desastre difícil de ser explicado.
663280	665420	Inclusive, os governos vão ter trabalho.
665760	668740	Talvez, obviamente, os governos podem, sei lá, com um vazamento de gás,
669240	674200	um atentado, sei lá, com uma bomba nuclear para poder isolar o lugar.
674620	678080	Ou talvez uma aventura de detetives tentando descobrir o que aconteceu.
678560	681380	Mas é complicado porque esses detetives ouviram o episódio, né?
681460	682060	Então...
682060	683940	Inclusive...
683940	685740	Mas eles não sabem o que aconteceu.
685880	687760	Eles sabem que aconteceu alguma coisa.
688180	690560	Sim, mas, assim, os próprios militares sabem, né?
690620	692040	Que eles começaram essa loucura toda.
692380	693680	Talvez eles queiram abafar.
694180	695300	E o militar faz isso, né?
695320	699220	É, pode ser uns teóricos da conspiração, então, tentando descobrir a verdade.
699620	700560	E, assim...
700560	700920	Eu tô...
700920	704360	A minha média tá pior que a do Jorge.
704520	705660	Deixa eu só voltar aqui.
706060	707140	Não lembro, mas vamos continuar.
707580	708860	Alguém ficou sabendo o que rolou ali?
709200	710240	Assim...
710240	712800	Ah, devia ter gente streamando na hora.
713280	713880	Então vai ter...
713880	714560	Assim...
714560	715160	Dá pra ocultar?
715160	715640	Dá pra ocultar?
715640	715740	Dá pra ocultar?
715740	716620	Mas vai dar trabalho.
717180	718120	Lembrei o que eu ia falar.
718600	719840	O nosso querido amigo Basso...
719840	721060	Vou entregar aqui o amigo do Andrei.
723300	723700	Ele...
723700	725400	Pô, ele conversando sobre o episódio comigo.
725540	725920	Ele falou...
725920	726780	Poxa...
726780	730380	No fim, eu não cheguei à ligação dos episódios.
730720	733200	Porque no original da Violinista, ele joga, né?
733640	734240	Aí eu falei...
734240	736800	Então é a segunda vez que tu não resolve o mesmo caso.
739640	740420	O Andrei não riu.
740540	740880	Ele tá...
740880	742200	Foi mal, foi mal.
742320	744440	É que eu vi que tava meio embaçado no meu computador.
744440	744920	Não entendi.
745020	745500	Daí que eu percebi...
745500	746360	Eu percebi que eu tô sem óculos.
747620	748520	Ok, banido.
748820	750000	Alguém que for sabendo o que rolou ali...
750000	750640	Pô, tá, isso já foi.
751100	752820	E se sim, como o mundo reagiu a isso?
752920	753440	Então, como eu falei...
754080	755900	Vai ter que descobrir isso no episódio futuro.
757460	757780	É...
757780	759860	Se os militares vão tentar abafar...
759860	762160	Talvez uma aventura em que os jogadores estão...
762160	763440	São, sei lá, jornalistas...
764000	766200	Ou parentes das vítimas querendo contar a verdade.
766640	770020	Assim, dá pra ter uma série gigante de aventuras que saiam daqui.
770520	771440	Não prometo nada...
772240	773060	Mas, porra...
773060	774180	Sim, espaço temos.
774440	775180	Nossos queridos músicos...
775500	776600	Se meteram nessa como?
777060	779800	Como voltaram os experimentos do exército?
780240	782000	Então, o exército enganou...
782000	783980	Eles fingiu que era...
783980	785720	Que eles foram contratados pra um show.
786400	788200	Fizeram eles terem um acidente na estrada.
788820	790880	Forjaram lá o carro deles amassado.
791440	793420	E, de alguma forma, fizeram um acordo...
793420	794820	Ou obrigaram eles...
794820	796540	A decorar a música...
796540	798140	Ou tocar, sei lá, a partitura...
798140	798580	Num show.
798980	800400	O que eles faziam no show...
800400	802580	As pessoas lá do experimento que eram...
802580	804720	O pessoal que tinha a ficha, né?
805500	806880	Não que isso seja um motivo pra acontecer.
806960	807940	Mas, pro exército era, né?
808340	809480	Essas pessoas morreram.
809780	811340	Quem tava em volta...
811340	812100	Enlouqueceu.
813960	815940	Daquele monte de pessoas que morreram...
815940	817800	Surgiu a serpente lá, inicial.
818420	819180	Morreu uma galera.
819280	821060	O próprio cientista que tava muito perto da banda.
821440	822700	Foi o que mais enlouqueceu.
823020	823940	E os jogadores também.
824120	825180	Tanto que os jogadores...
825180	827680	Eles perdem a memória.
828100	830380	Tanto que a aventura se passa com a ideia de que...
830380	832500	A cena deles depois do acidente...
833020	833980	É o show no final.
834460	835480	Então, é como se no fim...
835500	836360	No final...
836360	838400	Eles tivessem uma lembrança de mais ou menos...
838400	839760	Como chegaram ali...
839760	841320	Pra entender o que ia acontecer.
841780	843100	Como se a entidade estivesse...
843100	845960	Olha, tô devolvendo aqui parte da memória de vocês.
846380	848100	Porque eu quero que vocês entendam...
848100	849680	O que vocês estão fazendo agora.
850400	852300	E daí, a aventura em si...
852300	853440	São essas memórias voltando.
853900	855040	Na minha cabeça fazia sentido.
855200	855840	Faz sentido, André?
855920	857160	Faz sentido, sim.
858940	859300	É...
859300	860340	É tipo Black Mirror.
860380	861360	Tu já morreu da minha piada.
861540	861680	Hã?
861780	863520	Se tu tivesse discordado de mim, porra...
863520	864140	Era Strike 2.
864140	864520	Não, não, não.
864700	865480	Faz total sentido.
865500	865940	Faz total sentido, sabe?
866160	868400	O que aconteceu é a lembrança deles voltando.
868500	869620	Pra mim, faz total sentido.
870120	870280	Ok.
871140	872200	E o que aconteceu com eles agora?
872520	873220	Um dia a gente descobre.
873540	875400	Poderia perguntar muitas coisas.
875620	876480	Mas vou parar por aqui.
876820	877820	Para não ficar gigante.
878280	879560	Todos foram incríveis nesse episódio.
880060	881360	Me arrepiei aqui.
881800	883160	Mas a edição foi primorosa.
883240	883600	É verdade.
883940	886980	As coisas em formato do grande mal vindo do céu para todos.
887420	888160	Por hoje é isso.
888320	889420	Forte abraço a todos.
889560	890660	Força e luz a todos nós.
891060	891680	E até mais.
892260	892700	Abraço.
892820	893420	Até mais, querido.
893420	895420	O próximo comentário é do...
895500	896240	Desistindo.
896700	897680	Quando faz as frases, vai.
898120	899960	Ele faz uma...
899960	900460	Perdão?
900620	900880	Não, não.
901000	902160	Assim, tô desistindo.
902260	903040	Qual é a frase do Bing?
903480	904020	Não entendi.
904260	904700	Perdão.
906480	907460	Tô desistindo.
907520	908820	Por favor, não desista, querido.
908920	909320	Ah, é?
911540	913400	Ele faz uma musiquinha, né?
913820	916200	Um lanche legal é o que nós queremos.
916760	920080	A cada alguns anos é o que nós precisamos.
920560	921560	Não vão em shows.
921560	925260	Vocês nunca sabem o tipo de bichos que podem querer se alimentar de vocês.
925500	926440	Olá, Guaxa.
926540	927240	Olá, Guaxa...
927240	928200	Guaxomun...
928200	928720	Perdão?
928940	930660	Essa é a mensagem do episódio, não, Guaxo.
931660	935740	Ainda mais se for em um lugar desconhecido que você tem que andar numa estrada de terra
935740	937460	onde não tem nada em volta, né?
937860	938860	Já começa errado aí.
939360	940100	Olá, Guaxual.
940500	942020	Olá, Guaxovidade.
942120	943700	Guaxovidade do dia.
943920	944420	Olá, Guax...
944420	944800	E...
944800	945720	Olá, Guaxa.
945820	946220	Guaxa.
946820	948200	Como todos vocês estão?
948540	949040	Eu tô bem.
949520	950140	Tudo em cima?
950620	951000	Muito.
951080	953720	Assim, gravidade 40 anos já, né, gente?
954020	954280	É.
954800	955380	Trinta e...
955380	955480	Trinta e...
955500	956160	Trinta e três.
956380	957300	Eu imagino.
957700	958820	Pilates com a boba?
959400	959780	É.
960600	962440	Hemoglobina na faculdade dos monstros?
963020	963540	Herbologia.
963760	964720	Herbologia, perdão.
965180	967120	Minha dicção é de uma criança de cinco anos, gente.
967200	967600	Desculpa.
967960	969760	Herbologia na faculdade dos monstros?
970240	971020	E não desistam.
971320	975320	Quem sabe um dia vocês se tornam entidades poderosas como o Big N.
975800	976300	É verdade.
976540	980160	Se você tentar muito, se você acreditar, provavelmente não vai conseguir.
981120	983300	O próximo comentário é da Maria Clara.
983300	985380	Eu realmente não esperava um episódio...
985380	987700	Um episódio de terror vindo desse título.
988220	990220	Volto a dizer, título, ideia do jogador.
990640	992740	Oi, Guaxa, convidados, padrinhos e ouvintes.
992760	993440	Todo mundo vivo?
993580	993760	Sim.
994060	995280	Sim, à medida do possível.
995760	997300	Oi, Maria do Futuro, que tá no feed.
997640	998600	Ok, perfeito.
998940	1000000	Estou traumatizada.
1000200	1007460	Eu não esperava a volta desse mundo, dessa música, que me assusta mais do que bailarina,
1007940	1009260	com a boba cantando.
1009720	1013980	Nota que nunca escutamos essa música inteira, porque ela pode nos matar.
1013980	1015100	Só parte delas.
1015380	1018860	É, Guaxa, você tinha que ter arrumado um jeito de eles saírem dessa.
1019180	1020260	Eles não queriam.
1020460	1023460	Fora que eu sei como é viver muito tempo automático.
1023660	1024460	E isso é agoniante.
1024660	1025300	Não é justo.
1025500	1026000	Sim.
1026200	1026700	Sim.
1026900	1027400	Porra.
1027600	1028100	É...
1028300	1033900	Ela é temática do episódio, sinto muito, peço desculpas, prometo que a ideia da redenção
1034100	1038100	tá no topo da minha lista, embora provavelmente eu não vá fazer a continuação.
1038300	1044820	Enfim, todos muito bons, mesmo provavelmente eu demorando pra dormir, porque foi muito
1044820	1045900	difícil pra processar.
1046100	1047100	Amei.
1047300	1048300	Beijinhos.
1048500	1049500	Relaxa, Guaxa.
1049700	1050700	As coisas vão melhorar.
1050900	1051900	Tchauzinho.
1052100	1053100	E ela deixou um emoji de beijinho.
1053300	1054300	Emoji de beijinho.
1054500	1055500	Maria Clara, muito obrigado por esse comentário.
1055700	1056700	Beijo.
1056900	1057900	O próximo comentário é do Stênio Medeiros.
1058100	1059100	Olá, grande Comuni...
1059300	1060300	Comuni Guaxa.
