start	end	text
2600960	2601860	Estão vazios.
2602180	2603380	Estão abertos e vazios.
2603920	2606260	Dá pra supor que provavelmente haviam bonecas
2606260	2608300	ali dentro. Mas não há bonecas
2608300	2609460	naquele cômodo.
2610000	2611880	Há alguns quadros do casal, né?
2611940	2613800	Do Jack e da esposa.
2614120	2615960	Te chama a atenção que
2615960	2617980	nas fotos que tem a mulher que atirou em vocês
2617980	2620260	que abriu a porta lá embaixo
2620260	2622260	o Jack tá uns 20 anos mais novo.
2622600	2624060	E que existem algumas fotos dele
2624060	2626100	mais recente e que
2626100	2627880	dá pra ver que é aquela mulher do lado dele
2627880	2629900	mas é uma mulher mais velha.
2629900	2631900	Por que que parece que aquela mulher
2631900	2634060	que atirou na gente é tipo uma super boneca?
2634420	2635860	Ah, Jones,
2635960	2637820	tá muito claro. Ela era
2637820	2639880	uma bonecona. Um robô
2639880	2641500	também. Só pode ser isso.
2641660	2644000	Isso é... Não é assustador.
2644080	2646040	É nojento. Isso é muito nojento.
2647140	2648060	O Dimitri
2648060	2650200	ele tá meio, assim, assustado.
2650440	2651900	Ele quer olhar, guaxa, se tem...
2652600	2654080	Ele vê alguma chave,
2654320	2656020	alguma gaveta, assim, perto
2656020	2658360	de uma... daquelas mesinhas de cabeceira.
2658580	2660280	Ele tá pensando no porão
2660280	2661720	se aquele porão dá pra abrir
2661720	2663840	direto ou ele tá trancado. E se tiver trancado
2663840	2665120	se tem alguma chave por aí.
2665440	2667880	Tu não vê nada, assim, que tem chaves
2667880	2669980	de... Nesse andar não tem nada, né?
2669980	2671620	Mas lá na cozinha tu viu chave
2671620	2673520	de um jipe, né? De que tá
2673520	2675600	na garagem. Isso é uma chave de um carro.
2676160	2677360	Algumas chaves menores.
2677920	2679800	Mas nada, assim, nesse andar, nada que te chame
2679800	2682080	atenção. Ok, então é melhor agirmos
2682080	2683820	rápido porque além das bonecas
2683820	2685720	que vamos ter que lidar, tem a polícia
2685720	2688060	chegando, né? Vamos descer?
2688620	2689920	Alguém pega a chave dos jipes
2689920	2691700	para fugir e o resto vai pra casa?
2691720	2693780	Para o porão. Comigo, de preferência.
2694120	2695580	Eu não vou lá sozinho, não. Mas por que a gente precisa
2695580	2697760	do jipe? A gente tem o nosso método
2697760	2699100	de saída. Vem de carro.
2699480	2701740	É verdade, né? O nosso carro tá mais fácil de sair
2701740	2702980	provavelmente do que o jipe. É, a gente tem a chave dele.
2703280	2705240	É, então esquece. Porta partida.
2706340	2708040	E o portão tá fechado, né?
2708080	2709440	A gente teria que coisar o portão também.
2709660	2711260	É verdade. Desculpa, eu estou nervoso.
2711380	2713700	Eu não sei lidar com isso. A gente fechou
2713700	2715380	a cozinha, né? Quer dizer, vocês fecharam a cozinha.
2715900	2717420	Então é mais difícil entrar agora.
2717620	2719660	Vamos para o porão. Rápido, rápido.
2719660	2721560	Ah, Melina, você...
2721560	2723320	Me parece a pessoa mais forte desse grupo.
2723480	2725420	Por que você não vai na frente? Dimitro
2725420	2728120	e o meu cachorro vão no meio e eu posso ir na retaguarda.
2728400	2730200	Eu não sou tão forte, mas eu dou uns socos bem.
2730260	2731240	Concordo com esse plano.
2732100	2733780	Tudo bem, tudo bem. Eu posso ir na frente.
2734100	2735660	E aí eu vou descendo...
2736480	2737540	A gente vai olhar
2737540	2739880	algum outro quarto aqui ou vamos direto pro porão?
2740080	2742020	Vocês dão uma olhada ali nos quartos.
2742480	2743720	Dá pra ver que os quartos não são
2743720	2745300	usados há um bom tempo.
2745940	2748020	Mas nada assim que chame muita atenção.
2748360	2749860	Ok, nada por aqui.
2750060	2751540	É melhor descermos mesmo.
2751560	2753340	A Melina desce na frente
2753340	2755620	com a arma apontada.
2755920	2757580	Vocês vão até o primeiro andar lá, procuram
2757580	2759960	a escada que vai pro porão. É isso, né?
2761140	2763720	O porão, ele tem
2763720	2765140	trancas, né? Mas vocês
2765140	2767720	conseguem abrir facilmente ali.
2767940	2768700	Quem tá na frente?
2769340	2771220	A Mel tá na frente. Então, Mel,
2771360	2771760	dois dados.
2773140	2775100	Eu tirei seis e cinco.
2775460	2777480	Você espera pra perceber. É, pra perceber.
2779480	2779920	Tá
2779920	2781540	descendo a escada, Melina,
2781560	2783600	tu tá na frente. Quando chega ao
2783600	2785520	final dela, a casa é uma casa
2785520	2787780	grande. Ela tem um
2787780	2789840	porão relativamente grande
2789840	2791800	ali, com algumas divisórias.
2792360	2793460	Essa primeira área
2793460	2794980	no final da escada
2794980	2797400	parece ser um depósito com
2797400	2799740	peças, coisas metálicas,
2799860	2800580	engrenagens.
2801360	2803420	E te assusta por um momento.
2803940	2805740	Tu vê aquela mulher que atirou em vocês.
2806000	2807560	Ela é parada num canto.
2808220	2809420	Mas tu nota, assim,
2809420	2811260	ao olhar,
2811560	2813320	que, embora seja o rosto
2813320	2814040	dela,
2814760	2817400	é como um grande manequim
2817400	2819540	incompleto. Faltam os braços e as
2819540	2821580	pernas, e ela tá pendurada, assim,
2821620	2823240	com a cabeça abaixo, na parede.
2823480	2825520	Ela dá uma parada, assim, no final da
2825520	2827580	escada, e aí ela aponta
2827580	2828640	pra eles, assim, e fala
2828640	2831620	é, realmente, acho que esse aqui
2831620	2833340	aquela mulher era uma
2833340	2835560	grande boneca robô
2835560	2837800	e aqui talvez fosse o protótipo
2837800	2838020	dela.
2841560	2842360	Muito engenhoso.
2842540	2843960	O Dmitry se aproximou pra olhar?
2844240	2846620	Sim. Ele tá, tipo assim, a Melina tá com a arma
2846620	2848320	na frente, ele tá nas costas da Melina, sabe
2848320	2850500	com a mãozinha, assim, no ombro? Olhando, assim,
2850520	2852580	do lado? Ele tá olhando lá pra dentro pra ver se ele acha
2852580	2854540	algum computador ou algum
2854540	2856480	central que controle, né,
2856500	2858160	essas bonecas aí. Ele consegue identificar.
2858460	2860320	Tu nota que essa
2860320	2862380	boneca pendurada, ela tem
2862380	2864540	uma... um dos olhos
2864540	2866360	dela tá meio afundado, assim, o rosto
2866360	2868520	tá meio rachado. Mostra
2868520	2869940	alguma imperfeição ali.
2869940	2871840	Ah, tu nota que algumas das coisas
2871840	2874380	que tão ali, desses equipamentos
2874380	2875840	tem muitas peças
2875840	2877760	de boneca. Cabeça,
2877940	2880080	oelhinho, bracinho,
2880180	2881760	muitas peças ali soltas
2881760	2883600	e separadas, né. Tu nota
2883600	2884500	mais
2884500	2887760	peças de uma boneca
2887760	2889940	dessa grande, né, da mulher que atirou
2890500	2892040	naquele
2892040	2892960	cômodo ali.
2893780	2895520	E tem uma porta.
2895880	2897980	Essa é uma porta com senha.
2897980	2899780	É uma porta eletrônica.
2899940	2902140	Parece guardar o principal ali
2902140	2903360	daquele andar.
2903460	2905440	É isso, meninas. Eu acho que é lá.
2905640	2907940	Vocês precisam me dar cobertura.
2908480	2910020	Usem tudo. Tudo que puderem.
2910300	2911660	Precisamos chegar naquele ponto.
2911900	2913520	Guaxa, tem mais alguma coisa ali?
2913720	2915800	Tipo, móveis, alguma coisa que...
2915800	2917200	Algo posso esconder atrás?
2917500	2919060	Tu dá uma olhada por ali,
2919520	2921620	procurando nada, assim,
2921780	2923500	nada escondido. Não, certo.
2923580	2925900	Porque senão ela ia colocar o Adam pra farejar.
2926200	2927820	O Adam tá bem inquieto ali,
2927820	2929280	mas tá do teu lado.
2929940	2930600	O certo, então.
2930960	2933600	E aí, vamos de assalto? O que vocês acham?
2934540	2936400	A porta que a gente tem que ir
2936400	2936960	tá trancada, né?
2936980	2938160	Tem uma tranca eletrônica.
2938500	2941820	Ela parece uma porta que daria pra derrubar
2941820	2944760	com um chute, ou parece uma porta muito resistente?
2944980	2946160	Pra ti, que é uma pessoa forte,
2946260	2947980	tu acha que conseguiria
2947980	2950220	arrombar esta porta com um pouco
2950220	2951760	de esforço,
2952120	2953420	como o Dimitro acha.
2953820	2956060	Talvez ele conseguisse, com os conhecimentos dele
2956060	2958120	de eletrônica,
2958380	2959780	de hacker e tal,
2959940	2961620	ele conseguiria abrir ali
2961620	2963780	e eletronicamente
2964340	2965780	abrir aquele controle.
2966980	2968340	As duas opções são válidas.
2968680	2970160	Cada um de vocês tem uma ideia dessa.
2970600	2971700	A June, que é um atributo
2971700	2973820	meio de caminho, não sei o que ela acha que é a melhor opção.
2973840	2976060	No caso, a June, ela...
2976060	2977480	Se ela percebesse que a Mel
2977480	2979860	tá considerando abrir na força,
2980480	2981840	ela só ia, tipo, encostar assim
2981840	2983080	no braço da Mel e falar
2983080	2985480	guarda sua força, a gente pode precisar.
2985760	2987340	Deixa que o celular ele trabalhe.
2987340	2989420	É, aí tá com o notebookzinho já abrindo assim,
2989940	2990260	e elas...
2990260	2993920	Não, pode deixar, pode deixar. Era só uma segunda opção.
2994260	2995540	É. Se ele não conseguir,
2996640	2997720	a gente vai na força.
2998380	2999000	E aí ela sorri.
2999200	3001220	Quanto mais rápido passarmos, melhor.
3001440	3003840	Vamos correndo. E se alguma coisa se mexer,
3004140	3004520	atire.
3004940	3007420	O Dimitro, então, vai arrombar a fechadura
3007420	3009320	com o computador, né, vai hackear
3009320	3010380	a fechadura.
3010700	3013200	É um homem capaz de fazer um
3013200	3015860	robô dessa complexidade.
3015860	3017940	Ele criou um bom...
3017940	3019720	uma boa tranca ali, rola um dado,
3019940	3022060	mas tu só falha se tira um.
3022360	3023660	Enquanto ele tá tentando,
3023900	3025680	a Juni, ela se prepara
3025680	3027620	com um canivete também,
3027700	3029140	já que, ó, deu a arma pra Mel.
3030460	3031540	Tirou quanto, o Dimitro?
3031620	3033520	Eu tirei dois, o meu atributo.
3033780	3035020	E o Dimitro ainda fala assim,
3035200	3036900	muito fácil.
3039240	3041920	Tu tranquilamente faz aquela porta
3041920	3043920	abrir, ela não tá ligada a rede nenhuma,
3044060	3045720	então, o teu atributo,
3046000	3048300	o teu crítico não consegue tão longe.
3048300	3049300	Mas, após,
3049940	3052380	a porta tá aberta, tá destrancada, né?
3052900	3054060	É com vocês.
3054500	3056040	Ah, o Dimitro abre, do jeito que...
3056040	3057620	Ele vai abrir com medo, mas ele vai abrir.
3057840	3060540	A Mel fica atrás dele,
3060720	3061700	apontando pra dentro.
3062880	3064440	Nada se mexeu onde a gente tava?
3064680	3065260	Onde a gente passou?
3065740	3066060	Não.
3066660	3067540	Tem iluminação?
3068020	3069160	Tem iluminação ali embaixo.
3069360	3071260	Tem interruptor pra vocês acenderem a luz, né?
3071320	3073160	Sim, mas inclusive dessa sala aqui a gente abriu.
3075060	3076380	A sala que vocês abrem,
3076380	3077860	tem uma iluminação lá dentro.
3078160	3079380	A iluminação, ela acende,
3079940	3082940	provavelmente, detecta o movimento
3082940	3083940	pela porta aberta,
3083940	3085940	porque assim que a porta é aberta,
3085940	3087940	as luzes se acendem, não só do teto,
3087940	3089940	mas de vários
3091940	3093940	armários de vidro por todos os lados,
3093940	3095940	fazem um corredor
3095940	3097940	onde tem, pelo menos,
3097940	3099940	tem um modelo de cada boneca
3099940	3101940	sentadinha nessas...
3101940	3103940	Nesses armários de vidro.
3103940	3105940	Várias bonequinhas arrumadinhas,
3105940	3107940	sentadinhas, bonitinhas.
3107940	3109940	Elas formam um corredor,
3109940	3111940	dá pra ver que o corredor termina
3111940	3113940	numa mesa grande,
3113940	3115940	com algo coberto por um lençol,
3115940	3119940	e dá pra ver um computador lá no final.
3119940	3121940	É isso, né, gente?
3121940	3123940	É pra lá que a gente tem que ir, né?
3123940	3125940	Exato. Corredor polonês.
3125940	3127940	Quem vai na frente?
3127940	3129940	Eu preciso dos meus dedos intactos pra mexer na máquina.
3129940	3131940	Eu posso ir na frente.
3131940	3134940	A Junella olha rapidinho pro Adam.
3134940	3136940	Ele tá demonstrando algum sinal de medo,
3136940	3138940	de estar pronto pra atacar?
3138940	3140940	Ele tá bem inquieto ali,
3140940	3142940	mas
3142940	3144940	não mais do que ele já não estava antes.
3144940	3146940	Quem é a primeira pessoa que entra na sala?
3146940	3148940	Meu?
3148940	3150940	Foi a Melina.
3150940	3152940	Melina, assim que tu pisa na sala,
3152940	3154940	todas as bonecas
3154940	3156940	movem a cabeça pra te olhar.
3156940	3158940	Meu Deus.
3158940	3160940	Elas só movem a cabeça,
3160940	3162940	ou elas fazem menção de se
3162940	3164940	moverem pra sair do armário?
3164940	3166940	Elas estão sentadinhas,
3166940	3168940	assim, abertinhas pros lados.
3168940	3170940	Perninha, assim, sentadinha, meio aberta,
3170940	3172940	em posição de boneca.
3172940	3174940	Só o pescocinho gira, né,
3174940	3176940	e todas elas estão te encarando.
3176940	3178940	Esses vidros parecem
3178940	3180940	bombes, assim, tipo, trancados,
3180940	3182940	bem firmes, né? São vidros.
3182940	3184940	É, sei lá, um vidro melhorzinho.
3184940	3186940	Vai que...
3186940	3188940	É melhor. Vamos correndo.
3188940	3190940	É o único jeito. Se formos devagar,
3190940	3192940	tem mais chance de elas pularem na cabeça da gente.
3192940	3194940	Não sei
3194940	3196940	quem tá controlando isso,
3196940	3198940	se tem alguém controlando, mas sabe que a gente
3198940	3200940	chegou aqui. É, claramente.
3200940	3202940	Se eu pudesse sugerir, Melina,
3202940	3204940	diria que deve ser algum tipo de comportamento
3204940	3206940	em colmeia. Por isso,
3206940	3208940	precisamos chegar naquele computador.
3208940	3210940	Bom, acho que a sua ideia de correr é boa, mas
3210940	3212940	eu vou, tipo, na frente, caso
3212940	3214940	alguma delas, sei lá, caso elas se mexam,
3214940	3216940	eu tento atirar e aí
3216940	3218940	segurar elas e você corre pro computador.
3218940	3220940	Tem pelo menos umas 200 bonecas
3220940	3222940	ali, tá? Que grilo.
3222940	3224940	É muito comprido o corredor?
3224940	3226940	Assim, não dá pra gente chegar lá.
3226940	3228940	Se elas começarem a se mexer, não vai dar pra chegar lá.
3228940	3230940	É que, assim, elas não são
3230940	3232940	muito grandes, as bonecas, né? Cabem bastante
3232940	3234940	bonecas nesses espaços.
3234940	3236940	É isso, gente. Fé em algum deus.
3236940	3238940	Não tem outro espaço lateral, não,
3238940	3240940	o Guaxa, pra passar.
3240940	3242940	Só o do meio mesmo, né? Só o corredor.
3242940	3244940	É o jeito, gente.
3244940	3246940	Não tem outra alternativa.
3246940	3248940	A Melina avança pelo corredor,
3248940	3250940	seguida pelos outros dois.
3250940	3252940	Quando tá no meio do caminho,
3252940	3254940	todas as bonecas ficam de pé.
3254940	3256940	Não param de encarar com você.
3256940	3258940	A Juliana tá correndo, mas dando ordem
3258940	3260940	pro Adam correr mais rápido que ele puder também.
3260940	3262940	Se ele puder passar eles, melhor ainda.
3262940	3264940	A Melina tá na frente.
3264940	3266940	A Melina tá correndo também?
3266940	3268940	Ela tá indo rápido também.
3268940	3270940	Quando vocês chegam perto da mesa,
3270940	3272940	dá pra ver que tem
3272940	3274940	provavelmente uma daquelas bonecas
3274940	3276940	grandes cobertas
3276940	3278940	por um lençol branco,
3278940	3280940	mas não dá pra saber muito mais
3280940	3282940	porque as luzes se apagam
3282940	3284940	e tem barulho de vidro
3284940	3286940	sendo quebrado por todos os lados.
3290940	3292940	Nem a luzinha do computador a gente vê,
3292940	3294940	o Guaxa. Nada pra servir
3294940	3296940	de referência.
3296940	3298940	Tem um pontinho
3298940	3300940	vermelho, assim,
3300940	3302940	no mundo onde tu deveria
3302940	3304940	estar o computador, né?
3304940	3306940	Pra te tomar como base de onde ele tá.
3306940	3308940	Mas é isso. Melina,
3308940	3310940	pela ordem do atributo,
3310940	3312940	eu acho que enquanto isso
3312940	3314940	a June pode dar o comando
3314940	3316940	pro Adam ficar mais perto
3316940	3318940	e ela tentar pegar o telefone
3318940	3320940	pra acender a lanterna.
3320940	3322940	Calma, vamos lá.
3322940	3324940	Quanto é que tirou, Melina?
3324940	3326940	Eu tirei 5 e 2.
3326940	3328940	Tu sente mãozinhas tentando escalar tua perna.
3328940	3330940	E tu faz?
3330940	3332940	Eu começo...
3332940	3334940	Eu pego
3334940	3336940	com o cabo
3336940	3338940	com o cabo
3338940	3340940	da arma, eu começo
3340940	3342940	tipo, bater, assim,
3342940	3344940	bater pra baixo pra tentar derrubar
3344940	3346940	as que estiverem tentando subir.
3346940	3348940	Beleza. June, rola dois dados.
3348940	3350940	Eu tirei 2 e 2.
3350940	3352940	Tu pensa em
3352940	3354940	o que tu vai fazer com o cachorro ali,
3354940	3356940	mas antes de tomar qualquer decisão,
3356940	3358940	a Melina tirou um acerto simples.
3358940	3360940	Tu sente mãozinhas tentando ali te escalar,
3360940	3362940	mas tu já
3362940	3364940	sofreu um ataque antes.
3364940	3366940	Tu consegue evitar mais do que a tua amiga,
3366940	3368940	mas tu sabe que as bonecas estão por ali.
3368940	3370940	O que tu vai fazer?
3370940	3372940	Tu vai fazer alguma peça de mim, na minha perna, no caso.
3372940	3374940	É, elas não estão conseguindo te escalar,
3374940	3376940	mas elas estão por ali, tu sente toque.
3376940	3378940	Eu ainda quero chamar o Adam
3378940	3380940	e tentar...
3380940	3382940	Isso vai dar muito errado, meu Deus.
3382940	3384940	Eu quero tentar atacar alguma que esteja realmente
3384940	3386940	mais colada na minha perna
3386940	3388940	com o meu canivete.
3388940	3390940	Uma mão cachorro
3390940	3392940	e o outro canivete.
3392940	3394940	Não, a voz cachorro e uma mão canivete.
3394940	3396940	Soltou o cachorro e pegou um canivete.
3396940	3398940	Mas ele não tava segurando ele.
3398940	3400940	Ele tá sempre solto. Ah tá, ele tava solto.
3400940	3402940	Coitado do cachorro.
3402940	3404940	Meu Deus.
3404940	3406940	Tava tudo vazio.
3406940	3408940	Eu não tenho culpa, gente.
3408940	3410940	Dimitro, dois dados.
3410940	3412940	Eu tirei cinco e um.
3412940	3414940	Um é um acerto.
3414940	3416940	Mãozinhas também estão tentando te escalar ali.
3416940	3418940	Senti algumas já quase
3418940	3420940	conseguindo, mas o que tu faz?
3420940	3422940	Ele tá tentando chutar,
3422940	3424940	porque na mão dele ele tá
3424940	3426940	tentando pegar o celular, porque ele anda
3426940	3428940	sempre com o celular, ele vai usar a lanterna do celular
3428940	3430940	pra ver alguma coisa à frente.
3430940	3432940	E enquanto ele vai sentindo
3432940	3434940	mãozinhas, ele vai chutando
3434940	3436940	e tentando se desvencilhar e berrando.
3436940	3438940	Eu odeio o filme do Chucky, eu odeio o filme do Chucky,
3438940	3440940	eu odeio o filme do Chucky. Vai correndo.
3440940	3442940	Vocês naquela situação, até o momento
3442940	3444940	vocês estão evitando ser escalado
3444940	3446940	e sei lá o que essas criaturas podem fazer
3446940	3448940	com vocês. Melina
3448940	3450940	ou o grupo, o que vocês vão fazer
3450940	3452940	a partir de agora? Só ficar
3452940	3454940	evitando ou vão tomar alguma outra atitude?
3454940	3456940	Eu tenho uma ideia, mas
3456940	3458940	as pessoas vão querer ir junto comigo.
3458940	3460940	A gente caminhou também, né?
3460940	3462940	A gente andou um pouquinho pra frente, né?
3462940	3464940	Não, vocês estão no fundo da sala, né?
3464940	3466940	Vocês estão perto de uma mesa que tem algo
3466940	3468940	coberto ali, e tem
3468940	3470940	um computador, depois da mesa.
3470940	3472940	A porta de saída é do outro lado do corredor.
3472940	3474940	A minha ideia era, agora sim,
3474940	3476940	catar o cachorro que deve estar latindo,
3476940	3478940	então seguiria pelo som, não precisa
3478940	3480940	ver ele, e continuar correndo
3480940	3482940	chutando as bonecas. Pra fora da sala
3482940	3484940	ou até o computador? Até o computador,
3484940	3486940	né? A gente tem que desligar essa porcaria.
3486940	3488940	Algum deles conseguiu
3488940	3490940	pegar o celular pra acender uma
3490940	3492940	lanterna. Tem uma faixa de luz
3492940	3494940	na mão do Dimitro, ele tá
3494940	3496940	tentando focar em
3496940	3498940	alguma coisa. Tu vê que
3498940	3500940	a lanterna passa de um lado pro outro, porque ele tá evitando
3500940	3502940	que bonecas escalem
3502940	3504940	sua perna, né? E
3504940	3506940	o faixa de luz mostra que o chão tá cheio de vidro,
3506940	3508940	tem várias bonecas,
3508940	3510940	algumas delas segurando cacos de vidro
3510940	3512940	bem perigosos, e elas estão ali
3512940	3514940	meio indo na direção de vocês. O que você
3514940	3516940	vai fazer? Catar o cachorro e correr. E a Lina?
3516940	3518940	Então, eu ia tentar atirar
3518940	3520940	em algum, tipo,
3520940	3522940	deve ser muitas bonecas. Eu ia, tipo,
3522940	3524940	usar esse faixa de luz pra tentar, tipo,
3524940	3526940	atirar em algumas bonecas que tiverem
3526940	3528940	ali. Não sei quanto isso
3528940	3530940	vai ser efetivo. Nada que 200
3530940	3532940	tiros não resolva.
3532940	3534940	De uma arma normal
3534940	3536940	que deve ter o quê? Seis tiros. Seis tiros.
3536940	3538940	Exato.
3538940	3540940	E ele já gastou dois. Ou não,
3540940	3542940	que não atirou ainda. Não, atirou um só. Atirei um.
3542940	3544940	Ah, então foi um só.
3544940	3546940	Quer pra cachorro recorrer, gente?
3546940	3548940	Voltar no caso, cê tá dizendo?
3548940	3550940	Não, ir pro computador, tipo,
3550940	3552940	ir chutando as bonecas da frente e tentar isso.
3552940	3554940	Já que cê está ali discutindo, vamos mais uma rodada.
3554940	3556940	Dois dados cada um. Minha Lina?
3556940	3558940	Socorro, Deus. Boa!
3558940	3560940	Eu posso ter pego o cachorro? Pode.
3560940	3562940	Tá, obrigado.
3562940	3564940	Eu tirei
3564940	3566940	três e um. As poucas
3566940	3568940	que estavam te escalando ali antes, tu conseguiu
3568940	3570940	chutar pra longe, tu conseguiu
3570940	3572940	evitar ali.
3572940	3574940	Tu tá tranquila. A June?
3574940	3576940	Eu tirei
3576940	3578940	cinco e cinco. Agora eu me lasquei.
3578940	3580940	Beleza. O Dimitro?
3580940	3582940	Eu tirei seis e um.
3582940	3584940	Um é um acerto. Ah, tu tá conseguindo
3584940	3586940	evitar ali. Tu tem alguma
3586940	3588940	te escalando, tu às vezes consegue tirar
3588940	3590940	uma das costas, uma da perna.
3590940	3592940	Tá um pouco mais cercado, aparentemente,
3592940	3594940	do que a Melina. Mas
3594940	3596940	vocês escutam o barulho de algo grande
3596940	3598940	caindo. Foi a June.
3598940	3600940	A June foi derrubada.
3600940	3602940	Caraca!
3602940	3604940	Nesse momento a June está gritando
3604940	3606940	xingamentos que eu não vou reproduzir.
3606940	3608940	Ah, as minhas sete mãozinhas, assim,
3608940	3610940	no cabelo, no...
3610940	3612940	nos braços. Ela sente
3612940	3614940	coisas correndo pelas costas dela.
3614940	3616940	O cachorro sai do braço
3616940	3618940	dela e tá latindo bastante.
3618940	3620940	Ela tá se debatendo, provavelmente, assim,
3620940	3622940	com o canivete na mão
3622940	3624940	e tá com os outros dois também.
3624940	3626940	Ela tá se debatendo. Tá, é o...
3626940	3628940	o Oliver ali, né,
3628940	3630940	preso no chão, amarrado, mas
3630940	3632940	pelo menos cercado ali.
3632940	3634940	Melina e Dimitro.
3634940	3636940	Ação de vocês.
3636940	3638940	Se eu vi que ela caiu, eu vou
3638940	3640940	pra... eu vou pra ajudar ela a
3640940	3642940	levantar, pra tirar as bonecas, e eu
3642940	3644940	grito... e eu grito pro Dimitro
3644940	3646940	corre pro computador, a gente tem que se ligar
3646940	3648940	a elas de algum jeito. Tá certo.
3648940	3650940	Melina, tu vai ajudar a...
3650940	3652940	a June e o Dimitro vai correr
3652940	3654940	pro computador, é isso?
3654940	3656940	Antes de eu chegar no computador, ele tá desesperadamente
3656940	3658940	querendo chegar no computador. É...
3658940	3660940	Melina, tu não tá enxergando muito
3660940	3662940	bem ali, mas rola dois dados.
3662940	3664940	Eu tirei
3664940	3666940	três e um. Beleza. Tu chuta,
3666940	3668940	tu passa a mão, tu vai fazer como
3668940	3670940	pra tirar as bonecas de cima dela pra levantar?
3670940	3672940	Eu tento... tipo assim, pra andar eu vou
3672940	3674940	chutando as que estiverem no meu caminho,
3674940	3676940	e aí a hora que eu chegar
3676940	3678940	perto dela assim,
3678940	3680940	eu tento de novo bater
3680940	3682940	com a arma nas que estiverem em cima
3682940	3684940	dela pra ajudar ela a levantar. Beleza.
3684940	3686940	Assim que o Dimitro correu, tu perdeu
3686940	3688940	a tua luz, tu tá indo mais no
3688940	3690940	instinto e na memória ali,
3690940	3692940	mas tu consegue fazer um bom trabalho
3692940	3694940	ali. A June, ela
3694940	3696940	consegue levantar. E tá pra cachorro de novo.
3696940	3698940	O cachorro, ele não
3698940	3700940	tá perto de ti. O cachorro correu pra
3700940	3702940	frente. Ah, correu pra frente pro
3702940	3704940	computador, você sabe. Não, ele correu
3704940	3706940	pra fora.
3706940	3708940	Ai, meu Deus. Dimitro,
3708940	3710940	tu, pela luz, tu chega no computador,
3710940	3712940	tu vai tateando ali,
3712940	3714940	tu sente o teclado,
3714940	3716940	né, o computador
3716940	3718940	se ilumina e pede
3718940	3720940	uma senha. É...
3720940	3722940	Ai, caralho. Ele vai tentar...
3722940	3724940	Qual o nome do boneco mesmo?
3724940	3726940	Juju. Beleza. Rola dois dados.
3726940	3728940	Na verdade, ele vai sair tentando...
