start	end	text
3664140	3666140	A partir do momento que tu passar perto da Zuha,
3666140	3668140	ela tenta segurar tua mão.
3668140	3670140	Será que ela quer suco também?
3670140	3672140	Você pode tomar o suco também, Zuha?
3672140	3674140	Você pode respirar fundo. Quando eu
3674140	3676140	vejo a Zuha segurando a mão da
3676140	3678140	da Galta,
3678140	3680140	eu já vou na direção que eu tava de longe, não tava
3680140	3682140	perto. Aí eu vou na direção pulando.
3682140	3684140	A capa do mundo é nossa.
3684140	3686140	Aí eu pego as mãozinhas da Zuha e começo a dançar
3686140	3688140	e circulando.
3688140	3690140	Com os orquídeos, não há quem passar.
3690140	3692140	E rodando. Eu pego a mão e começo.
3692140	3694140	Eu passo. Ai, droga!
3694140	3696140	Ok.
3696140	3698140	A Zuha acaba
3698140	3700140	entendendo que não é o momento.
3700140	3702140	E imagino que todas
3702140	3704140	as pessoas estão de acordo, irmão. É isso aí.
3704140	3706140	Eu vou procurar capim-santo e limão pra ver se eu consigo fazer um suco.
3706140	3708140	A menos que alguém trouxe.
3708140	3710140	Mas eu vou procurar
3710140	3712140	de qualquer jeito.
3712140	3714140	Se eu não achar, tudo bem.
3714140	3716140	Rola um dado.
3716140	3718140	Cinco!
3720140	3722140	Os elfos deixaram alguns caixas de
3722140	3724140	mantimento e trouxeram
3724140	3726140	vários tipos de especiarias
3726140	3728140	e tal. Tu encontra ali
3728140	3730140	algo que parece, ou pelo menos
3730140	3732140	é um substituto bom o suficiente
3732140	3734140	pro que tu quer fazer o charme.
3734140	3736140	Não, é um suco. É um suco de capim-santo com limão.
3736140	3738140	Ah, um suco. Ok.
3738140	3740140	Eu passo o suco pra nós três
3740140	3742140	e aí eu levo as canequinhas
3742140	3744140	e ela linda fala, aqui,
3744140	3746140	nós merecemos. Fizemos muito bem
3746140	3748140	hoje, hein? Um suquinho pra você, chicote,
3748140	3750140	pra você, morga, e pra mim. Assim
3750140	3752140	nós vamos poder dormir e amanhã estaremos
3752140	3754140	renovadas. Obrigada, sim.
3754140	3756140	Obrigada, sim. Vocês têm
3756140	3758140	um espaço ali pra vocês três, com uma
3758140	3760140	grande cama única feita no chão,
3760140	3762140	né? Dormem as três ali.
3762140	3764140	Tudo bem, sem problema.
3764140	3766140	Ninguém mais incomoda
3766140	3768140	vocês essa noite, né?
3768140	3770140	E vocês,
3770140	3772140	quando levantam, a hora que
3772140	3774140	vocês abrem a cortina de vocês, que vocês
3774140	3776140	abririam o quarto, entre aspas,
3776140	3778140	as três elfas estão paradas ali
3778140	3780140	na frente e
3780140	3782140	elas estão assim, cabeça
3782140	3784140	baixa, a
3784140	3786140	líder delas estende assim
3786140	3788140	aquela fitinha de volta
3788140	3790140	pra Chica. Eu pego o
3790140	3792140	lacinho e tento fazer
3792140	3794140	perguntar da carne.
3794140	3796140	Como que eu vou fazer isso?
3796140	3798140	Fazer o símbolo do que eu tirei,
3798140	3800140	de onde eu tirei, do que eu tava
3800140	3802140	nas mãos, e fazer um sinal
3802140	3804140	com a mão, de que eu tô comendo.
3804140	3806140	Perguntar se ela gostou, fazer um positivo.
3806140	3808140	Elas fazem, sim, com a cabeça,
3808140	3810140	tocam na barriga.
3810140	3812140	Uma delas, assim, faz uma carinha
3812140	3814140	meio de nojinho,
3814140	3816140	mas também tocou na barriga.
3816140	3818140	A Irene,
3818140	3820140	ela ajoelha,
3820140	3822140	as outras duas acompanham,
3822140	3824140	e elas baixam a cabeça pra vocês.
3824140	3826140	Oxi! Eu me abaixo,
3826140	3828140	falo, não precisa, não precisa,
3828140	3830140	é só uma carrinha, eu posso pegar mais carninha pra
3830140	3832140	vocês, aí eu vou lá mexendo minhas coisas
3832140	3834140	pra pegar mais carninha pra dar pra ela.
3834140	3836140	Eu acho que, talvez,
3836140	3838140	é porque a gente não falou o que eles falaram.
3838140	3840140	Aí eu tento repetir o que ela falou pra gente
3840140	3842140	quando a gente deu o lacinho.
3844140	3846140	As elfas
3846140	3848140	se olham assim, o arco
3848140	3850140	ela fala. Vermelho.
3850140	3852140	Vermelho.
3852140	3854140	Ela aponta pro rosto dela.
3854140	3856140	Será que ela quer que a gente pinte
3856140	3858140	o rosto dela de vermelho?
3858140	3860140	Acho que a gente torce alguma etiqueta.
3860140	3862140	Ela torce pra gente?
3862140	3864140	Eu aponto pra ela. Você é vermelho?
3864140	3866140	Elas se olham assim, não se abaixam mais.
3866140	3868140	Uma delas chora, até.
3868140	3870140	Gente, isso tá estranho, gente. Eu não tô entendendo nada.
3870140	3872140	Eles fizeram alguma coisa errada.
3872140	3874140	Isso não é possível. Por que eles tão chorando do nada?
3874140	3876140	Eu abaixo e fico tentando olhar pra cara
3876140	3878140	dela e fazendo umas mãozinhas assim de
3878140	3880140	por quê? Tipo...
3880140	3882140	Eu tô com carne numa mão
3882140	3884140	e uma tinta vermelha na outra mão.
3884140	3886140	Assim, sem saber o que eu faço, que a mulher tá chorando.
3886140	3888140	Eu estendo assim a
3888140	3890140	tinta. Vermelho?
3890140	3892140	Vermelho. Aí eu pego assim, mexo
3892140	3894140	no meu dedo e passo no rosto. Vermelho.
3894140	3896140	Eu vou tentar
3896140	3898140	consolar. Como que se consola
3898140	3900140	um adulto elfo chorando?
3900140	3902140	Abraça, abraça ela.
3902140	3904140	Abraçar fortemente.
3904140	3906140	Ela se deixa
3906140	3908140	abraçar. Ela fica meio assustada
3908140	3910140	no começo. Mas ela começa a
3910140	3912140	chorar cada vez mais.
3912140	3914140	Meu Deus, gente. O que a gente fez?
3914140	3916140	Que isso?
3916140	3918140	Será que foi a cerveja?
3918140	3920140	Não. Ela não tava bebendo nem comendo.
3920140	3922140	Ela não ia sentir falta da cerveja. Eu não sei.
3922140	3924140	Isso tá esquisito, gente.
3924140	3926140	Será que aconteceu alguma coisa lá fora? Deixa eu olhar.
3926140	3928140	Aí eu vou lá na
3928140	3930140	porta da tenda
3930140	3932140	olhar lá fora.
3932140	3934140	Tá o time dos elfos
3934140	3936140	aquecendo ali, batendo
3936140	3938140	uma bolinha na quadra. Mas só
3938140	3940140	os elfos. Eu olho pra ela
3940140	3942140	e pergunto. Faço chorando
3942140	3944140	e aponto lá fora, tipo, pra perguntar
3944140	3946140	se ela tá chorando por causa do jogo.
3946140	3948140	Ela afasta sim. Eu falo assim
3948140	3950140	Meninas, eu vou ali na tenda dos rapazes
3950140	3952140	num instante. E saio correndo lá pra tenda
3952140	3954140	dos rapazes. Deixar elas ali
3954140	3956140	com as elfos. Rola dois dados.
3956140	3958140	Eu tirei seis
3958140	3960140	e um. Tu vê que tem
3960140	3962140	três elfos, assim, bem animados, tocando
3962140	3964140	bola um pro outro. Mas
3964140	3966140	os outros três jogadores
3966140	3968140	é um time misto, né?
3968140	3970140	Uma das meninas
3970140	3972140	e dois rapazes.
3972140	3974140	Estão, assim, mais de canto,
3974140	3976140	sem prestar atenção. E quando
3976140	3978140	te veem, eles ficam
3978140	3980140	vermelhos, assim, no rosto.
3980140	3982140	Eles se sentem constrangidos.
3982140	3984140	Vermelho.
3984140	3986140	Pergunha.
3986140	3988140	Mas aí eu continuo indo pra
3988140	3990140	tenda lá dos homens.
3990140	3992140	Abrir lá. Eu vou entrar lá dentro.
3992140	3994140	Tu
3994140	3996140	entra e tá os
3996140	3998140	humanos e os órfãos.
3998140	4000140	Dormindo. Os órfãos
4000140	4002140	tão dormindo? Eu vou lá mexendo eles.
4002140	4004140	Os humanos também. Os humanos também?
4004140	4006140	Sim. Não acordam. Eu balanço eles
4006140	4008140	assim. Ei, ei, cambada. Tá na hora de acordar.
4008140	4010140	Não. Não tão acordando.
4010140	4012140	E os humanos? Eu
4012140	4014140	mexo nos humanos também. Eu
4014140	4016140	mexo todos eles lá. Nada.
4016140	4018140	A Azurra acorda
4018140	4020140	e, com aquela comoção, vê as
4020140	4022140	elfas chorando ali, pra vocês.
4022140	4024140	Isso, a Galto
4024140	4026140	tá lá na outra tenda, né?
4026140	4028140	Isso, pra Morgue e pra Chica.
4028140	4030140	Ela dá de ombros e sente o que tá
4030140	4032140	acontecendo. Aí eu faço o que não sei, com os
4032140	4034140	bracinhos. Aponto pras elfas e faço
4034140	4036140	chorinho. Eu quero fazer sinal
4036140	4038140	pra ela. Abraça. Ajuda
4038140	4040140	aqui. Faço sinal com a cabeça.
4040140	4042140	Ela corre pra fora da tenda.
4042140	4044140	Ok, ela não nos
4044140	4046140	entendeu. Eu tento arrancar alguma
4046140	4048140	coisa delas, né? Mas
4048140	4050140	inutilmente, porque elas não
4050140	4052140	entendem. Mas eu tô tentando entender o que tá
4052140	4054140	acontecendo. Assim que for possível,
4054140	4056140	eu percebi que eles não acordaram, eu volto
4056140	4058140	correndo lá pra tenda das meninas.
4058140	4060140	Tu tá saindo da
4060140	4062140	tenda e encontra a
4062140	4064140	Zurra. Ela sorri pra ti,
4064140	4066140	mas, assim, um sorriso meio
4066140	4068140	de canto de boca. Ela olha
4068140	4070140	pro pessoal dormindo,
4070140	4072140	assim. Ela se abaixa, assim,
4072140	4074140	ela cheira perto da
4074140	4076140	boca deles. Ela começa a cheirar
4076140	4078140	algumas vasilhas, algumas garrafas.
4078140	4080140	E ela diz...
4080140	4082140	Suno elfo. Como é?
4082140	4084140	Suno elfa? Suno
4084140	4086140	elfo. Caramba!
4086140	4088140	Eu pego na mão dela e trago
4088140	4090140	de volta pra dentro da outra lá
4090140	4092140	na cabana das meninas.
4092140	4094140	Eu entro com ela com a mão dada e falo
4094140	4096140	Os homens estão todos
4096140	4098140	dormindo. Zurra disse que
4098140	4100140	Suno elfo.
4100140	4102140	O quê? Os homens
4102140	4104140	estão dormindo? Eu tentei acordar eles e
4104140	4106140	não consigo. Luzes...
4106140	4108140	É de dia, mas dá pra ver globos de luz
4108140	4110140	se iluminando lá fora.
4110140	4112140	Eu vou tirar minha
4112140	4114140	faquinha, puxar o cabelo da elfa e
4114140	4116140	colocar minha faca no pescoço dela.
4116140	4118140	Morga, não faça isso, morga.
4118140	4120140	Chegou a sua vez.
4120140	4122140	Eles estão dormindo. Eu estou me sentindo extremamente
4122140	4124140	atacada, porque
4124140	4126140	tá todo mundo dormindo.
4126140	4128140	O campeonato vai começar. Eu acho que ela
4128140	4130140	reagiria assim. Não, eu sei,
4130140	4132140	mas eu...
4132140	4134140	Eu pego assim. Morga, é a sua
4134140	4136140	chance. Eles não vão acordar mesmo.
4136140	4138140	Vamos lá. Não, mas
4138140	4140140	o que eles fizeram eles tem que desfazer.
4140140	4142140	Lá fora o elfo começa
4142140	4144140	a dizer. Tomar carne, estourar
4144140	4146140	o rastro, ter uma luz
4146140	4148140	de vernista, por carnes
4148140	4150140	de lustre. Eu fico
4150140	4152140	olhando pra elfa e falando
4152140	4154140	desfaz, ajuda, eu vou
4154140	4156140	cortar sua garganta.
4156140	4158140	Ela faz que não com a cabeça assim
4158140	4160140	assustada. Eu pego a morga pelos
4160140	4162140	ombros, balanço ela e falo
4162140	4164140	jogo morga, foco.
4164140	4166140	Aí eu olho pra
4166140	4168140	zurra, da zurra, aí
4168140	4170140	aponto pra ela, aponto pras elfas
4170140	4172140	e boto assim os dois olhos no meu
4172140	4174140	olho e aponto pras elfas, sabe?
4174140	4176140	Tipo pra ela ficar de olho nas elfas.
4176140	4178140	Não deixar as elfas saírem dali. Eu entrego
4178140	4180140	minha faquinha pra ela. Eu tiro do
4180140	4182140	pescoço, entendo, e dou a
4182140	4184140	faquinha pra zurra. Morde.
4184140	4186140	Tá todo mundo dormindo?
4186140	4188140	Se tá todo mundo dormindo
4188140	4190140	é o seu momento.
4190140	4192140	Mas eu não sei se tá todo mundo dormindo.
4192140	4194140	Eu não sei o que que é esse sono elfo.
4194140	4196140	E se não for o sono elfo, entendeu?
4196140	4198140	Eu não vi eles, eu não sei se tá vivo.
4198140	4200140	A gente tá num lugar estranho cheio de elfos
4200140	4202140	e a elfa claramente fez alguma coisa
4202140	4204140	e aí tá dizendo vermelho que tosse pra gente
4204140	4206140	mas não tosse pra gente porque foi lá e sabotou nosso time.
4206140	4208140	Mas tá bom, a gente vai jogar.
4208140	4210140	Vamos jogar, depois do jogo você vai lá
4210140	4212140	ver. Eu tentei acordar eles, não consegui.
4212140	4214140	Tá, meninas, então a gente vai acabar
4214140	4216140	com esses elfos. Eles vão
4216140	4218140	se arrepender do que fizeram.
4218140	4220140	Porque a gente consegue ser melhor do que eles.
4220140	4222140	Esse é o espírito!
4222140	4224140	Vamos fingir
4224140	4226140	que os adversários
4226140	4228140	são o Bartô.
4228140	4230140	Isso!
4230140	4232140	É!
4232140	4234140	A gente vai lá pra fora.
4234140	4236140	Lá fora
4236140	4238140	aquelas grandes bolas de luz
4238140	4240140	tão passando imagens
4240140	4242140	dos orques e dos humanos
4242140	4244140	bebendo bastante.
4244140	4246140	O time élfico ali como eu falei
4246140	4248140	metade tá fora da quadra
4248140	4250140	bem chateado com a situação
4250140	4252140	mas os três estão em quadra
4252140	4254140	que são duas elfas e um elfo
4254140	4256140	tão sorrindo bastante
4256140	4258140	tão brincando, fazendo embaixadinha com a bola
4258140	4260140	tão se exibindo ali
4260140	4262140	e dá pra ver aquelas esferas com
4262140	4264140	ovos de vários lugares
4264140	4266140	do mundo
4266140	4268140	vendo aquilo ali
4268140	4270140	dá pra ver na cara dos orques assim
4270140	4272140	a derrota, a tristeza
4272140	4274140	uma voz é ouvida
4274140	4276140	e entendida por todos
4276140	4278140	é uma
4278140	4280140	voz de um usuário de magia
4280140	4282140	que diz
4282140	4284140	Se não há nenhum orque para disputar a partida
4284140	4286140	teremos de dar essa vitória
4286140	4288140	para o céu.
4288140	4290140	Epa! Tem orque aqui sim!
4290140	4292140	Eu vou puxando as meninas
4292140	4294140	Espera! Espera! Espera!
4294140	4296140	E eu tô muito brava e tenho dentes muito grandes
4296140	4298140	então eu tô com uma careta muito feia
4298140	4300140	e entrando muito puta no time
4300140	4302140	no campo.
4302140	4304140	Vocês não são jogadoras?
4304140	4306140	Agora somos!
4306140	4308140	Dá pra ver numa daquelas esferas
4308140	4310140	aquele mago élfico
4310140	4312140	era ele que tava falando
4312140	4314140	meio exaltado
4314140	4316140	e uma mãozinha verde vai no ombrinho dele
4316140	4318140	e ele senta
4318140	4320140	mais controlado, ele era meio assustado
4320140	4322140	é duvidoso
4322140	4324140	Como não há regras específicas
4324140	4326140	para determinar quem poderá ou não poderá jogar
4326140	4328140	creio que vocês podem acessar
4328140	4330140	o campo e confrontar
4330140	4332140	nossos elfos
4332140	4334140	cremos que nossos três elfos atletas
4334140	4336140	jogaram bem contra vocês
4336140	4338140	três dançarinas
4338140	4340140	Os três elfos ali
4340140	4342140	dão uma tremida
4342140	4344140	mas eles se posicionam na quadra
4344140	4346140	Nessa hora eu fiz uma careta
4346140	4348140	e não tem quando a pessoa faz os músculos
4348140	4350140	os braços pra baixo pro estômago
4350140	4352140	na posição assim
4352140	4354140	eu to fazendo essa posição
4354140	4356140	ameaçadora
4356140	4358140	Eu começo a copiar a Galta
4358140	4360140	Vocês três então estão em quadra
4360140	4362140	Eu quero jogar os pompons na plateia
4362140	4364140	É, não é uma plateia né
4364140	4366140	São bolinhos
4366140	4368140	Os elfos que estão ali no canto
4368140	4370140	Cabisbax, elas jogam neles
4370140	4372140	Nos elfos que estão chateados
4372140	4374140	com a situação
4376140	4378140	Nós estamos mais chateados do que eles
4378140	4380140	Fora da quadra
4380140	4382140	Os elfos tristes incluindo
4382140	4384140	a gente torcida
4384140	4386140	Os elfos fazem sinal pra ver se elas dançam
4386140	4388140	e elas fazem que não, sentam no chão
4388140	4390140	Mas agora elas tem os pompons da cor certa
4390140	4392140	A Azurra
4392140	4394140	olha pra Galta
4394140	4396140	faz um sinal com a cabeça
4396140	4398140	assim pros elfos
4398140	4400140	e passa o dedinho assim no pescoço
4400140	4402140	Aí eu faço assim, calma, calma
4402140	4404140	Vocês estão em quadra
4404140	4406140	quem tiver no ataque rola o seu atributo ao menos
4406140	4408140	quem tiver na defesa o seu atributo ao mais
4408140	4410140	Toda rodada vocês decidem
4410140	4412140	quantas estão no ataque, pode ser as três
4412140	4414140	e quantas estão na defesa
4414140	4416140	Se não tiver ninguém na defesa vocês tomam o gol
4416140	4418140	de qualquer forma
4418140	4420140	Só existe uma bola, então mesmo que vocês tenham dois acertos
4420140	4422140	vocês
4422140	4424140	marcam um gol só
4424140	4426140	Vai começar a partida
4426140	4428140	Quantas de vocês estão mais avançadas
4428140	4430140	e quanta protegendo o golzinho fechado
4430140	4432140	Acho que a gente pode avançar em duas e ficar uma protegendo
4432140	4434140	o golzinho fechado
4434140	4436140	A morga aqui é a cabeça
4436140	4438140	Vamos morga, eu vou seguir essas instruções
4438140	4440140	Eu esqueci
4440140	4442140	A gente atributa ao mais no ataque
4442140	4444140	ou atributa ao menos na defesa?
4444140	4446140	É o contrário
4446140	4448140	Menos no ataque, mais na defesa
4448140	4450140	A gente tá naquele bolinho assim
4450140	4452140	A Galta nessa primeira rodada
4452140	4454140	vai eu e a Galta pra atacar
4454140	4456140	Aí a Chica fica na defesa
4456140	4458140	Aí depois a gente troca
4458140	4460140	Mas a Galta vai ser sempre atacante
4460140	4462140	porque ela é maior e pode fazer um gol mais fácil
4462140	4464140	Combinado?
4464140	4466140	Tenta intimidá-los com nossas caretas
4466140	4468140	Pode deixar comigo
4468140	4470140	A bola começa com vocês
4470140	4472140	Morga e Galta rola um dado
4472140	4474140	Seu atributo ao menos
4474140	4476140	Dois, ufa, três
4476140	4478140	A morga foi o atributo dela
4478140	4480140	Eu tô muito puta gente
4480140	4482140	A morga tirou um três
4482140	4484140	Que é um acerto crítico
4484140	4486140	A Galta tirou um acerto simples
4486140	4488140	Eu imagino, se vocês quiserem melhorar isso
4488140	4490140	me ajudem, por favor
4490140	4492140	A Galta começa com a bola
4492140	4494140	Ela chuta pra morga
4494140	4496140	domina a bola
4496140	4498140	passando por um dos elfos
4498140	4500140	e jogando pro gol vazio
4500140	4502140	fazendo o primeiro gol da partida
4502140	4504140	Um gol de bicicleta
4504140	4506140	Tu fez um gol de bicicleta
4506140	4508140	Essa é a nossa
4508140	4510140	É crítico
4510140	4512140	Tu correu, tu mesma levantou a bola
4512140	4514140	e fez a bicicleta
4514140	4516140	Não, pode ser assim
4516140	4518140	Eu tava com a bola
4518140	4520140	Aí eu fui pra cima de um elfo
4520140	4522140	Dei uma patada nele
4522140	4524140	e chutei pra morga
4524140	4526140	Nisso que eu chutei pra morga
4526140	4528140	Perfeito
4528140	4530140	Agora vocês dois estão mais pro ataque
4530140	4532140	Os elfos já pegam a bola e começam a correr
4532140	4534140	rapidamente indo pra fazer o gol
4534140	4536140	Chica Scott, um dado
4536140	4538140	Três ou mais
4538140	4540140	Seis
4540140	4542140	Tem um elfo correndo na tua direção
4542140	4544140	Ele tá com a bola no pé
4544140	4546140	Como é que tu parou ele e tirou a bola?
4546140	4548140	Eu girei a minha trança
4548140	4550140	Ele tentou vir com a bola
4550140	4552140	e eu rebati a bola como se fosse um gol
4552140	4554140	Jogou a bola pra frente
4554140	4556140	Lá pra frente
4556140	4558140	Vai avançar pra fazer o gol
4558140	4560140	A técnica
4560140	4562140	é a morga
4562140	4564140	Vou ficar ali
4564140	4566140	Eu só joguei a bola bem pra frente
4566140	4568140	Como se fosse uma goleira mesmo
4568140	4570140	Continua a dupla de ataque então?
4570140	4572140	Sim
4572140	4574140	Morga e galta, cada um joga um dado
4574140	4576140	Galta tirou quanto?
4576140	4578140	Eu tirei seis
4578140	4580140	Que é um erro
4580140	4582140	Tu te embananou ali, um dos elfos te derrubou
4582140	4584140	Não há falta nesse jogo
4584140	4586140	Ele veio na rasteira e te derrubou
4586140	4588140	Mas a bola sobrou
4588140	4590140	No pé da morga
4590140	4592140	Que tem um acerto crítico
4592140	4594140	Faz esse gol como quiser
4594140	4596140	Vai morga
4596140	4598140	Eu quero fazer uma fita ali na defesa
4598140	4600140	Aí fingir que vou e volto
4600140	4602140	E fazer o elfo cair no chão
4602140	4604140	E só dar um passinho assim
4604140	4606140	Bem snob, bem devagarzinho
4606140	4608140	Pra humilhar mesmo
4608140	4610140	Está de dois a zero
4610140	4612140	Não há um ataque agora pra Chica segurar
4612140	4614140	Porque a cada dois gols
4614140	4616140	De um dos times
4616140	4618140	Muda o lado do campo
4618140	4620140	E nesse momento é o intervalo
4620140	4622140	A Azurra ela traz água pra vocês
4622140	4624140	Ela entrega água ali
4624140	4626140	Olha só, deixa eu falar só rapidinho
4626140	4628140	Antes da gente ir lá pro coisa
4628140	4630140	Quando a morga fez o segundo gol
4630140	4632140	Eu saí correndo pra cima dela
4632140	4634140	Dei um abraço
4634140	4636140	E a gente se abraçou e ficou pulando
4636140	4638140	E a Chica de longe vendo
4638140	4640140	As duas abraçadas
4640140	4642140	Logo que eu percebi
4642140	4644140	Eu separei e falei
4644140	4646140	Tá bom, obrigada
4648140	4650140	Chica, não está sendo um dia fácil
4650140	4652140	Não, mas super bom
4652140	4654140	Mas olha só
4654140	4656140	Quando a gente está as três indo juntas
4656140	4658140	Pro intervalo
4658140	4660140	Aí eu pego assim a Chica
4660140	4662140	Abraço ela com o braço assim
4662140	4664140	Tamo ganhando Chica
4664140	4666140	Aí eu concentradíssima
4666140	4668140	Concentradíssima falo
4668140	4670140	Chica, agora você vai pro ataque
4670140	4672140	Eu fico na defesa
4672140	4674140	Tá bom, tá bom, a Chica está animadinha
4674140	4676140	Ela recebeu a atenção da
4676140	4678140	Ciclone
4678140	4680140	A Azurra ela traz água
4680140	4682140	Pra vocês, as Elfas vão
4682140	4684140	Pro meio da quadra fazer uma dancinha
4684140	4686140	Os Elfos até ficam felizes
4686140	4688140	Por um momento
4688140	4690140	Até que notam que os pompons são vermelhos
4690140	4692140	São vermelhos
4692140	4694140	E elas estão dançando pra vocês
4694140	4696140	A plateia não entende nada
4696140	4698140	É grita assim, bate o palmo
4700140	4702140	Começa o segundo tempo
4702140	4704140	Os Orquídeos vão começar atacando
4704140	4706140	Quem está na defesa?
4706140	4708140	Eu
4708140	4710140	Agora é a Morga, a Morga um dado
4710140	4712140	O segundo tempo começa com um banho de água fria
4712140	4714140	Os Elfos
4714140	4716140	Eles pegam ali a
4716140	4718140	A Morga meio distraída
4718140	4720140	Ela foi avançar e lembrou que ela tinha que voltar
4720140	4722140	E o gol entrou
4722140	4724140	2 a 1 a partida
4724140	4726140	Chica e Galta um dado cada uma
4726140	4728140	É hora do contra-ataque
4728140	4730140	A Galta tirou quanto?
4730140	4732140	Eu tirei 5, que é um erro
4732140	4734140	Ela se embananou ali com a bola
4734140	4736140	A bola chegou pra ela e deixou passar
4736140	4738140	Afinal ela não é uma jogadora profissional
4738140	4740140	Mas a bola sobrou pra Chica
4740140	4742140	E assim
4742140	4744140	É um gol simplesinho
4744140	4746140	Como é que foi esse gol?
4746140	4748140	É um gol simplesinho
4748140	4750140	A bola
4750140	4752140	O Elfo foi tentar bater
4752140	4754140	Pra jogar a bola pra longe
4754140	4756140	Pra afastá-la
4756140	4758140	A bola bateu no meu corpo
4758140	4760140	Na minha barriga
4760140	4762140	E entrou no gol
4762140	4764140	Ela tirou 2, ela tributou era 3
4764140	4766140	E vão manter a formação então
4766140	4768140	A Morga continua na defesa?
4768140	4770140	Eu acho que sim
4770140	4772140	Contra-ataque Morga
4772140	4774140	Tirei 5
4774140	4776140	Ela tributou mais, segurou ali o contra-ataque dos Elfos
4776140	4778140	Continua 3 a 1
4778140	4780140	Eu quero morder esse Elfo
4780140	4782140	Literalmente
4782140	4784140	Você faltei
4784140	4786140	Eu tô muito brava
4786140	4788140	Você tirou sangue ou só deixou uma marca?
4788140	4790140	Só deixei uma marca, me controlei
4790140	4792140	Não há regras lembrando disso
4792140	4794140	Tanto que fazer os jogadores do oponente dormir
4794140	4796140	Até o dia de hoje
4796140	4798140	Não era uma regra escrita
4798140	4800140	Porque ninguém pensou que alguém pudesse fazer isso
4800140	4802140	O time de ataque agora
4802140	4804140	Um dado cada uma
4804140	4806140	Galta tirou quanto?
4806140	4808140	Eu tirei 5
4808140	4810140	Falhou, Chica
4810140	4812140	Eu tirei 4
4812140	4814140	Morga um dado
4814140	4816140	Vocês se embolaram ali
4816140	4818140	E os Elfos conseguiram passar pra vocês
4818140	4820140	Um Elfis que vai correr na direção da Morga
4820140	4822140	E chuta pro outro Elfo
4822140	4824140	Que chuta pro gol
4824140	4826140	E estamos 3 a 2
4826140	4828140	E temos uma nova pausa
4828140	4830140	De mudança de campo
4830140	4832140	As Elfas voltam a fazer a dancinha
4832140	4834140	Azul que tá lá
4834140	4836140	Quer fazer uma massagem na Galta
4836140	4838140	Eu falo assim
4838140	4840140	Meninas, eu acho que a Morga tem que ir no ataque
4840140	4842140	Porque a Morga é
4842140	4844140	É nossa titular aqui
4844140	4846140	E você, Cicote
4846140	4848140	Você defendeu maravilhosamente bem
4848140	4850140	Gente
4850140	4852140	Tá só começando
4852140	4854140	A gente tá na frente ainda
4854140	4856140	Isso tudo a Galta falou
4856140	4858140	Com a Azul assim
4858140	4860140	Firtando o ombro dela
4860140	4862140	Fazendo uma massagem ali
