start	end	text
0	10500	Uma cidade no céu, habitada por seres alados e protegida por sua deusa, uma deusa que muda
10500	17520	de tempos em tempos, uma deusa que nasce para ser uma deusa, uma menina que quando completa
17520	20820	15 anos recebe o peso do mundo nas costas.
22060	24580	Mas será que toda deusa nasce pronta para este fardo?
25640	26500	É o que vamos descobrir.
27500	29840	Episódio de hoje, a deusa menina.
30000	36260	Com Debbie Cabral no papel de Drielle, a deusa menina, que amanhã se tornará a deusa efetiva.
36600	39960	Com Chris Lane e Julia, os protetores da deusa.
40380	41960	Wanda e Morte.
42820	46780	O RPG Guaxa usa um sistema chamado Laser de Sentimentos, na verdade uma adaptação dele.
47280	51940	Basicamente cada jogador possui um único atributo e rola dados de seis faces.
52600	57300	Sempre que precisar realizar uma ação física ou um combate, seja ele um ataque,
58000	59980	precisa atirar no dado de seus lados.
60000	62700	O seu número de atributo ou menos.
63220	67000	Sempre que precisar realizar uma atividade que não seja uma atividade física,
67900	70300	como se esconder, procurar,
71100	73680	precisa tirar seu atributo ou mais.
74300	79640	Rolar no dado exatamente o seu atributo é considerado um acerto crítico.
80220	81780	Lembre-se de nos seguir nas redes sociais.
84300	88260	Lembre-se também que temos apoio no Padrim e no PicPay.
88260	89880	Mais informações no Escudo Mestre.
90000	91220	Lá no final do episódio.
102220	110600	Aí, vocês estão notando aí, né?
111080	111720	Rola o dado.
112740	114320	Bola de fogo!
115040	116220	Chama o...
116220	118140	Chama o clérigo.
118140	118220	Chama o clérigo.
118220	118300	Chama o clérigo.
118300	118340	Chama o clérigo.
118340	118420	Chama o clérigo.
118420	119080	Chama o clérigo.
119080	119180	Chama o clérigo.
119180	119220	Chama o clérigo.
119220	119980	Chama o clérigo.
120000	120220	Chama o clérigo.
120220	121000	Se eu morrer...
121720	122940	Rola a iniciativa.
123640	126020	Então, não tem armadilha.
126280	126900	Podemos ir.
127580	128800	O que vocês fazem?
130220	130880	Tá, tá.
131120	134220	Eu amarro uma corda nelas e uso como arma.
134560	135480	Eu ataco.
135900	139820	O Magro lança seu Thunderbolt mais 15 no Ube Holder.
139860	142120	Eu quero rolar a perseguição, posso?
142960	144520	Tem algum lugar pra se esconder?
145180	147400	Ah, falha crítica.
147940	148920	Ataque de imprudiridade!
148920	149980	Ei, Romão!
150000	157740	RPG Realidades Paralelas do Guaxinim
157740	160700	Sua aventura de bolso na forma de podcast
160700	163660	Uma jornada completa a cada episódio
163660	171920	Skyland é como o próprio nome diz
171920	173440	Uma cidade no céu
173440	176060	Uma ilha flutuando entre as nuvens
176060	178460	Essa ilha possui uma cidade
178460	181580	Um pequeno bosque e um palácio feito de cristal
181580	184720	O palácio fica no centro dessa ilha flutuante
184720	186620	No entorno ficam as casas
186620	188780	E num dos pontos mais afastados fica o bosque
188780	191480	E o resto tem uma borda gigantesca
191480	194680	Que você pode ver nuvens e às vezes algumas pequenas casas à distância
194680	198300	Todos os habitantes possuem asas
198300	199800	Com algumas exceções
199800	202700	Embora todos os habitantes possuam essas asas
202700	203600	Eles não voam
203600	205580	Apenas caem de forma lenta
205580	208100	E podem planar por pequenas distâncias
208100	210280	As asas são de todo tipo
210280	212000	Em sua maioria são de aves
212000	214420	Mas existem algumas que são de insetos
214420	216140	Como borboletas e vespas
216140	218880	No palácio vive a deusa
218880	220900	Uma mulher que nasceu sem asas
220900	223780	E é responsável por manter a ilha flutuando
223780	226860	E ela também protege esta ilha de todo o mal
226860	229500	Ela faz isso através de sua magia
229500	230960	E de seu coração bondoso
230960	234500	Sempre que nasce uma menina sem asas
234500	236520	Nascem dois outros bebês
236520	238080	Com uma asa apenas
238100	241240	Esses bebês são destinados a protegê-la
241240	244200	Por isso nascem com um talento natural para o combate
244200	246060	Em contrapartida
246060	249380	Se eles se afastarem por muito tempo da deusa menina
249380	252440	Eles acabam adoecendo e morrendo
252440	255360	Mas eles podem voar se abraçados
255360	256980	Ou com a deusa menina
256980	258440	Cada um segurando ela por um lado
258440	261320	Então eles podem voar ao contrário dos outros habitantes
261320	263700	Não se preocupem, eu sou levinha
263700	267060	Outra coisa que acontece quando nasce uma menina sem asas
267060	268080	Chamada de deusa menina
268100	271820	É que a deusa em exercício
271820	273860	Começa a contar sua aposentadoria
273860	276100	Pois quando a nova deusa completa
276100	277480	Quinze anos
277480	280200	A deusa anterior é levada pelos braços
280200	281420	Por seus dois protetores
281420	282780	Até uma outra ilha menor
282780	285360	Onde a deusa recebe a imortalidade
285360	286580	E descansa para sempre
286580	289740	E seus protetores tem um desejo atendido
289740	292580	Atualmente os defensores da deusa
292580	294000	São dois homens chamados
294000	295440	Duque e Uno
295440	297680	Duque é o espadachim mais talentoso
297680	298080	Que já existe em todo o mundo
298100	300260	E ajudou vocês no treinamento
300260	302280	Uno é um fanfarrão
302280	304120	Ele deveria ajudá-los no treinamento
304120	306040	Mas a maior parte do tempo ele não estava lá
306040	308240	Ele já quase morreu várias vezes
308240	310180	Por se afastar por muito tempo
310180	311800	Da deusa que ele deveria proteger
311800	314360	Dizem que ele possui alguns filhos
314360	315640	Espalhados pela cidade
315640	317780	Vocês, os jogadores
317780	319880	Estão quase completando quinze anos
319880	322560	O personagem da Debbie é uma deusa menina
322560	324120	Ou seja, quando fizer quinze anos
324120	325900	Ela vai assumir esse posto de deusa
325900	326820	Que protege tudo
326820	328860	E você e os outros dois jogadores
328860	330520	A Chris Lane e o Julian
330520	333380	Eles vão ter que proteger essa deusa
333380	335000	Que estão se preparando para esse momento
335000	337760	Hum, tudo bem
337760	339180	Vamos ver se eu sobrevivo
339180	340720	O Julian tem uma asa
340720	342740	Virada, sei lá, para a esquerda
342740	344520	E a Chris uma para a direita
344520	346480	Essas asas são idênticas
346480	348000	Ou pelo menos muito parecidas
348000	349860	Vocês pensaram numa cor?
349980	351440	Como é que podia ser essa asa de vocês?
351920	354060	É um reino bonito, tão branco
354060	356420	Então são asas de pássaro com penas
356820	357860	São asas brancas
357860	359940	Qual a aparência do teu personagem, Chris?
360360	361680	Cabelo, altura
361680	362700	A minha personagem?
363100	365420	Ela é baixinha
365420	368360	Tem os cabelos cacheadinhos e dobrados
368360	371360	Tem uma carinha de menina irritada
371360	372140	Tá
372140	373120	E o Julian?
375180	377960	Não sei se eu vou como o Morgan de verdade
377960	379560	Mas vai um baixinho
379560	382940	Um baixinho, forte
382940	385420	Barbudo e careca
385420	386800	Tu tem 14 anos?
386820	388820	Não consegue ser barbudo
388820	395540	Então vai
395540	397820	Aquelas barbichinhas que tá crescendo
397820	398900	Sabe, bigode cobrador
398900	400360	Aqueles bigodinhos bem fininhos
400360	403220	Quando tu for realmente o protetor da deusa
403220	404460	Tu acha que vai ter uma barba bonita
404460	406360	Mas por isso é que ela tá em processo
406360	409380	Ultimamente ele olha pra mim e diz
409380	410300	Olha a minha barba
410300	411160	E eu chego bem pertinho e faço
411160	412740	Aaaaah
412740	414160	Aaaaah
414160	414660	Aaaaah
414660	414860	Aaaaah
414860	415460	Aaaaah
415460	415940	Aaaaah
415940	416160	Aaaaah
416160	416660	Aaaaah
416660	416760	Aaaaah
416760	416800	Aaaaah
416820	420840	Aqueles pelinhos nascendo, vai, de adolescente
420840	422740	A aparência da Debbie?
424480	424760	É
424760	426840	Primeiro, meu nome é Drielle
426840	431960	Mesmo sabendo que vai ser ignorado
431960	433340	Ela tem
433340	435200	Ela é bem baixinha também
435200	435980	É
435980	439160	Diria que ela tem, sei lá, um metro e meio
439160	440400	É
440400	442960	Ela tem um cabelo azul
442960	444020	É
444020	445380	Bem comprido
445380	446760	E ela tem duas antenas
446760	450740	Coloridas, assim, rosa com verde
450740	451520	Tudo bem
451520	470460	Vocês estão diante do Palácio de Cristal
470460	472880	O povo tá lá em volta assistindo
472880	476740	Você sabe que, no geral, o povo não gosta muito da arte cristal
476740	477520	Atual deusa
477520	480440	Embora todos a venerem
480440	481640	Porque ela é a deusa
481640	483680	Principalmente por conta do nascimento da Drielle
483680	484360	Por quê?
485100	487300	Normalmente, nasce uma deusa menina
487300	489120	Quando a deusa em atividade
489120	491580	Tá perto dos seus 40, 50
491580	494600	Tem histórias de só quando tinha 60 anos
494600	497640	E a atual deusa
497640	499900	Tinha 20 anos
499900	502100	Quando nasceu a Drielle
502100	505000	Então ela tá pra fazer 35 anos
505000	505560	E vai ser
505560	506720	Terá que ser em 20 anos
506740	507740	E vai ser aposentada
507740	509960	E a Drielle vai tomar o lugar dela
509960	513140	Então o povo viu isso como um presságio
513140	514960	De que ela não era uma deusa tão forte
514960	516800	Que o reino estaria em perigo
516800	518240	Mas fora isso
518240	519280	Falta um dia
519280	522380	Pra essa mudança de deusas
522380	524540	E o reino tá protegido, né
524540	528920	Diante desse público tá sendo apresentado
528920	530580	A nova deusa menina
530580	531860	Embora todos a conheçam
531860	534100	De vê-la andando pela cidade, né
534100	535440	Ela deve estar
535440	536560	A Drielle tá com
536560	538100	Vestes brancas
538100	539760	Pra mostrar a pureza
539760	541280	Da nova deusa que tá chegando
541280	544280	No trono
544280	546160	Fica a deusa atual
546160	547380	Ela é belíssima
547380	548420	É uma mulher muito alta
548420	549740	Um cabelo bem louro
549740	550580	Olhos verdes
550580	552600	E ela tem uma
552600	555060	Aquela majestade
555060	555820	Tu olha pra ela
555820	557300	Tu sabe que ela é a deusa
557300	558320	Que ela é poderosa
558320	559960	E do lado dela
559960	561160	Tá o duque
561160	562560	Que é um de seus protetores
562560	563640	E o Uno
563640	564780	Que é o outro protetor
564780	565520	Ele não tá ali
565520	566420	Embora ele deveria
566560	566760	Ser o deus
566760	574760	A Wanda e o Mori
574760	576060	Eles estão lutando
576060	578380	Uma luta de demonstração
578380	580660	Também eles tem que se provar
580660	582080	Guerreiros poderosos, né
582080	584140	Pro povo se sentir tranquilo
584140	586880	E eles tão fazendo uma luta maravilhosa
586880	587880	Assim, entre eles
587880	590140	Não sei se vocês tão lutando pra valer
590140	591980	Ou se tão lutando de maneira ensaiada
591980	594140	Pô, aqui é risca-faca, velho
594140	596260	Risca-faca já vale pra valer
596560	598100	Pra valer porque eu sou pirreta
598100	599340	É, é isso aí
599340	600440	Poxa, não é o destino
600440	601420	É risca-faca, velho
601420	603800	Cada um rola um dado
603800	606340	Dois
606340	607320	Dois
607320	609040	Quatro
609040	610520	O Julien vai agir primeiro
610520	611300	Rola de novo agora
611300	611840	Dois dados
611840	614280	Nossa, foda, velho
614280	615080	É isso aí
615080	616220	Seis e quatro
616220	617820	Descreve a tua ação
617820	618820	Vocês usam espadas
618820	621180	Luta de espadas
621180	621760	Vamos lá
621760	625100	Eu vou bater da direita pra esquerda
625100	625900	E eu vou bater da direita pra esquerda
625900	626400	E eu vou bater da direita pra esquerda
626400	626540	E eu vou bater da direita pra esquerda
626560	629100	E depois eu vou bater de cima pra baixo
629100	630540	E vou dar uma rasteira
630540	636540	Teu primeiro golpe lateral foi defendido
636540	639580	O segundo pegou o ombro da Wanda
639580	641780	Fez um pequeno corte na roupa dela
641780	644740	Mas a rasteira também não acabou pegando
644740	647380	Tu obrigou a Wanda a recuar
647380	649100	Senão tu teria derrubado ela
649100	650680	Wanda, ataque
650680	653420	Quanto é que tirou?
653500	654300	Dois e cinco
654300	655460	Descreve a tua ação
655460	656400	Eu vou bater da direita pra esquerda
656400	658060	Eu dei aquele passo pra trás
658060	663200	E fui correndo com a espada da direita
663200	664220	Descendo
664220	666340	Da direita pra esquerda
666340	667520	Fazendo um ângulo
667520	668940	Correndo
668940	670620	Tu acaba dando esse pulinho pra trás
670620	673120	Depois já se joga numa investida
673120	675220	Dá um golpe bem forte
675220	678600	O Julian chega a dobrar um joelho
678600	680120	Pra poder aparar o golpe
680120	682840	Ele sente a mão dele doer
682840	684360	De aparar esse golpe
684360	686240	E vocês dois parecem estar bem empatados
686240	687840	Julian, dois dados
687840	689260	Se liga aí
689260	692260	Baixinha aí é forte, rapaz
692260	692840	Vamos lá
692840	694420	Quatro e um
694420	696200	Descreve a tua ação
696200	697760	Esperava menos dela
697760	699920	Mas aqui eu tô vendo que ela é bem mais forte do que eu esperava
699920	703440	Então eu vou atacar da esquerda pra direita
703440	704980	De baixo pra cima
704980	708700	Depois eu vou atacar de cima pra baixo
708700	710860	A direita e esquerda
710860	713340	Tipo, meio que diagonal pra cima
713340	714480	Depois diagonal pra baixo
714480	715640	Tá
715640	716060	O Julian, dois dados
716060	717700	O teu primeiro golpe
717700	721900	Acaba acertando a Cris em cheio
721900	724500	Não chega a cortar a pele dela
724500	729600	Mas corta um pedaço da blusa que ela usa por cima da armadura
729600	732240	Ela vai cair pra trás
732240	734400	O teu segundo golpe pegaria ela em cheio
734400	737100	Mas a tua espada é parada pelo Duque
737100	739340	Que tu nem viu ele se aproximar
739340	742000	Ele parou pra parar o teu golpe
742000	742500	Chega
742500	743440	E te dá os parabéns
743440	744660	Que você venceu
744660	745660	Chega
746060	747500	Que eu tava mostrando pra baixinha aqui
747500	748660	Quem é que manda no negócio
748660	750140	Você não deixou terminar, cara
750140	751560	Pô, mas valeu
751560	753440	Olha, você lutou muito bem
753440	755940	Só tem que usar mais essa asa
755940	758140	Esconda os ataques
758140	759520	Distrai o seu inimigo
759520	761920	Ele estende a mão pra Wanda
761920	763640	Eu não pego na mão dele
763640	764840	Só me levanto com um
764840	766540	E limpo a roupa
766540	769180	Agora você é o oposto, né?
769940	771180	Isso aqui não é uma dança, não
771180	774420	Você vai acabar perdendo essa asa de tanto tentar abrir
774420	775200	Ok
775200	775400	Ok
775400	777040	Os dois estão feridos
777040	779120	A Wanda mais do que o Morte
779120	780000	Mas os dois estão feridos
780000	781260	Ai, meu Deus
781260	782720	Vamos lá, meninos
782720	784680	Menina, chega mais
784680	786020	Ai
786020	790340	Aí eu coloco minha mão em cima dos ferimentos deles, assim
790340	791840	Pra curar
791840	792560	É
792560	795760	Vocês sentem um calor tomando conta do corpo de vocês
795760	797820	E os ferimentos desaparecem
797820	801680	Todo cansaço e ferimento desaparece
801680	802480	Oi
802480	803520	Vou dizer, viu
803520	805240	Vocês não estão feridos
805240	807120	Vocês um dia vão me matar do meu coração
807120	810080	Você sabia, Mori, que o objetivo não era machucar
810080	812720	Eu me controlei e você se aproveitou disso
812720	815640	Pô, mas a brincadeira tava legal, cara
815640	818540	Não, o objetivo era só mostrar o que a gente sabia
818540	821060	Ah, um tapinha não dói
821060	822340	O Duque fala pra vocês
822340	825360	Todo o povo está olhando pra vocês
825360	827240	Se comportem
827940	831640	Ele me apunhou a mão no meio do abdômen
831640	834120	E reverenciou o pessoal abaixo
834120	834240	Aplausos
834240	834360	Aplausos
834360	834400	Aplausos
834400	834440	Aplausos
834440	834520	Aplausos
834520	834560	Aplausos
834560	834600	Aplausos
834600	834640	Aplausos
834640	835080	Aplausos
835080	835200	Aplausos
835200	836900	O Duque fala
836900	839260	Vamos liberar o espaço aqui pros outros
839260	840660	Me sigam
840660	841460	Eu também?
841960	842900	Os três
842900	844560	Tá, vamos lá
844560	847240	Ele vai seguindo por uma parte de trás
847240	849640	Onde tá o trono e tal
849640	851000	Ele fala pra vocês
851000	854000	Olha, eu sinto muito que o Uno não estava aqui pra ver vocês
854000	856240	Mas eu tenho certeza que onde ele estiver
856240	857560	Ele está muito feliz
857560	859000	Eu também
859000	860420	Estou orgulhoso
860420	863060	Amanhã finalmente vou me aposentar
863060	864520	E fazer o meu desejo
864520	867240	Sabe o que eu estou tranquilo
867240	870500	Saber que vocês três são capazes de nos substituir nesse fardo
870500	871580	Obrigada
871580	873940	Obrigada também pela confiança
873940	875860	É isso aí, obrigada
875860	877900	No templo ao norte
877900	879740	O sacerdote Zero os espera
879740	881460	Pros últimos preparativos
881460	884280	Vamos pra lá, o mais rápido possível
884280	885120	Tudo bem
885120	886680	A gente vai voando
886680	889140	Vamos aí galerinha
889140	891240	Como é que voa com um asa?
891240	892920	Eu não aprendi ainda essa parte
892920	893500	Nossa
893500	894360	Para com isso
894360	896200	É só a gente se abraçar e levar ela
896200	897560	Como a gente sempre faz
897560	898820	Oi, oi, oi
898820	900120	Vamos lá
900120	902100	Ei, olha essa mão boba, hein
902100	903100	Opa
903100	905100	Unidos venceremos, vamos lá
905100	912420	Vocês começam a voar
912420	914360	Em direção à borda, né
914360	917860	Que é literalmente um disco flutuando no céu
917860	920180	Vocês vêm saindo de uma casa
920180	922320	Próximo ao local do evento
922320	924020	O Uno
924020	926540	Ele parece estar apertando os botões da camiseta
926540	927700	Ele parece meio atrasado
927700	930560	Tisque, tisque, hein, seu Uno
930560	932600	Ele olha pra cima
932600	934900	Dá um sorriso pra vocês
934900	936620	Vocês acham, principalmente as meninas
936620	938260	Um sorriso muito bonito
938260	939760	Ele faz um sinal
939760	941620	Ele põe a mão na testa, assim
941620	943880	Faz um sinal, tipo, me desculpem
943880	945820	E ele segue pra apresentação
945820	948080	Eu solto o braço da Debbie
948080	949560	Deu tchauzinho, mas quando ela tá caindo
949560	950460	Eu jogo o outro braço
950460	953980	Segura baixinha
954020	954440	Rapaz
954440	956460	Ei, cê tá louca?
957120	957680	Desculpa
957680	961080	Não sou só eu que caio não, hein
961080	962520	Cê empolga não
962520	965140	Cê só tem uma, umazinha
965140	967780	A cidade lá embaixo
967780	969120	Vocês veem a população
969120	970840	Em sua maioria está lá
970840	973220	Vendo as apresentações
973220	975840	Algumas outras pessoas andam de um lado pro outro
975840	978440	Todo o bosque
978440	979460	E alguns locais
979460	980960	A comida simplesmente surge
980960	983740	Porque a deusa está ali pra proteger a todos
984020	986280	A população no geral não faz muita coisa
986280	987680	Além de colher as frutas
987680	989100	Tem pessoas que gostam de cozinhar
989100	990280	Acabam cozinhando
990280	993020	Tem pessoas que gostam de cuidar de animais
993020	996400	Embora toda a região coma apenas frutas e vegetais
996400	997520	Ninguém sacrifica animais
997520	999960	Todos os animais, incluindo os domésticos
999960	1000800	Possuem asas
1000800	1002340	Gato, cachorro
1002340	1004240	Embora nenhum deles voe realmente
1004240	1005040	Apenas plane
1005040	1007680	Embora também existam pássaros
1007680	1009320	Que esses sim voam por padrão
1009320	1013680	E vocês chegam na
1013680	1015280	Perto da borda
1015280	1016180	Onde tem a igrejinha
1016180	1018600	Pousam, né, diante dela
1018600	1021000	Lá tem um senhor que é muito, muito velho
1021000	1022560	Ele já estava esperando vocês
1022560	1024240	Ele abre um sorriso
1024240	1025080	E diz
1025080	1027580	Por favor, entrem
1027580	1029480	Mostra algumas almofadas
1029480	1031200	Sentem
1031200	1033240	A do meio é minha
1033240	1036400	Vai lá, ó chatona
1036400	1037980	Vou pegar do canto ali, vai
1037980	1040200	Vou pegar da direita por causa da ameaça
1040200	1042340	O sacerdote fala
1042340	1043620	Vocês viram todas?
1043680	1046260	Todas essas pessoas olhando para vocês
1046260	1048840	As crianças sorrindo
1048840	1051920	Todas essas vidas só existem
1051920	1053620	Graças a nossa deusa
1053620	1055160	E amanhã
1055160	1057620	Essa responsabilidade
1057620	1058780	Será sua
1058780	1061660	A partir de amanhã
1061660	1064120	Não haverá mais espaço para erros
1064120	1067120	Vocês serão adultos
1067120	1069580	Todas essas vidas
1069580	1071480	Dependerão de vocês
1071480	1073360	Se a deusa
1073360	1074080	Menina
1074080	1076320	Quando se tornar deusa regente
1076320	1077300	Fraquejar
1077300	1079460	Ou falhar
1079460	1082440	Todos aqui sofreremos
1082440	1085620	E não só as pessoas
1085620	1087380	Que vocês conhecem
1087380	1090040	Pois lá embaixo existe um mundo
1090040	1092220	Com bilhões de vidas
1092220	1094440	Que dependem apenas
1094440	1095220	De vocês
1095220	1096480	Para, para, para
1096480	1098220	Não, não, não estou pronta não
1098220	1100380	Para de botar esse peso todo em cima de mim
1100380	1102480	Eu estou com a cara de assustada
1102480	1103120	Olhando para ele
1103360	1104720	Pô, deixa eu te reclamar aí
1104720	1105440	O que é que vocês estão
1105440	1107120	Passando essa vida toda treinando
1107120	1109180	Vocês já tem 14 anos
1109180	1110840	Pô, estou prontíssima
1110840	1111720	Vamos lá galera
1111720	1115360	Pelo menos alguém está pronto
1115360	1118100	O Asha, né
1118100	1120300	Respeita aí
1120300	1122440	O sacerdote fala
1122440	1125700	Eu já vi muitas deusas
1125700	1127860	Virem e partirem
1127860	1129800	E se tem um conselho
1129800	1131080	Que eu posso lhe dar
1131080	1133200	É que faça o seu melhor trabalho
1133200	1133340	E que faça o seu melhor trabalho
1133360	1135980	Sabendo que no final
1135980	1137100	Do seu fardo
1137100	1139360	Vocês serão recompensados
1140380	1142020	Eu passo a mão
1142020	1142800	No ombro da Debbie
1142800	1145000	No ombro da deusa
1145000	1146440	Da futura deusa
1146440	1149360	Como se fosse só reconfortar
1149360	1154640	Estamos juntos galera
1154640	1156220	Vai dar tudo certo
1156220	1159760	Como é tradição
1159760	1162320	Vocês devem meditar no templo
1162320	1163340	Pense em Deus
1163360	1164620	E no que está por vir
1164620	1167260	Esvaziem seu coração
1167260	1169800	De todas as dúvidas
1169800	1173640	Aqui se vocês prestarem bem atenção
1173640	1176540	Poderão ouvir muitas vozes
1176540	1179780	De vidas muito distantes
1179780	1182400	Esse local vai mostrar
1182400	1184080	A grandeza que está
1184080	1185880	Reservada a vocês
1185880	1187900	Ele sai
1187900	1189420	Deixa vocês lá sozinhos
1189420	1193060	Ah, que história é essa, né
1193060	1195520	Ai, fica aqui até amanhã
1195520	1197100	A gente não come
1197100	1199180	Vocês estão conseguindo ouvir alguma coisa?
1200340	1201040	Não, nada
1201040	1201900	Alguém?
1203420	1203760	Ei
1203760	1206580	Não, não, nada
1206580	1209240	Vocês não escutaram nada antes?
1209680	1211480	Isso é novo pra todo mundo?
1212180	1212900	Nenhum boato?
1215240	1217660	Vocês aos poucos começam a ouvir vozes
1217660	1218540	Das pessoas
1218540	1219760	Felizes
1223060	1224060	, maravilhosas, maravilhosas
1224060	1224460	Viva
1224460	1226600	O novo deus vai sumir
1226600	1227540	Finalmente
1227540	1229380	Me sinto tranquila agora
1229380	1232160	Sim, eu sempre tive medo dessa deusa nos condenar
1232160	1233580	Ela é muito jovem
1233580	1235120	Quando a deusa menina nasceu
1235120	1236780	O melhor suco que eu já tomei
1236780	1238140	Só pode ser um sinal
1238140	1239900	Um novo ciclo se inicia
1239900	1240520	Festa
1240520	1241820	Eu vou sentir falta do Duque
1241820	1242240	Madruginha
1242240	1244760	Eu tenho um cenouro
1244760	1246780	E daí as vozes vão ficando cada vez mais distantes
1246780	1250320	Vocês escutam pessoas que não são daquela região
1250320	1252340	Em vários idiomas
1252340	1252560	É
1252560	1254480	Falando línguas diferentes
1254480	1257380	Mas vocês notam que o mundo inteiro
1257380	1258840	Pode ser ouvido ali
1258840	1260940	Quanto mais vocês se concentram mais
1260940	1263840	Aquela cacofonia de vozes vindo por todos os lados
1263840	1264820	Falando com vocês
1264820	1267240	Nossa, vocês estão ouvindo?
1267800	1268880	Tô conseguindo ouvir isso
1268880	1274240	Pô, a parada parece séria aí
1274240	1275720	Tem gente em todo canto
1275720	1278180	E eu não tô entendendo metade do que eles estão falando
1278180	1280240	Ai, eu não sei se eu tô gostando
1280240	1281440	Disso não, gente
1281440	1282240	Esse monte de...
1282560	1284120	De gente falando na minha cabeça
1284120	1285420	O que que eles querem de mim
1285420	1285880	O que que...
1285880	1286680	Ai, não
1286680	1287880	Não, não, não, não
1287880	1288280	Calma
1288280	1288980	Calma
1288980	1289960	Você é a deusa
1289960	1291440	Você tem que saber de tudo
1291440	1293080	Pô
1293080	1294500	Chama o maluco lá, velho
1294500	1295600	Eu não tô mais preparado, não
1295600	1296880	Tem que me preparar de novo
1296880	1298720	Eu quero mudar a minha opinião
1298720	1300200	Naquela pergunta lá dele
1300200	1301180	Volta lá
1301180	1302960	Reprovou
1302960	1305780	Vocês notam que o tempo ali
1305780	1307300	Parece ter passado muito rápido
1307300	1309660	Porque pela janela vocês vêem que já é a noite
1309660	1311880	Quando...
1311880	1312400	Um...
1312400	1313660	Um barulho diferente de vozes
1313660	1314840	Chama a atenção de vocês
1314840	1317360	Que parece som de...
1317360	1318520	Coisas rachando
