start	end	text
4814120	4815460	Olha só. Olha só. Olha só.
4815480	4817660	Olha só. E se essa
4817660	4819640	era a verdadeira deusa?
4820080	4821080	Pera aí.
4821200	4823660	Pera aí. A gente tá numa ilha
4823660	4825760	que é cheia de deusas. Aposentadas.
4825980	4827440	Mas deusas. Não mortas.
4827720	4829740	Não mortas. Exatamente.
4830380	4831660	Porém... Vamos entrando.
4831920	4833380	Vamos ver se a gente descobre.
4833580	4835600	Se a gente acha a deusa, a nossa
4835600	4837540	deusa que tava lá. E ela vai ter uma
4837540	4839420	explicação. Ela ou alguém vai ter.
4839600	4841260	Vamos continuar andando aqui. Vamos sim.
4843860	4845460	Vocês andam por mais alguns corredores?
4845480	4847500	E passam por mais uma
4847500	4849880	pilha de corpos de mulheres mortas.
4851880	4853460	Ai, meu coração.
4854060	4854320	Ai.
4855900	4857400	Vou só perguntar pra garantir. Tem certeza
4857400	4859680	que não quer que a gente volte e mate ele?
4859980	4861120	Tá? Tipo isso.
4861340	4863660	Uai. Você disse que se ele matar, mata.
4863800	4865440	Eu acho que não. Ele tá preso.
4865640	4866960	Por que a gente vai matar?
4867240	4869560	Eu tenho um bom coração. Ele vai
4869560	4871560	depois ficar preso. Ele não vai
4871560	4871960	morrer.
4871960	4872800	Tá ok.
4873220	4875220	É... Meu Deus.
4875480	4877080	As pessoas todas estão mortas.
4877200	4879440	Eu tento sentir se tá todo mundo morto. Se não tem
4879440	4881460	ninguém ali no meio que tenha
4881460	4883360	sobrevivido. Ali os teus poderes não
4883360	4885340	funcionam, mas tu sente que
4885340	4887480	tem pessoas ali que morreram
4887480	4889080	em diversas épocas diferentes.
4889400	4891100	Nenhuma delas. Elas não morreram ao mesmo tempo.
4891160	4893580	Elas são trazidas pra cá pra morrer.
4894000	4895300	Não existe a coisa do
4895300	4896240	desejo.
4897460	4898760	Meu Deus!
4899560	4901780	Oh, deusa! Oh, eu mesma!
4901780	4903800	Na verdade, nunca
4903800	4905460	existiu. Toda vez que eu estou aqui, eu estou aqui.
4905460	4907460	Toda vez que nasce alguém assim que nem
4907460	4909500	a gente, depois de um
4909500	4911140	tempo, a gente vai morrer.
4911560	4913640	Não existe retiro.
4913740	4914660	Não existe nada.
4915300	4917700	Sabe o que a gente podia fazer? Falar com
4917700	4919420	o mestre que
4919420	4920740	falou com a gente lá embaixo.
4920960	4922960	Que falou com a gente na igreja? Sim.
4923220	4925300	Na igreja? Cadê ele? Vamos falar com o Duque.
4925620	4927460	Ele tá lá amarrado. É, o que tá
4927460	4929140	amarrado. Que tava tentando matar vocês.
4929440	4930960	Vocês vão voltar? É isso?
4931180	4933380	Não, não. Pera, pera, pera, pera, pera, pera,
4933380	4935380	mulher. Essas pessoas, elas foram mortas.
4935460	4937100	Ou elas só morreram?
4937420	4939660	Vai ver ficar os corpos, dois dedos.
4939740	4941560	Vamos nas três verificar os
4941560	4943480	corpos. Vamos lá, rodei o dado
4943480	4943780	aqui.
4945380	4946100	Um e seis.
4947340	4948900	Todos os corpos tem
4948900	4951100	dois golpes de espada.
4951220	4953700	Espadas cravadas. Um de cada lado do corpo.
4953780	4955140	Todos tem essa mesma morte.
4955360	4956540	Ai, caramba, viu?
4958380	4959720	Será que é algum ritual?
4960580	4961060	Sim!
4961280	4962420	É isso que eu tô dizendo!
4962420	4964400	As deusas são
4964400	4965420	mortas pelo...
4965460	4966620	Pelos seus guardiões?
4966880	4969420	É isso que eu tô dizendo! Depois que nasce alguém novo,
4969760	4971220	as outras pessoas tem que vir aqui
4971220	4972020	morrer!
4974220	4975780	É, faz sentido.
4976040	4977120	Mas, não,
4977380	4978860	eu não gostei dessa ideia, não.
4979040	4980880	Vamos lá, vamos voltar lá no Duque e
4980880	4982700	perguntar pra ele o que aconteceu.
4983300	4984860	Vocês voltam...
4984860	4987340	Antes da gente voltar, Guaxa, a gente chegou no
4987340	4989980	final desses túneis ou...
4989980	4991620	Não, a gente parou no meio do caminho.
4991840	4992500	Parou no meio do caminho.
4992500	4994420	Ah, então já que a gente chegou até aqui, melhor terminar.
4994700	4995380	É, então.
4995460	4996960	Senão a gente vai ter que voltar isso tudo de novo.
4997440	4998660	Vamos até o final, então.
4999000	5001200	Vamos. Ele não vai sair de lá mesmo? A gente pode
5001200	5002900	perguntar daqui a pouco se a gente não achar nada.
5003280	5005400	Vocês vão seguindo e passam por vários
5005400	5007300	outros corpos, até que
5007300	5009720	chegam no final da caverna.
5009940	5011580	E lá tem uma sala
5011580	5013420	com mais alguns corpos pelos cantos.
5013660	5015200	E no centro dessa sala tá
5015200	5017300	a deusa. Ela tá, assim,
5017360	5019560	agachada no chão, com as mãos no rosto
5019560	5020040	chorando.
5020040	5021960	Deusa? Deusa? Deusa?
5022440	5024360	Ela olha. Ela olha pra vocês.
5024360	5026280	O Duque morreu?
5026520	5028640	Não, ele tá só preso. O que que aconteceu?
5029440	5030820	Ele cometeu um pecado
5030820	5032680	terrível. Nós
5032680	5034380	cometemos. O quê?
5034720	5036880	Eu já vou colocando a mão
5036880	5038700	na minha espada. Ele desejava viver
5038700	5040040	comigo pra sempre.
5040760	5042900	Mas quando o sacerdote explicou o meu verdadeiro
5042900	5044880	destino, o mal tomou
5044880	5046580	conta dele e de mim.
5046960	5049060	Por um momento eu sonhei o sonho
5049060	5050660	dele. Tá vendo?
5050840	5052640	Falei que destino final era
5052640	5053820	vir pra cá morrer.
5054360	5056640	Mas a gente pode mudar isso. A gente não precisa.
5057060	5058420	Não precisa. Por que que
5058420	5060400	precisa vir pra cá morrer? Não pode.
5061100	5062860	Só de pensar na possibilidade,
5062960	5064720	o reino começou a se destruir.
5065420	5067120	E as pessoas começaram a sofrer.
5067240	5068480	Eu tenho que escolher entre a minha
5068480	5070040	felicidade ou a de todos.
5072540	5074320	E se a deusa nova morrer?
5074700	5076260	Hã? Você vai me matar?
5076620	5078860	Calma aí, galerinha. Calma aí, galerinha.
5078860	5080300	Eu só estou perguntando.
5080460	5082200	Calma, calma. Deusa reclamando aí.
5082280	5084120	Fica calma. E baixinha. Silêncio.
5084360	5086720	Vamos entender como é que funciona
5086720	5088980	a coisa aqui, rapaz. Calma aí.
5089260	5089920	Fala aí, deusa.
5090280	5092780	E se a novinha ali morrer?
5093000	5094640	Ela reclama pra caralho. Também não gosto dela não.
5094740	5094840	Vai.
5097660	5098780	Eu te salvei!
5101780	5102780	A deusa diz...
5103400	5105040	O meu tempo já acabou.
5105860	5106980	Agora é o tempo dela.
5107140	5108800	Eu não sirvo mais como pilar
5108800	5109660	desse mundo.
5110520	5112920	E você se lascou porque agora você não gosta de mim
5112920	5114340	mas vai ter que me engolir.
5114360	5116360	Pera, pera.
5116360	5118500	Só se os guerreiros
5118500	5120220	podem te matar ou se outros
5120220	5122700	guerreiros te matarem, tudo se estabiliza.
5123000	5123740	Não precisa.
5124340	5126460	Basta eu morrer e o poder de proteger
5126460	5128360	os reinos passa para a nova deusa.
5128880	5130380	O ritual antigo é
5130380	5132020	destinado aos protetores que dão
5132020	5133600	seu último abraço.
5134340	5135500	Mas nessa situação
5135500	5138560	teremos que abrir mão das formalidades.
5139360	5140740	Ah, eu não quero ver isso não.
5141080	5142640	Coloco a mão na minha espada
5142640	5143460	e olho pra deusa.
5143460	5144920	Só pode ter uma deusa no mundo.
5145200	5146500	Eu não quero ver isso não.
5146860	5149100	E se a gente mandar essa deusa pra outra
5149100	5151920	realidade ou pra outro lugar aí?
5152160	5152620	Não tem certo?
5153940	5155440	Enquanto essa deusa estiver viva
5155440	5157660	a outra deusa não tem poder pra fazer nada do tipo.
5157780	5158780	Ai caramba, viu?
5159020	5159840	É difícil, hein?
5160840	5162880	Essas leis aí são meio complicadas.
5163240	5165780	A Debbie sabe que o reino de vocês está se rachando
5165780	5167660	cada vez mais. Outros pedaços
5167660	5169700	estão se desprendendo e pessoas lá
5169700	5170840	embaixo estão sofrendo.
5170840	5173000	Deusa, eu sei que eu deveria fazer tudo
5173000	5174820	o que você pedisse e te proteger.
5175100	5177040	Mas nesse exato momento eu preciso
5177040	5178340	proteger a nossa tã.
5178640	5180260	Isso, eu sei disso.
5180640	5182940	E ela sabe também, não sabe, deusa?
5183260	5184980	Só é muito difícil saber que
5184980	5187140	daqui a alguns anos vou ser eu nesse lugar.
5187540	5188980	Mas você sabe que tem
5188980	5190100	que ser feito isso.
5190320	5192680	A gente pensa nisso depois. Vamos resolver o de agora.
5192760	5193600	Enfim, a faca não.
5197140	5198400	Como assim?
5198400	5200900	Alguém vai impedí-la?
5201280	5202440	Ou ajudá-la?
5203000	5204000	Eu só fecho o olho.
5204220	5207360	Eu estou surpreso, eu não vi.
5208000	5208600	A Wanda
5208600	5211280	tira a vida da deusa.
5211540	5212560	A Debbie sente
5212560	5215840	uma energia tomar conta do corpo dela.
5216840	5219580	Ela sente que todas as rachaduras,
5219900	5221260	as criaturas, tudo
5221260	5223340	desaparece no reino de vocês
5223340	5226100	e que o mundo lá embaixo está um pouco melhor agora.
5226200	5227400	A gente ainda estava discutindo,
5227400	5229540	tentando achar uma solução e você foi lá
5229540	5230420	e matou a deusa.
5230920	5232980	Não, ela tinha que fazer isso.
5233000	5235040	Isso mesmo, não tinha jeito.
5235440	5237000	E a deusa sabia disso.
5237400	5238460	Agora está tudo bem.
5238720	5241480	O reino está bem, as coisas lá embaixo
5241480	5242520	estão bem também.
5242920	5245000	Mas, mas, mas...
5245660	5247000	Mas nada, mas nada.
5247300	5248880	Fecha sua boquinha, fecha sua boquinha.
5249220	5251120	Fecha sua boquinha, porque depois que você
5251120	5252300	disse que você não gosta de mim,
5252620	5254480	acho bom você ficar bem quietinho.
5254500	5256700	Porque agora eu sou a deusa.
5257120	5259500	Eu limpo a espada olhando pra ele com a cara de...
5259500	5261720	Já reclamava antes.
5263000	5264980	Mas acho que a gente deveria voltar pra falar com o Duque.
5265140	5267180	Porque agora a gente matou
5267180	5268640	o amor da vida dele.
5268900	5269740	É, vamos lá.
5269940	5271540	Vamos voltar no Duque.
5271720	5272940	Vocês voltam até o Duque.
5273080	5276120	Ele está chorando, ele já acordou e ele está preso ao chão.
5276280	5276720	Duque.
5276940	5277680	Ele olha pra você.
5278340	5280740	A gente entende o que aconteceu,
5281220	5284300	mas você entende também que a gente precisava fazer
5284300	5285760	o que a gente fez,
5285760	5287400	que você não conseguiu fazer.
5287680	5288240	Não entende?
5288400	5288940	Eu entendo.
5289660	5292440	Pelo que sei, Deus já cumpriu o seu destino.
5293000	5295340	Eu tenho direito a um pedido, não é mesmo?
5295480	5296740	Tem, tem direito.
5296860	5298140	Coloque meu corpo ao lado dela.
5298800	5300720	Então, me deixem até lá.
5301380	5303620	Não queremos mais mortes nessa discussão.
5303840	5305140	Me deixem até ela com a minha espada.
5305440	5306840	Não, não.
5307360	5309040	Você não precisa morrer.
5309720	5310620	Só uma pergunta.
5311060	5313060	Desculpa toda a sua dor, mas
5313060	5315700	qual era o destino final dos guerreiros?
5316240	5316800	Renascem.
5317240	5318040	Como mortais.
5318260	5320460	Então, na hora que a gente te matar,
5320460	5322640	ou se a gente te matar,
5323000	5324700	você vai virar um mortal, é isso?
5325000	5325240	Sim.
5325520	5327660	Eu vou nascer em uma família humana.
5327700	5329200	Ai, menos mal, eu acho.
5329420	5332340	Aí eu pego essa coisa de energia
5332340	5335740	e a gente leva ele pra dentro da cachoeira,
5335860	5338280	pro perto do corpo da deusa.
5338720	5340060	E vocês vão voltar lá pra baixo,
5340180	5341000	pro castelo cristal?
5341960	5342400	Sim.
5343160	5343800	Mas peraí, peraí, peraí.
5343820	5344780	A gente vai deixar ele com a espada?
5344980	5345700	Ele se mata.
5346020	5346280	Não?
5346340	5347440	Não precisa da gente se matar.
5347720	5348720	A gente vai matar o outro agora.
5348960	5350060	Eita, então tá.
5350680	5352980	Eu vou deixar ele com a espada aqui em cima.
5353000	5354880	Ele quase matou a gente lá embaixo.
5355020	5355300	Vou dizer a ele.
5355920	5356960	Vou chegar assim perto dele.
5357180	5357460	Vou dizer.
5357740	5358300	Tudo bem.
5358620	5360160	Tá melhor aqui perto da sua amada.
5360360	5360800	Obrigado.
5360900	5361180	Pá.
5361360	5362060	Uma facada nele.
5362680	5363120	Ai.
5363820	5364760	Meu Deus.
5365260	5365620	Caraca.
5365640	5366440	Tu tem uma...
5366440	5369260	Tu tem um psicopata e um cara que não gosta de ti, Debbie.
5369360	5369920	Tu tem futuro.
5371060	5373360	Quando chegar a tua hora, tu pode ficar tranquila.
5375300	5377140	Ninguém vai te tupear, né?
5378900	5380740	Ô, se liga aí, ô.
5380740	5381920	Ô, reclamona.
5382000	5382820	A baixinha não tem pena?
5383000	5384720	Tu se liga.
5387040	5390220	É bom saber que as coisas vão funcionar.
5390320	5392600	Vão ser cumpridas quando chegar a minha hora.
5393860	5397120	Vamos voltar lá pro reino de cristal.
5398400	5402280	Antes de voltar, eu olho assim pra Wanda e falo...
5402280	5403000	Nenhuma lágrima derramada?
5403720	5404060	É isso?
5404160	5406000	É tipo sangue nos olhos mesmo?
5406080	5407860	Matou e nenhum ressentimento?
5408060	5408980	É, tinha que ser feito.
5409060	5409500	Como ele.
5409860	5410360	É, exatamente.
5410360	5412460	Foi pra isso que a gente treinou.
5412460	5414560	E pra isso que a gente tem as espadas.
5414880	5416380	Não só pra isso, mas isso faz parte.
5416540	5419120	Por isso que ele te perguntava isso na luta.
5419460	5420380	Ai, que triste.
5420700	5421680	Eu chorei.
5421860	5422660	Eu chorei.
5422960	5424960	Caraca, tudo faz sentido agora.
5427940	5428640	Bora, Deus.
5428820	5430880	Decisões difíceis ainda deverão ser tomadas.
5431260	5431680	Vamos.
5431840	5432400	Vamos voltar.
5432520	5433320	Pega na mãozinha aqui.
5433760	5436640	Eu tô dando unhada na sua mão.
5438060	5439600	Eu tô segurando a sua mão.
5439760	5441460	Eu tô torcendo os seus dedos.
5441460	5442260	Os seus dedos.
5442460	5443220	Nossa, minha mão.
5443460	5446060	Tu vê que machuca um pouquinho, mas...
5446060	5446840	Ô, ô, ô.
5446920	5448620	Você não faz essas coisas não?
5448800	5450880	O toque dela cura mais do que machuca.
5452300	5455220	Mesmo que ela queira machucar, a sensação é boa.
5458020	5458420	Droga.
5458720	5459280	Volta aí.
5459360	5460760	Eu vou mudar a minha resposta, então.
5461860	5462260	Droga.
5462360	5463720	Ô, ô, ô, ô, reclamona.
5464060	5465400	Você tá pensando que você tá me ferindo?
5465520	5466860	Não, você tá fazendo bem.
5467040	5467840	Faz mais aí, vai.
5468120	5469320	Muda pro outro lado.
5469620	5471840	Muda pra outra mão aí, que essa massagem tá boa.
5472460	5473280	Não, não, não.
5473280	5490140	A população tá em festa lá embaixo.
5490260	5492280	Tá muito feliz com a nova deusa chegando.
5492460	5493360	Tá comemorando.
5493620	5498320	A Debbie sabe que o povo tá feliz porque a antiga deusa agora tá junto das amigas.
5498820	5501840	Conversando, tomando chá, descansando pela eternidade.
5501840	5501900	Não.
5501900	5502000	Não.
5502000	5505160	Esperando o dia que você vai se unir pra tomar chá com elas.
5505960	5507700	Tá uma festa lá, carnaval.
5507940	5511760	Eu tô com um sorriso na cara, nesse momento.
5514200	5514940	Carnaval, hein?
5514960	5517460	E eu tô acenando, acenando igual Miss.
5518060	5520280	Como você se sente em relação a isso?
5520820	5528340	Eu me sinto triste, mas não vejo como um problema.
5528340	5532160	Eu vejo como faz parte, é um ciclo que precisa ser cumprido
5532160	5535140	e eu vou cumprir na hora que chegar a hora, eu acho.
5535320	5535780	Eu acho?
5537280	5540440	Eu acho, ainda vai demorar um tempo, né?
5540520	5544960	Vai que eu mudo de ideia, mas a princípio sim, eu vou fazer quando chegar a hora.
5545320	5550080	No mesmo dia que tu assumiu como a deusa, nasceu uma menina sem asas.
5558340	5576680	Escudo do Mestre
5576680	5580460	E chegamos ao Escudo do Mestre, que é aquela estrutura de papelão
5580460	5584320	onde o mestre protege suas rolas de dados e suas anotações.
5584480	5587280	Muitos mestres, quando acaba a aventura, ele baixa seu escudo
5587280	5588320	e deixa seus jogadores escondidos.
5588340	5589420	Eles espiarem o que ele preparou.
5589860	5591100	Mentira, a maioria não deixa.
5591420	5593520	Alguns nem anotações tem, nem dados rolaram.
5593660	5595860	Fique registrado aqui a denúncia.
5596300	5599820	Mas, na realidade, para a loja do Agostinim, eu abaixo essa estrutura de papelão
5599820	5602280	e venho aqui contar um pouco da aventura para vocês.
5602680	5604860	Então, querem saber qual foi a minha inspiração para ela?
5605360	5608660	Será que foi um daqueles contos de curso de catequese?
5609220	5611720	Será que foi um anime?
5612300	5615800	Ora, vamos descobrir tudo isso e outras coisas nessa leitura.
5615800	5617800	Mas antes, eu queria agradecer muito aos jogadores
5618340	5624920	a Debbie, que além de ter jogado, ela é madrinha e revisora dos episódios.
5625240	5628120	Esse episódio só saiu graças a ela.
5628640	5630980	Por sinal, a versão que eu mandei para ela olhar,
5631320	5634240	que na minha cabeça estava tudo certo, tinha a fala faltando,
5634360	5636140	foi uma correria para lançar esse episódio,
5636500	5638180	ele deu uma atrasadinha por culpa minha.
5638440	5640920	Na verdade, a culpa é dela, porque o episódio poderia ter saído antes,
5641060	5643800	cheio de defeito, mas é obrigado, Debbie.
5644240	5646700	A Debbie, para quem não sabe, ela é podcast, ela é lá no Sycast,
5646800	5647700	ela é redatora.
5648340	5653440	Ela é responsável pelos textos lá, então não deixe de prestigiar o portal.
5653740	5656160	O portal também emprestou os outros dois jogadores.
5656740	5660900	A Cris Lane, que é mais conhecida por gravar o Derivadas,
5660960	5662540	a leitura de e-mails do Sycast,
5662920	5665960	mas ela grava vários Sycasts também, spin de notícia,
5666500	5667280	e está sempre por aí.
5667660	5669060	Então, muito obrigado, Cris.
5669420	5670220	E ela é madrinha também.
5670720	5673980	O nosso terceiro elemento tem três coisas em comum.
5674540	5676860	Ele também é do portal Deviante, ele também é padrinho
5676860	5678320	e também é podcaster lá do Sycast.
5678340	5681780	Então, nosso querido Julian, muito obrigado.
5681880	5682980	Ele ficou padrinho recentemente.
5683120	5684900	Essa semana eu vou até agradecer ele daqui a pouco.
5685500	5688700	Ele tinha gravado bem antes, então ele não gravou porque era padrinho.
5689140	5690500	Ele virou padrinho porque gravou.
5690840	5692820	O que me faz querer chamar cada vez mais pessoas.
5692960	5693500	Não, mentira, gente.
5693700	5696060	Chamei ele porque o Malta não pôde.
5696520	5697560	Fique registrado aqui.
5698040	5699700	Que, porra, maravilhosa a participação dele.
5699780	5700540	Quero agradecer muito.
5700860	5702920	Mas eu chamei ele em cima da hora para gravar,
5703280	5705260	porque o Malta iria gravar essa aventura
5705260	5707860	e acabou ficando preso do lado de fora de casa.
5708340	5710580	Essa aventura, no final, tem aquele dileminha moral
5710580	5711540	que a gente vai falar daqui a pouco.
5712120	5713780	E ela tinha pensado nesse dilema,
5714300	5716200	o Malta, para tentar resolver.
5716720	5718540	Mas ficou maravilhoso o papel do Julian.
5718900	5720160	Quero agradecer muito ele aqui.
5720640	5722340	É muito importante que você me siga
5722340	5723480	nas redes sociais,
5723620	5727920	tanto no Twitter quanto no Instagram.
5728400	5730740	Isso serve para mostrar para as marcas que a gente é relevante.
5731320	5732960	E isso para o meu ego também é bom, gente.
5732960	5733760	Hoje eu vou falar de ego.
5733820	5735520	Eu quero meu ego. Vamos lá. Eu quero números.
5735520	5736000	Números.
5736280	5738320	Siga o Marcelo Guaxinim tanto no Twitter quanto no Instagram.
5738340	5740400	E também siga no Twitter
5740400	5744360	Eu sei quantos vocês são.
5744480	5746400	Eu sei quantos estão baixando.
5746800	5748280	E o número lá é muito, muito inferior.
5748700	5750300	Então sigam lá também. Eu sou bem legal.
5750700	5752420	Às vezes eu converso comigo mesmo,
5752520	5753720	com vocês, com quem aparecer.
5754240	5755200	Posto coisas legais lá.
5755640	5757980	Eu não sou o chato que fica flodando a timeline de vocês.
5758320	5760520	Às vezes, em algum evento especial,
5761380	5763140	eu faço um pouquinho mais de AOE.
5763420	5764560	Mas normalmente eu sou bem quietinho.
5764820	5766180	Então me sigam lá também.
5766180	5768220	E no Instagram eu só posto coisa bonita.
5768340	5769460	Então lá nunca tem foto minha.
5769820	5770660	Tem foto da minha filha.
5771100	5773200	Às vezes surge uma foto minha, mas é mais da minha filha.
5773520	5775120	Esse episódio foi editado pela Lucy.
5775580	5777480	Que também participa lá do RPG Next.
5777900	5779100	Eu roubei ela um pouquinho pra mim.
5779160	5780360	Ela edita outros podcasts de RPG.
5780720	5782360	Eu precisava de mais gente pra estar me ajudando.
5782440	5783040	Chamei ela.
5783400	5785180	E ela fez esse trabalho maravilhoso.
5785560	5786360	Ela fez...
5786360	5788420	Algumas das trilhas foi ela que fez.
5788780	5790100	Algumas das músicas foi eu que escolhi.
5790480	5792700	Provavelmente as músicas que se encaixaram muito bem na cena
5792700	5794760	são da parte dela.
5794760	5796420	E aquelas que ficaram meio estranhas
5796420	5797500	são minha parte.
5797960	5798160	Eu coloquei...
5798340	5799400	A voz dos NPCs.
5799440	5800820	Troquei minha voz pelos NPCs.
5801120	5802340	Botei trilha em alguns pontos.
5802700	5804260	Mas todos os efeitos sonoros.
5804660	5806040	Os cortes iniciais.
5806380	5807360	Tudo foi feito por ela.
5807640	5808860	Um trabalho maravilhoso.
5809220	5811540	Vou deixar também aqui o Twitter da Lucy.
5812120	5815780	É arroba ferrato com dois R's e dois T's.
5816200	5816560	Lucy.
5816680	5817380	Vai estar aqui no post.
5817860	5818880	Sigam ela também.
5819020	5819620	Vão até ela.
5819720	5820860	Agradeçam pelo episódio.
5821420	5822460	Digam pra ela me dar desconto.
5822680	5823300	Não, é mentira, gente.
5823300	5824560	Ela já cobrou bem pouquinho.
5824660	5825220	Ela é bem gente boa.
5825520	5827200	Arroba ferrato Lucy.
5827680	5828300	Ela que editou.
5828340	5828940	Ela que editou esse episódio.
5829280	5831460	E vai editar vários outros também.
5831920	5833520	Então, muito obrigado, Lucy.
5833720	5836200	E eu só pude ter uma editora maravilhosa como a Lucy
5836200	5837720	graças aos padrinhos.
5837800	5839940	As pessoas que apoiam esse projeto.
5840400	5842320	Se você quiser apoiar esse projeto
5842320	5844540	dando um real, dez reais, vinte reais.
5844900	5845740	Se você quiser de reais.
5846220	5848920	Mas você pode fazer isso tanto pelo PicPay.
5849440	5850580	Vá no aplicativo do PicPay.
5850660	5852220	Procure por RP Guaxa.
5852680	5853700	E vá lá em assinar.
5854200	5856120	Se você ainda não usa o aplicativo PicPay
5856120	5857180	eu recomendo muito.
5857180	5857840	Ele é maravilhoso.
5857840	5858580	Ele é maravilhoso por um monte de coisa.
5858980	5860500	Eu uso pra pagar a Jujuba.
5860860	5861740	Pagar editores.
5861840	5864060	A Lucy foi paga no aplicativo.
5864440	5865360	Ele paga boleto.
5865540	5867080	Muitas coisas maravilhosas.
5867600	5868720	Recarga pro jogo.
5868820	5870980	Eu coloco crédito no joguinho de celular
5870980	5872920	pra minha esposa, pra minha filha.
5873280	5874480	Eu recarrego meu celular.
5874840	5876020	Então ele é um aplicativo maravilhoso
5876020	5876880	com muitas funções.
5877300	5878940	E se você nunca usou o aplicativo
5878940	5880440	quando você for criar sua conta
5880440	5880960	aparece lá.
5881380	5882800	Você tem um código de amigo?
5882960	5884620	É óbvio que você tem.
5884700	5885620	Pois eu sou seu amigo.
5886180	5886840	Escreva Guaxa.
5886840	5887480	Guaxa.
5887840	5889740	G-U-A-X-A
5889740	5891400	Guaxa é o seu meu código.
5891900	5893880	Fazendo isso na sua primeira compra no aplicativo
5893880	5895060	você ganha 10 reais de volta.
5895500	5897360	E eu ganho 10 reais só porque você usou.
5897420	5897820	Olha que legal.
5897900	5898940	Você tá me ajudando também
5898940	5900660	a tá mantendo esse projeto.
5900980	5902540	Então, criou uma nova conta nova?
5902800	5904960	Use Guaxa como seu código de amigo.
5905400	5906740	E você pode assinar por ali também.
5907120	5908500	Mas você não quer instalar um aplicativo?
5908620	5909140	Não consegue?
5909260	5910500	Você ainda usa um Nokia.
5910860	5911940	Daquele do jogo da cobrinha.
5912340	5913960	Você pode assinar também pelo Padrim.
5914260	5915240	Padrim.com.br
5915240	5916720	barra rp guaxa.
5916960	5917820	Lá você cria.
5917840	5918480	Cria sua conta.
5918720	5919960	Dá pra pagar por boleto.
5920340	5921460	Dá pra pagar com cartão.
5921540	5922280	Com um monte de coisa.
5922680	5923720	Você cria sua conta lá
5923720	5925400	e faz sua doação também.
5925760	5926500	A partir de 10 reais
5926500	5928060	você faz parte do nosso grupo de WhatsApp
5928060	5929520	e do Discord.
5930080	5931380	No WhatsApp a gente conversa.
5931700	5933700	Tem dois grupos de WhatsApp, na verdade,
5933800	5934300	no momento.
5934640	5935460	Tem um mural de recados
5935460	5936520	onde só eu escrevo.
5936800	5938400	Onde a gente posta aventuras
5938400	5939340	que os padrinhos montam
5939340	5940360	no grupo do Discord.
5940780	5942580	E recados, tipo, quando sai o episódio.
5943100	5943500	Vozes.
5943580	5944960	Quando eu peço, ó, eu quero que gravem vozes.
5945060	5946380	Mandem pra mim pra entrar no episódio.
