start	end	text
2519040	2521940	Não vai porque eu vou segurar essa casa
2521940	2523460	Com o meu pensamento
2523460	2524980	Eu tenho força
2524980	2526980	Eu vou segurar
2526980	2528400	A partir de amanhã eu vou segurar
2528400	2531520	Essa terra plana toda que eu tô aqui
2531520	2533400	E a terra lá de baixo
2533400	2535220	Eu tenho que ter alguma força pra segurar essa casa
2535240	2537660	Então rola dois dados
2537660	2541320	Tanto dado num RPG guache
2541320	2545060	Dois e dois
2545060	2547340	Dois e dois
2547340	2547900	Qual é o teu atributo?
2548860	2550400	É dois, é dois
2550400	2553420	A casa toda se ilumina
2553420	2554680	Como se uma
2554680	2557140	Um vidro
2557140	2558580	Ou uma parede invisível
2558580	2561080	Feita com raios de sol envolvendo
2561080	2561860	Essa casa
2561860	2563980	E ela é indestrutível
2563980	2565040	Mas o cachorro
2565040	2565980	Continua atacando
2565980	2566620	E eu tô
2566620	2571280	Morre, ação
2571280	2572600	Boa, princesa
2572600	2574440	Bom, se a casa agora é indestrutível
2574440	2575800	Eu vou voltar e ajudar a Wanda
2575800	2578240	Fica de olho aí e vê se alguma coisa acontece
2578240	2579380	Tá, tu voltou
2579380	2581260	Tu tava indo no meio do caminho e tu voltou
2581260	2581920	Beleza
2581920	2583180	Wanda, ação
2583180	2587620	Wanda, a gente tem que atacar junto
2587620	2589980	Não, a tua ação
2589980	2591440	Tu tava indo em direção ao bicho
2591440	2592740	Aí tu começou a voltar
2592740	2594740	É, eu voltei porque agora a casa tá protegida
2595040	2597480	O bicho não vai mais entrar no quarto das crianças lá
2597480	2599220	É, você está voltando
2599220	2601440	A Wanda tá colada do Duke
2601440	2602660	A Wanda tem uma ação antes
2602660	2603560	Tá, tá
2603560	2607460	Tá, eu movimento a asa
2607460	2609020	Do meu lado direito
2609020	2610120	Que minha asa é a direita
2610120	2612720	Mas eu pego a espada e ataco ele
2612720	2614800	Com o movimento pela esquerda
2614800	2615480	Dois dados
2615480	2618440	Quatro e seis
2618440	2619940	Tu consegue acertar ele
2619940	2621420	Tu sente a espada cravar
2621420	2624260	Tu sente um pouco do sangue dele escorrer
2624260	2625020	Embora
2625040	2625940	Tu não sinta
2625940	2627680	Ele em momento algum
2627680	2629320	Demonstrar que tá sentindo dor
2629320	2630440	E ele te ataca
2630440	2634920	Com o cabo da espada
2634920	2636540	Ele bate com força na tua cabeça
2636540	2638280	E tu cai pra trás
2638280	2640900	Ele pega a deusa pelo pé
2640900	2642460	E levanta a voa
2642460	2645140	Pô, galera, esse Duke tá muito forte, hein
2645140	2647300	A gente tem que fazer alguma coisa
2647300	2648320	Pra ferir ele
2648320	2650600	Quando ele era só uma pessoa normal
2650600	2652780	Ele treinou vocês e ele era mais forte que vocês
2652780	2654960	Agora parece que ele tá com alguns poderes extras
2655040	2656520	Eu apaguei
2656520	2659360	Tu tá no chão com muita dor na cabeça
2659360	2660780	Tu não chegou a apagar, tu tá bem ferida
2660780	2663340	O cachorro parou de atacar aquela casa
2663340	2664480	E tá indo em direção a outra
2664480	2666940	Vocês vão perseguir o Duke
2666940	2668280	Ou eliminar o cachorro?
2669020	2670600	Vamos eliminar esse cachorro logo
2670600	2672940	Tá, eu vou atrás da
2672940	2675020	Da Wanda, porque aparentemente
2675020	2677140	A gente ataca melhor juntos
2677140	2681040	E...
2681040	2682520	Vou atrás da Wanda
2682520	2685000	Pegar ela, voar atrás do cachorro
2685040	2686460	E fazemos
2686460	2688140	Passamos por cima da
2688140	2690660	Da... da deusa
2690660	2692980	Balançamos só a cabeça e fazemos o mesmo
2692980	2694460	Movimento que a gente fez
2694460	2696240	Pra atacar os outros dois gigantes
2696240	2697640	Em cima do cachorro
2697640	2700780	Voamos por cima do cachorro e descemos usando o peso
2700780	2702260	Do corpo na espada
2702260	2704680	Ao mesmo tempo os dois pra cravar no cachorro
2704680	2706900	Beleza, dois dados cada um
2706900	2710920	Wanda
2710920	2712360	3 e 4
2712360	2713240	Mori
2713240	2714660	3 e 2
2715040	2719580	Os dois agora caem no golpe perfeito
2719580	2721680	Embora a Wanda que tirou o próprio atributo
2721680	2722460	Ela foi um pouco melhor
2722460	2724740	A Wanda cai sobre a cabeça do bicho
2724740	2726000	Atravessando com a espada
2726000	2728960	E o Mori cai nas costas do bicho também
2728960	2731520	O Mori cai naquela escorregadinha
2731520	2732900	Fazendo um corte, sabe?
2733020	2733840	De cima pra baixo
2733840	2735360	E a criatura cai
2735360	2737900	Boa baixinha
2737900	2739920	A Wanda tá muito ferida
2739920	2741920	A gente tem que atacar junto sempre
2741920	2744520	Eu dou aquela olhada pra trás pra ver se eu ainda consigo
2745040	2747260	Ver a deusa sendo levada
2747260	2750440	A deusa em serviço
2750440	2752920	Tu viu que ela foi levada
2752920	2754840	Existe próximo ao palácio
2754840	2756200	Mas muito, muito mais acima
2756200	2757900	Existe uma ilha menor
2757900	2761020	Que é a ilha pra onde a deusa vai depois repousar
2761020	2762100	Quando se aposenta
2762100	2764680	E parece que o duque levou ela pra lá
2764680	2765920	Tá
2765920	2768120	Vamos correndo até a
2768120	2770140	A deusa menina
2770140	2771780	E me abaixo pra que ela
2771780	2772920	Me cure
2772920	2777260	Todas as pessoas já saíram dessa casa
2777260	2778080	Ai
2778080	2780900	Tu vê que dessa vez com o cachorro
2780900	2782760	Algumas crianças se arranharam
2782760	2783640	Com telhas que caíram
2783640	2784900	Mas ninguém morreu
2784900	2786760	Vocês conseguiram salvar várias vidas
2786760	2788900	Porque esse cachorro poderia derrubar várias casas
2788900	2790540	Não, mas eu tava segurando a casa, né?
2790600	2792320	Então eu quero saber se as pessoas já saíram da casa
2792320	2794780	Pra eu poder largar e parar de fazer a mágica
2794780	2796780	Se tu prefere que as pessoas saiam
2796780	2797980	As pessoas saíram
2797980	2799820	Ou, sei lá, ou que a casa não cai mais
2799820	2800980	Não, a casa não vai cair mais
2800980	2802840	Ela tá protegida
2802920	2807620	Provavelmente é a casa mais segura
2807620	2809800	Tirando o palácio no momento ali na região
2809800	2810840	Ah, então tá
2810840	2813160	Então eu vou correndo em direção à Wanda também
2813160	2815820	Pra poder já tentar curar ela rápido
2815820	2818720	Eu vou lá na casa que a gente acabou de salvar
2818720	2821340	E trazer as pessoas pra essa casa protegida
2821340	2823420	Enquanto você cura a Wanda
2823420	2825140	Isso, ótimo
2825140	2827380	Joga, é...
2827380	2828420	A deusa menina, joga
2828420	2830900	Cinco e um
2830900	2832080	Não foi um...
2832080	2832700	Não foi um...
2832700	2832800	Não foi um...
2832800	2832820	Não foi um...
2832820	2832860	Não foi um...
2832860	2832900	Não foi um...
2832900	2834560	Não foi um raio luminoso como da outra vez
2834560	2837500	Mas você conseguiu curar os ferimentos da Wanda
2837500	2839920	A população...
2839920	2841460	A maioria tá indo pra aquela casa
2841460	2843920	Que o morte tá guiando
2843920	2845700	Mas algumas pessoas vêm até vocês
2845700	2847460	O... O que tá acontecendo?
2847980	2848920	O que houve com a deusa?
2849320	2849840	Pra casa!
2850260	2851340	Entra na casa agora!
2851860	2853200	A comida tá estragando
2853200	2854600	Isso nunca aconteceu
2854600	2856360	O chão tá rachado
2856360	2857580	As crianças tão chorando
2857580	2859140	Todos tão inquietos
2859140	2860520	Pra casa agora
2860520	2861680	Nós vamos tentar cuidar disso
2861680	2862280	A deusa...
2862280	2862840	A gente não vai tentar
2862840	2863940	A gente vai conseguir
2863940	2864800	Calma
2864800	2866120	Vai ficar tudo bem
2866120	2867740	Fica dentro da casa
2867740	2869820	Com a deusa menina falando
2869820	2870260	Ele...
2870260	2871180	Ele dá uma acalmada
2871180	2871900	E aí?
2872080	2873480	Vamos então lá pra ilha, né?
2873900	2874580	Vamos sim
2874580	2875420	Mori!
2876640	2877680	Vamos, vamos, vamos
2877680	2880220	Vamos, pega a mãozinha aqui
2880220	2882420	Toda vez que chama Mori
2882420	2883740	Parece que tá chamando o motorista
2883740	2884360	Mori!
2887420	2888540	Quase isso, né?
2889200	2890840	Mori, cadê você, meu filho?
2890840	2890960	Mori!
2892840	2894380	Vamos, vamos!
2894800	2895300	Rápido!
2895820	2897200	Abraçamos, nos abraçamos
2897200	2898060	Pegamos a Debbie
2898060	2899860	Começamos a voar no...
2899860	2901960	Os três começam a levantar voo
2901960	2903780	Em direção a essa pequena ilha
2903780	2905580	Que a Debbie só deveria visitar
2905580	2907300	No dia que ela se aposentasse, né?
2907520	2908560	Assim como vocês
2908560	2910800	É a ilha onde acontece
2910800	2913280	O último momento da deusa
2913280	2915520	Onde ela passa
2915520	2917720	Seus poderes pra deusa menina
2917720	2919760	Onde ela recebe
2919760	2921060	A sua imortalidade
2921060	2921840	E o descanso
2921840	2922820	E onde os guerreiros
2922840	2924320	Que sempre a protegeram
2924320	2925640	São abençoados
2925640	2927820	E tendo o seu desejo realizado
2927820	2929700	Vocês chegam, né?
2929760	2930700	Nesta ilha
2930700	2932960	Ela é coberta por floresta
2932960	2933880	Por todos os lados
2933880	2935460	Vocês não sabem onde está
2935460	2936340	O...
2936340	2938360	O Duque nem a deusa
2938360	2940300	Eu não consigo sentir?
2941020	2942860	Ali parece que nessa...
2942860	2943740	Ali tu não...
2943740	2945040	Teus poderes não funcionam
2945040	2946380	Tu não sente nada
2946380	2946840	Tu não sente...
2947680	2948680	As plantas
2948680	2950440	Tu deveria saber que da existência delas
2950440	2951080	Tu sentia, né?
2951080	2952080	A energia que vem delas
2952080	2952820	Não é?
2952840	2953280	Nem isso
2953280	2954580	Parece ser um lugar
2954580	2955940	Que teu poder ainda não toca
2955940	2958120	Tamo lascado
2958120	2959740	Mas por quê?
2960580	2961960	Eu não tô sentindo nada
2961960	2963400	Eu não sinto nada aqui
2963400	2964960	Eu não sinto o poder das plantas
2964960	2966640	Eu não sinto o poder da deusa
2966640	2967720	Eu não sinto nada
2967720	2968680	Eu não sinto nada
2968680	2970300	Eu não sinto nada
2970300	2972240	A gente enxerga a ilha vazia?
2972740	2973760	Não, vocês vêem uma ilha
2973760	2976000	É uma ilha menor do que a que vocês estão
2976000	2976640	Mas ainda assim
2976640	2977920	Ela é grande
2977920	2979820	E vocês só veem florestas
2979820	2980580	Pra todos os lados
2980580	2981840	Vamos...
2982840	2984500	Sobrevoar por cima
2984500	2986100	Da floresta
2986100	2988960	E ver se a gente encontra alguma coisa
2988960	2990640	Deve ter uma casa
2990640	2991840	Onde elas ficam
2991840	2993360	Deve ter algum lugar
2993360	2994280	Que a gente possa ir
2994280	2995900	Até pra pedir
2995900	2997940	Conselho
2997940	3000100	Pras outras deusas
3000100	3001520	Mas elas são imortais?
3001620	3002840	Elas ficam aí pra sempre?
3003320	3004360	Se aposentam, morrem?
3004540	3005400	É tipo um...
3005400	3006220	Senhor dos anéis, sabe?
3006540	3007300	Se elas são imortais
3007300	3008120	Elas não morrem
3008120	3009320	Sim, elas se aposentam
3009320	3010040	E ficam ali pra sempre
3010040	3010740	Juntas
3010740	3012780	Podendo conversar e tal
3012780	3014960	A ilha deve estar super lotada então
3014960	3015520	Vai
3015520	3016380	Beleza
3016380	3017540	Vamos atrás dessas...
3017540	3018500	Das deusas lá
3018500	3019860	E ver o que é que elas podem
3019860	3021000	Nos ensinar
3021000	3022620	Pega na mãozinha aqui
3022620	3022920	Vamos
3022920	3024000	Vamos voar
3024000	3026080	Os três juntos começam a voar
3026080	3027760	Vocês começam a levantar voo
3027760	3029280	Olhar por cima das árvores
3029280	3031600	Vocês notam que mais pro centro da floresta
3031600	3032500	Aparece uma...
3032500	3033840	Uma pequena montanha
3033840	3034880	Com uma cachoeira
3034880	3036140	Mas
3036140	3037740	Do meio do mato
3037740	3039120	Levanta a voo
3039120	3040160	Uma criatura
3040160	3041920	Ela tem...
3041920	3042580	O corpo dela
3042580	3044020	É toda coberta por penas
3044020	3045140	Não só as asas
3045140	3047180	São penas verdes
3047180	3048520	Ela tem um bico comprido
3048520	3049860	Onde deveria ter a boca
3049860	3051620	E as asas dela
3051620	3052760	Batem muito rápido
3052760	3054700	Ela segura na mão dela
3054700	3055820	Uma...
3055820	3056500	Uma lança
3056500	3057140	Comprida
3057140	3059020	Ela olha pra vocês e fala
3059020	3059820	Alto lá
3059820	3061540	Apenas a deus e seus protetores
3061540	3062760	Podem entrar ao paraíso
3062760	3064000	Pô, desculpa aí, ó
3064000	3065240	Desculpa aí, desculpa aí
3065240	3066280	Olha só
3066280	3068320	Eu vou ser deus amanhã
3068320	3070000	Então a gente tá quase lá
3070000	3071040	Na verdade, não
3071040	3072560	Amanhã você se torna deus
3072580	3073660	E ainda assim
3073660	3075640	Precisa esperar uma nova deusa nascer
3075640	3076320	E crescer
3076320	3077440	Pra depois se mudar pra cá
3077440	3078960	Tá, tá, tá, tá
3078960	3079820	Tá, tá, tá
3079820	3082060	Isso é burocracia que chama
3082060	3083400	Eu tô aqui
3083400	3084520	Eu tô aqui
3084520	3085400	A gente tá aqui
3085400	3087060	Porque a deusa foi raptada
3087060	3088120	E trazida pra cá
3088120	3089800	Talvez a deusa tenha preferido
3089800	3090440	Vir mais cedo
3090440	3091900	Ansiedade, talvez
3091900	3094560	Não, não, não
3094560	3096000	Ela foi raptada
3096000	3098320	Ela tava apagada, desacordada
3098320	3099620	Quem trouxe ela
3099620	3100960	Foi o...
3100960	3101700	O...
3101700	3101940	O...
3101940	3102540	Do...
3102540	3103160	O do...
3103160	3103760	Não, o duque
3103760	3105400	O duque tava possuído
3105400	3107280	Ele tinha uma sombra nele
3107280	3109220	E ele matou o outro protetor
3109220	3111900	E ele matou o...
3111900	3112780	No...
3112780	3114820	Isso é bem grave
3114820	3116320	Voltem para o castelo de cristal
3116320	3117660	E eu prometo averiguar o caso
3117660	3118200	Não
3118200	3119060	Não
3119060	3121020	Nós já temos tempo pra isso
3121020	3122120	Vamos descer
3122120	3123100	Quero ir pro chão
3123100	3123800	Quero ir pro chão
3123800	3124300	Quero ir pro chão
3124300	3124840	Vamos pro chão
3124840	3126420	Tá, desce todo mundo pro chão
3126420	3126680	Vai
3126680	3128280	Vamos conversar aqui
3128280	3129380	A gente não tem tempo pra isso
3129380	3131140	Ele desce acompanhando vocês
3131140	3132380	Eu sou o espírito do bosque
3132540	3133480	E eu o protejo
3133480	3134820	Vocês não podem estar aqui
3134820	3135780	Mas olha só
3135780	3136660	A gente...
3136660	3138240	Você sabe que a gente não vai fazer mal nenhum
3138240	3140040	Porque a gente faz parte disso
3140040	3141940	Eu vou estar aqui daqui a uns anos
3141940	3144160	Deixa de ser um burocrata
3144160	3146160	Para de ser pentelho
3146160	3147740	A gente precisa salvar
3147740	3148860	A gente tá perdendo tempo
3148860	3150560	A gente precisa salvar a deusa
3150560	3152180	Ela saiu desacordada
3152180	3153040	Você tá ouvindo o que eu tô falando?
3153120	3154360	Ela tava desacordada
3154360	3156160	Pô, já que você é o...
3156160	3158420	O espírito protetor do bosque
3158420	3161060	Você não viu a deusa chegando aqui com o duque?
3161380	3162520	E aí não viu que ela tava desacordada?
3162540	3165220	Como que eles chegaram aqui?
3165640	3167640	Eu desperto quando alguém que não está pronto
3167640	3169340	Para os segredos do bosque chega até aqui
3169340	3171000	E vocês me despertaram
3171000	3173000	Mas já que você está despertado agora
3173000	3174560	Você não consegue sentir nada?
3175160	3176720	Nadinha? Nada estranho?
3177160	3179620	Não, apenas vocês invadindo esse local sagrado
3179620	3181340	Galera, essa parada tá muito errada
3181340	3183440	Tem alguma coisa muito errada aí
3183440	3185360	Vocês ainda não são dignos de estarem aqui
3185360	3187100	Mas eu vou dar uma chance pra vocês
3187100	3189340	Ele bate com a lança no chão
3189340	3190540	E vocês...
3190540	3191540	Vem aqui...
3192540	3194840	O chão sumir
3194840	3196820	Aquela região toda desaparecer
3196820	3198240	E vocês estão caindo, os três
3198240	3201540	Seguramos
3201540	3202040	Segura!
3202260	3202500	Segura!
3202500	3204240	Nos abraçamos e seguramos a tele
3204240	3208820	Mas a gente...
3208820	3209760	A gente voa de...
3209760	3210340	Eu acabei de lembrar
3210340	3211340	A gente voa de verdade
3211340	3213280	Ou a gente só plana igual os outros?
3213520	3214220	Não, vocês...
3214220	3215840	Os três juntos voam de verdade
3215840	3216440	Tá
3216440	3216980	Mas...
3216980	3220060	Quer dizer, você não voa em potes nenhuma
3220060	3221520	Porque ela tá sendo carregada
3221520	3221640	Não, não, não
3221640	3221680	Não, não, não
3221680	3221740	Não, não, não, não
3221740	3221840	Não, não, não, não
3221840	3221880	Não, não, não, não
3221880	3221940	Não, não, não, não
3221940	3222000	Não, não, não, não
3222000	3222040	Não, não, não, não
3222040	3222080	Não, não, não, não
3222080	3226580	Gente, que maluco
3226580	3227980	Que maluco
3227980	3230240	De repente o chão volta até vocês
3230240	3231080	Até voar
3231080	3234100	Mas vocês estão numa região que é um campo
3234100	3236840	Parece ser um campo de trigo
3236840	3239800	Em que as pessoas estão lá colhendo trigo e tal
3239800	3243080	Tem umas sete pessoas fazendo essa colheita
3243080	3244760	Tem algumas crianças brincando perto
3244760	3246560	E tá só vocês três ali
3246560	3247660	Mas como assim?
3247720	3248640	A gente tava na floresta
3248640	3249280	Caiu o chão
3249280	3251280	A gente tá numa plantação de trigo
3251280	3251380	De trigo
3251380	3252120	De trigo
3252120	3254560	Vamos perguntar onde a gente tá
3254560	3258560	Essas pessoas são as deusas?
3259180	3260040	Eu consigo sentir?
3260480	3260820	Não
3260820	3262720	Essas pessoas são mortais
3262720	3266500	São pessoas que moram abaixo da ilha de vocês
3266500	3268440	Que beleza
3268440	3269960	A gente desceu um andar demais
3269960	3272480	Como assim?
3273000	3274440	A gente tá dentro?
3274840	3276980	A gente desceu um andar demais?
3278200	3278380	É
3278380	3281080	Nós estamos na terra abaixo da gente
3281080	3284200	Que filho da...
3284200	3286020	Como é que ele mandou a gente pra cá?
3286220	3287300	Que sacanagem
3287300	3291760	E ele falou que ia dar uma chance pra gente
3291760	3293940	Como que ele ia dar uma chance e mandou a gente pra cá?
3294080	3296180	A gente tinha que falar com as deusas lá?
3297860	3298200	Aqui
3298200	3299020	Aqui
3299020	3301560	Adriele consegue sentir as coisas?
3302300	3303180	Consegue sentir
3303180	3304280	Tem essas pessoas
3304280	3306740	Que mais distante tem outras fazendas
3306740	3307860	Com outras pessoas
3309160	3310720	Essa história tá muito mal contada
3310720	3311060	Vamos fazer uma pergunta
3311080	3312640	Vamos tentar conversar com essa galera.
3313040	3315220	Eles têm consciência de que a gente existe?
3315660	3317280	Eles parecem não ter notado vocês.
3318220	3319040	Gente, olha só.
3319920	3324640	Aqui não é exatamente o nosso plano, não é mesmo?
3325520	3329100	Então eu vou falar pra vocês ficarem só escondidinhos um pouco aqui.
3329660	3332640	Deixa eu chegar ali e conversar com essas pessoas.
3332640	3335160	É, porque você não tem asma, você tem antenas coloridas.
3335340	3337980	Eu tenho antenas coloridas.
3338100	3340640	É muito normal uma pessoa com antenas coloridas.
3340640	3343600	Mas eu posso falar que é uma fantasia.
3344540	3344820	Tá.
3345560	3347680	É melhor do que as asas de vocês, vamos lá.
3349100	3353740	Oi, eu me aproximo perto de alguém que tá trabalhando no...
3353740	3354720	Catando trigo, sei lá.
3355320	3356340	Bom dia.
3356800	3359380	A pessoa parece não te ouvir, nem te notou.
3359380	3361160	Tu nota que eles tão...
3361160	3363880	O trigo tá meio ressecado, não tá uma colheita muito boa.
3364320	3365380	Mas eles tão ali colhendo.
3366360	3368040	Ei, tô falando com você.
3368640	3369840	Meu educado, bom dia.
3370640	3376760	Um dos trabalhadores, assim, levanta, olha em volta, limpa o suor da testa.
3376820	3379060	Mas ele acha estranho, mas volta a trabalhar.
3379860	3387000	Eu quero tentar colocar minha mão no chão e ver se eu consigo fazer com que a plantação melhore.
3387580	3388240	Rola dois dados.
3389780	3390940	Cinco e quatro.
3392240	3397780	O trigo ainda não colhido, ele se torna em maior quantidade.
3397780	3398780	Ele parece que tá...
3399320	3399780	Tá pronto.
3399780	3402680	Tem muito mais trigo do que as pessoas haviam notado antes.
3403400	3405360	As pessoas sorrirem umas pras outras.
3405740	3408240	Começa a colher ali com mais alegria.
3408760	3411560	O que parece ser o chefe da família, né?
3411640	3412400	Diz assim...
3412400	3413080	Olha, gente.
3413420	3413680	Olha.
3414220	3415840	Olha como tá rendendo.
3416420	3420260	Se continuar assim, a gente não vai precisar vender moinho, gente.
3420320	3420940	Olha só.
3421100	3422780	Não vai precisar vender fazenda.
3423060	3423300	Olha.
3423760	3427300	Daí ele olha pras crianças, feliz, com elas brincando ali.
3427300	3429560	Vamos poder manter nossa família unida.
3429780	3432240	Obrigada, deuses da natureza.
3432500	3433420	Fui eu, tá?
3433880	3434720	Só pra dizer.
3435480	3435960	Mérito.
3437220	3438620	Será que uma das crianças me vê?
3438760	3439780	Posso tentar com as crianças?
3439980	3440640	Falar com as crianças?
3441820	3443760	Aí eu já grito pros meninos.
3444560	3446380	Ô, ô, Wanda e Morty.
3447260	3449340	Podem vir porque eles não enxergam a gente.
3449460	3451040	Já desisti aqui.
3451400	3451900	Podem vir.
3452440	3452900	Beleza.
3453220	3453560	Entra aí.
3453560	3458860	E aí a gente chega perto de uma das crianças pra ver se elas enxergam a gente.
3459780	3460500	Oi.
3461160	3464900	Elas tão brincando de riscar no chão e também parece não notar vocês.
3465340	3468500	Uma das crianças tem um cachorro e o cachorro não para de olhar pra vocês.
3469180	3470240	Oi, cachorrinho.
3470360	3471080	Você fala?
3472920	3474500	Ele late pra vocês.
3476480	3477920	Eu te entendo?
3478260	3478900	Não.
3479420	3479720	Ok.
3481800	3485680	Tu sabe que além dessa fazenda existem várias outras na região ali.
3485680	3489680	Que ele tá voando até alguma outra fazenda.
3489780	3490240	Além da deusa.
3490620	3491380	Vamos, né?
3491500	3492980	A gente tem que fazer alguma coisa.
3493920	3497560	A gente consegue voar de volta também pra casa, né?
3498100	3498920	Essa é uma opção.
3499520	3502160	Se tu olha pra cima e tu não vê o...
3502160	3504680	O que seria o mundo de vocês.
3504840	3505700	Tu não sabe onde fica.
3506680	3507660	O céu é bem amplo.
3508480	3508920	Palhaçada.
3509300	3511780	Que capi.
3514520	3516760	Pô, já tô com raiva desse cara aí, véi.
3516760	3519120	Morty, você consegue ver alguma coisa olhando pra cima?
3519780	3521320	Ah, hum...
3521320	3522520	Ah...
3522520	3523320	Não.
3523680	3524180	Hum, hum.
3524600	3525580	Não, nada.
3526160	3529040	Então a gente vai ter que procurar alguma coisa por aqui pra não ter que voltar pra casa.
3529620	3529860	Deus.
3529960	3531380	Ai, vamos pra próxima.
3531600	3532600	Vamos procurar.
3532740	3536320	Vamos continuar procurando porque agora a gente tem que achar um jeito de voltar pra casa.
3536500	3537920	Ai, meu Deus, que dor de cabeça.
3538300	3539720	Foca nos sentimentos, Deus.
3539820	3540880	Foca nos sentimentos.
3541000	3542460	Se você consegue sentir alguma coisa.
3543520	3546060	Tô focando, tô focando, tô focando.
3546060	3549060	Tu nota que, exceto essa família que tá ali...
3549780	3552740	As famílias nas proximidades, todas estão bem felizes.
3553180	3553620	Infelizes.
3554360	3555560	Estão infelizes.
3556340	3561080	As pessoas, tirando essa família ali, que parece que teve um ânimo renovado ali com a colheita,
3561720	3565840	no geral, as pessoas em todo o entorno ali, em outras fazendas, estão infelizes.
3565940	3566580	Estão bem tristes.
3567120	3568500	Galera, tem alguma coisa errada aí.
3568600	3570080	Porque a gente não tinha problema de nada.
3570200	3572520	Todo mundo comia feliz, todo mundo estava feliz.
3572700	3576020	E nesse lugar aqui, as famílias estão infelizes.
3576500	3577260	Vamos lá.
3577380	3579620	Eu quero tentar fazer uma coisa mais...
3579780	3583080	Mais forte e fazer a plantação de todo mundo melhorar.
3584120	3584840	Rola dois dados.
3587560	3588560	Um e cinco.
3589520	3590480	É, um é...
3590480	3593020	Tu vê que em alguns locais tu deu uma melhorada.
3593720	3599140	Mas tu acha que tu consegue melhorar a plantação de todo mundo?
3599680	3600860	Que tu consegue sentir?
3601460	3604760	Mas isso vai levar pelo menos umas nove, dez horas.
3606440	3607340	Gente, é...
3607340	3609100	Não dá pra deixar todo mundo feliz, não.
3609160	3609760	Então vamos andando.
3609760	3613000	Pra gente ver o que a gente consegue fazer de...
3613000	3615200	Pra gente conseguir o caminho de volta pra casa.
3617320	3620760	O que eu acho que pode ser de estranho...
3621840	3622740	Ai, eu nem sei.
3623960	3624780	Não sei de nada.
3624880	3627140	Vamos andando e vamos chegar na próxima casinha.
3627220	3628680	Ver se a gente consegue alguma coisa.
3630040	3631360	Só uma pergunta antes da gente ir.
3631520	3632760	A plantação está seca?
3633800	3634780	Está faltando água?
3635440	3637020	As plantações estão morrendo?
3637580	3639160	O que está acontecendo, mais ou menos?
3639160	3639220	Não sei.
3639760	3640780	Estão ficando secas, é.
3640920	3642300	Parece que está faltando água.
3642860	3645320	Alguma coisa não permitiu o crescimento correto delas.
3646680	3648900	Galera, lá em cima era floresta.
3649000	3649860	Estava tudo bonitinho.
3649940	3651740	Aqui embaixo está tudo seco.
