start	end	text
1435260	1438260	A Dora só indo atrás, em pé.
1438260	1440260	E sacudindo a cabeça.
1440260	1442260	Você mima essa menina demais, Balu.
1442260	1444260	Eu vou cantando.
1446260	1448260	Vocês, então...
1448260	1451260	Colocam a menina ali e estão saindo da casa, né?
1451260	1452260	Sim.
1452260	1454260	Vocês...
1454260	1456260	Alguém pelo grupo, dois dados, por favor.
1456260	1458260	Pra anotar, atributou mais.
1458260	1460260	Fica o aviso.
1460260	1462260	Cinco e quatro.
1462260	1464260	Dois acertos.
1464260	1466260	O caminho que vocês fizeram quando chegaram
1466260	1468260	e o caminho que estão fazendo agora
1468260	1470260	é diferente. Não porque vocês estão indo pra um outro lugar.
1470260	1472260	Mas é como se a floresta
1472260	1474260	em volta da casa de vocês
1474260	1476260	tivesse mudado.
1476260	1478260	Vocês andam um tempo e vocês já não reconhecem
1478260	1480260	nada em torno de vocês.
1480260	1482260	Balu, tem certeza que a casa da Dona Coruja
1482260	1484260	é nossa direção?
1484260	1486260	Eu tenho quase certeza.
1486260	1488260	Afinal de contas, aquela pedra...
1488260	1490260	Ué...
1490260	1492260	Onde é a pedra?
1492260	1494260	Agora que ela falou, eu consigo também perceber isso?
1494260	1496260	Ou...
1496260	1498260	Foi pelo grupo, né?
1498260	1500260	Agora que ela falou, todo mundo não.
1500260	1502260	Tá bem diferente, né?
1502260	1504260	É, eu lembro que
1504260	1506260	a casa da Dona Coruja
1506260	1508260	era depois
1508260	1510260	da casinha do João de Barro.
1510260	1512260	Que era ali na esquina.
1512260	1514260	Passou pela casinha do João de Barro,
1514260	1516260	não passou, Cacá?
1516260	1518260	Mamãe,
1518260	1520260	eu tô achando muito estresse.
1520260	1522260	Será que aquele seu lobo lá soprou
1522260	1524260	e mudou as coisas?
1524260	1526260	Eu olho pra trás pra ver se vê a nossa casa?
1526260	1528260	Ou a gente tá muito longe pra ver?
1528260	1530260	Tá um pouco mais longe agora.
1530260	1532260	Eu olho pra trás, eu olho pra frente...
1532260	1534260	Sei não...
1534260	1536260	A Dora conseguiu dois acertos.
1536260	1538260	Um pouco mais à frente,
1538260	1540260	vocês notam também um amontoado
1540260	1542260	de palha.
1542260	1544260	E quando chegam mais perto, notam
1544260	1546260	que era uma casa feita de palha
1546260	1548260	que foi derrubada.
1548260	1550260	Eu acho que aqui era uma casa.
1550260	1552260	Mas não tem essa casa aqui, tinha?
1552260	1554260	Não.
1554260	1556260	O João de Barro faz casa com barro, não com palha.
1556260	1558260	Ele até usa palha, mas ele usa mais barro.
1558260	1560260	Alguém aí?
1560260	1562260	Ninguém fala nada. Vocês vão continuar?
1562260	1564260	A casa tá obviamente...
1564260	1566260	Assim, nem os móveis sobraram, né?
1566260	1568260	A maioria...
1568260	1570260	Sobrou uma outra coisa quebrada, mas
1570260	1572260	foi derrubada.
1572260	1574260	Estranho. Espero que não tenha nada a ver com aquele globo.
1574260	1576260	Ele disse que ia fazer isso com a nossa casa.
1576260	1578260	Mas ele disse que é só pra... Oi!
1578260	1580260	Eu não quero perder minha casa.
1580260	1582260	A gente deve ser vizinho novo,
1582260	1584260	que não soube construir.
1584260	1586260	Vamos andar mais um pouquinho,
1586260	1588260	a Dona Coruja deve estar por aí.
1588260	1590260	Andando mais um pouquinho, uma casa de madeira
1590260	1592260	destruída.
1592260	1594260	Estão fazendo casas fracas ultimamente.
1594260	1596260	Mas pera aí, uma casa de madeira simples
1596260	1598260	ou com madeiras adornadas,
1598260	1600260	bonitinhas?
1600260	1602260	Uma casa de madeira simples.
1602260	1604260	Assim...
1604260	1606260	Nem todas boas madeiras, inclusive.
1606260	1608260	Ou seja, não é a nossa casa.
1608260	1610260	Não.
1610260	1612260	Eu acho que pode ter sido o material
1612260	1614260	que foi fraco, que utilizaram.
1614260	1616260	Mas é madeira, madeira é forte.
1616260	1618260	Mas essa tábua aqui,
1618260	1620260	tá vendo? Ela parece tão fraquinha.
1620260	1622260	Dessa vez eu vou pegar
1622260	1624260	um pedaço de madeira
1624260	1626260	que tá caído e vou levantar e ver
1626260	1628260	se tem alguma coisa embaixo.
1628260	1630260	Rola um dado, vai.
1630260	1632260	Seis.
1632260	1634260	Pela posição da madeira, esta casa foi
1634260	1636260	soprada até ser derrubada.
1636260	1638260	Tenho certeza disso.
1638260	1640260	Eu cheiro, olho de um lado,
1640260	1642260	olho do outro.
1642260	1644260	Olha, por incrível que pareça,
1644260	1646260	isso é obra de sopro.
1646260	1648260	E falo com um olhar sério.
1648260	1650260	Me esqueci de trazer
1650260	1652260	meu rolo de macarrão.
1652260	1654260	Que que a gente faz? A gente volta pra casa?
1654260	1656260	A gente... que que a gente faz?
1656260	1658260	Ah, o lobo tinha ido pro outro lado,
1658260	1660260	então eu acho que a gente não encontra ele
1660260	1662260	por aqui mais. Mas se ele
1662260	1664260	deu a volta e foi pra nossa casa?
1664260	1666260	Não, ele disse que ia voltar
1666260	1668260	depois. De noite.
1668260	1670260	Aí eu olho pra cima,
1670260	1672260	tá de dia, tá de tarde.
1672260	1674260	Tá de dia, tá de dia.
1674260	1676260	Ah, então tá bom, ufa. E outra coisa,
1676260	1678260	ele tava atrás dela, não é?
1678260	1680260	Vamos primeiro tentar descobrir
1680260	1682260	alguma coisa com a doroncoruja e
1682260	1684260	se ela souber de alguma coisa,
1684260	1686260	ele vai atrás da doroncoruja, não é?
1686260	1688260	Mas a gente vai deixar a fava de mel
1688260	1690260	com a doroncoruja? Ela é mais inteligente,
1690260	1692260	ela sabe o que faz.
1692260	1694260	Ela entende de humanos. Mas a doroncoruja
1694260	1696260	não vai nem conseguir levantar a fava de mel, olha só.
1696260	1698260	Aí eu levanto a menina e deita a menina.
1698260	1700260	Ah, mas talvez ela
1700260	1702260	faça ela se mexer mais.
1702260	1704260	Tá bom, mamãe, eu vou acertar na senhora.
1704260	1706260	Lembra da vez que você tava
1706260	1708260	doente, com aquela tosse
1708260	1710260	e que a gente te levou pra
1710260	1712260	doroncoruja? Hum...
1712260	1714260	Que passou rapidinho. Ela me deu um remédio muito amargo.
1714260	1716260	Mas passou.
1716260	1718260	Ela deve dar um remédio pra menina também, né?
1718260	1720260	Ela deve acordar com aquele remédio.
1720260	1722260	Pois é. Tá bom.
1722260	1724260	Doroncoruja!
1724260	1726260	Cadê a senhora, doroncoruja? Eu acho que é
1726260	1728260	naquela direção ali.
1728260	1730260	Andando pela floresta,
1730260	1732260	vocês logo chegam a uma casa
1732260	1734260	de tijolos.
1734260	1736260	E ela tá em pé. Rola dois
1736260	1738260	dados, Balu.
1740260	1742260	Tu instintivamente te
1742260	1744260	abaixa e ainda
1744260	1746260	instintivamente tu levanta o braço pra
1746260	1748260	puxar o chapéu pra baixo também, que ficou parado
1748260	1750260	no ar. E uma cadeira
1750260	1752260	foi atirada por cima da
1752260	1754260	casa de tijolos
1754260	1756260	e passou assim e ia
1756260	1758260	acertar a tua cara se tu não tivesse abaixado.
1758260	1760260	Ei! Tem crianças
1760260	1762260	aqui! Cuidado! Ainda grito
1762260	1764260	duas!
1764260	1766260	Uma cabeça assim de porquinho é vista
1766260	1768260	no topo da casa. Animais!
1768260	1770260	Não vão destruir nossa casa!
1770260	1772260	Se afastem!
1772260	1774260	Eu não quero destruir sua casa.
1774260	1776260	Você tá andando muito com o lobo, hein?
1776260	1778260	Ele destruiu a casa dos meus irmãos.
1778260	1780260	E agora eu tenho gente
1780260	1782260	morando comigo. Família é sempre legal.
1782260	1784260	Aí eu abraço a Dora.
1784260	1786260	Não, quando você é um porquinho.
1786260	1788260	Esse tal desse
1788260	1790260	desse lobo aí, ele era grande que nem eu?
1790260	1792260	Sim! Então,
1792260	1794260	esse maldito tentou derrubar
1794260	1796260	a minha casa. Então a gente tá no mesmo
1796260	1798260	barco. Eu não quero derrubar
1798260	1800260	a casa de ninguém. Eu espantei ele com
1800260	1802260	rola de macarrão. Isso é verdade.
1802260	1804260	O porquinho olha assim.
1804260	1806260	Meu Deus! Eu posso atirar
1806260	1808260	coisas com a minha arma!
1808260	1810260	Tá, mas a gente só quer achar a Dona Coruja.
1810260	1812260	Eu não sei nada de Dona Coruja
1812260	1814260	nenhuma! Tá, e o que que você sabe
1814260	1816260	desse lobo? Eu sei que ele mora aqui pra
1816260	1818260	baixo. Ele aponta assim pra
1818260	1820260	pra floresta? Logo ali!
1820260	1822260	No final daquele atalho. Você sabe
1822260	1824260	por acaso porque que ele tem essa mania
1824260	1826260	danada de querer derrubar a casa dos outros?
1826260	1828260	Acho que é porque ele não tem
1828260	1830260	um polegar opositor para construir
1830260	1832260	uma casa pra ele. Olha pra minha pata, eu falei
1832260	1834260	por isso. Ele foca o estômago no polegar.
1834260	1836260	O polegar opositor.
1836260	1838260	Mamãe, mamãe, os porcos
1838260	1840260	têm polegares opositores.
1840260	1842260	Não que eu lembre. É, ok.
1842260	1844260	Moço, ô moço, porquinho,
1844260	1846260	moço, porco, porco,
1846260	1848260	moço, cê já viu
1848260	1850260	uma humana? Aí eu levanto assim
1850260	1852260	a fava de mel. Não!
1852260	1854260	Nunca vi!
1854260	1856260	Parece até uma porquinha de peruca!
1858260	1860260	Eu olho pra cara dela.
1860260	1862260	Olho pra cara dele.
1862260	1864260	Olho pra cara dela.
1864260	1866260	Não parece não?
1866260	1868260	Só é a rosinha igual,
1868260	1870260	mas o nariz é diferente.
1870260	1872260	Ele põe a patinha assim no narizinho dele e tenta
1872260	1874260	mexer assim. Mas você
1874260	1876260	sabe como é que acorda um humano? Da mesma
1876260	1878260	forma que um porquinho.
1878260	1880260	E como é que acorda um porquinho?
1880260	1882260	Você vai na barriga dele
1882260	1884260	e faz...
1886260	1888260	A Dora vai tentar
1888260	1890260	fazer isso. Não funciona.
1890260	1892260	É, ela realmente não é um porquinho,
1892260	1894260	é uma humana. Não funcionou.
1894260	1896260	Ô mãe, faz na minha
1896260	1898260	barriga também. Vai.
1898260	1900260	Eu vou e faço na barriga da Cacá.
1902260	1904260	Olha que legal.
1904260	1906260	Obrigada. Eu vou e faço de novo.
1906260	1908260	Eu gosto.
1908260	1910260	Eu vou pegar a cadeira,
1910260	1912260	vou quebrar a cadeira,
1912260	1914260	vou pegar o que sobrou
1914260	1916260	ali da cadeira e vou virar assim pra
1916260	1918260	Dora. Toma, meu amor.
1918260	1920260	Não é que nem o nosso rolo, mas
1920260	1922260	eu acho que vai ser suficiente.
1922260	1924260	Eu ganho um também, papai?
1924260	1926260	Acho que você já tá crescidinho, né?
1926260	1928260	Eu vou tacar pisinho pra ela um pouquinho mais.
1928260	1930260	Ih, super herói, a sua
1930260	1932260	pera? Não, que é isso.
1932260	1934260	É isso aí.
1934260	1936260	Na dúvida, você pode usar isso pra tirar
1936260	1938260	mel das comédias. É só um galho
1938260	1940260	arrumado.
1940260	1942260	Fala isso. Pra fazer a mesma
1942260	1944260	coisa com um galho.
1944260	1946260	Tá bom, mas olha pra ela. Enfim,
1946260	1948260	esse não é o problema. A gente tem um
1948260	1950260	lobo
1950260	1952260	derrubador de casas.
1952260	1954260	A solta. E já derrubou duas
1954260	1956260	casas. Mas é que
1956260	1958260	era de material fraquinho.
1958260	1960260	Se eles tivessem feito a casa decente,
1960260	1962260	eles não tinham derrubado.
1962260	1964260	O negócio é que a nossa casa é de madeira
1964260	1966260	e ele derrubou de madeira.
1966260	1968260	Então... Mas aquela madeira
1968260	1970260	era fraquinha, a nossa é forte.
1970260	1972260	Tu não viu que ele não conseguiu derrubar?
1972260	1974260	Porque você deu
1974260	1976260	uma porrada na cabeça
1976260	1978260	dele, Dulce. Tá bom.
1978260	1980260	E se a gente construir uma casa pra ele?
1980260	1982260	Ele disse que o problema era a falta de casa.
1982260	1984260	Será que era por isso que ele queria a humana?
1984260	1986260	A humana sabe construir casa?
1986260	1988260	Ela é tão pequenininha? Ela tem polegares.
1988260	1990260	Compositores.
1990260	1992260	A gente vai na casa do lobo,
1992260	1994260	então? O porquinho,
1994260	1996260	o seu porquinho, moço,
1996260	1998260	o porco ali, disse que era ali.
1998260	2000260	Né? A casa dele é pra lá?
2000260	2002260	Seguindo a Thalia. Ah, agora sua mãe tem um
2002260	2004260	um porrete na mão, tá tudo bem. Ah, é verdade.
2004260	2006260	E eu também.
2006260	2008260	Você fica ensinando a menina a brigar.
2008260	2010260	Daí eu dou um tapinha
2010260	2012260	assim na cabeça do balu.
2012260	2014260	Ela tem que se defender. Ela tá
2014260	2016260	grandinha. Na influência dos esquilos.
2016260	2018260	Não, mamãe, eu sei que a gente
2018260	2020260	não pode bater em amiguinho. Não pode.
2020260	2022260	Senão é legal. Muito bem, Caca.
2022260	2024260	Isso aqui é pra
2024260	2026260	cutucar a colmeia.
2026260	2028260	Talvez bater no pé do seu lobo.
2028260	2030260	Eu dou uma piscadinha pra Caca.
2030260	2032260	Então é isso.
2032260	2034260	A gente sabe que o lobo tá logo ali.
2034260	2036260	O que vocês acham?
2036260	2038260	Vocês acham que a gente vai encontrar
2038260	2040260	a Dona Coruja? Porque até agora
2040260	2042260	a gente não tinha encontrado a Dona Coruja.
2042260	2044260	E o lobo parecia saber quem era Favo de Bel.
2044260	2046260	E ele tá logo ali.
2046260	2048260	Tá, tá. Agora
2048260	2050260	depois, se ele tiver a barriga cortada
2050260	2052260	por causa da humana,
2052260	2054260	eu não me responsabilizo.
2054260	2056260	Vai dar tudo certo,
2056260	2058260	vai dar tudo certo.
2058260	2060260	Vocês tão dizendo.
2060260	2062260	Mamãe, eu não tô dizendo nada não, mamãe.
2062260	2064260	É o papai que tá dizendo.
2064260	2066260	Eu vou pegar o meu chapéu de palha,
2066260	2068260	que deve ser bem grande, certo? Certo,
2068260	2070260	eu vou colocar na cabeça da Favo de Bel
2070260	2072260	e ir colocando os cachinhos
2072260	2074260	dourados dela pra dentro do chapéu.
2074260	2076260	Vou tentar disfarçar que ela
2076260	2078260	tem esse... sei lá,
2078260	2080260	ela é um pouquinho diferente.
2080260	2082260	Já que ela parece porco,
2082260	2084260	eu vou... Tentar disfarçar que ela é uma humana.
2084260	2086260	Dá pra ver o pedacinho do queixo dela.
2086260	2088260	Pronto. O chapéu é realmente muito grande.
2088260	2090260	Perfeito. Se olhar, fala que é
2090260	2092260	o nosso filhotinho mais novo.
2092260	2094260	A irmãzinha da Caca.
2094260	2096260	A gente adotou um porco?
2096260	2098260	Por que não?
2098260	2100260	Eles são fofinhos.
2100260	2102260	Eles são fofinhos.
2102260	2104260	Ah, eles são rosinhos.
2104260	2106260	A trilha vai indo cada vez mais
2106260	2108260	por uma mata fechada. Fica até difícil
2108260	2110260	pra vocês que são ursos estar se movimentando
2110260	2112260	por ali. Mas a trilha,
2112260	2114260	o atalho,
2114260	2116260	termina numa pequena casa, assim,
2116260	2118260	entre árvores e dá pra ver
2118260	2120260	sentada na varanda
2120260	2122260	uma senhora de idade,
2122260	2124260	usando uma camisola,
2124260	2126260	fazendo um tricô, né,
2126260	2128260	dançando suavemente numa cadeira
2128260	2130260	de balanço.
2130260	2132260	Ela parece não ter notado vocês.
2132260	2134260	Eu me escondo atrás do balu.
2134260	2136260	Mamãe, você disse que não tinha
2136260	2138260	humano por aqui?
2138260	2140260	Eu não sei, mas
2140260	2142260	disseram que o lobo tava
2142260	2144260	por aqui e
2144260	2146260	lembrei que tinha
2146260	2148260	uma velha também que quase cortou
2148260	2150260	a barriga do lobo, então é melhor a gente
2150260	2152260	ficar aqui. E se os porcos
2152260	2154260	não falarem? E porco lá sabe
2154260	2156260	de alguma coisa? Já.
2156260	2158260	Deixa eu ver aqui.
2158260	2160260	Mas se ela for papai, papai, papai,
2160260	2162260	papai, papai, papai, papai, papai,
2162260	2164260	papai, papai, papai, papai, papai,
2164260	2166260	e se ela for
2166260	2168260	mãe,
2168260	2170260	avô, parente da
2170260	2172260	fava de mel? A gente pode
2172260	2174260	empurrar
2174260	2176260	a fava de mel pra ir rolando
2176260	2178260	pra lá e a gente fica aqui?
2178260	2180260	É uma ideia interessante.
2180260	2182260	É só a gente tirar o chapéu,
2182260	2184260	rola
2184260	2186260	a fava de mel até ela vir.
2186260	2188260	E a gente fica observando
2188260	2190260	o que acontece.
2190260	2192260	Eu quero observar se
2192260	2194260	tipo assim, se é uma senhoria
2194260	2196260	mesmo, se tem alguma coisa
2196260	2198260	estranha nela. Dois dados.
2198260	2200260	Enquanto isso, a Dora vai tirando
2200260	2202260	a fava de mel das costas do Balu
2202260	2204260	pra botar no chão pra rolar.
2204260	2206260	Ah, tirei três e dois
2206260	2208260	e eu não vi nada.
2208260	2210260	Parece uma senhorinha simpática.
2210260	2212260	É, ela parece simpática.
2212260	2214260	Acho que não tem problema.
2214260	2216260	Eu só quero ter certeza disso.
2216260	2218260	O plano de vocês é rolar
2218260	2220260	a criança.
2220260	2222260	Até a senhora é isso.
2222260	2224260	Por que não, né?
2224260	2226260	Os planos dos meus pais são esses.
2226260	2228260	Eu tiro o chapéu. Eu tiro o chapéu.
2228260	2230260	Eu falo a criança pra fora da boa.
2230260	2232260	Aí eu falo assim, gente, ó,
2232260	2234260	papai, mamãe,
2234260	2236260	ela parece legal.
2236260	2238260	Olha, simpática.
2238260	2240260	Ela tá ali bordando
2240260	2242260	que nem a mamãe faz às vezes.
2242260	2244260	Acho que ela não vai cortar a barriga de ninguém.
2244260	2246260	Ah, lembra
2246260	2248260	daquela coméia de abelha
2248260	2250260	que eu disse que não era pra você mexer
2250260	2252260	porque aquelas de lá, elas tinham
2252260	2254260	ferrão, que elas eram bem
2254260	2256260	bonitinhas, amarelinhas,
2256260	2258260	alegres.
2258260	2260260	Lembra o que que aconteceu?
2260260	2262260	Então, ser só
2262260	2264260	simpática não quer dizer
2264260	2266260	que ela não possa te fazer dodói.
2266260	2268260	Mas o papai é forte.
2268260	2270260	Papai. Oi.
2270260	2272260	Você é forte.
2272260	2274260	Bota-se a barriga, bota-se a mãozinha na
2274260	2276260	marquinha. É, sou,
2276260	2278260	sou bem forte, mas
2278260	2280260	eu tive uma ideia.
2280260	2282260	Eu vou caçar ali no chão baixo uma pedrinha,
2282260	2284260	tem? Tem. Eu vou tacar
2284260	2286260	a pedrinha, deixa eu ver,
2286260	2288260	numa janela.
2288260	2290260	Casei com um fandom.
2290260	2292260	Que bom, né? Eu pensei que ia tacar.
2292260	2294260	Tá, vocês não enrolaram a menina
2294260	2296260	ainda, é isso? Não. Vou jogar uma pedra na janela.
2296260	2298260	A Caca, ela tá preocupada
2298260	2300260	com alguma coisa. Dois dados.
2300260	2302260	Quatro e dois.
2302260	2304260	Tu arrebenta uma
2304260	2306260	janela. Casei com
2306260	2308260	um fandom. A vovozinha
2308260	2310260	levanta assim, assustada, num pulo.
2310260	2312260	Da casa sai uma outra vovozinha.
2312260	2314260	As duas conversam
2314260	2316260	alguma coisa na varanda e tão olhando
2316260	2318260	assim a janela. Mamãe tem duas
2318260	2320260	vovozes agora.
2320260	2322260	Eu disse? Eu não disse?
2322260	2324260	Imagina, quantas vovozes
2324260	2326260	podem sair daquela casa e correr
2326260	2328260	atrás da gente? Pergunta mais importante.
2328260	2330260	Elas portam coisas
2330260	2332260	cortantes? Não. Assim não se
2332260	2334260	tiraram essa ideia, inclusive.
2334260	2336260	Mas, uma delas é mais
2336260	2338260	alta que a outra, assim, bem mais alta.
2338260	2340260	A mamãe da outra, né? Uma é mais alta
2340260	2342260	que nem o papai, a outra é mais baixinha.
2342260	2344260	Eu não lembro dos humanos tão grandes
2344260	2346260	assim, não. Alguém enrola um dado pelo
2346260	2348260	grupo ou tributou a mãe?
2348260	2350260	Dois.
2352260	2354260	Uma
2354260	2356260	das vovozes, a mais alta
2356260	2358260	entre elas, dá uma farejada
2358260	2360260	no ar e num pulo
2360260	2362260	ela larga a roupa pra trás
2362260	2364260	e fica ainda maior
2364260	2366260	e peluda. Ela é o lobo novamente
2366260	2368260	e ela corre na direção
2368260	2370260	de vocês.
2370260	2372260	Ah, o lobo tá vindo, o lobo tá vindo.
2372260	2374260	Agora tá vindo pra cima
2374260	2376260	da minha faca. Aí não tem conversa, não.
2376260	2378260	Vai sair uma sombra
2378260	2380260	de mesmo tamanho, eu vou crescendo
2380260	2382260	assim, eu só vou ficando em cima das
2382260	2384260	duas patas e vou dar aquela
2384260	2386260	aquela posição
2386260	2388260	assustadora de urso, que ele abre os braços
2388260	2390260	e começa a fugir. Ok.
2390260	2392260	Vou fazer. Dois dados.
2392260	2394260	Cinco e três.
2394260	2396260	Cinco é um acerto crítico, três
2396260	2398260	é um acerto simples. Me diz como é
2398260	2400260	que tu assustou, derrubou, o que
2400260	2402260	que tu fez com esse lobo? Eu fui ficando em cima das duas
2402260	2404260	patas, ficando cada vez maior, cada vez
2404260	2406260	maior e eu
2406260	2408260	só olhei assim o lobo por cima
2408260	2410260	e mostrei os meus dentes
2410260	2412260	assim, eu mostrei que ele
2412260	2414260	pode levar uma mordida ou um abraço
2414260	2416260	por causa disso. O lobo se
2416260	2418260	assusta e ele faz aquele
2418260	2420260	arco e começa a voltar, ele
2420260	2422260	desce algumas pedras e rola assim
2422260	2424260	em direção a casa e fica caído
2424260	2426260	lá e a vovozinha menor
2426260	2428260	foi lá fazer. Oh, lobo!
2428260	2430260	Tá fazendo um carinho
2430260	2432260	nele. Ela nunca
2432260	2434260	só tá rica nele.
2434260	2436260	Eu vou tentar falar com a senhora.
2436260	2438260	Ô, minha senhora,
2438260	2440260	a senhora conhece esse
2440260	2442260	esse lobo aí,
2442260	2444260	esse derrubador de
2444260	2446260	casas? Ele tem morado
2446260	2448260	comigo. Hum,
2448260	2450260	certo.
2450260	2452260	E por que que ele fica
2452260	2454260	derrubando a casa dos outros? Ele foi lá em casa
2454260	2456260	ameaçar a minha família, dizendo que ia
2456260	2458260	derrubar a minha casa. Ela olha pro
2458260	2460260	pro lobo, ele levanta
2460260	2462260	assim meio envergonhado. Eu
2462260	2464260	tenho meus hábitos. A Dora
2464260	2466260	quando
2466260	2468260	vê que o lobo tá assustado, ela sai
2468260	2470260	de trás da moita, ainda meio
2470260	2472260	escondida atrás do baluco. É, e
2472260	2474260	maus hábitos, maus hábitos.
2474260	2476260	Tenho certeza que a sua mãe ficaria com
2476260	2478260	a gente. É que aquela senhora
2478260	2480260	que mora perto do rio, tentou
2480260	2482260	marchar com a gente, né?
2482260	2484260	Ela não sabe que eu sou o lobo.
2484260	2486260	Mas ela falou dessa
2486260	2488260	criança, e que essa criança
2488260	2490260	estava correndo perigo.
2490260	2492260	Não ia acordar mais.
2492260	2494260	E se ela não acordasse,
2494260	2496260	todos nós deixaríamos
2496260	2498260	de existir.
2498260	2500260	Então, né? Tem maneiras diferentes
2500260	2502260	de você explicar
2502260	2504260	pras pessoas a urgência.
2504260	2506260	Você não chega na casa das pessoas,
2506260	2508260	ou derruba a sua casa, ou entrega
2508260	2510260	a criança. Se você
2510260	2512260	tivesse dito
2512260	2514260	assim, é urgente,
2514260	2516260	a gente vai parar de existir, é outra
2516260	2518260	história, né? Ah, mas é sempre assim.
2518260	2520260	Aí eu perguntar,
2520260	2522260	nossa, por que você dá vestido
2522260	2524260	de velhinha? Aí eu ia ter
2524260	2526260	que parar pra explicar as coisas
2526260	2528260	que eu gosto. Ninguém nunca entende.
2528260	2530260	Da última vez,
2530260	2532260	a gente teve que fingir que eu tinha devorado
2532260	2534260	minha amiga. Veio um caçador,
2534260	2536260	mó loucura com a neta dela.
2536260	2538260	O fato é que a gente precisa
2538260	2540260	levar a menina pra ela acordar.
2540260	2542260	A gente tava tentando levar
2542260	2544260	pra Dona Coruja, mas a gente
2544260	2546260	perdeu o caminho da trilha. Não conheço
2546260	2548260	essa Dona Coruja. A velhinha
2548260	2550260	contou pra gente que essa menina é importante
2550260	2552260	e que ela precisa acordar.
2552260	2554260	Mora perto do rio. E tem que levar pra lá.
2554260	2556260	É. E por que tu não
2556260	2558260	disse antes? A gente veio
2558260	2560260	do rio. A gente ia de casa
2560260	2562260	pequenininho com o Alonso. Talvez não seja o mesmo rio.
2562260	2564260	Ele tenta levantar,
2564260	2566260	ele dá uma mancada. Droga!
2566260	2568260	Eu não vou poder
2568260	2570260	acompanhar vocês.
2572260	2574260	Tá certo. Eu chego assim perto
2574260	2576260	do lobo. Ó.
2576260	2578260	Seu lobo, é o seguinte.
2578260	2580260	Quando eu chegar em casa, eu espero que
2580260	2582260	tá tudo no lugar, viu?
2582260	2584260	Estou ferido. Eu não posso
2584260	2586260	sair daqui. Nada de casas mais
2586260	2588260	derrubadas, entendeu?
2588260	2590260	Entendi. Qual é a direção do rio?
2590260	2592260	É por ali. Mas
2592260	2594260	os porquinhos contam? Contam.
2594260	2596260	Tudo bem. É por aqui.
2596260	2598260	Sigam essa clareira. Logo
2598260	2600260	lá em cima vão ouvir o barulho da água.
2600260	2602260	Só seguirem o rio que
2602260	2604260	vocês chegam na casa da senhorinha. Tá.
2604260	2606260	É... Minha senhora, é...
2606260	2608260	Assim, a senhora conhece
2608260	2610260	essa outra senhorinha, já que você
2610260	2612260	toma chá com o lobo e
2612260	2614260	outras... outras convidadas?
2614260	2616260	Sabe como é que é? Eu não confio
2616260	2618260	muito nele, não. É uma senhora muito
