start	end	text
3776260	3778260	Joga o príncipe pra cima,
3778260	3780260	pra um lado e pro outro.
3780260	3782260	Tão dançando maravilhosamente bem.
3782260	3784260	Balu e Dora, a ação de vocês.
3784260	3786260	Só pra completar, eu subo ele assim, giro ele lá
3786260	3788260	em cima e desço.
3788260	3790260	Ele abre os braços assim, sabe fazer aquela pose.
3790260	3792260	Perfeito.
3792260	3794260	Eu vou gritar.
3794260	3796260	Comida liberada por conta do príncipe.
3796260	3798260	Você pode pegar a Dora.
3798260	3800260	Mas a comida já está liberada,
3800260	3802260	Babu.
3802260	3804260	A comida já é gratuita.
3806260	3808260	É a ideia da festa, inclusive.
3810260	3812260	Eu vou lá, puxo a Dora
3812260	3814260	pelo braço, dizendo que o príncipe tá sendo
3814260	3816260	safado com ela.
3816260	3818260	Eu vou rugir, dando apoio.
3818260	3820260	Ok, tá rugindo pra ajudar.
3820260	3822260	Dora, dois dados, passar pela multidão e chegar
3822260	3824260	até a tua filha. Tem atributo ou
3824260	3826260	menos?
3826260	3828260	Quatro e quatro. É muita gente
3828260	3830260	são muitos humanos ali, aglomerado
3830260	3832260	pra ver. Tu não tá conseguindo
3832260	3834260	passar. E os ponteiros do
3834260	3836260	minuto andando.
3836260	3838260	Então, eu começo a gritar
3838260	3840260	Cacá! Tá na hora de ir pra casa!
3840260	3842260	Cama! Um dado, Cacá.
3842260	3844260	Teu atributo ou mais?
3844260	3846260	Dois.
3846260	3848260	Nada. Tu tá lá, estreitinha.
3848260	3850260	Eu volto
3850260	3852260	revoltada, batendo o pé pro
3852260	3854260	Balu. Empurra todo mundo
3854260	3856260	e vai lá e pega ela. Você é o pai,
3856260	3858260	faça alguma coisa. Tá bom.
3858260	3860260	Ah, então tem um urso
3860260	3862260	correndo disparado no meio da multidão.
3862260	3864260	Dois dados.
3864260	3866260	Cinco e cinco!
3866260	3868260	Tu
3868260	3870260	sai correndo assim,
3870260	3872260	com uma bola de boliche.
3872260	3874260	Humanos são atirados pra todos os lados.
3874260	3876260	A Cacá
3876260	3878260	joga o príncipe pra cima
3878260	3880260	pra segurar ela no movimento.
3880260	3882260	Mas antes de segurar o príncipe,
3882260	3884260	o Japarsa levando ela
3884260	3886260	de arrasto ali, botando ela nas tuas costas.
3886260	3888260	O relógio marca
3888260	3890260	um pra meia-noite
3890260	3892260	e pra aproveitar o embalo, já correr pro
3892260	3894260	lá pra fora. Exato, já sai rolando
3894260	3896260	já com os bilhetes na mão. Dora vai
3896260	3898260	acompanhar. Com certeza, já que ele tá abrindo
3898260	3900260	caminho. Tem uma carruagem
3900260	3902260	lá fora, com a porta aberta
3902260	3904260	e parece que tá esperando você.
3904260	3906260	Eita! Muita gente só fala assim, papai,
3906260	3908260	coitado do príncipe, ele vai cair, quem é que vai
3908260	3910260	pegar ele? Da volta a gente vê!
3910260	3912260	Tem bastante gente pra segurar ele.
3912260	3914260	Vocês entram
3914260	3916260	na carruagem, ela começa a
3916260	3918260	andar, então ela
3918260	3920260	sai um pouco
3920260	3922260	do chão.
3922260	3924260	Vocês escutam o barulho da meia-noite
3924260	3926260	do relógio batendo.
3926260	3928260	Cacá, você olha pra trás, caído
3928260	3930260	sobre a escadaria,
3930260	3932260	o príncipe, na mão
3932260	3934260	dele, a capa.
3934260	3936260	Não! Minha capa!
3936260	3938260	A minha capa ficou pra trás!
3938260	3940260	Minha capa!
3940260	3942260	Que triste!
3942260	3944260	O que eu vou fazer sem a minha capa,
3944260	3946260	mamãe? Eu costuro
3946260	3948260	outra pra você, Cacá.
3948260	3950260	Fica assim, não. Eu começo a fazer carinho
3950260	3952260	na cabecinha dela.
3952260	3954260	Vocês estão voando, de qualquer
3954260	3956260	forma. Lá fora,
3956260	3958260	escuridão da noite, estrelas.
3958260	3960260	De repente, só escuridão.
3960260	3962260	Um vazio.
3962260	3964260	Tudo escuro. A carruagem
3964260	3966260	para novamente
3966260	3968260	no solo, num outro lugar.
3968260	3970260	Parece uma...
3970260	3972260	Um reino muito similar ao de
3972260	3974260	vocês, com um pouco menos de árvores.
3974260	3976260	O planeta acordava hoje, não é?
3976260	3978260	É. Eu lembro
3978260	3980260	que a bruxa ficava num outro castelo.
3980260	3982260	Tá. Eu olho pra fora,
3982260	3984260	tá tudo escuro, não tem nenhum
3984260	3986260	sinal de luz, nem nada.
3986260	3988260	Não. A hora que tocou o chão,
3988260	3990260	dia claro. Dá pra ver, assim,
3990260	3992260	uma pracinha, tem um pessoal
3992260	3994260	meio forte, assim, de sunga,
3994260	3996260	empurrando uns pneu,
3996260	3998260	sabe, fazendo umas barras.
3998260	4000260	Hum... Cacá tá se
4000260	4002260	recuperando do choro,
4002260	4004260	limpando as lágrimas dos olhos. A gente
4004260	4006260	ainda tá na carruagem. Estão.
4006260	4008260	Eu olho pra fora e falo, que que é isso,
4008260	4010260	gente? Que que é isso?
4010260	4012260	Não sei, mas deixa eu ver aqui um negócio.
4012260	4014260	A gente cai na direção
4014260	4016260	da bruxa, eu falo,
4016260	4018260	pra frente da carruagem.
4018260	4020260	É, desculpa. Não tem cocheiro.
4020260	4022260	Vai sair da carruagem o monstro,
4022260	4024260	esse avô. O urso sai das detas.
4024260	4026260	Não tem cocheiro na frente da carruagem,
4026260	4028260	nem cavalo, só a carruagem parada.
4028260	4030260	Esse troço não anda mais.
4030260	4032260	Peraí, tem um monte de gente,
4032260	4034260	pessoas, se exercitando
4034260	4036260	do lado de fora. Humanos, homens, muito fortes.
4036260	4038260	Se exercitando uma pracinha.
4038260	4040260	Só pra confirmar se foi isso que eu ouvi mesmo.
4040260	4042260	Foi exatamente isso que você ouviu.
4042260	4044260	Vocês chegaram em
4044260	4046260	outro reino. Relaxa. Ok.
4046260	4048260	A gente vai ter que sair. Eu abro a porta.
4048260	4050260	Eu não uso de vestido.
4050260	4052260	Pra onde é que fica a casa da
4052260	4054260	bruxa? Castelo.
4054260	4056260	Uma bruxa. Um dos caras tava empurrando
4056260	4058260	um pneu muito grande.
4058260	4060260	E é um pneu, não uma roda
4060260	4062260	de carruagem, né? Você nem sabe que é um pneu,
4062260	4064260	provavelmente. É...
4064260	4066260	Ele usa uma sunga. Uma rosquinha gigante.
4066260	4068260	Ele usa apenas uma sunga,
4068260	4070260	assim como os outros homens ali se exercitando.
4070260	4072260	Ele chega mais perto.
4072260	4074260	Vocês perguntaram da bruxa? Sim.
4074260	4076260	Sim. Ele faz sinal
4076260	4078260	pros outros que vão, assim,
4078260	4080260	pra perto dele. Cada um deles fazendo uma
4080260	4082260	uma pose, assim,
4082260	4084260	de músculos, né? Um deles expira.
4084260	4086260	Saúde.
4086260	4088260	O que querem com a bruxa?
4088260	4090260	Vocês trabalham pra ela? Não.
4090260	4092260	A gente quer acordar
4092260	4094260	Favo de Mel. Os sete se olham.
4094260	4096260	Favo de Mel?
4096260	4098260	É. Eu aponto pra mochila que tá
4098260	4100260	nas costas do baú. É, isso
4100260	4102260	é um assunto particular.
4102260	4104260	Eu olho assim meio desconfiado.
4104260	4106260	A Maiara veio do castelo. Ela pode ajudar
4106260	4108260	vocês. Ela tá em casa. Eu aponto pra uma
4108260	4110260	casa. Maiara.
4110260	4112260	Esse é o nome da bruxa?
4112260	4114260	Maiara? Não.
4114260	4116260	Enteada, eu acho. Enteada da
4116260	4118260	bruxa. E pra onde fica a casa dela mesmo?
4118260	4120260	É aquela casinha ali, ó. Do lado do campinho.
4120260	4122260	A gente treina aqui do lado dela.
4122260	4124260	De manhã, a Maiara não gosta da gente
4124260	4126260	em casa. A gente faz muito bem.
4126260	4128260	Tá bom.
4128260	4130260	Ela sabe qual é a direção que mora a bruxa isso?
4130260	4132260	Ela morava lá, até fugir da bruxa.
4132260	4134260	E essa bruxa não parece ser legal.
4134260	4136260	É, nessa direção aqui é a casa, né?
4136260	4138260	Isso, dele. Quando a gente vai andando
4138260	4140260	eu falo pra mamãe. Mãe, se eu rasgar
4140260	4142260	esse vestido e deixar só atrás, ele vai
4142260	4144260	parecer uma capa? A gente pode tentar.
4144260	4146260	É muito quente. É muito quente fazer
4146260	4148260	esse vestido aqui. Eu tenho
4148260	4150260	uma agulha e uma linha quinta.
4150260	4152260	Eu posso fazer. Eu tentar
4152260	4154260	transformar numa capa. Ah, eu tiro o vestido.
4154260	4156260	E eu vou tentar
4156260	4158260	transformar numa capa o vestido.
4158260	4160260	Enquanto a gente vai andando em direção da capa.
4160260	4162260	Ok. Seis
4162260	4164260	daqueles homens estão olhando vocês.
4164260	4166260	Um deles dormiu.
4166260	4168260	Ok, a gente tá indo. Eles
4168260	4170260	mandaram a gente ir, né? Tchau, moça.
4170260	4172260	Até mais. Eles voltam
4172260	4174260	a se exercitar eventualmente.
4174260	4176260	E vocês chegam até a casinha.
4176260	4178260	Porta fechada.
4180260	4182260	Uma voz lá dentro.
4182260	4184260	Ah, esqueceram a chuva de novo?
4184260	4186260	Ela abre a porta.
4186260	4188260	Hum...
4188260	4190260	Quem são vocês? Prazer.
4190260	4192260	Valor. Você é a Mayara?
4192260	4194260	Você não tinha que me chamar de
4194260	4196260	Branca de Neve? Eles falaram que seu nome era Mayara.
4196260	4198260	Foi. Foi Mayara mesmo. Ok.
4198260	4200260	Mayara. Vocês são tipo
4200260	4202260	a polícia?
4202260	4204260	Polícia? O que é polícia? Eu sou
4204260	4206260	o pai urso.
4206260	4208260	Essa é a mãe urso. Essa é a filha urso.
4208260	4210260	E...
4210260	4212260	Estamos atrás da bruxa. Ela...
4212260	4214260	Ela mexe assim a mão no ar.
4214260	4216260	Vocês não deveriam estar aqui, não.
4216260	4218260	É, ninguém deveria estar aqui.
4218260	4220260	Ninguém deveria estar lá. E se a gente
4220260	4222260	não for rápido, não vai ter nem aqui
4222260	4224260	nem lá. É, a gente tem que acordar
4224260	4226260	a fava de mel.
4226260	4228260	Quem é fava de mel? Eu aponto pra mochila.
4228260	4230260	É um assunto particular. A mochila
4230260	4232260	é a fava de mel?
4232260	4234260	Ó, moça. Moça Mayara. Ah...
4234260	4236260	Aquela senhorinha...
4236260	4238260	A senhorinha disse que a fava de mel comeu
4238260	4240260	uma maçã.
4240260	4242260	E que ela tá dormindo e que a gente tem que acordar ela.
4242260	4244260	É. E que pra gente acordar ela
4244260	4246260	ou a gente espera 12 anos
4246260	4248260	ou a gente desacorda a bruxa.
4250260	4252260	A fava de mel é uma mulher?
4252260	4254260	Uma humana? É.
4254260	4256260	Daí eu abro ali a mochila. Essa menina
4256260	4258260	aqui. Puxa a fava de mel. É uma humana
4258260	4260260	de verdade?
4260260	4262260	E você não é humana, não? Eu sou.
4262260	4264260	Então não devia ser tão surpresa assim.
4264260	4266260	É surpresa porque cada reino deveria ter
4266260	4268260	uma humana. E eu desabilitei
4268260	4270260	a bruxa de poder me afetar.
4270260	4272260	Mas no reino
4272260	4274260	que a gente veio tinha um monte de
4274260	4276260	humanos no castelo. Como eu abri
4276260	4278260	algumas portas e alterei
4278260	4280260	algumas coisas,
4280260	4282260	ela conseguiu mudar de reino
4282260	4284260	e sequestrou a humana de lá. Ah, por
4284260	4286260	culpa da senhora então? Moça, tem que acordar ela.
4286260	4288260	Vai, acorda ela aqui. Vai, por favor.
4288260	4290260	Acorda a fava de mel. No reino de vocês
4290260	4292260	provavelmente duas
4292260	4294260	coisas. O beijo,
4294260	4296260	mas não deve ser, já que ela é menor
4296260	4298260	de idade. Não tinha nada de beijo. Só disse que
4298260	4300260	era pra esperar 12 anos. Então,
4300260	4302260	eu dou uma cutucada assim na Dora.
4302260	4304260	Né? Era por isso que a
4304260	4306260	Cacá não podia casar com tu. Tá.
4306260	4308260	Eu vou tentar descobrir o que foi que eu
4308260	4310260	fiz. A outra opção é derrubar
4310260	4312260	a bruxa. Então. Isso. Muito simples.
4312260	4314260	Me mostra onde tá a bruxa, aí eu mostro
4314260	4316260	a fava do urso e o resto a gente resolve. Mas
4316260	4318260	papai, papai ela mexeu em alguma coisa.
4318260	4320260	E se ela mexer de novo e
4320260	4322260	a fava de mel dormir de novo? Daí a gente
4322260	4324260	sai pra passear de novo. Aí eu danço de novo.
4324260	4326260	Legal, legal. Isso.
4326260	4328260	Arrumem a menina,
4328260	4330260	voltem pro reino de vocês.
4330260	4332260	Ninguém precisa saber que
4332260	4334260	isso aconteceu.
4334260	4336260	O castelo tá até mais perto.
4336260	4338260	Aponta o castelo que antes não estava ali.
4338260	4340260	Nossa, por que você fica mexendo os dedos?
4340260	4342260	É coisa de humano isso, né? Você não tá vendo isso
4342260	4344260	aqui? Ela mexe os dedos no ar
4344260	4346260	assim, no nada. Sim.
4346260	4348260	Que isso? Não tá vendo nada. Tá.
4348260	4350260	Fica tranquila. Tá
4350260	4352260	tudo bem. Vão lá
4352260	4354260	e derrotem a bruxa. Você é a bruxa
4354260	4356260	mesmo? Não, não. Eu sou só
4356260	4358260	uma usuária. Eu acho melhor a gente
4358260	4360260	ir pro castelo. Cacá, vem
4360260	4362260	aqui. Eu puxo assim a Cacá
4362260	4364260	pra perto.
4364260	4366260	Aquela moça é meio doida,
4366260	4368260	né, mãe? Um pouquinho. Eu acho
4368260	4370260	que ela tá comendo muito cogumelo. Ela
4370260	4372260	tinha comido mais mel. Ela deve ficar
4372260	4374260	nervosa que tem aquele monte de moço se
4374260	4376260	exercitando ali de lá fora. É meio estranho
4376260	4378260	esse reino. A gente
4378260	4380260	chegou no castelo.
4380260	4382260	Não, mamãe, você conseguiu fazer minha capa?
4382260	4384260	Eu consegui fazer a capa?
4384260	4386260	Conseguiu. Eu olho assim
4386260	4388260	Ai, que bonita ficou a capa.
4388260	4390260	Agora a capa
4390260	4392260	tá com fufus.
4392260	4394260	Obrigado. Assim que vocês
4394260	4396260	saem, a Mayara fecha a porta.
4396260	4398260	Vocês começam a ir em direção ao castelo.
4398260	4400260	A gente tá muito longe. Dois dados cada um.
4400260	4402260	Balu. Quatro e três.
4402260	4404260	Dois acertos. Muito bem.
4404260	4406260	Dora. Seis
4406260	4408260	e três. Um acerto crítico. Muito
4408260	4410260	bem. Acho que todos vão passar ileso
4410260	4412260	pro que aconteceu.
4412260	4414260	Cacá. Tirei seis e cinco.
4414260	4416260	Eu estou muito deslumbrada
4416260	4418260	com a minha capa. Das
4418260	4420260	escadarias do castelo, que é similar
4420260	4422260	ao outro, só que o outro era
4422260	4424260	assim, ele era meio cristalino
4424260	4426260	iluminado. Esse ele
4426260	4428260	é mais escuro, mais
4428260	4430260	cinzento.
4430260	4432260	Das escadarias dele,
4432260	4434260	um homem
4434260	4436260	ele atira três vezes
4436260	4438260	contra você. Ele
4438260	4440260	erra dois tiros. Um dos
4440260	4442260	tiros derruba a Cacá. Ele está recarregando.
4442260	4444260	Oi? Ah, ele não está em pé mais.
4444260	4446260	Ele está bem longe.
4446260	4448260	Pulo pra frente da Cacá.
4448260	4450260	Assim, eu vou começar a correr,
4450260	4452260	na direção dele. Eu penso que ele me atire.
4452260	4454260	O meu peso vai matar ele.
4454260	4456260	Tá. Tu já está correndo.
4456260	4458260	A mochila está contigo, né? Tá.
4458260	4460260	Tá ótimo. Dois dados.
4460260	4462260	O teu atributou mais.
4462260	4464260	Seis e dois. Um acerto
4464260	4466260	simples. Um outro tiro passa assim
4466260	4468260	zunindo pela tua orelha.
4468260	4470260	Tu está te aproximando cada
4470260	4472260	vez mais. Um dado.
4472260	4474260	Cinco.
4474260	4476260	Ai. Ai.
4476260	4478260	Quando tu finalmente te aproxima, um acerto crítico.
4478260	4480260	Que fim levou esse caçador?
4480260	4482260	Hum, deixa eu pensar aqui.
4482260	4484260	Eu vou morder ele assim pelo ombro.
4484260	4486260	E eu só vou jogar ele
4486260	4488260	pra um lado e o resto pro outro lado.
4490260	4492260	Balançou ele que nem uma boneca
4492260	4494260	e foi isso. E atirou
4494260	4496260	ele. É. Tu vê que ele não
4496260	4498260	assangue
4498260	4500260	no que acontece ali. Mas
4500260	4502260	o caçador parece que não levanta mais.
4502260	4504260	Eu estou meio eufórico ainda.
4504260	4506260	Eu nem consegui olhar pra
4506260	4508260	trás. Lá atrás?
4508260	4510260	Está a Dora e a Cacá.
4510260	4512260	Cacá, um tiro passou raspando
4512260	4514260	pelo teu ombro. Também não
4514260	4516260	tem sangue, mas queimou os pelos.
4516260	4518260	Tu está sentindo um pouco de dor.
4518260	4520260	E a tua mãe está ali contigo.
4520260	4522260	Ai, mãe. Está doendo. Mãe.
4522260	4524260	O que é isso? Eu não
4524260	4526260	sei. Eu não sei. Eu disse que humanos
4526260	4528260	não são bons. Eu disse. Eu disse.
4528260	4530260	Daí eu começo a fazer carinho nela e
4530260	4532260	um beijinho pra Sarah. Um beijinho pra Sarah.
4532260	4534260	Daí eu dou um beijinho no ombro dela. Ela está
4534260	4536260	lá alisando assim, um braço segurando.
4536260	4538260	Cadê o papai? É quando ela
4538260	4540260	fala, cadê o papai? Daí que eu lembro do balo.
4540260	4542260	Olha assim pra cima na escada.
4542260	4544260	Daí eu não vejo
4544260	4546260	mais sinal do caçador. É.
4546260	4548260	Seu pai está lá em cima. Vamos
4548260	4550260	subindo. Eu pego a Cacá
4550260	4552260	e boto na minha Cacum.
4552260	4554260	E vou subindo a escada. E eu estou lá aproveitando
4554260	4556260	quentinho. E estou meio um pouco
4556260	4558260	assustada. Agarrando nela lá em cima.
4558260	4560260	Meu pai, ó. Machucou
4560260	4562260	aqui no meu ombro, ó. Nossa.
4564260	4566260	Eu nem consegui reagir.
4566260	4568260	É o que? É uma ponta que tem ali embaixo?
4568260	4570260	É uma porta dupla grande.
4570260	4572260	Eu vou começar a dar
4572260	4574260	uns golpes com a garra
4574260	4576260	na porta. Dois dados.
4576260	4578260	Atributo ou menos.
4578260	4580260	Seis e três. Tu não consegue derrubar
4580260	4582260	a porta, assim. Tu faz um estrago na mesma.
4582260	4584260	Mas depois de um tempo a porta
4584260	4586260	se abre por
4586260	4588260	a pessoa lá dentro abre a porta pra ti.
4590260	4592260	Uma mulher assim
4592260	4594260	num vestido
4594260	4596260	negro. Ela tem chifres
4596260	4598260	muito altos. Ela tem uma
4598260	4600260	boca bem vermelha, né.
4600260	4602260	Ela segura em uma das mãos uma maçã.
4602260	4604260	A outra mão tá livre.
4604260	4606260	E ela fala.
4606260	4608260	Bem-vindos, ursos.
4608260	4610260	Não imaginei
4610260	4612260	que viriam tão longe.
4612260	4614260	Bem-vindos nada. Esse
4614260	4616260	caçador atirou na nossa filha. E a senhora
4616260	4618260	tem que acordar a
4618260	4620260	a
4620260	4622260	a menina que tá na mochila.
4622260	4624260	A fava de mel. É isso.
4624260	4626260	A fava de mel. A senhora.
4626260	4628260	Por acaso, a senhora...
4628260	4630260	Se eu responder, eu
4630260	4632260	sei que você vai me atacar.
4632260	4634260	Eu queria um minutinho
4634260	4636260	da sua atenção
4636260	4638260	antes. Eu abri a
4638260	4640260	porta pra vocês
4640260	4642260	pra que me escutem. Tem mingau?
4642260	4644260	Tem maçãs.
4644260	4646260	Papai não come a maçã. Não come a maçã, papai.
4646260	4648260	Ela aponta pra um espelho
4648260	4650260	na parede. Espelho, espelho
4650260	4652260	meu. Existe um reino
4652260	4654260	mais lindo que o meu.
4654260	4656260	E ele mostra uma cidade, assim, gigantesca.
4656260	4658260	Cheio de pessoas.
4658260	4660260	Cheio de casas.
4660260	4662260	Esse é o mundo real.
4662260	4664260	Nós aqui
4664260	4666260	somos uma história.
4666260	4668260	Não existimos.
4668260	4670260	Cada vez que uma criança
4670260	4672260	quer ir na casa dos
4672260	4674260	ursos, ela vai
4674260	4676260	e depois vocês esquecem.
4676260	4678260	Eu esqueço.
4678260	4680260	A Branca de Neve da vez
4680260	4682260	conseguiu enlouquecer
4682260	4684260	o programa de alguma
4684260	4686260	forma. E eu finalmente
4686260	4688260	entendi. Eu vi
4688260	4690260	através de tudo.
4690260	4692260	Da mesma forma que eles
4692260	4694260	conseguem vir pra cá,
4694260	4696260	eu posso ir
4696260	4698260	viver a vida dessa menina.
4698260	4700260	Eu ajudo vocês
4700260	4702260	e nós podemos trazer o resto
4702260	4704260	da família dela e
4704260	4706260	viverem um mundo que as coisas
4706260	4708260	são de verdade.
4708260	4710260	Eu tô dizendo que esse povo todo
4710260	4712260	endoidou. Eu quero
4712260	4714260	é voltar pra minha casa
4714260	4716260	com meu marido e com
4716260	4718260	a minha filha sem
4718260	4720260	tiro nenhum. Acorda
4720260	4722260	menina agora. Espelho
4722260	4724260	me mostre outro reino
4724260	4726260	conosco. Mostra uma outra casa igual de vocês
4726260	4728260	com três ursos
4728260	4730260	conversando com uma menina dormindo.
4730260	4732260	Olhem, é um reino igual
4732260	4734260	de vocês. E a menina
4734260	4736260	vai brincar e vai embora.
4736260	4738260	E eles vão esquecer.
4738260	4740260	Assim como vocês vão esquecer.
4740260	4742260	Eu não quero um reino igual.
4742260	4744260	Eu quero voltar pra minha casa com
4744260	4746260	a minha filha e o meu marido.
4746260	4748260	Daí eu vou indo na direção do espelho
4748260	4750260	pra derrubar o espelho. Dois dados
4750260	4752260	que eu atributo ao menino.
4752260	4754260	Seis e dois.
4754260	4756260	O espelho cai e se quebra.
4756260	4758260	A bruxa se assusta.
4758260	4760260	Não consigo repará-lo. Eu não me
4760260	4762260	preocupo com isso. Esse seu
4762260	4764260	reino real, a minha filha
4764260	4766260	vai se machucar, não vai?
4766260	4768260	Porque até onde a gente tá,
4768260	4770260	eu não quero seu reino real. Ela vai poder
4770260	4772260	viver uma vida que não
4772260	4774260	seja acordar,
4774260	4776260	passear e comer mingau. A gente
4776260	4778260	não acorda só passear e comer mingau.
4778260	4780260	Ainda bem que é só isso que a gente lembra.
4780260	4782260	Mas não é só isso que a gente faz. Hoje a gente até
4782260	4784260	dançou com o príncipe. A gente cuida.
4784260	4786260	A gente cuida da nossa
4786260	4788260	família. Acorda
4788260	4790260	a menina agora.
4790260	4792260	Dona Bruxinha, você falou que a Branca de Neve
4792260	4794260	conseguiu mudar as coisas.
4794260	4796260	O que você quer mudar? É fácil.
4796260	4798260	A vida de vocês é divertida.
4798260	4800260	Vocês têm uma família.
4800260	4802260	Eu sou sempre derrotada.
4802260	4804260	A velha malvada que dá
4804260	4806260	veneno pra mocinha.
4806260	4808260	Vai lá pra Branca de Neve e pede pra ela mudar
4808260	4810260	as coisas pra você. Só dessa vez
4810260	4812260	o mundo tá mudado. Por conta
4812260	4814260	daquela Branca de Neve maluca.
4814260	4816260	Da próxima vez, eu vou
4816260	4818260	esquecer. Por que você não pede pra ela ensinar você?
4818260	4820260	Ela fez uma vez. Se você consegue
4820260	4822260	fazer também. Mas deixa a menina acordar,
4822260	4824260	coitadinha. Ela deve ser mais nova que eu.
4824260	4826260	O bichinho vai ficar dormindo. Se eu for uma pessoa
4826260	4828260	real, eu vou poder fazer essas
4828260	4830260	coisas. Eu não tô entendendo nada. Ela
4830260	4832260	tá doida. Tá.
4832260	4834260	Igual a menina da casa.
4834260	4836260	Mas se você pular
4836260	4838260	no mundo real, a gente vai deixar de existir.
4838260	4840260	Isso também não é bom. Quem disse que o nosso mundo
4840260	4842260	não é real? Essa doida que tá dizendo.
4842260	4844260	Talvez, se eles
4844260	4846260	desconfiarem que a menina foi
4846260	4848260	substituída, eles deletem
4848260	4850260	todo o reino.
4850260	4852260	Eu tô dizendo que ela tá doida.
4852260	4854260	Balu, tu tá acreditando nessa história
4854260	4856260	dessa bruxa? Ou seja, o seu
4856260	4858260	plano é só pra se salvar.
4858260	4860260	Você tá muito pouco preocupada
4860260	4862260	com todo mundo do tempo. Eu fui criada
4862260	4864260	pra ser má. Me desculpe.
4864260	4866260	Tudo bem. Eu pego e dou um
4866260	4868260	cocorote na cabeça dela. Dois dados.
4868260	4870260	Seis
4870260	4872260	e um. Ela cai
4872260	4874260	no chão assustada. Ela não desacordou. Foi só
4874260	4876260	um acerto simples. Ela espreme
4876260	4878260	a maçã na mão dela.
4878260	4880260	Dois dados cada um. Atributou mais ou tá
4880260	4882260	dormindo.
4882260	4884260	Eu vou chamando.
4884260	4886260	Dora.
4886260	4888260	A Dora deu o cocorote
4888260	4890260	e caiu junto com a bruxa. Um
4890260	4892260	e um. Tava muito perto do
4892260	4894260	veneno da maçã. Desmaiou.
4894260	4896260	Balu. Comecei a hibernar.
4896260	4898260	Dois e um. Dois e um.
4898260	4900260	Dormiu também. Kaká.
4900260	4902260	Eu tirei cinco e um.
4902260	4904260	Um acerto. Você sentiu uma
4904260	4906260	pequena sonolência, mas tu tá acordada.
4906260	4908260	A bruxa tá caída no chão. Qual é a tua ação?
4908260	4910260	O que que você fez com os meus
4910260	4912260	pais? Acorda todo mundo
4912260	4914260	agora. Ela tá pondo a mão no bolso
4914260	4916260	e pegando uma outra maçã.
4916260	4918260	Eu vou botar
4918260	4920260	a pata na cara dela.
4920260	4922260	Botar? Por quê?
4922260	4924260	Tipo, a pata pra ela não respirar e
4924260	4926260	ela desmaiar.
4926260	4928260	Ok. Um dado. O teu atributo ou menos.
4930260	4932260	Quatro é o meu atributo. Eu pedi um aumento
4932260	4934260	porque era realmente difícil. Era mais fácil ela fazer ela
4934260	4936260	comer a própria maçã. Mas
4936260	4938260	quatro é um acerto crítico.
4938260	4940260	E ela tenta esmagar a maçã.
4940260	4942260	Ela não consegue. Ela dá
4942260	4944260	uma debatida. Ela dorme.
4944260	4946260	E agora, gente, o que que eu faço? Eu tô pensando.
4946260	4948260	Ela dormiu. E o papai e a mamãe tão dormindo também.
4948260	4950260	E a família tá dormindo também.
