2974820;2977060;"00";não passou pela minha cabeça.
2977200;2978420;"00";E é por isso que ficou tão legal.
2978420;2979740;"00";E outra pergunta.
2979860;2982700;"00";A princesa foi mandada com a doença ou o Elfo foi o culpado?
2983200;2983460;"00";Sim.
2984000;2986340;"00";A princesa já foi mandada
2986340;2988200;"00";com uma doença
2988200;2989200;"00";por algum motivo.
2990260;2992740;"00";Talvez ela foi contaminada por algum Elfo
2992740;2994120;"00";lá no território dela.
2994800;2996420;"00";E o mesmo Elfo, um outro Elfo,
2996500;2998580;"00";deu a ideia de enviar ela já como
2998580;2999920;"00";um cavalo de Troia, né?
3000440;3003160;"00";Ou talvez, sei lá, a família não gosta dela.
3003620;3004640;"00";Mas ela já foi
3004640;3006060;"00";carregando um problema.
3006060;3008060;"00";Ou talvez ela se candidatou
3008060;3009500;"00";pra esse plano maluco.
3010000;3010780;"00";Não sabemos.
3011460;3012420;"00";Um beijinho e um abraço pro Seixo.
3012500;3013320;"00";Um beijinho e um abraço, querido.
3013720;3014900;"00";Agora você se ferrou, gente.
3016140;3018040;"00";E é um amigo nosso, assim,
3018060;3019540;"00";uma pessoa de convívio nosso.
3019960;3022340;"03, 00";Mas eu acho que a regra diz
3022340;3025240;"03";que é muito mais gostoso quando o Guaxa
3025240;3026400;"03";fala esse nome.
3026800;3028820;"03";Então acho que você tinha que pelo menos falar o nome dele.
3029280;3031340;"03, 00";A Ju agora vai ler o comentário do Gabriel Balardino.
3031820;3032440;"03";Muito bom.
3032820;3034160;"03";Agora estou satisfeita e feliz.
3034160;3036440;"03";O comentário do Balardino
3036440;3037220;"03";é o seguinte.
3038060;3040820;"03";A Guaxa, Guaxa novidade, Guaxate e ouvintininhos.
3041200;3041660;"03";Tudo bem.
3042220;3044360;"03";Retorno depois de um longo inverno.
3044420;3046020;"03";Até porque o verão, com El Ninho,
3046420;3048600;"03";promete trazer temperaturas altas
3048600;3050640;"03";recordes. A minha depressão
3050640;3052560;"03";tem essa mania de me pegar distraído
3052560;3054060;"03";e me atingiu em fevereiro.
3054520;3056200;"03";Eu parei de fazer tudo que gostava
3056200;3058000;"03";e isso incluiu ouvir o RP Guaxa,
3058340;3060420;"03";interagir na taberna e muitas outras
3060420;3061820;"03";coisas em outros espaços.
3062000;3063520;"03";Me curei dessa crise.
3063920;3065840;"03";Com sequelas na saúde, que estou lidando
3065840;3067820;"03";agora, e o Guaxa Encontro teve um papelado.
3068060;3069340;"03";É muito importante nisso.
3070880;3071780;"03";Sério, cara.
3071920;3074340;"03";Desejo que você conheça cada uma delas um dia.
3074680;3075500;"03";Eu desejo também.
3076040;3077700;"03";Essas pessoas são de uma beleza
3077700;3079440;"03";que é até difícil de acreditar.
3079960;3082140;"03";A forma como acolhem e dão um sentimento
3082140;3083880;"03";de comunidade me fez chorar.
3084460;3086040;"03";Literalmente. Eu e a Ju
3086040;3087260;"03";fomos os chorões de lá.
3088460;3090400;"03";Um abraço aí, Balardino.
3091820;3092380;"03";Compreendo.
3092800;3094400;"00";Eu não sabia que teve chororô
3094400;3094740;"03, 00";no Brasil.
3094740;3096400;"03, 00";É que teve chororô
3096400;3097980;"03";meu e do Balardino.
3098060;3099440;"03";Mas vamos lá.
3100780;3102100;"03";A partir de então,
3102280;3104720;"03";iniciei um processo pra ficar em dia com os episódios.
3104940;3106340;"03";E finalmente consegui.
3106780;3108180;"03";Sendo assim, gostaria de fazer
3108180;3110360;"03";alguns comentários. O que foi a decisão
3110360;3112660;"03";de deixarem o personagem de Atributos 5
3112660;3114280;"03";rolar todos os testes
3114280;3116220;"03";de percepção? Esse grupo tava
3116220;3118280;"03";pro caos. Coisa esperada da Rafa
3118280;3120160;"03";e da Ju. O Príncipe Vidani não
3120160;3122220;"03";conhecia, mas provou ser um adepto
3122220;3124340;"03, 00";do caos. Ele é um adepto do caos,
3124400;3125880;"00";pelo amor de Deus. Ele tem medo de peixe.
3125880;3127980;"00";Ele é conhecido no programa dele.
3128220;3129920;"03, 00";As pessoas mandam... A leitura
3129920;3131220;"00";de comentários deles envolve
3131220;3133400;"00";Vinadi manda um gemido pra mim.
3134240;3135860;"00";Esse é o nível da loucura.
3136220;3137760;"03";Faltou essa oportunidade no episódio,
3137880;3139380;"03, 00";mas quem sabe, né? Faltou essa oportunidade.
3139480;3142000;"03, 00";É assim, vamos pensar num próximo
3142000;3142400;"00";tema.
3143660;3144580;"03";Ai, que medo.
3146440;3147800;"03";A decisão de morder o
3147800;3149820;"03";mercador. Como você conseguiu
3149820;3151300;"03";voltar a narrar depois disso?
3151880;3153060;"00";É assim,
3154320;3155360;"00";completamente inesperado,
3155360;3157280;"00";mas eu tô pro caos também.
3157280;3158260;"03, 00";Beleza.
3159260;3160620;"03";Até me perdi, sabe?
3161120;3162760;"03";Tá, é porque tava com
3162760;3164060;"03";marcado com spoiler.
3164580;3167440;"03";Eu precisei pausar o episódio pra rir por alguns minutos.
3167980;3169560;"03";A Ju é simplesmente maravilhosa
3169560;3171500;"03";e caótica. Te amo, filha da mãe.
3172260;3173220;"03";O Balardino
3173220;3175000;"03";que é um fofo e um querido.
3176880;3178940;"03";Você mora no meu coração também, Balardino.
3179700;3181260;"03";A Princesa Orquiza. Tem relação
3181260;3183300;"03";com as orquizas que participaram do torneio
3183300;3185180;"03, 00";contra os elfos? Não, não.
3185180;3187060;"00";Assim, a Princesa Orquiza, a relação?
3187280;3189160;"03, 00";Não. Tá. Será que agora
3189160;3191200;"03";que a Princesa Orquiza foi salva e se
3191200;3192780;"03";casou com o Príncipe de Outro Reino,
3193100;3195140;"03";isso pode melhorar as relações entre eles?
3195600;3197240;"00";Não, enquanto não derrubarmos os elfos.
3199360;3201180;"03";A Princesa se voluntariou
3201180;3202940;"03";ou foi forçada a se matar
3202940;3205200;"03, 00";com magia? Não, não tenho
3205200;3206900;"00";decidido isso, nem cravado.
3207300;3209040;"00";Como não foi levantado na aventura, não
3209040;3211420;"00";cravei. Vou deixar em aberto
3211420;3213440;"00";porque talvez eu use isso em aventuras futuras.
3215760;3217140;"03";Ficou claro que os elfos
3217140;3219160;"03";têm um papel importante na manutenção da
3219160;3220820;"03";guerra e conheciam a doença.
3221260;3223100;"03";Foram eles que forneceram ela para
3223100;3225180;"03";os inimigos? Se sim, isso
3225180;3226240;"03";não ia acabar com a guerra?
3226760;3229140;"00";Não, porque se a ideia era a Princesa chegar
3229140;3230920;"00";e...
3230920;3233260;"00";Como eu falei, a doença não ia espalhar
3233260;3234380;"00";pra cidade inteira.
3234860;3236840;"00";É uma doença por mordida ou por consumir
3236840;3238980;"00";coisas contaminadas. A ideia
3238980;3241400;"00";era pegar o...
3241400;3243340;"00";Quem ia receber a Princesa e dar um banquete
3243340;3245200;"00";pra ela? As pessoas que querem
3245200;3247020;"00";que esse casamento ocorra. Então,
3247140;3248620;"00";eles morrendo ia gerar um caos,
3248980;3250880;"00";uma outra pessoa ia acabar sumindo,
3251400;3253060;"00";o povo ia tomar aquilo
3253060;3254920;"00";como um ataque, ia querer retaliação.
3255320;3257200;"00";A guerra que já estava dando uma esfriada
3257200;3259080;"00";ia voltar a ficar uma guerra
3259080;3261080;"00";quente, né? Precisando de armas.
3262220;3262380;"00";Então,
3262640;3265040;"00";na minha concepção, os elfos
3265040;3267180;"00";ali, eles queriam pela manutenção da guerra.
3267500;3268940;"03";O Guaxa queria um casamento
3268940;3270040;"03";sangrento.
3271660;3273100;"03";Beleza. Um grande
3273100;3275360;"03";beijo e abraço e espero me manter melhor,
3275620;3277100;"03";mais ativo e participativo.
3277140;3279000;"03";no grupo. Eu amo muito essa
3279000;3281260;"03";tabela linda e você é um guaxinim
3281260;3283120;"03";muito especial. Se cuida e vamos
3283120;3284120;"03";juntos com uma glória.
3284860;3286840;"03, 00";Vamos junto, querido. Quando precisar,
3287000;3289140;"00";fala com a gente. Eu sou um pai
3289140;3290380;"00";muito ausente lá no grupo.
3292020;3293400;"03";Tamo junto, Balaidinho.
3293840;3295100;"00";Mas tem muita gente
3295100;3296520;"00";maravilhosa lá. Eu sempre digo que
3296520;3299260;"00";o menos legal lá dentro sou eu,
3299360;3300540;"00";então tem um monte de gente pra te ajudar.
3301140;3302780;"00";E o que precisar, manda mensagem pra mim,
3302960;3304840;"00";pras meninas, pro Felipe,
3304840;3306960;"00";pra quem precisar ali, a gente tá ali
3306960;3308480;"03, 00";pra te ajudar. É isso aí.
3308820;3310220;"03";Chama a gente que a gente chora junto.
3312820;3313180;"03, 00";Literalmente.
3313200;3314720;"03, 00";Vamos ver se a gente joga
3314720;3316860;"00";mais uma, tá? Então fica aí que a gente vai
3316860;3318720;"00";precisar de ti. E o próximo comentário é da
3318720;3320780;"00";Sereia Amiga. Pô, maravilhosa.
3321380;3322600;"00";Comentário de uma linha.
3322880;3324580;"00";Porra, isso é ser amiga mesmo.
3325500;3326820;"00";Olá, querido Guaxa e Guaxa
3326820;3328960;"00";é um convidado. Parabéns por mais uma cena de episódio e não esqueçam
3328960;3330980;"00";de beber água. Estou com a água
3330980;3332880;"00";aqui, querido. É isso aí, vou até dar um
3332880;3334780;"00";golinho também. Eu não ia pegar.
3335640;3336920;"00";Mas é como a Ju, antes
3336920;3338800;"00";de começar, a Ju mandou. Lembra de
3338800;3341280;"01, 00";pegar arma. Ah, pegar arma. O que é isso?
3342220;3342900;"00";Ela falou, pega
3342900;3344640;"00";arma. Não, ela falou
3344640;3346040;"00";lembra de pegar água.
3346820;3348600;"00";E daí, daí eu peguei água.
3348900;3350840;"03, 00";Depois ela ia pegar comigo. É isso, tem
3350840;3352180;"03, 00";que se hidratar. É.
3352500;3355180;"03";O próximo comentário é do Sr. Urso Urso.
3355700;3357080;"03";Hum, ele começa assim.
3358840;3361160;"03, 00";Como é que ele começa? Ai, caramba.
3361700;3363100;"03";Eu não sei me dar um urso.
3363460;3364960;"03";É G-R-R-R-R.
3364960;3365960;"03";Eu faz um...
3365960;3368600;"03, 00";Mas eu não sei.
3369000;3370380;"03, 00";Perfeito. Já pode
3370380;3372100;"00";aparecer no Mal Acompanhado.
3372100;3372640;"03, 00";Vamos lá.
3374860;3376160;"03";Como puderam matar o
3376160;3377060;"03";Roberto.
3377740;3379380;"03";Ele destacou o bear no meio.
3380100;3382100;"03";Ele só estava doente. Tudo bem
3382100;3384340;"03";que ele meio que avançou na direção de vocês.
3384840;3386160;"03";Mas a gente não tem mãos
3386160;3388020;"03";e a maioria não fala linguagem
3388020;3390240;"03";humana. Mataram o pobrezinho
3390240;3392060;"03";e se banharam em seu sangue.
3392560;3393900;"03";Pobre Robertinho.
3394440;3395920;"03, 00";Humano por trás do urso falando.
3395960;3398120;"03";Diga, Guaxa. Desculpa.
3398500;3399120;"00";Eu também acho
3399120;3401580;"00";absurdo. A Jumazinha é assim mesmo.
3401940;3403780;"03";Ah, tá. Ah, tá.
3403920;3405780;"03";O urso babando o negócio
3405780;3407440;"03, 00";vem pra cima da gente e não pode.
3408120;3409800;"03";Tá bom, né? Vamos lá.
3410600;3412180;"03";Humano por trás do urso falando.
3412680;3414080;"03";Brincadeiras à parte, amei
3414080;3416020;"03";o episódio. Fiquei surpreso como
3416020;3417960;"03";o Vitinho tá participando. É meio
3417960;3420180;"03";estranho ver ele fora dos programas tradicionais
3420180;3422200;"03";que participa. Mas como já conheço
3422200;3424080;"03";a figura, tava ansioso desde o primeiro
3424080;3425940;"03";minuto pra ver como iria rolar o urso.
3425960;3428040;"03";Bom episódio. E foi quase perfeito.
3428200;3429900;"03";Faltando somente o famoso
3429900;3431720;"03";gemidinho do nosso querido príncipe.
3432280;3434180;"03";Nota mil a todos os 50%
3434180;3436060;"03";de hoje e uma taça
3436060;3437840;"03";de vinho pra vocês. Confia,
3437940;3438560;"03";esse é do bom.
3440080;3442220;"00";Ok. Muito obrigado pelo seu comentário.
3442680;3443900;"00";E porra, é muito bacana
3443900;3445620;"00";a pessoa ser conhecida pelo gemidinho dele.
3445860;3447600;"03, 00";Queria deixar registrando. É bem especial.
3448240;3449960;"00";O próximo comentário é da Monique Coelho.
3450520;3452340;"00";Eu sou guaxinim, tenho o Fernando Pessoa,
3452760;3453920;"00";tenho o Fernando Lobo e tenho
3453920;3455260;"00";a Monique Coelho. Olha que legal.
3455960;3457440;"00";Felizmente a todos. Excelente episódio.
3457880;3460260;"00";Todos os 50% envolvidos foram excelentes.
3460500;3462180;"00";O Vidani me arrancou boas risadas.
3462620;3464120;"00";Paguei de maluca rindo sozinha
3464120;3466280;"00";na rua enquanto empurrava o carrinho do meu bebê.
3466660;3467980;"00";Olha que legal. Obrigado
3467980;3469980;"00";por alegrar o meu dia. Obrigado, Monique.
3470060;3471900;"03, 00";Obrigado por comentar. Que legal.
3472420;3474360;"00";Eu sou Marcelo Guaxinim, a Monique Coelho,
3474460;3475280;"00";o Fernando Pessoa.
3476060;3478600;"00";Tem dois ursos aqui. Tem o Fernando Lobo.
3479120;3480020;"00";Ju, pergunta
3480020;3481840;"00";de RH. Se você fosse um animal,
3481940;3484160;"03, 00";que animal seria? Obviamente eu seria uma vaca,
3484160;3485920;"03";né? Eu fui batizada pra ir
3485920;3488320;"03";de uma, então seria uma vaca.
3488340;3489880;"03, 00";É verdade. Sem dúvidas.
3490140;3492340;"00";Deixa eu ver se vai aparecer. Tá olhando a live?
3493140;3493500;"03";Awww.
3495520;3496400;"00";Eu comprei.
3496540;3498160;"00";A Malu escolheu. Aí daí
3498160;3499800;"00";eu disse, pô, eu vou levar mais uma
3499800;3502140;"00";porque eu vou encontrar a Ju no sábado e vou levar pra
3502140;3503960;"00";ela, né? Porque tem a vaquinha, né?
3503960;3505840;"00";A mamô. E daí eu esqueci de levar.
3505980;3506820;"00";Tô comendo. Tá aqui dentro.
3508920;3510120;"03, 00";Desculpa, Ju. Que bom. É isso.
3510600;3512200;"00";É porque você não sabe qual é a validade disso.
3512200;3513640;"00";Quando é que eu vou ver a Ju de novo? Não sei.
3513840;3514320;"03, 00";É verdade.
3515920;3518340;"03";Mas eu agradeço a lembrança
3518340;3518980;"03";mesmo assim.
3519860;3521860;"03, 00";Pô, eu vi isso aqui e eu disse, pô, isso aqui
3521860;3524120;"00";com todo respeito, é a cara da Ju
3524120;3525980;"03, 00";que tem que comprar isso aqui. Gente, Guaxa,
3526060;3528240;"03";eu recebo, a minha mãe, eu recebo
3528240;3529240;"03";coisa de vaca.
3529800;3532220;"03";É com carinho. Eles me deram o nome
3532220;3534040;"03";de uma vaca. Claro que eles gostam do
3534040;3535840;"03, 01, 00";bichinho. É verdade. Né?
3535940;3537040;"03";Então tá tudo bem.
3538380;3540160;"00";Ah, pra quem tá vendo, pra quem não
3540160;3542260;"00";tá na live, né? Tá só ouvindo editado.
3542720;3544100;"00";Eu mostrei uma caixinha do
3544100;3545800;"00";Mumu Kids, que é,
3545920;3547700;"00";tipo, uma caixinha de bombom do
3547700;3550040;"00";Mumu, que é uma marca muito conhecida por doce
3550040;3552180;"00";de leite. Eles devem fazer outras coisas. Mas eu gosto
3552180;3553940;"00";muito do doce de leite da Mumu. Não estou sendo
3553940;3555500;"00";patrocinado, infelizmente, pela Mumu.
3555920;3557320;"00";Mumu patrocina nós.
3558060;3560420;"00";É, pô, um episódio da Mumu patrocinado
3560420;3561680;"00";eu tenho que chamar a Lumozinho, inclusive.
3562340;3564100;"00";É da...
3564100;3566220;"00";Mumu Kids vem quatro...
3566220;3567520;"00";Vem doze chocolates.
3568520;3569900;"00";Quatro... Tem quatro sabores, né?
3569900;3572180;"00";Vem três de cada. Tem o chocolate com morango,
3572340;3573480;"00";o chocolate com chocolate,
3573480;3575400;"00";o chocolate com baunilha e o meu
3575400;3576700;"00";favorito, que é o com banana.
3577120;3578720;"03, 00";Eles têm formato de vaca ou não?
3579140;3581980;"00";O chocolate tem o formato de uma vaquinha, Ju.
3582340;3583300;"03";Isso é tudo.
3583900;3584980;"03, 00";Isso aparece aqui.
3585060;3585620;"03, 00";Incrível.
3587280;3589640;"03, 00";Uma vaquinha redondinha, bonitinha.
3590420;3590980;"03";Maravilhoso.
3591820;3592380;"03, 00";Maravilhoso.
3593040;3595180;"00";Próxima vez que tu vir, me lembra que
3595180;3596360;"03, 00";eu vou comprar de novo.
3596800;3597660;"03";Tá certo.
3598860;3600180;"03, 00";E não tem de doce de leite.
3601240;3602140;"00";Mumu, que é conhecida
3602140;3603400;"00";por doce de leite e não tem
3603400;3604900;"00";o sabor do doce de leite. É verdade.
3605020;3606620;"03, 00";Não tem a versão do doce de leite.
3606640;3607620;"03, 00";Enfim, é hipocrisia.
3608340;3611500;"03, 00";O próximo comentário, que caiu pra mim, olha só.
3611920;3612380;"03, 00";Que é grande.
3612720;3614520;"03, 00";Ah, não. Ver mais. Desculpa, eu não ligo não.
3614720;3616280;"03, 00";É, tem um ver mais.
3617700;3619680;"03";É do Ubar do Petis.
3620260;3621420;"03";Bom dia, boa tarde,
3621640;3622980;"03";boa noite, Guaxamanidade.
3623500;3625320;"03";Plot twist atrás de plot twist.
3625560;3627320;"03";Amo isso. Tão interessante
3627320;3629360;"03";como foram interagindo, entendendo,
3629680;3630640;"03";planejando as coisas.
3630920;3632280;"03";Amo essas interações.
3632280;3634480;"03";Jogadores incríveis e Guaxa
3634480;3636100;"03";sendo guaxástico, como sempre.
3636420;3638380;"03";Como de praxe, seguem meus versos.
3638780;3640180;"03";Talvez tenha ficado um pouco longo
3640180;3642440;"03";e por isso me desculpo. Mas vou botar a culpa
3642440;3644560;"03";na licença poética. Amor e guerra
3644560;3646800;"03";seguem juntos, unindo os dois mundos.
3647240;3647840;"03";Esse é o título.
3648240;3650300;"03";Agora vamos com o momento leitura
3650300;3652300;"03";de poesia. Deixa eu pegar água pra beber antes.
3653200;3653520;"03, 00";Vamos lá.
3653540;3655940;"03, 00";Jumazinha bebe Santa Rita. Santa Rita,
3656060;3656560;"00";patrocinando.
3657860;3660100;"03";Santa Rita, eu acho que é Águas Mornas,
3660100;3661160;"03, 00";Santa Catarina. Vamos lá.
3662280;3664060;"03, 00";A Mumu deve ser na Santa Catarina.
3664140;3666180;"03, 00";Eu acho que é Gaúcha. Tenho quase certeza.
3666680;3667860;"00";Como é que eu vou achar isso agora aqui?
3668560;3670120;"03";Uma vez eu fui pesquisar
3670120;3672800;"03";porque eles vendiam barra de chocolate da Mumu
3672800;3674520;"03";no mercado,
3674640;3676720;"03";no Big. Enfim, vendiam no mercado.
3677100;3678360;"03, 00";E depois essa barra sumiu.
3678800;3680580;"03, 01";E eu queria muito, isso faz anos, tá?
3680980;3682060;"03";É muito tempo.
3682320;3684100;"03";Eu preciso achar o Mumuzinho.
3684620;3686920;"03";E daí eu pesquisei Mumuzinho na internet
3686920;3688880;"03, 00";e eu descobri o cantor.
3688880;3691340;"03, 00";O cantor que não é filho do Mussum.
3692280;3693520;"03, 00";Não é filho do Mussum, que é famoso.
3694100;3695760;"00";Tem o Mumuzinho e o Mussunzinho.
3695900;3698340;"00";Eu sei que um dos dois não é filho do Mussum, de verdade.
3698500;3699360;"00";Que se não me engano, é bem, desculpa.
3700560;3702440;"00";Fica em Arroio do Meio, Rio Grande do Sul.
3702580;3702840;"03, 00";É verdade.
3703580;3706220;"03";Eu descobri porque eu achei, enfim, na minha pesquisa anterior
3706220;3707060;"03";sobre o Mumuzinho.
3708700;3709960;"03";Voltando à poesia.
3710740;3712300;"03";Deixando o Mumu e as vacas de lado.
3712640;3713820;"03";Prontos para a missão?
3714340;3715440;"03";Reunidos de prontidão.
3716300;3717580;"03";Interessantes ofertas vêm.
3717580;3719980;"03";Num EFO que não agrada ninguém.
3720460;3721980;"03";Convence a todos com armas bonitas.
3722980;3723740;"03";Excêntricas.
3723920;3724540;"03";Esquisitas.
3725140;3726360;"03";Saem para o resgate.
3726900;3728600;"03";Agora, seguem detalhes.
3729160;3730200;"03";Ouçam as pistas.
3730720;3731900;"03";Recuperem a orquisa.
3732400;3733440;"03";Quase chegam a tempo.
3733940;3735400;"03";Urgentes contratempos.
3735820;3737220;"03";Imprecisos empecilhos.
3737800;3738520;"03";Zona de guerra.
3738900;3739820;"03";Ataque das feras.
3740380;3741420;"03";E a princesa volta.
3741940;3743480;"03";Agora, com uma escolta.
3743820;3745480;"03";Ganham atenção com correria.
3745480;3747980;"03";Uns dedos se vão com uma mordida.
3748460;3750340;"03";Espalham a doença com alegria.
3750860;3752080;"03";Reparam seus danos com energia.
3752280;3755280;"03";Repercutem seus atos para todo o reino.
3755820;3757940;"03";Agora, um novo futuro vem surrateiro.
3759140;3759700;"00";Excelente.
3760160;3761680;"00";E pra quem é novo aqui,
3762040;3764660;"00";a primeira letra de cada frasezinha
3764660;3765620;"00";é o nome do episódio.
3766020;3767180;"00";O nome do episódio.
3767240;3767520;"00";Sim.
3767800;3768080;"03";O não.
3768220;3769000;"03";Bardopetis.
3769060;3770860;"03";Ele tinha que lançar a sessão.
3771420;3771960;"03";Incrível.
3772200;3772720;"03";Sensacional.
3773500;3775400;"00";O dia que o RPG sai impresso,
3775540;3778300;"00";vai ter o caderno do poema.
3778980;3779520;"03";Bardopetis.
3779640;3780620;"03";Sim, eu compraria.
3780620;3781620;"03";Uma revista.
3782280;3783080;"00";Em 2023.
3783540;3783940;"00";Difícil.
3784120;3784480;"00";Vamos lá.
3784840;3787540;"00";O próximo comentário é do Caio Lourencio.
3787700;3788120;"00";Ele coloca.
3788220;3788800;"00";Olá, Guaxa.
3789180;3790540;"00";Ju-vidade da vez.
3790960;3793140;"00";Que tem 34% de ser a própria Ju.
3793220;3793700;"00";É verdade.
3794460;3796480;"00";E toda a Guaxa-munidade incrível.
3797000;3798940;"00";Como esse deve ser um dos últimos comentários,
3799240;3800640;"00";tentarei ser breve.
3801200;3801860;"00";Adorei o episódio.
3802280;3803960;"00";Os personagens, as viradas na história.
3804420;3805360;"00";Porém, a sensação que tive
3805360;3807720;"00";é que esse era uma aventura
3807720;3809880;"00";que tudo estava fadado a dar errado.
3809880;3811880;"00";Mas o grupo, no mais belo,
3811880;3813420;"00";o caos contornou lindamente.
3813500;3813920;"00";É verdade.
3814280;3816180;"00";Aquela mordida que a personagem da Judeu
3816180;3817100;"00";foi 10 de 10.
3817160;3817600;"00";É verdade.
3818000;3819120;"00";Era um episódio que, como assim,
3819460;3820420;"00";era um episódio alegre
3820420;3822180;"00";que falava de guerra no plano de fundo,
3822780;3825420;"00";o mais provável era o pior final possível.
3825900;3828200;"00";Mas os jogadores, incríveis, como sempre, sim.
3828360;3829640;"00";Só posso elogiá-los.
3829800;3831880;"00";Guaxa, o quão longe o grupo levou a história
3831880;3833660;"00";do que você tinha planejado?
3834120;3835760;"00";Você contava que eles iriam levar
3835760;3836780;"00";a melhor Convuelve?
3836920;3837960;"00";Não, não contava.
3839100;3841660;"00";Sabemos que não tinha nada de errado com a bebida.
3841880;3842560;"00";Mas e as armas?
3842660;3843060;"00";Também não.
3843240;3845400;"00";Ele realmente quer vender as armas.
3845920;3848280;"00";Não em pequena escala para os jogadores,
3848900;3851340;"00";mas para os povos.
3851580;3853820;"00";Tanto que, quando eu descrevo o general,
3854040;3855940;"00";a espada dele é uma espada élfica.
3856700;3859020;"00";Eu deixo claro que, desde o início,
3859100;3860640;"00";antes de eles verem o primeiro elfo
3860640;3862300;"00";tentando conversar com eles,
3862820;3865380;"00";já está claro que a influência das armas élficas
3865380;3866880;"00";está ali, de alguma forma.
3866880;3870100;"00";E daí tinha as armas no general daquele povo,
3870380;3871640;"00";tinha as armas no pessoal,
3871640;3874600;"00";que sequestrou a princesa.
3874980;3876900;"00";Se eles tivessem passado o teste na carroça lá,
3877360;3879680;"00";também descobriram que tinha arma élfica lá,
3879760;3881000;"00";uma faca, alguma coisa,
3881500;3884220;"00";para mostrar que os elfos estavam envolvidos em tudo,
3884680;3885580;"00";não só de um lado.
3886160;3887340;"00";Sabemos que não tinha nada...
3887340;3888000;"00";Ah tá, isso já foi.
3888380;3889020;"00";É isso, pessoal.
3889160;3889960;"00";Vida longa ao RPG Guaxa.
3890020;3890500;"00";Obrigado, Pedro.
3890540;3891080;"00";Vida longa para você.
3891440;3892120;"00";Isso é legal, olha só.
3892720;3894480;"00";Jogadores da geladeira aí,
3894720;3896120;"00";Tele, mas pessoal...
3896120;3898520;"00";Porra, lembrei do Caio Lourenço.
3898660;3898980;"00";Porra, legal.
3899200;3900060;"00";Pense em chamar ele de novo.
3900480;3901620;"00";Lembrei do Balardinho.
3901620;3901940;"00";Balardinho.
3902360;3902960;"00";Porra, legal.
3903700;3904900;"00";Pretendo chamá-lo de novo.
3905300;3906420;"00";Eu tenho uma peça na memória, gente.
3906460;3908140;"00";Se você não ficar dando oi de vez em quando,
3908200;3909000;"00";eu esqueço de você.
3909220;3910060;"03";E eu acho, inclusive,
3910160;3912420;"03";que podia ter uma aventura com Caio Lourenço e Balardinho
3912420;3913180;"03";numa mesma aventura,
3913260;3915660;"03";porque os dois são pessoas excelentes.
3916160;3917640;"00";Tá, e quem é a menina?
3917880;3918680;"00";E daí tem que ter uma menina.
3919780;3921740;"03";Ah, e agora rola um D10.
3922080;3922640;"03";Deixa eu ver.
3923240;3924720;"03";O Caio já jogou com a Agatha,
3924820;3926440;"03";o Balardinho já jogou com a Agatha.
3926940;3927260;"03, 00";Já.
3927380;3928280;"03, 00";Com a Fabi também.
3929060;3929920;"03, 00";Com a Fabi, ele já jogou.
3929920;3930720;"03, 00";Com a Rafa.
3931320;3931600;"03";Não lembro.
3931620;3932200;"03";Não lembro.
3934300;3935940;"03";Ah, a Zuzu.
3936420;3937460;"03";Pra dar um tempero.
3937640;3938060;"03, 00";Olha aí, ó.
3938060;3939200;"03, 00";O Trota gritou eu.
3939940;3940560;"00";Não, o Trota.
3942880;3944000;"03, 00";A regra é clara.
3944740;3944960;"00";Ok.
3945440;3947140;"00";Caio e Balardinho e Zuzu.
