start	end	text
0	5540	Um disco flutuando no espaço, em seu centro, um continente redondo dividido por montanhas
5540	11580	gigantescas, cercado por um oceano que escorre por suas bordas, um mundo plano, um planeta
11580	12340	chato.
12640	16840	Mas não para um grupo de aventureiros que vão ousar navegar em direção ao horizonte.
17120	23600	Episódio de hoje, Úrsula, com Felipe Queiroz no papel do pirata Pierre Lebon, Roberto Pena
23600	31140	no papel do cientista Thomas Bacon, e Deb Cabral no papel do navegador Matias Fernandes.
31140	38980	Sempre levo junto a mim o saquê de um tal de Pim, navegando sem temer as ondas desse
38980	39500	mar.
40000	48040	Se a tristeza nos pegar e o saquê se acabar, olhe pro céu e veja aquela lua de cristal.
51440	53580	Aí vocês estão na caverna.
54100	54680	Rola os dados.
55740	57340	Bola de fogo!
58020	58740	Chamo...
58740	61120	Chamo o clérigo.
62240	63500	Como assim eu morri?
64680	65900	Rola a iniciativa.
66560	68960	Então, não tem armadilha.
69240	69840	Podemos ir.
70580	71760	O que vocês fazem?
73080	73840	Tá, tá.
74060	77160	Eu amarro uma corda nelas e uso como arma.
77160	78440	Eu ataco.
78820	82660	O mago lança seu Thunderbolt mais 15 no Beholder.
82840	83580	E eu quero rolar.
83600	85100	Eu sou uma perseguição, posso?
85800	87480	Tem algum lugar pra se esconder?
88100	90380	Ah, falha a crítica.
90920	91740	Ataque de impunidade!
92060	92980	Ei, Romano!
93120	94320	Chamo o clérigo!
97060	100700	RPG Realidades Paralelas do Guaxinim.
101060	103640	Sua aventura de bolso na forma de podcast.
104060	106580	Uma jornada completa a cada episódio.
113600	118700	Se inscreva no canal e ative o sininho pra receber notificações de novos vídeos.
118700	124760	As antigas lendas falam que o continente de Quétier era um grande deserto cercado por um abismo,
125180	128720	pois as nuvens eram controladas por quatro deuses irmãos.
128960	134500	E que desses quatro, três eram egoístas, pois guardavam toda a água para si.
134500	139500	Um dia, porém, três mortais invadiram o reino dos céus, derrotaram os deuses malignos
140040	143500	e liberaram as represas que seguravam todas as águas.
144260	147720	Essa água caiu criando os rios e formando os mares.
148080	152980	Essa água trouxe vida, comida e a possibilidade de viajar mais facilmente entre os reinos.
153360	158460	Afinal, era mais fácil navegar em seu entorno que superar montanhas colossais.
158660	164100	Hoje, mais de mil anos depois dos tais deuses terem sido derrotados,
164540	169460	seu culto desapareceu, mas a lenda da terra em forma de disco ainda permanece.
170380	172440	Estamos na grande era das navegações.
172740	173460	Embora ninguém tenha conhecido,
173600	176140	ou tenha tido coragem de navegar para longe da margem,
176580	178120	ao menos ninguém que tenha voltado,
178580	181900	o reino de vocês vive um grande momento de paz.
182180	186440	A terra, para todo mundo, menos para o Pena e para algumas pessoas que acreditaram nele,
186540	191380	a terra é plana, o reino de vocês está riquíssimo,
191580	193420	porque ele está no auge das navegações.
193680	196500	Todas essas navegações são feitas circundando o continente,
196960	200340	sempre se navega com o continente de um dos lados do navio,
200340	203240	para saber que você está próximo, que você não vai cair.
203240	205620	No abismo que existe além do mar, né?
206100	209540	Se traz muitas especiarias, criaturas raras.
209840	213820	É o melhor período para as navegações, e este reino é o que mais está lucrando.
214100	217100	Os melhores barcos, os maiores navegadores vêm desse reino.
217200	217540	Beleza.
217620	221240	Thomas Bacon é um professor cientista.
222020	227340	Ele ficou muito desacreditado quando tentou levantar a teoria de que a terra era redonda.
227720	231500	Escreveu um livro com contas e várias justificativas,
231500	232960	mas quando foi perguntado,
232960	236720	o porquê todo navio que partia em direção ao horizonte não voltava,
236980	238640	ele deu algumas respostas vagas,
238860	243040	e só não caiu em ostracismo, foi preso, ou talvez alguma coisa pior,
243280	245680	porque ele ajudou na educação do príncipe.
245780	247480	A ideia das sereias não colou, né?
247820	248560	Realmente não.
248860	250100	A ideia das sereias não colou.
251220	253800	Pena, qual é a aparência do teu personagem?
254180	256660	Cara, meu personagem tem uma estatura mediana.
256660	261880	Ele é franzino, não é um cara, assim, atlético.
262260	262860	Ele passou a...
262860	264380	A maior parte da vida dele nos livros.
264840	269540	Ele usa uma roupa, um hobby cinzento, escuro,
270040	273280	que é aquela roupa tradicional, assim, de monge, sabe?
273340	276640	Imagina ele como se fosse um monge medieval, escolástico,
276880	280000	com livros embaixo do braço, aquela togazinha,
280540	283960	e uma barba, uma barba já crescida,
283960	288400	uma idade por volta de uns 40 anos, eu imagino, uns 45.
288760	289480	Eu acho que é isso.
289900	292840	Você estava tomando uma sopa, já é próximo da hora,
292860	295260	da hora do almoço, quando batidas fortes na porta
295260	296540	chamam a tua atenção.
296800	297620	Hum, eu atendo.
297880	302100	Tem um oficial, um soldado, acompanhado de outros dois soldados.
302280	303680	Este soldado fala...
303680	304460	Senhor Thomas?
304720	304960	Sim?
305120	307940	O rei solicita a vossa presença imediatamente.
308060	309860	Ok, estou me aprontando.
310540	312040	Pego lá...
312040	315800	O rei me chama com frequência ou isso é uma coisa fora do normal?
316060	316940	O rei nunca te chama.
317200	317520	Nunca?
318000	319280	O rei não gosta de ti, inclusive.
319460	320020	Ah, entendi.
320020	322020	Então, eu prontamente vou...
322860	323820	Vou pra lá.
324160	328120	Tu vê que os soldados estão ali, um deles está só com um pergaminho na mão pra te chamar,
328220	330240	mas outros dois estão com lanças, estavam bem armados,
330400	333100	prontos pra convencê-lo a ir caso você não quisesse.
333140	335660	Ok, engulo seco assim e vou.
335840	339580	O personagem da Debbie, Matias Fernandes, estava no porto,
339680	344540	observando alguns marinhos descarregarem um navio, trazendo chá,
344640	346980	quando os soldados chegam até você.
347260	348320	Ai, pois não?
348320	351320	Senhor Matias, o rei solicita a sua presença no castelo imediatamente.
352240	352380	Oi.
352380	354740	Ele necessita de um especialista em sua área.
354880	356160	Pois não? Vou agora.
356460	357500	Qual é a aparência do teu personagem?
357780	367200	Ele é baixo, uns 60 e pouquinhos, e gordo, assim, forte e meio desajeitado.
367340	369640	Tu não precisa fazer a voz dele quando não tá falando por ele.
377640	380680	Eu imagino também um cabelo castanho, bagunçado.
380840	381640	Por ali estava também...
382380	383520	R. Lebon, é isso, né?
383720	384140	Isso aí.
384220	388620	Tu tava por ali tentando procurar informações sobre o seu barco desaparecido?
388760	392280	E disfarçado porque eu sou perseguido, né, pela polícia.
392440	392800	Perfeito.
393040	397860	Quando tu vê essa cena, assim, soldados procurando por todos os lados pelo Matias, né?
397980	401180	Tu conhece já, é um amigo seu.
401380	401780	Uhum.
401940	403760	Tu vê os soldados abordarem o Matias.
403760	408740	Ao contrário do pênalti que foi escoltado, né, os soldados avisaram o Matias e saíram.
408840	410240	Tipo, o Matias vai por conta própria.
410380	412260	Tu vê que o Matias tá lá se preparando pra...
412260	412940	Pra alguma coisa.
413060	414240	Os soldados falaram alguma coisa pra ele.
414300	415960	Tá, eu me aproximo dele.
416060	418780	Antes de tudo, qual é a aparência do teu personagem nesse momento, então?
418900	426420	Eu tô com um manto bem opaco, assim, marrom, alguma coisa jogada sobre o corpo.
426520	429440	Com um tapa-olho, né, tapando o meu olho que não é tão bom.
430020	433440	E o cabelo preso num rabo de cavalo pra dentro do manto também.
433440	436300	E o manto cobrindo a cabeça, como uma touca.
436640	441360	Tentando parecer o mais discreto possível, pra as pessoas não perceberem as feições do meu rosto.
442260	450520	E andando meio empenado, assim, sem porte, sem garbo, pra não reconhecerem a minha sensacional presença.
452660	456320	Pra Debbie, né, pro Matias, ser chamado pelo rei não é comum.
456560	458260	Embora já tenha acontecido outras vezes.
458460	463360	Era muito mais comum o teu pai, que há muito tempo tá desaparecido, né?
463800	466460	O teu pai era um conselheiro direto do rei.
466560	469800	Então, sempre que o rei queria alguma coisa sobre navegação, teu pai era consultado.
469940	470360	E quando teu pai se foi, como os teus irmãos mais velhos...
470360	472240	E quando teu pai se foi, como os teus irmãos mais velhos...
472260	474580	Não ligam pra essa parte de navegação.
474840	477140	Tu ficou sendo um especialista quando ele precisa.
477400	481920	Mas, como teu pai já ensinou muita coisa pro rei, tu dificilmente era chamada, né?
482120	486700	Tá, eu vejo que depois que a guarda se afasta dela, eu me aproximo.
487080	489660	Aí eu vejo que tem gente em volta, então eu tento ser discreto.
489760	493540	Falo assim, e aí, amigo, o que a guarda queria com você?
493840	495020	Ai, Pi, sei lá.
495220	500260	Eles me chamaram ali, falaram alguma coisa a respeito das minhas habilidades e...
500780	502240	Bom, não sei.
502260	504380	Meu pai fazia umas coisas aí pro rei.
504720	507840	Vai que eles tão querendo me chamar pra gente ir pro mar.
508300	509900	É, ir pro mar é uma boa.
510040	512760	Se você precisar de uma tripulação, não se esqueça de mim.
512840	513700	Pode deixar, Pi.
513780	516160	Eu realmente preciso de voltar pro mar.
516640	518480	Esse tempo em solo está acabando comigo.
518760	519680	Acabando com a minha pele.
520080	521600	Acabando com o meu cabelo.
523520	524900	Ah, para, né?
527400	528300	Sua moça.
529920	531260	Vamos comigo, então.
531260	533840	Eu falo que você vai estar de assistente, alguma coisa assim.
534060	535180	Perfeito, perfeito, perfeito.
535340	536980	Eu serei seu calculador.
537280	537720	Ótimo.
538060	540600	Tá, então partem vocês dois em direção ao castelo, né?
540700	540980	Uhum.
541320	547600	Tá, quando vocês chegam no castelo, vocês são levados até uma sala de espera, com alguns sofás e tal.
547820	552740	E lá está sentado o Thomas Bacon, em pé atrás do sofá onde ele está sentado.
552820	556260	Tem dois guardas com lanças apostos, né?
556440	557560	E ele está ali aguardando também.
557560	559860	Uma característica do meu personagem.
560180	561220	Ele sempre porta.
561260	567140	Ele sempre porta um caderninho e uma pena pra fazer as anotações dele.
567560	570040	Então o Thomas está ali escrevendo, inclusive.
570140	570660	Exatamente.
571400	571980	Muito bom.
572440	576380	Senhor Bacon, senhor Bacon, muito prazer, muito prazer.
576540	579620	Meu nome é Matias, Matias Fernandes.
579980	582320	Eu li muito do tudo que o senhor escreveu.
582920	583520	Matias?
584080	586660	Poxa, obrigado, mas você faz o que exatamente?
587040	588720	Eu sou um grande navegador.
589060	590560	Meu pai me ensinou tudo o que eu sei.
590560	591240	Muito bom.
591380	594660	Matias, então, você sabe por que a gente está aqui?
594800	596880	Você também foi chamado para os serviços do rei?
597100	598760	É, fui chamado, e só isso que eu sei.
599020	600420	Ok, então a gente está na mesma situação.
600800	603040	Mas, prazer. E você, senhor?
603400	606520	Tá, eu olho bem de rabo de olho pra ele, que eu sei que ele é uma fraude.
606840	610200	Afinal, todos sabem que a Terra é plana, pelo amor de Deus.
610520	612560	Só um louco poderia dizer o contrário.
613020	614580	E falar assim, ah, eu sou pi.
615880	616280	Legal.
616280	620120	Eu já sei, eu conheço a referência do número pi, eu acho.
620300	621000	Isso não existe.
621260	623000	Sim, tu tem conhecimento do pi.
623440	623600	Tá.
624220	624860	Tá, eu dou um so...
624860	627580	Na verdade, eu só penso assim, eu não vou falar nada, porque...
627580	628840	Eu só dou uma pensada assim.
629460	630700	Ah, prazer.
631180	631860	E você faz o que?
632140	633360	Eu faço contas.
633500	635540	Eu sou um ótimo calculador.
635840	637880	Ah, agora entendo por causa do porquê do nome.
638020	638820	Tá bom, senhor pi.
639520	639920	É...
639920	641260	Prazer em conhecê-los.
641740	644900	Nisso, entra um jovem, muito bem vestido.
645020	645600	Ele grita.
645600	647760	Vossa excelência, o rei.
648080	649140	Eu me abaixo, assim.
649700	650600	Tá, eu fiquei...
651260	652320	Reverência, por favor.
652440	653940	É, faz toda a etiqueta.
654020	654900	Fizeram a reverência.
655040	655580	Matias também?
655820	656340	Sim, claro.
656660	658720	Aí ele abre a porta, o rei entra.
658940	660540	Vocês veem que o rei tá...
660540	663900	Olheira, a roupa dele tá meio suja, a capa tá torta.
664040	666520	Ele aponta o dedo pro Thomas e fala...
666520	668580	Você matou o meu filho?
669780	670720	Tá, eu já...
670720	670860	O quê?
671080	675660	Me afasto assim, assustado e preparado pra atacar o Thomas, caso precise.
676300	678380	Não, senhor rei, isso é algum engano.
678640	679020	Eu...
679020	679500	Como assim?
679740	680940	Teodoro, eu...
680940	682940	O garoto, ele morreu.
683160	686480	Eu sabia que era louco, mas que é um assassino, eu não fazia ideia.
686840	687780	Não, é algum erro.
688120	689060	Certamente é algum erro.
689180	689680	Eu estou...
689680	690800	Estão nos meus aposentos.
690900	692940	Faz um mês que eu estou nos meus aposentos fazendo contas.
693260	693780	Não é possível.
693780	701600	Aquele garoto enfiou na cabeça que você estava certo, roubou o navio e se lançou ao mar.
701820	704780	Poxa, que imprudente, mas...
705320	708100	Mas isso de repente não quer dizer que ele tá morto, não é mesmo?
708300	710920	Ele navegou em direção ao horizonte.
710940	714660	Eu abaixo a cabeça assim, boto a mão no peito assim.
714860	717340	É, ele realmente não está mais entre nós.
717460	722820	Falou que tinha descoberto o real motivo dos barcos não voltarem.
723280	724260	Eu não levei a sério.
724920	732760	E na calada da noite, ele e os malucos com quem ele andava roubaram um navio sem bandeira.
732860	735120	Mas, senhor rei, a terra...
735120	736080	Terra ou é mundo?
736280	737420	Posso falar terra, Guaxa?
737520	737800	Pode.
737960	739620	A terra é redonda.
739620	740680	Eu provei isso.
740680	741240	Isso tá claro.
742020	744400	Certamente não é por isso que os barcos não voltam.
744760	746400	Os barcos não despencam de nenhum lugar.
746620	748680	Se fosse assim, a água já teria toda indo embora.
748920	754860	Então, devo cruzar meus braços e esperar que meu filho faça o que ninguém nunca fez.
755560	759240	Sentar em meu trono e aguardar ele aparecer no oriente.
759440	765580	Não, eu acho que há algo sim que faz os barcos não voltarem, mas isso não quer dizer necessariamente que é a morte.
766600	768820	A gente pode fazer alguma coisa a respeito?
768820	769540	Não sei.
769640	770620	De repente a gente faz uma expedição.
770680	772560	Não me fale de sereias.
773320	777660	Ok, sereias foi um tiro longo, mas deve haver alguma coisa.
777900	779780	Outras terras ou... eu não sei.
779980	795000	É, senhor, por acaso esse barco sem bandeira, ele tinha uma frente bonita, frondosa, com uma imagem assim de uma criatura marinha meio mulher, meio dragão do mar, algo do tipo.
795100	797100	O que você sabe sobre esse barco?
797100	797900	Não, não, não.
798080	799220	Eu vi no...
799220	800180	Eu realmente vi.
800680	805420	É, ancorado há poucos dias e achei ele muito bonito, chamou atenção e reparei que ele tinha desaparecido.
805720	808400	Matias, quem é esse que ousa falar comigo?
808940	810440	Esse é um colega.
810700	813040	É um colega que trabalha comigo de vez em quando.
813160	816580	Eu resolvi trazê-lo porque eu não sabia exatamente o que o senhor queria, não é mesmo?
817100	818380	E achei que ele podia ajudar.
818760	823740	Tá, eu percebo que eu estou sendo inconveniente, me afasto um pouquinho e fico atrás do Matias.
823880	825880	Aí quando ninguém tá olhando eu falo no ouvido dele assim.
825880	828540	Você acredita que o pirralho roubou o meu barco?
828740	828880	Que safado!
829720	830380	Puta que pariu!
830680	831020	Puta que pariu!
840520	844860	O rei deixa o corpo cair numa das poltronas.
844960	852100	Eu criei esse menino pra ser um rei, pra ser o meu substituto, mas ele nunca obedeceu.
852840	857120	Falei pra ele aprender sob espadas e ele estudou arco e flechas.
857720	860660	Falei pra ele aprender a navegar e ele me voltou.
860680	863900	Ele me voltou com essa idiotice de terra redonda.
864420	867220	Ele puxou minha esposa, que Deus a tenha.
867780	868800	Ela não entenderia.
869320	870840	Ela me daria mais filhos.
871780	872760	Por quê?
873620	874600	Por quê?
875020	878000	Por quê ela foi morrer tão jovem?
878460	880080	Que será de minha linhagem?
880240	881140	Vossa majestade.
881600	886500	Vossa majestade, eu mesmo eduquei o seu filho com maior honra, maior prazer.
886880	889660	O menino, o garoto é muito bom.
889660	890520	Ele...
890520	893520	Eu ensinei álgebra, astronomia pra ele.
893700	894940	Ele certamente tem...
894940	896420	Ele não se perdeu nesse mar.
897220	898340	Eu confio.
898640	899880	Ele está nessa missão.
900100	901880	Alguma coisa chamou a atenção dele.
902060	904460	E eu tenho muita convicção que ele não se perdeu.
904560	908040	Se você permite, a gente pode fazer uma expedição pra ir atrás dele.
908340	909380	Mas eu confio.
909580	910220	Ele está vivo.
910460	914020	Então você está dizendo que meu filho não ficou louco?
914360	915660	Claro que não, majestade.
915660	918660	Um dia, todos terão a visão de que a terra realmente é...
920520	921280	É redonda.
921560	922240	E essa...
922240	923420	Toda essa ilusão vai cair.
923960	925900	E se você me permite, talvez seja o momento.
926620	926980	É...
926980	928080	Eu acho que...
928080	929280	Eu acho que...
929280	929940	Pode ser...
929940	933380	Pode ser esse grande momento pra gente fazer essa mudança de paradigma.
933660	934860	Tragam o prisioneiro!
935200	939180	Eles trazem um marinheiro, assim, já bem idoso.
939360	940420	Ele não tem um braço.
940660	941080	É...
941080	942240	Anda mancando, assim.
942360	943800	Tá bem, bem machucado.
944020	945160	Conta pra eles.
945440	946340	O marinheiro fala.
946520	948220	Eu fui até lá e voltei.
948620	949140	Como assim?
949140	950460	Existe uma serpente.
950460	951080	Uma serpente gigante.
951580	952060	O rei fala.
952180	953720	Jogue em sua cela novamente.
954020	955540	Não, como assim?
955780	956440	Que serpente?
956680	957200	Pois é.
957760	964080	Ao vez de aceitar a verdade simples de que o mundo acaba, ele me inventa uma serpente marinha.
964340	966260	E se sobrevivermos à serpente?
966540	967240	O que vem depois?
967920	968480	Sereias?
968740	969900	Não, sereias era...
969900	971460	Foi realmente um chute longo.
971740	972560	Não tinha nada a ver.
972560	972680	Não tinha nada a ver.
979740	980220	É...
980220	983780	Mas como esse marujo sobreviveu à serpente, então?
983920	985340	O marujo, então, volta, né?
985880	988020	Se os guardas estavam levando ele para, ele fala.
988140	991920	A serpente comeu meus amigos, meu barco, meu braço.
992660	994060	Mas eu consegui nadar de volta.
994320	997560	Nossa, realmente é um marujo exemplar.
997940	999000	Esse aí é muito bom.
999140	1003140	O tempo todo que o Pena tava falando, que o Thomas tava falando com o rei,
1003140	1005840	eu tava atrás do Matias, né?
1006100	1008140	Fazendo aquela cara daquele menininho do meme, assim...
1008140	1012240	Que pra mim ele só tá falando bobagem o tempo todo.
1012820	1014260	E aí quando ele...
1014260	1018640	Aí eu dei uma cotovelada nele.
1019040	1019780	Fica quieto, cacete.
1019780	1021640	E aí quando o cara sai, eu falo assim...
1022200	1023800	Gente, esse homem fede a bebida.
1024280	1026620	Tá na cara que isso é alguma alucinação de álcool dele.
1026940	1028860	Onde já se viu serpentes marinhas?
1029240	1032800	Onde já se viu um homem nadar com um braço só durante todo o mar?
1032920	1033920	Isso não faz o menor sentido.
1034260	1036100	Fica quieto, você tá querendo...
1036100	1037260	Bom, mas de fato ele tá...
1037260	1037420	Ele tá...
1037420	1038780	Sem braço, né?
1038880	1040860	Assim, vamos pensar que o cara realmente só...
1040860	1042080	Ele só tem um braço mesmo, Guaxa?
1042180	1042880	Só tem um braço.
1042980	1043740	Não, e fica quieto.
1043800	1046160	Você tá querendo dizer que o filho do rei é louco?
1046420	1046780	Não!
1047260	1049640	Não, o louco é esse maluco aqui que tá do nosso lado.
1050060	1051140	Mas ele acreditou.
1051240	1053380	O filho acreditou no cara e foi embora.
1053480	1054340	Fica quieto.
1054580	1055220	Meu Deus.
1055460	1056800	E ele ainda levou o meu barco.
1057160	1063200	Vossa Majestade, a gente só tem uma única história, uma anedota, eu diria,
1063360	1064920	sobre essa tal dessa serpente.
1064920	1066920	E esse marujo talvez não seja nem muito confiável.
1068260	1068580	É...
1068580	1071360	Eu realmente acredito que há muita esperança, sim,
1071400	1074640	que o seu filho, o grande príncipe Teodoro, esteja vivo.
1074960	1076640	Ele era um garoto muito inteligente.
1076980	1079920	E certamente, se ele estava atrás de alguma coisa, ele tem informações privilegiadas.
1080800	1083140	Eu não consigo acreditar que ele se perdeu.
1083220	1086280	E, Majestade, o senhor, quando chamou todo mundo aqui,
1086460	1088340	tinha que ter algo em mente, não é mesmo?
1088780	1091920	Bom, eu sou um navegador, temos aqui um grande cientista,
1092600	1094680	então, o que o senhor tá pensando?
1094920	1095260	Sim.
1095420	1097400	Além de querer ouvir seus conselhos,
1097420	1102740	Capitão Matias, eu gostaria de perguntar seu preço pra essa viagem suicida.
1102980	1104600	Me sinto péssimo em pedir isso.
1105040	1111060	Há meu melhor navegador, mas a estabilidade do reino depende da existência de meu sucessor.
1111820	1112380	Hum...
1112380	1116500	Bom, aí eu dou uma olhada de rabicho, assim, de olho pro...
1116500	1116580	O barco!
1118220	1119300	O barco!
1119560	1120120	O barco!
1120400	1120960	O barco!
1121960	1123420	Eu gostaria...
1123420	1126420	Eu gostaria de ficar com o barco que seu filho...
1126420	1127000	O barco!
1127000	1127020	O barco!
1127020	1127060	O barco!
1127060	1127120	O barco!
1127120	1127140	O barco!
1127140	1127180	O barco!
1127180	1127200	O barco!
1128060	1132620	Levou, se possível, e mais umas mil moedas de ouro.
1132800	1133760	Parece-me justo.
1134320	1134840	Uf!
1135340	1135860	Obrigado.
1136060	1136860	Ótimo, ótimo!
1136920	1141080	Então eu vou poder instruir perfeitamente aqui com mapas a tripulação
1141080	1144180	pra que eles façam essa viagem e encontrem o seu filho.
1144280	1145480	Ô, você tá louco?
1145640	1146540	Você vai com a gente!
1146920	1147160	Oi?
1147500	1151360	Não, eu tenho vertigem, eu enjoo, esse negócio de mar não cai bem.
1151580	1155520	Senhor Thomas, ou o senhor vai buscar meu filho imediatamente,
1155520	1157180	ou ele pendura pelos pés.
1157180	1160780	Na torre mais alta do castelo, e só lhe desço de lá,
1160980	1163420	quando os corvos tiverem comido seus olhos.
1163660	1165400	Não, eu acho que a água vai me fazer bem.
1165500	1168060	Pensando assim, de novo, muito bom.
1168500	1170220	A maresia é agradável.
1170540	1171400	Eu tô dentro.
1174380	1177960	Senhor Matias, quantos soldados você precisará em sua missão?
1178360	1180920	Imagino que prefira um barco menor e mais rápido.
1181240	1181980	Sim, claro.
1182820	1183260	É...
1183260	1184500	Uns quinze?
1184840	1185360	Cinquenta?
1185660	1186860	Cinquenta, cinquenta.
1186860	1186900	Cinquenta.
1186900	1187100	Cinquenta.
1187100	1187160	Cinquenta.
1187180	1187220	Cinquenta.
1192100	1193240	É pra isso que...
1193240	1197200	Não, eu acho que se for um barco pequeno, quinze é razoável, assim.
1197340	1198840	É, eu acho que quinze é razoável.
1199000	1199540	Ah, ok.
1200220	1204480	É porque realmente fomos enfrentar uma serpente gigante,
1204600	1206660	quinze soldados vão resolver o nosso problema.
1207460	1210940	Eles enchem a barriga dela antes de comer a gente.
1212660	1215720	Bom, além disso, a família de construtores, Tom,
1215880	1217100	se sentiu muito ofendida por ter feito isso.
1217100	1219880	Se sentiu muito ofendida com a teoria de que seus barcos não voltavam
1219880	1222460	porque não eram resistentes o suficiente.
1223020	1226340	E pediram pra que Frank, o filho mais velho da família,
1226700	1230600	os acompanhe pra dar manutenção no barco, caso necessário.
1230920	1231380	Tudo bem.
1231500	1235560	Ou seja, temos um construtor, quinze soldados, mais alguém?
1236380	1238100	Mantimento, né? Comida e...
1238700	1241200	Instrumentos de medida, Vossa Majestade.
1241460	1245200	Eu mesmo projetei alguns instrumentos que podem ser muito úteis,
1245200	1246180	se você me permite.
1247100	1251820	Por exemplo, isto aqui, que é um tubo, que é feito com lentes,
1251900	1255860	se você puder financiar pra gente um pouco maior,
1256280	1258280	eu chamei de Luneta. Olha que nome legal.
1258520	1259880	Vocês partem amanhã.
1260060	1263280	Leva seu protótipo aí e tá tudo bem.
1263560	1267060	O que você conseguir fazer até lá, você pode levar.
1267260	1267800	Ah, muito bom.
1267920	1270880	Eu falo com o Matias, pro Matias falar com o Rei,
1270960	1272840	pra eu poder não falar diretamente pro Rei.
1273200	1277060	Pergunto se esse barco, apesar de pequeno, ele não pode conseguir um barco,
1277160	1279280	com bastante peças de artilharia,
