start	end	text
4444760	4447040	Ele não parece ser natural. Ele foi plantado,
4447100	4449220	realmente plantado ali. E vocês estão andando
4449220	4451300	e tem café. Vocês estão andando num cafezal.
4451440	4452480	Vocês podem esperar um pouco pra catar o café.
4452480	4454840	Ah não, então dá pra... Ah não, então perfeito.
4454960	4456760	Então eu vou me encher também de café.
4456940	4458920	Se fosse só um murinho de café,
4458980	4460860	eles botavam fogo e invadiam de qualquer jeito.
4461560	4463140	Professor Bacon,
4463260	4463960	né? Thomas.
4465240	4466360	Café ser
4466360	4469200	perigoso pra eles? Tem alguma
4469200	4470880	justificativa?
4471180	4472660	Você consegue pensar em alguma coisa?
4473380	4475660	É, alguns compostos voláteis.
4475800	4476960	O café é rico.
4477540	4478360	É maravilhoso.
4478360	4481340	Eu tenho algum conhecimento sobre isso,
4481400	4483260	eu acho. Sabe que o café é venenoso
4483260	4484480	pra alguns tipos de inseto, né?
4484960	4487220	O ser humano não é
4487220	4488700	venenoso o suficiente, né? Sim.
4488860	4490020	Então eu falo isso.
4490920	4493180	Há insetos que têm irritação
4493180	4495220	às substâncias voláteis
4495220	4497360	do café, porque eles têm respiração
4497360	4498620	cutânea. Entendi.
4499200	4501240	Não entendi, na verdade, mas tudo bem.
4501340	4503700	Então vamos indo, vamos guardar muito café
4503700	4505560	aí pra se a gente precisar mais pra frente.
4505900	4507520	E caso precisemos ficar acordados,
4507580	4507820	também.
4509260	4509700	Também.
4511960	4513600	Tem alguma trilha, marca
4513600	4515180	de pegada? Tem, tem.
4515320	4516880	Vocês vão ficar na trilha?
4517140	4519860	E aí, gente, vamos chegar chegando ou a gente vai...
4519860	4521400	Acho que a gente pode chegar chegando.
4521820	4523540	Eu não sei, eu tô achando
4523540	4524540	que esse cara vai ser massa.
4525720	4527300	Úrsula, estamos
4527300	4528640	só entre nós agora.
4529200	4531140	Acho que é interessante que você
4531140	4532840	não se disfarce mais. É?
4533140	4535320	É, sim, sim. Pra que termos segredos
4535320	4535940	entre nós?
4538620	4539140	Cara,
4539240	4541260	eu vou me afastando.
4543020	4543540	Credo.
4543760	4547220	Eu mando ele calar a boca.
4547720	4548360	E aí, continua.
4550600	4551580	Fica na sua,
4551780	4551940	pi!
4555420	4557100	Porque ninguém me leva a sério.
4557100	4558600	Tá, eu vou adorar atrás.
4559200	4560860	Vocês notam,
4561320	4563800	seria o fim do cafezal, alguns daqueles
4563800	4566000	quadrúpedes escolhendo café. Eles não notaram
4566000	4567860	vocês. Ah, os quadrúpedes não
4567860	4569920	se incomodam com café? Olha aí.
4570080	4571780	É só os grandões,
4572080	4573740	que beleza. Tá, a gente continua
4573740	4575900	passando, eu acho. Eu não vou parar pra tentar
4575900	4577860	falar, porque eles não falam com a gente. Tá, eu dou um
4577860	4579900	sorrisão pra um deles. Tá, quando eles finalmente
4579900	4581820	notam vocês, eles largam
4581820	4583920	a cesta, um deles pega uma
4583920	4585020	lança e grita.
4588020	4588820	Eita, porra.
4589200	4591820	Eu levanto uma das mãos,
4591980	4593960	aí eu faço rará, sorrindo
4593960	4596180	pra ele, e puxo
4596180	4597740	a adaga que eu ganhei,
4597880	4599620	e mostro. Rará, rará,
4599700	4602020	levantando assim pra cima, como se eu estivesse atacando,
4602080	4602420	por favor.
4603640	4605260	Quatro. Três ou mais, ok.
4606440	4607640	Um deles baixa
4607640	4609860	a lança, meio assustado,
4610140	4611660	meio desconfiado, na verdade.
4611920	4613140	Fica encarando vocês.
4613440	4616140	Olha, acho que funcionou. O que você está fazendo,
4616300	4617940	continue. Eu sou muito bom
4617940	4618340	nisso.
4619200	4621680	Eu faço um gesto, mostro a lança
4621680	4623880	assim, abaixo da cabeça, boto a minha
4623880	4625160	palma da mão pra baixo, faço
4625160	4628020	faço gestos pra ele
4628020	4629920	assim, mostrando. Amigo,
4630040	4631780	amigo. E bato assim
4631780	4633820	no ombro dos dois que estão comigo,
4634140	4635500	aí bato no ombro do Bacon,
4635720	4638060	aí passo o dedinho assim, volto a orelha dele
4638060	4639860	fazendo um sinal de louco. É doido.
4639860	4641800	Eu pego um pouco de café no bolso e
4641800	4643320	abro a palma com café.
4643500	4645360	Eles estavam colhendo café, certo?
4645360	4647680	Eles estão olhando desconfiado pra vocês.
4647680	4649680	Às vezes eu esmungo mais alguma coisa
4649680	4650920	e...
4650920	4653680	Eu tento
4654300	4655420	me aproximar dele
4655420	4657420	pra falar baixo
4657420	4659760	bem perto dele, meio que sussurrar pra ele ouvir.
4660020	4661680	Eu consigo chegar o meu rosto tão perto
4661680	4663700	dele assim? Sim. Eu falo baixo
4663700	4665740	no ouvido dele assim. Úrsula.
4665940	4666820	Baixo, bem baixo.
4666920	4669560	Ele fala alto um pro outro. Úrsula,
4669860	4671600	Úrsula. E aponto
4671600	4673700	pra trás e começo a
4673700	4675560	andar. Faz sinal pra te vir
4675560	4677520	e fala. Úrsula. Aí eu viro
4677520	4679560	pra ela e falo. Pois, como
4679560	4681460	eu disse, é melhor você tirar o seu disfarce.
4682040	4682440	Vamos.
4684480	4685880	Ô, cacete.
4686280	4687080	Tá, eu...
4687080	4689700	Eu não tenho muito mais que eu tava disfarçada, né?
4689700	4691460	Eu tava com colete, alguma coisa assim.
4692420	4693900	Eu... Tá calor,
4694180	4695580	eu tiro o colete. Eu não vi
4695580	4697640	nada do que ele falou pro cara. Tu viu que os bichos
4697640	4699080	falaram Úrsula. Tá.
4699260	4701460	Ei, ei, ei. Você já conhece
4701460	4703560	esses caras. Eu sorrio
4703560	4705400	pra ele e jogo o meu... Dou aquela jogada
4705400	4707400	de cabelo pra trás, assim, típica de filme, que aí
4707400	4709620	o cabelo vai caindo em câmera lenta
4709620	4711400	e brilhando ao sol. E fala
4711400	4713540	assim. É um talento
4713540	4715580	natural que eu tenho. Me desculpe.
4715980	4716380	Me viro.
4719440	4719960	Maravilhoso.
4719980	4721420	Você disse
4721420	4723460	sem mais segredos. É bom você
4723460	4724160	começar a falar.
4725540	4727560	É, eu acho que eu saquei
4727560	4729480	o que está acontecendo aqui. Você não...
4729480	4731600	Afinal, você é o grande gênio.
4732060	4733440	Eu sou só um
4733440	4735440	pobre criminoso das ruas
4735440	4737360	e pelo visto sou mais perspicaz do que você.
4737360	4739480	Para com essa treta aí. O que é que você
4739480	4741340	está pensando? Fala pra gente.
4741540	4743100	Sério que você ainda não percebeu, Úrsula?
4743640	4745420	Sério. Sempre que tu fala Úrsula,
4745520	4747060	os bichinhos repetem. Úrsula.
4747340	4749000	Ponta pra frente e continua andando.
4749280	4751480	Então eu não vou...
4751480	4753980	Meu pai! É meu pai que está aqui.
4754680	4755460	Vamos em frente?
4755600	4757420	Vamos. Meu Deus. Espero que...
4757420	4759280	Aí eu saio correndo. Aí eu vou
4759280	4761240	sussurrando com o Bacon. Espero que ele esteja vivo,
4761340	4762420	senão vai ser bem frustrante.
4765200	4767240	Imagina, tem só o mausoléu dele lá.
4767360	4768740	Entendeu? Aí vai ser bem triste.
4769640	4770800	Eu saio correndo.
4788640	4790640	Vocês chegam numa região
4790640	4792540	que tem pequenas, sei lá,
4792680	4794220	orcas feitas com bastante
4794220	4796680	barro. Parece ser uma vila desses quadrúpedes
4796680	4797680	e eles falam...
4797680	4800460	A gente vai...
4800460	4801920	A gente segue pras orcas.
4802280	4804080	O nome da cidade é Úrsula.
4804180	4806360	Aí eu começo a gritar o nome
4806360	4807080	do meu pai.
4807940	4809520	Rui! Rui!
4810020	4811320	Os bichinhos repetem.
4811520	4813600	Rui! Rui! Rui!
4813600	4814600	Rui! Rui! Rui!
4816860	4818340	Rui! Rui! Rui!
4818340	4821360	Eu começo a gritar junto.
4821720	4823400	Rui! Rui! Rui!
4823400	4823560	Rui!
4824960	4826020	Rui! Rui! Rui!
4826020	4826040	Rui! Rui! Rui! Rui!
4826040	4826660	Eu entro nadando.
4826680	4827860	Você também vai? Pronto.
4828480	4829640	Só tem louco nesse lugar.
4830900	4832200	Rui! Rui! Rui!
4832540	4834540	Um dos bichinhos me deixa segurá-lo assim
4834540	4836420	porque eu levanto ele assim. Rui!
4836660	4838940	Festejando. Sabe quando você segura um filhotinho
4838940	4840700	porque ele é um quadrúpede? Rodando assim.
4840980	4841820	Rui! Rui!
4841920	4845500	Eu tento levantar ele e vejo que é bem pesado.
4845740	4846660	Tu não consegue.
4847480	4850780	Vai girando tipo Titanic.
4851420	4851860	Exatamente.
4851860	4856660	Rui! Rui! Rui! Rui!
4856680	4864560	Rui! Rui! Rui! Rui!
4864560	4864600	Rui! Rui! Rui! Rui! Rui! Rui! Rui! Rui! Rui! Rui! Rui! Rui! Rui! Rui! Rui! Rui! Rui! Rui! Rui! Rui! Rui! Rui!
4864600	4864640	Rui! Rui! Rui! Rui! Rui! Rui! Rui! Rui! Rui! Rui! Rui! Rui! Rui! Rui!
4864640	4866180	Eu saio correndo pra entrar na OCA.
4866320	4871780	Tá, eu tô emocionado, eu abraço assim o ombro do Bacon, do Thomas Bacon.
4872020	4874860	Pois é, pelo menos alguma coisa foi boa nessa viagem.
4875180	4876640	Deixa a menina ser feliz, coitada.
4876760	4878620	É, quando a gente pensa que já viu de tudo.
4879020	4883540	Tu entra na OCA, Debbie, e tá lá o teu pai, bem mais velho,
4883540	4886700	ele tá sentado assim, numa cama improvisada no chão,
4886800	4890280	cheio de peles cobrindo da cintura pra baixo, assim.
4890560	4893340	Ele tá bem velhinho, e ele olha pra você e fala
4893340	4895760	Quem é você?
4896000	4898800	Como quem sou eu? Úrsula, papai, Úrsula!
4899160	4902300	Como é? Meu Deus, eu estou alucinando.
4902480	4903640	Úrsula, sua filha.
4903900	4906000	Acho que finalmente estou morrendo.
4906240	4910560	Ainda sentado, coberto por peles, ele começa a chorar.
4910560	4912780	Eu saio correndo, abraço, choro.
4913800	4914360	Papai!
4915440	4918420	Eu nunca imaginei que pudesse encontrá-la novamente.
4919140	4920380	Como estão seus irmãos?
4921000	4922580	Tocando os negócios da família?
4922580	4924080	Claro que não, papai.
4924180	4926640	A única pessoa que tá tocando o negócio da família sou eu.
4927260	4931620	O rei, o rei me pediu pra vir aqui e buscar o filho dele.
4931680	4933860	O filho dele tá aqui, o Theodore.
4934320	4936760	O rei está aceitando mulheres marinheiras?
4937300	4938780	Ai, não, né, papai?
4939060	4942180	Eu tive que fingir que eu era um homem.
4942540	4946060	Bom, então imagino que você não tenha casado.
4946580	4948780	É, não. Não casei, papai.
4949280	4952560	Papai, eu acabei de viajar a porra do mundo todo.
4952580	4954580	Eu caí num buraco.
4955300	4958840	Eu enfrentei uma porra de uma minhoca gigante.
4959360	4960820	E você tá perguntando se eu casei?
4961040	4961980	Se eu casei?
4962300	4962780	Caralho.
4967140	4968380	Eu vou te cantar.
4968540	4970980	Eu viro as costas e vou lá pra fora e falo.
4971400	4972860	Se vocês quiserem, vocês falem com ele.
4976560	4978460	Ai, eu seguro a risada, assim.
4978460	4978820	Hum.
4981460	4981780	É...
4981780	4983380	Ela saiu mesmo da oca.
4983380	4983620	Ela tem um ponto.
4983740	4984300	Ela tem um ponto.
4984360	4986000	Eu olho pro véio e falo assim.
4986080	4986960	Acho que ela tem um ponto.
4988300	4990780	Tá, eu entro na oca, assim, abaixo do chapéu.
4990860	4991140	Eu falo assim.
4991220	4992900	Senhor Rui, é uma honra conhecê-lo.
4993220	4994660	Ouvi muitas histórias do senhor.
4995000	4995880	Muito obrigado.
4996740	4997700	É, mas...
4997700	4998300	Quem é você?
4998780	4999180	Eu...
4999180	5000340	Ah...
5000340	5005200	O senhor desapareceu há muitos anos e não teve a oportunidade de conhecer o meu legado.
5005800	5006980	Eu jogo o cabelo pra trás.
5006980	5008680	Eu sou o Pierre Lebon.
5008880	5009980	O Grand Capitão.
5010160	5011540	O ladrãozinho de...
5011540	5011980	De Porto.
5012020	5012500	É isso que ele é.
5012880	5014120	Mas, é...
5014120	5015100	Olá, senhor Rui.
5015280	5016920	Eu sou o Thomas Bacon.
5017180	5018740	Eu sou um cientista.
5019100	5020840	Ah, eu conheço você.
5021440	5023120	Você é o professor do príncipe.
5023580	5024580	Como que anda, moleque?
5025060	5027000	Imagino que hoje já esteja um homem.
5027340	5027820	Exatamente.
5028380	5031060	Mas, rapidinho, eu já conheci esse homem?
5031060	5032440	De vista, provavelmente, sim.
5032580	5032760	Ah, tá.
5032760	5035060	Tu foi famoso porque tu foi o professor do príncipe.
5035280	5035920	Ah, perfeito.
5036240	5036700	Sim, sim.
5036700	5037500	É, exatamente.
5037900	5038560	Eu estou...
5038560	5039540	Inclusive, ele está...
5039540	5040680	Acho que ele está bem.
5040800	5041500	Está nesse momento.
5041540	5042420	Ele está conversando com a rainha.
5044300	5044700	Mas...
5044700	5046420	Já que a gente está tocando nesse assunto,
5046600	5048220	eu acho que o tempo aqui urge.
5048800	5050900	O que você sabe sobre esses insetos?
5052000	5053800	Eu já vi que tem duas raças aqui.
5053860	5057000	Os quadrúpedes e os outros, que são bípedes.
5057320	5058800	E o que você sabe sobre eles?
5059060	5059340	Sim.
5059480	5059580	Tá.
5059720	5062240	Eu entro um facar assim quando eles começam esse diálogo.
5062500	5063160	E falo assim...
5063160	5064500	Não, não, não, não, senhor Bacon.
5064620	5065700	O tempo urge uma ova.
5066120	5068180	Aquela pobre menina que está ali fora.
5068460	5071240	Passou a vida dela inteira atrás do legado do pai.
5071540	5072540	Ela rodou o mundo.
5072620	5073600	Ela atravessou o continente.
5073660	5077060	Ela enfrentou uma serpente marinha para estar aqui com ele.
5077660	5079520	E ele foi muito indelicado com ela.
5079580	5080260	Por favor, senhor.
5080360	5080960	Chame a sua filha.
5081100	5081720	Converse direito com ela.
5081740	5082460	Ela estava morrendo.
5082560	5083140	Saudade de você.
5083240	5084340	Você foi perguntar se ela se casou.
5084600	5086160	E se ela não quer se casar, pobre coitada.
5086400	5087600	Ela está aqui sempre comigo.
5087680	5088740	Nós somos grandes companheiros.
5088800	5091920	Ela se mostrou uma das guerreiras mais honradas do universo.
5092220	5093600	E você viveu em falar um negócio desse.
5093600	5095660	Minha filha está andando com um pirata?
5096380	5100920	Bom, eu não sou o que você pode considerar um pirata.
5100920	5101520	Eu entro e eu volto.
5101580	5102360	Eu interrompo.
5102760	5103120	Ah, papai.
5103220	5104800	Agora você vai querer também.
5105000	5106500	Depois que você sumiu tantos anos.
5106620	5108440	Você vai querer falar com quem eu estou andando.
5109580	5111300	Eu não tinha como voltar.
5111740	5113340	Porque é claro que eu estava ouvindo tudo.
5114420	5115480	Tá, tudo bem.
5116520	5117920	Ora, vamos por partes.
5118100	5119280	Ele levanta as peles.
5119560	5120540	Ele não tem...
5120540	5123060	Do joelho para baixo, ele não tem mais as pernas.
5123700	5125060	Oh, caceta.
5125420	5126480	Meu Deus.
5127100	5129840	Aí eu vou para o lado dele e choro.
5130500	5131240	Como assim?
5131540	5133180	Oh, meu Deus do céu.
5133180	5135160	Eu enfrentei uma serpente gigante.
5135680	5137120	Meu barco naufragou.
5137460	5141440	Eu me segurei em destroços e uma corrente marítima me levou até uma praia.
5141620	5144480	Onde esses insetos gigantes me acharam.
5145080	5147520	Eles me conduziram até uma montanha gigante.
5147740	5149520	Uma espécie de formigueiro.
5150180	5151900	Lá eu desmaiei.
5152180	5157020	Quando acordei, havia uma mulher inseto gigantesca comendo as minhas pernas.
5157580	5158500	Que horror.
5158980	5161060	Minha sorte é que esse povo é burro.
5161060	5162640	E me deixou lá com minhas armas.
5163160	5165440	Eu cravei minha espada naquela desgraçada.
5165520	5168280	E nesse momento todos eles ficaram paralisados.
5169140	5172080	Me arrastei para fora e os quadrúpedes me ajudaram.
5172520	5174460	Me trouxeram para cá e cuidaram de mim.
5175240	5177940	Junto comigo chegaram algumas coisas do naufrágio.
5178360	5181480	Incluindo sementes que eu estava trazendo do oriente.
5182140	5185960	Eu as plantei e descobri que os quatro braços não chegam perto.
5186820	5188360	Estou vivendo bem desde então.
5189000	5190260	Volta e meia a gente vai lá.
5191060	5193840	Soltam os termietes, como chamamos os quadrúpedes.
5194300	5196960	E ensinei a eles que a inteligência vence a força.
5197340	5199300	Mas, mas, mas, peraí, peraí.
5199880	5203880	A gente falou com um deles que aprendeu nosso idioma em dois dias.
5204060	5206280	Isso não parece ser criaturas tão imbecis assim.
5206580	5207360	E eles falam?
5208140	5210280	Quando cheguei aqui eles não falavam.
5210700	5211740	Como assim falam?
5211920	5213020	Falam, falam.
5213180	5216760	A gente encontrou com um deles que falava perfeitamente nosso idioma.
5216900	5218920	Diz que aprendeu com o príncipe em dois dias.
5218920	5220920	Tá, eu tô atrás enquanto eles estão tendo essa...
5221060	5223020	Esse diálogo enrolando os meus bigodezinhos.
5223220	5223960	É importante.
5223980	5224820	A ponta dos bigodes.
5225180	5227780	Então vocês precisam correr para salvar o príncipe.
5228260	5229280	Ou para fugirem.
5229620	5231240	Ou podem morar aqui em Úrsula.
5231620	5233460	Eu batizei essa vila com o nome dela.
5233620	5236100	Espero que isso conte pontos pra me perdoar um dia.
5238160	5240300	Ah, papai, claro.
5244360	5245260	Gente, gente.
5245340	5247260	São muitos derrichos aqui, gente.
5248260	5249460	Será que...
5249460	5251620	A rainha vai comer as pernas do príncipe também?
5251780	5252260	O que que...
5252260	5253560	Se já não comeu, né?
5253740	5255060	Eu acho que a gente...
5255060	5257680	Papai, o senhor acha que tem chance da gente conseguir voltar?
5258060	5258420	Como é?
5258660	5259100	Voltar?
5259640	5261000	Vocês precisam de um navio?
5261600	5263760	A gente não tem como construir um navio?
5263940	5265140	Construir um barco?
5265320	5265740	Construir um...
5265740	5266740	Frank, Frank está quase...
5266740	5268060	Nós temos o filho de...
5268060	5270000	O filho de Fernão, o construtor.
5270400	5270840	Exato.
5271420	5273880	Então basta ele construir o barco para vocês.
5274360	5276520	Os termietes me entendem e me ajudam.
5276520	5278380	Eles vão ajudá-los também.
5278980	5279220	É...
5279220	5281680	Eu acho que existe uma possibilidade
5281680	5283640	de conseguirmos libertar não só o príncipe
5283640	5285100	como todos os termietes.
5285380	5286260	O que você tem em mente?
5286680	5289100	O que o Rui disse é que
5289100	5290980	quando ele atacou a rainha,
5291260	5292880	todos pararam de se movimentar.
5293360	5297260	Talvez esse momento de sobressalto,
5297320	5299480	esse momento de confusão mental que dê neles
5299480	5301260	quando eles perdem o controle da rainha,
5301640	5303740	a gente consiga destruir a todos
5303740	5305100	e libertar as criaturinhas.
5305380	5305980	Ótimo.
5305980	5307980	E como que a gente vai, então...
5308500	5308980	Papai, você sabe...
5309220	5311680	de algum caminho que a gente consiga chegar na rainha?
5311880	5312380	Sim.
5312560	5314980	Infelizmente, não posso ir com vocês.
5315380	5317980	Mas posso pedir para um termietes levá-los até lá.
5318180	5320360	Mas espera aí, tem alguma coisa que eu ainda não entendo.
5320360	5322860	Por que que eles não nos aprisionaram, então?
5322860	5326260	Se eles são esse tipo de criatura?
5326260	5329960	E por que que os termietes andam entre eles
5329960	5331960	e não parecem estar aprisionados também?
5331960	5333960	Se você disse que eles são escravos...
5333960	5336560	Se eles tentam fugir, os soldados matam.
5337060	5339060	Você viu algum deles sem soldados próximos?
5339060	5340060	Acho que não.
5340060	5341060	Não, de fato.
5341060	5344060	Mas a gente podia andar livremente, assim, eles não davam.
5344060	5346060	Eles que falaram pra gente vir aqui.
5346060	5347060	Mas eles falaram pra gente vir aqui.
5347060	5351060	É porque eles acharam que nós íamos matar o rebelde, né?
5351060	5354060	Nossa, mas realmente tem que ser criaturas muito burras pra pensar isso.
5354060	5356060	Ele é meu pai, você tá duvidando do meu pai?
5356060	5359060	Não, eu tô duvidando dos outros.
5359060	5360060	Enfim, não estou duvidando de ninguém.
5360060	5362060	Eu sou só um cientista.
5362060	5364060	Eu só trabalho com evidências e hipóteses.
5364060	5367060	Os Myr, que são os quatro braços, são ignorantes.
5367060	5368060	Me deixaram com a espada.
5368060	5369060	Me deixaram com a espada.
5369060	5371060	Eles nem sabem o que é uma espada, eu imagino.
5371060	5372060	Entendi.
5372060	5375060	Tá, insetos são seres que vivem na base de colônia
5375060	5379060	e pode ser que essa tal rainha exerça algum poder,
5379060	5384060	tem algum vínculo, algum link, sei lá, neuronal...
5384060	5386060	Bom, não vou falar isso porque eu não conheço esse conceito.
5386060	5392060	Mas talvez tenha alguma conexão que acabe dando mobilidade pra eles.
5392060	5397060	Se a rainha for ferida, pode ser que todos acabem ficando lesados.
5397060	5398060	Vai, então vamos lá.
5398060	5400060	Vamos matar a rainha.
5400060	5405060	Você faz ideia de quantos dessa criatura existem?
5405060	5408060	Quantas criaturas dessa raça maior existem?
5408060	5410060	Sinceramente, não faço ideia de números.
5410060	5412060	Só sei que são muitos.
5412060	5414060	Muitos mesmo.
5414060	5417060	Tinha que ter um outro jeito, hein, gente.
5417060	5419060	Vamos pensar num plano.
5419060	5424060	Papai disse que de vez em quando eles jogam algumas bombas e tal.
5424060	5427060	Enfim, bombas não, mas tem distração.
5427060	5428060	Acho que a gente pode...
5428060	5431060	Eu treinei os Termit para usarem lanças.
5431060	5435060	Como os Mier não sabem atacar à distância, usamos isso em nossa vantagem.
5435060	5437060	E você nunca usou café, papai?
5437060	5440060	Eles têm alergia, eles não gostam de café.
5440060	5442060	Eles não conseguem passar pelo cafezal.
5442060	5444060	Eu uso como barreira apenas.
5444060	5446060	E tomo café.
5446060	5450060	E se nós envenenássemos a água deles com café e matássemos todos?
5450060	5452060	Muito mais rápido do que eu pensei.
5452060	5456060	Hum, eu duvido que a gente vai conseguir envenenar...
5456060	5459060	É, eu acho que o cheiro do café é muito perceptível.
5459060	5461060	Eles iam perceber antes de beber, né?
5461060	5462060	Eu tenho uma sugestão.
5462060	5463060	Diga.
5463060	5467060	Eu já vi que esses Termietes, eles usam uma cesta nas costas.
5467060	5468060	A gente pode...
5468060	5470060	Se essa cesta for grande o suficiente, a gente pode...
5470060	5473060	Cada um de nós fica escondido numa dessas cestas.
5473060	5476060	Eles são escravos, então eles vão estar lá.
5476060	5481060	Eles vão entrar dentro do formigueiro, porque eles vão entregar produtos, folhas que eles pegam.
5481060	5483060	A gente vai estar debaixo dessas folhas.
5483060	5485060	E quando a gente estiver lá dentro, eles são nossos amigos.
5485060	5488060	A gente chega no recinto da rainha e sai, e se revela.
5488060	5490060	E aí, a gente joga café na rainha.
5490060	5491060	Pau, porrada e bomba, é isso?
5491060	5492060	Nossa!
5492060	5497060	Tá, eu bato palmas pro Bacon pela primeira vez desde o começo da leitura.
5497060	5498060	Genial!
5498060	5499060	Excelente!
5499060	5502060	E eu acho que a gente ainda pode colocar um café, né?
5502060	5503060	Eu dou um sorrisinho.
5503060	5505060	O Thomas ainda nota uma outra coisa.
5505060	5506060	O...
5506060	5507060	O quê?
5507060	5508060	O Rui.
5508060	5509060	O Rui Fernandes.
5509060	5510060	O pai da Úrsula.
5510060	5514060	Ele disse que é fácil atacar as criaturas porque, apesar de ter quatro braços, elas
5514060	5515060	não atacam a distância.
5515060	5517060	E elas tinham arco e flechas quando você chegava.
5517060	5519060	Mas eles tinham arco e flecha, é verdade.
5519060	5520060	Sim.
5520060	5522060	Mas eles têm arco e flecha e não atacam a distância?
5522060	5525060	O que o Rui falou é que eles nunca atacam a distância, e vocês viram eles com arco
5525060	5526060	e flecha.
5526060	5527060	Tá, então eu pergunto.
5527060	5529060	Ô, seu Rui, você disse que eles não atacam a distância?
5529060	5531060	Eles não sabem usar o arco e flecha?
5531060	5533060	Eles nunca usaram o arco e flecha?
5533060	5536060	Eu imagino que nunca devem ter visto um arco e flechas.
5536060	5537060	Ah!
5537060	5538060	Puts!
5538060	5539060	Eles aprenderam...
5539060	5541060	Foi o pirralho do seu pupilo que ensinou pra eles.
5541060	5542060	Hum...
5542060	5544060	Mas eles não sejam proficientes o suficiente.
5544060	5548060	Apesar que o cara aprendeu a língua sem sotaque em dois dias, caramba.
5548060	5550060	Devem ser os melhores arqueiros do mundo.
5550060	5551060	Mas a gente não vai...
5551060	5552060	A gente não...
5552060	5556060	Não acho que a gente corra esse risco, porque a gente vai estar escondido dentro do...
5556060	5557060	Do...
5557060	5558060	Dos cestos.
5558060	5559060	Sim, sim.
5559060	5560060	De fato.
5560060	5562060	Mas no momento que a porrada começou, talvez...
5562060	5563060	Eu acho...
5563060	5564060	Seja uma questão.
5564060	5565060	Sim, sim.
5565060	5567060	Quantos guardas será que deve ter com ela?
5567060	5570060	Quantos tinha quando você acordou com a rainha da primeira vez?
5570060	5571060	Com a rainha?
5571060	5572060	Nenhum.
5572060	5573060	Nenhum do lado de fora.
5573060	5574060	É.
5574060	5575060	E os...
5575060	5579060	E os pequeninos, os Tetatek, têm acesso a essa câmara principal da rainha?
5579060	5582060	Ele fala com algum grunhido pros bichos?
5582060	5584060	Hum...
5586060	5587060	Eles não sabem.
5587060	5588060	Vamos ter que passar por soldados.
5588060	5589060	Tá, mas...
5589060	5591060	A gente vai tentar chegar o mais perto possível depois.
5591060	5592060	É, e a gente...
5592060	5593060	A gente tem que ver.
