start	end	text
2282140	2283640	Tatiada. O próximo comentário é da
2283640	2284840	Coruja das Torres.
2285380	2287860	Meu Deus, Guaxa! Bom, eu queria
2287860	2289660	começar esse comentário
2289660	2291920	com os outros dizendo bom dia, boa tarde,
2292020	2293560	boa noite, mestre Guaxa Guaxo.
2293720	2295820	Juvidades do dia, que é o que o João
2295820	2297500	prefere. E todos os
2297500	2299360	ouvintes, tudo bem? Tudo bem comigo? Tudo bem contigo?
2299420	2301320	Juvidades do dia. Tudo ótimo.
2302580	2303580	Mas foi impossível
2303580	2305720	com esse episódio. Meu tema favorito
2305720	2307800	é zumbis. Olha só, uma pessoa que não gosta
2307800	2309540	é uma pessoa que gosta. E todos gostam
2309540	2311460	do RPG Guaxo. Apocalipse e todas
2311460	2313400	essas coisas. E como sempre, o senhor Guaxinim
2313400	2315680	superou todas as expectativas.
2316020	2317500	Foi bem difícil ter que parar de
2317500	2319380	ouvir para entrar no trabalho e só
2319380	2321540	conseguir terminar o episódio no fim do
2321540	2322860	dia. Episódio incrível.
2323400	2325400	Os jogadores foram ótimos. Eu tô sem palavras
2325400	2327360	com esse final. E triste, mas
2327360	2329260	velhinha também me enganaria com o
2329260	2331520	pipoca e videogame. Parabéns, Guaxa
2331520	2333460	e todos os envolvidos. Vou ficando por
2333460	2335580	aqui. Um beijo e até mais.
2335660	2337440	Até mais, coruja. Lembrei
2337440	2338420	o que eu queria dizer antes.
2338660	2340980	A pessoa fala, ah,
2341440	2343180	eu vou, eu tô pronto
2343180	2345500	para um apocalipse zumbi. Eu pergunto
2345500	2347660	se, sei lá, a tua esposa,
2348120	2349560	uma filha, tua mãe
2349560	2350820	foi mordida.
2351260	2353560	Tá do teu lado. Tu tá pronto para um apocalipse zumbi?
2353920	2355560	Porra, nem a pau. Nem a pau.
2355640	2357340	Eu ia ser mordido também. Vambora.
2357360	2359420	Vamos enlouquecer junto, como diz
2359420	2361460	no Last of Us.
2361780	2363160	Tipo, não tem... E lá,
2363200	2365040	dá errado, né? Mas, eu
2365040	2367680	espero que, não sei
2367680	2368820	o Romeu e Julieta ali.
2369340	2371380	Porra, não dá, sabe?
2371460	2372180	Assim, a pessoa
2372180	2375260	não tem como. Tu vê, sei lá, teus vizinhos
2375260	2377240	machucados. Tu vê gente numa
2377240	2379420	situação terrível. E, porra,
2379420	2380980	vou pensar só no meu umbigo
2380980	2383180	e todos a minha volta. Todos.
2383320	2384960	Porque não tem essa. Eu vou proteger minha família.
2385120	2386880	Porra, um que se ferrou, tu vai
2386880	2387320	fazer o quê?
2387800	2389420	Então, é isso. Essa é a ideia do episódio.
2389600	2389960	Desculpa.
2390800	2392760	Eu acho que eu também não conseguiria.
2392980	2395000	Porque, como você mesmo disse no episódio, tem que ter
2395000	2397380	muito sangue frio. É, porra.
2397440	2398380	Não tem coração.
2399200	2401360	Não tem como. Eu não conseguiria
2401360	2402540	ser uma Sarah da vida.
2403100	2404820	Beleza. Carlos...
2404820	2407120	A Sarah personagem.
2407540	2409380	Não, a Sarah jogadora.
2409880	2411420	É isso aí. Irmã,
2411540	2412580	não fique com raiva de mim.
2412580	2414700	Fique com registro. Já perdeu a amizade
2414700	2416380	da Ágata. Perdeu a Sarah também.
2416380	2418140	Oh! Carlos Henrique
2418140	2420060	Barbosa. Que final
2420060	2422140	inesperado. Eu fui pego
2422140	2424420	de surpresa. O outro grupo
2424420	2426460	dos elfos... Ah, o outro
2426460	2428320	grupo dos elfos apareceriam
2428320	2430460	na história, mas a decisão
2430460	2432380	dos jogadores levaram eles para outro
2432380	2434600	caminho? Não, a decisão do narrador
2434600	2435800	ao escrever a história
2435800	2438240	acabou diminuindo o papel
2438240	2440200	deles. Que, assim, eu faço
2440200	2442180	uma manchote de, no máximo,
2442300	2444220	duas horas. Mas a
2444220	2446360	expectativa é sempre ficar em uma hora e meia.
2446380	2448440	E ter combate com os elfos.
2448800	2450360	Sei lá, alguém podia querer entrevistar um
2450360	2452460	elfo. Eu achei que ia criar
2452460	2454140	uma barriga no episódio.
2455360	2456260	Alguém, né?
2457200	2458380	Talvez fosse desnecessária.
2459340	2460240	Então eu cortei
2460240	2462120	da aventura final. Quando você for
2462120	2464340	narrar pros seus amiguinhos, eu sei que
2464340	2466380	muita gente faz isso, você pode incluir
2466380	2468580	os elfos ali e fazer uma aventura maior e tal.
2468880	2470200	Fica a dica. Achei
2470200	2472220	muito legal a ideia dos
2472220	2474440	zumbis. Zumbis
2474440	2476340	velhos e novos. Sempre a
2476380	2478520	cheia estranho ainda terem zumbis
2478520	2480320	em The Walking Dead, depois
2480320	2482400	de um inverno muito rigoroso.
2482760	2483760	Não fazia sentido
2483760	2486440	até com apodrecimento.
2486800	2488660	Pois eles não teriam como manter
2488660	2490740	a estrutura muscular. Certo.
2491040	2492860	É um vírus, então continuariam
2492860	2494900	vivos. E o aspecto
2494900	2496580	do zumbi poderia
2496580	2498240	ser considerado pela
2498240	2500500	quantidade de ferimentos
2500500	2502340	que a pessoa teve ao ser
2502340	2504700	atacada. E não haveria o processo
2504700	2506360	de apodrecimento. Sem o
2506360	2508220	processo de apodrecimento, eles
2508220	2510580	manteriam os seus cinco sentidos, certo?
2511580	2512560	Pergunta, Guax.
2512980	2514440	Eles manteriam os cinco sentidos
2514440	2516400	se não tivesse o processo de
2516400	2518360	apodrecimento? Sim, assim, a ideia
2518360	2520480	ali é que o zumbi ele tava já
2520480	2522360	ele não enxergava, ele não
2522360	2524420	escutava. Aquele zumbi específico
2524420	2526480	ainda cheirava e foi o que aconteceu a situação.
2526980	2528420	A ideia, assim, era
2528420	2530700	se o ninguém fizer nada
2530700	2532060	foi contaminado,
2532440	2534540	o mundo volta, entre aspas,
2534540	2536200	ao normal ali.
2536360	2538320	É como, porra, é como uma
2538320	2540820	eu não quero fazer essa comparação,
2540960	2542240	mas vou fazer essa comparação.
2542740	2544680	A gente teve toda a pandemia da
2544680	2546800	covid, massacrou, morreu
2546800	2548640	muita gente. Hoje ainda tá
2548640	2550480	tendo muitos casos, mas por conta
2550480	2552240	da vacina, principalmente, né?
2552700	2554180	Esses casos ficam
2554180	2556980	menores. Então não é que a gente venceu
2556980	2558540	a guerra
2558540	2560680	contra esse vírus. A gente
2560680	2562360	reduziu os impactos.
2562360	2564260	A ideia de um apocalipse zumbi, a mesma
2564260	2566200	coisa ali, né? Tem um vírus
2566200	2567820	que se as pessoas
2567820	2570220	se cuidarem, né? No caso
2570220	2572260	evitarem mordidas, a tendência
2572260	2573980	é que o negócio diminua bastante.
2574300	2575920	Tem um filme... Não, desculpa.
2576920	2578180	Eu não vou lembrar o nome
2578180	2580220	do filme. Alguém vai
2580220	2581820	lembrar e, sei lá, coloca nos comentários.
2582400	2584240	Mas era, tipo, um filme de apocalipse
2584240	2586220	zumbi, que tinha uma cidade
2586220	2588200	e daí as pessoas saiam pra procurar
2588200	2590040	coisas fora e tinha
2590040	2592280	fogo de artifício, porque
2592280	2594400	os zumbis gostavam de ver coisas brilhantes
2594400	2596200	e tal. E lá,
2596200	2598260	era um mundo em que o zumbi
2598260	2600040	não era um vírus. Era, tipo, uma
2600040	2602280	maldição. Então, por
2602280	2603800	exemplo, eles tinham uma cidade protegida,
2604220	2606060	mas, sei lá, tu morreu na tua casa, sei lá,
2606120	2607920	teve um infarto, tu virou um zumbi.
2608260	2609740	E isso era um problema
2609740	2612240	foda. Nessa minha versão
2612240	2614000	dos zumbis, tu é zumbi se tu for
2614000	2616200	contaminado, né? Então só morrer
2616200	2618160	não vai te transformar num zumbi. Se fosse
2618160	2619960	simplesmente a pessoa morreu e virou zumbi,
2620340	2621820	aí não teria como escapar.
2622260	2623620	Beleza. É, tipo,
2623620	2625280	o The Walking Dead, que,
2626200	2628140	se você ainda não assistiu a série,
2628600	2629820	pretende assistir
2629820	2632240	Alerted Spoilers, que
2632240	2634160	no final, eles descobrem que
2634160	2636360	praticamente todas as pessoas já são
2636360	2638280	contaminadas. Assim que morrer, elas já se
2638280	2639720	transformam. É, então
2639720	2642320	isso aí não tem o que fazer.
2642500	2644260	Tem muito o que fazer. Beleza.
2644520	2645920	Porém, é...
2645920	2648720	O filme que eu falei
2648720	2650640	é Land of the Dead. Não confirmo
2650640	2652060	nem desconfirmo, mas tá em informação.
2652060	2654100	Se não for, o
2654100	2655600	responsável da informação é o Jean.
2656200	2658100	Continuando, porém
2658100	2660200	sem inteligência, não teriam como
2660200	2662160	sobreviver ao inverno. Caso
2662160	2664140	não tenham algum mecanismo ou
2664140	2666080	instinto que os levasse a
2666080	2668120	migrar para zonas quentes, como
2668120	2670060	os pássaros, ou ficariam
2670060	2672020	invernando agrupados
2672020	2673300	em algum lugar
2673300	2676140	em algum lugar abrigado
2676140	2677300	durante o inverno.
2678200	2680000	Eu acho que
2680000	2682140	ele tá falando aqui como os
2682140	2684440	zumbis poderiam sobreviver ao inverno.
2684440	2685000	Aham.
2686200	2688540	Tipo, só se salvando do apodrecimento.
2689300	2689700	Hum...
2689700	2691840	Tá cortando teu áudio ou tu parou de ler?
2692220	2693400	Eu parei de ler. Acabou.
2694760	2696140	Ah, que inverno. Desculpa.
2696580	2698200	Eu tava olhando o próximo. O próximo
2698200	2699760	terminava com um abraço. Eu tô perdido.
2700200	2702000	Voltando. Tem um jogo que eu gosto
2702000	2704380	bastante, que não deu muito sucesso, que é o Days Gone.
2704820	2706280	Do Playstation 4. Eu joguei no Playstation
2706280	2708180	4, pelo menos. E lá
2708180	2710040	tinha um esquema desse. Tipo, os
2710040	2711700	zumbis, eles se...
2711700	2713740	Eles andavam em bando, né?
2714200	2716000	Eles se organizavam em caverna, em lugar.
2716200	2718400	Tinha ninhos, né? De zumbis.
2718760	2720040	E uma das coisas que tu fazia era ir lá
2720040	2722040	queimar o ninho de zumbi, pra que
2722040	2723660	eles parassem de surgir na área e tal.
2724140	2726060	É um jogo, assim. É um jogo que eu gostei bastante
2726060	2728200	de jogar. É tipo um mundo aberto,
2728620	2729400	entre aspas.
2729880	2731460	Daí tem algumas cidadezinhas,
2732200	2733860	pequenos acampamentos, né?
2734220	2736260	E tem uma moto, tem um motoqueiro que mata zumbis.
2736380	2738020	Isso é legal. Tem aquela
2738020	2740060	cena icônica do trailer, quando
2740060	2742340	lançou, que é no... Na fazenda
2742340	2743980	que vem aquela horda gigante.
2743980	2744600	Aham.
2746200	2748220	Eu sempre também quero muito jogar e não tive
2748220	2750380	oportunidade ainda. Eu platinei,
2750420	2750920	pelo que eu lembro.
2752180	2753940	Espero que tenham dois. Não sei.
2754900	2756080	Dei igual nos dois. Vamos lá.
2756380	2758200	A história foi bem fechada, não foi, Guax?
2758420	2759560	Foi, mas assim...
2759560	2762280	Ela tem um plot twist no final,
2762780	2764000	que eu não vou contar, obviamente,
2764460	2766060	que eu achei meio caído.
2766500	2768460	Mas dá pra ter, porra, um motoqueiro
2768460	2770560	que mata zumbi, dá pra fazer mais uns quatro jogos.
2770900	2772420	Mas voltando, antes que a gente se perca.
2772420	2773160	Quanto tempo tem?
2773620	2776120	Não sei, eu não abri o Audácio. A gente começou no
2776200	2778080	nove e meia, mais ou menos. Uma hora,
2778180	2780200	talvez. Porra, meu Deus, que triste. Vamos lá.
2780540	2781480	O próximo comentário é do
2781480	2783320	AcerMaker0. Ele coloca...
2783320	2785940	Boas noites, Guaxa. Convidado e
2785940	2787840	pessoas incríveis que ouvem. Sim,
2788240	2789600	você é incrível. É verdade.
2789920	2791260	Incrível também foi essa aventura.
2791720	2793560	Dos NPCs aos jogadores.
2794020	2796120	Me amarrei na história. Me deixou
2796120	2798260	preso. Preso tal qual os jogadores
2798260	2800000	no final do episódio. Toda a ambientação
2800000	2801960	passou uma vibe bem de série Apocalipse
2801960	2804460	sobrevivência. Adorei também a leveza
2804460	2806180	dos jogadores, criando falas engraçadas
2806180	2808080	e mesmo a situação perigosa.
2808340	2810200	É o que eu falei. Os jogadores abraçaram
2810200	2812440	a ideia de ter a inocência
2812440	2814140	dentro daquele mundo ali.
2814620	2816220	E a gente sabe o que acontece quando você é
2816220	2817740	inocente no mundo de zumbis, né?
2818080	2820140	Você vira comida. E o final me pegou também.
2820320	2822120	Eu tive zero desconfiança da
2822120	2824360	Sarah. Também teria levado a senhorinha
2824360	2826080	pra morar na minha base sobrevivente.
2826160	2827580	Todos teríamos. Off-topic.
2827800	2830100	Também adorei a aventura anterior. O mês
2830100	2831960	que o mar levou Magnolia. Adorei o enredo.
2832280	2834100	E os jogadores foram maravilhosos. Brabíssimo.
2834100	2836100	Obrigado pelas aventuras.
2836700	2838620	Abraços, pessoas. Abraços, querido.
2838860	2839900	Continuando com
2839900	2842460	Atari Boy. Gostei
2842460	2844060	do seu... Por algum motivo, o Atari
2844060	2845980	eu gostei desse nome. Olá,
2846220	2848020	Guaxa. Faz alguns
2848020	2850060	bons tempos que não comento
2850060	2851800	nada em seus episódios.
2852060	2854440	Mas venho sempre o acompanhando.
2854860	2856560	Eu terminei semana passada
2856560	2858180	uma viagem aqui pela
2858180	2860200	América Latina. E eu posso
2860200	2862020	dizer que você foi
2862020	2863500	meu companheiro de bolso.
2863800	2866120	Em meus momentos no ônibus, avião
2866120	2868260	ou antes de dormir, estava
2868260	2869900	lá você. E os jogadores.
2870300	2871900	E os jogadores comigo.
2872260	2873740	Então, obrigado
2873740	2875960	demais por existir.
2876340	2878020	Dito isso, vamos
2878020	2880040	ao episódio. Primeiro,
2880400	2881960	no momento que o primeiro
2881960	2884540	zumbi apareceu, eu lembro exatamente
2884540	2886140	do vídeo em que você
2886140	2888160	faz... O vídeo que você faz
2888160	2890100	referência no episódio do
2890100	2891380	Ora, Tiago.
2891680	2892380	Ora, Tiago.
2892380	2892860	Ah!
2894000	2895680	Mas ok. Segundo,
2896120	2898060	quando a Sarah decidiu ir com os
2898060	2899360	personagens, eu coloquei
2899360	2901960	uma mão na testa e pensei
2901960	2904400	caramba, é, caralho,
2904660	2905860	ele vai morrer.
2906300	2908160	Ela vai morrer, Sarah. É, ela vai
2908160	2908580	morrer.
2910000	2912340	Eu também tive essa leve preocupação
2912340	2914220	no momento, mas eu pensei
2914220	2916000	tipo, putz, e agora? A gente vai ter que
2916000	2918020	proteger a Sarah. Também a gente mal
2918020	2920440	tá conseguindo se proteger. Entretanto,
2920940	2922240	quando vi que eles
2922240	2924260	chegaram na caverna, nada demais
2924260	2926080	havia acontecido e o episódio já está
2926120	2928240	no fim, bom, sabia que
2928240	2930300	vinha Caquita. Terceiro,
2930660	2931920	eu estava
2931920	2933740	tomando meu café da manhã
2933740	2936020	quando ela falou que a amiga
2936020	2937660	a... Quem falou? A
2937660	2940360	amiga Bruna estava deliciosa.
2940660	2941860	Enfim, é isso.
2942160	2944260	Forte abraço e obrigado por tudo.
2944580	2945660	Obrigado, querido. Assim,
2945920	2947860	fico muito feliz. Em algum momento o podcast
2947860	2949820	fala, é, é, é,
2949820	2952060	é sua aventura de bolso
2952060	2953660	na forma de podcast.
2953940	2956040	Na voz dos gírias, bem bonito. Então é isso,
2956040	2956100	meu amigo.
2956120	2958260	Eu mesmo fico feliz de ter ficado no seu bolso
2958260	2959860	de ter acompanhado você
2959860	2962040	nesta incrível viagem, o que é
2962040	2963880	é uma dicotomia. Eu
2963880	2965900	não gosto de sair de casa e você tá
2965900	2967940	viajando o mundo me ouvindo. E a gente tá
2967940	2970120	junto. Ué, perfeito. Obrigado.
2970460	2972020	Obrigado mesmo, Atari Boy,
2972320	2973980	que é um menino muito talentoso.
2974280	2976040	Próximo comentário, é, porra,
2976060	2978020	eu queria criticar o jogo. Esse aqui é
2978020	2980160	tu também? Ó, esse
2980160	2981740	aí é um morcego que vive aqui
2981740	2983380	no prédio. Ele
2983380	2986100	ele pede pra mim fazer os comentários por ele.
2986120	2988060	Mas não sou eu. Tá, então tu vai ler
2988060	2989100	o comentário dele, vai lá.
2990800	2992220	Tudo bem, tudo bem, tudo bem.
2992660	2994020	Ah, um zumbi!
2994560	2996220	Ah, não. Ele está apenas
2996220	2997820	contemplando o vasto,
2998040	2999540	a vasta imensidão do céu.
2999840	3001780	Olá, guacha, guacho,
3002040	3003720	guacho sociedade e
3003720	3006240	juvidade do dia. Que episódio
3006240	3007860	divertido. Ação,
3008100	3009740	investigação e romance.
3010120	3011740	Os personagens foram incríveis
3011740	3014200	e a sincronia entre os jogadores também.
3014200	3016100	Só eu que tive a impressão,
3016120	3018340	que eles realmente se conheciam
3018340	3020320	a vida toda. Os personagens,
3020720	3022300	a Ágata, foi incrível
3022300	3024520	como sempre. O padrão porrada
3024520	3026600	e suas infalíveis técnicas
3026600	3028400	de paquera. Tarinê,
3028860	3030180	bem, sendo ela mesma.
3030860	3032240	Extrovertida e verdadeira.
3032520	3034440	Será que a arte copia
3034440	3036340	a realidade? E o João Pedro?
3036800	3038180	No caso, ele estava falando de mim aqui,
3038380	3039540	não é eu.
3039840	3042000	É você falando em você, é o terceiro pessoal.
3043120	3044060	Ai, meu Deus.
3044060	3045800	Esse eu já sou,
3045800	3048060	tendencioso a falar, mas foi fiel
3048060	3050280	ao personagem e deu um contraste
3050280	3052140	ótimo. Nem sempre todos
3052140	3053500	são corajosos. Ah,
3053960	3056000	e a vaquinha? Amei fazer carinho
3056000	3057040	nela. Pera.
3057780	3059940	O Nolan, eu mesmo sou
3059940	3062060	apenas um morcego amigável buscando o caminho
3062060	3064020	de casa. Bem, acredito
3064020	3065240	que as...
3065240	3068080	Eu acredito que as perguntas
3068080	3070060	já foram feitas, então
3070060	3071980	vou deixar nas mãos dos
3071980	3073640	devidos responsáveis.
3073640	3075660	Bem, vou voltar a bater
3075660	3077260	minhas asas. Até o próximo
3077260	3080000	pessoal e uma ótima aventura
3080000	3081160	barra semana a vocês.
3081500	3083200	Obrigado, querido morcego de roca,
3083500	3084440	pelo seu comentário.
3085760	3087360	O próximo comentário é da
3087360	3089280	Iwakika, maravilhosa, mora aqui perto.
3089620	3091640	Me deu um gostinho maravilhoso e eu fiquei
3091640	3093180	alugando o senhor Iwakika
3093180	3095820	falando de anime no evento que a gente se encontrou
3095820	3097500	uma vez. Olá, guaxa criatura!
3097720	3099720	Só vim dizer que eu cairia na armadilha da senhorinha
3099720	3101740	também. Excelente episódio, obrigado a todos.
3101740	3103240	É porque você é fofa e maravilhosa.
3103760	3105400	E pessoas fofas e maravilhosas,
3105660	3106900	seriam todas devoradas.
3107520	3109960	Tala Slade,
3110180	3111580	eu realmente
3111580	3113860	não consegui pronunciar seu nome.
3114220	3115680	É assim mesmo.
3116020	3117700	Boa noite, mestre dos
3117700	3119620	mestre dos guaxas,
3120040	3121720	que é tipo o mestre dos
3121720	3123480	magos, só que versão em guaxinim.
3123900	3126020	Jubidade do dia e guaxa
3126020	3127780	versus. Que é o que o João
3127780	3128920	prefere, que é a Jubidade.
3129360	3131380	É só apenas uma mera coincidência.
3132180	3134080	Meu Deus,
3134080	3135620	que final foi esse?
3135660	3136760	Expectativa.
3138520	3140340	Personagem da Tarinê.
3140680	3142000	Sorry, eu sou apenas
3142000	3143600	para guardar nomes.
3143740	3145480	Sorry, eu sou péssima para guardar nomes.
3145720	3147840	Virando zumbi pela rolagem da Agatha
3147840	3150260	para verificar se ela tinha se machucado
3150260	3152360	lá no começo da história.
3152720	3154080	E acabei matando
3154080	3156040	e acabar matando
3156040	3157560	todo mundo. Realidade,
3157780	3159720	a velhinha fofa que me fez
3159720	3162020	acreditar que ia ter um final fofinho
3162020	3164160	e feliz no meio de um apocalipse
3164160	3165360	e o pior inimigo que eu tinha visto.
3165360	3165620	E o pior inimigo que eu tinha visto.
3165620	3167300	É, é o pior inimigo.
3167440	3168460	E matou todo mundo.
3168700	3171380	E me senti representada pela Agatha
3171380	3172960	como personagem com
3172960	3174580	heterocromia.
3174900	3177540	Meu fursona é um
3177540	3179960	meu fursona é um husky
3179960	3181700	com um olho direito azul
3181700	3183940	e piscina e o esquerdo
3183940	3184660	verde água.
3185100	3187600	Biscoito para todos em formatos de
3187600	3189060	vaca indo para o brejo.
3189360	3190080	Até a próxima.
3190320	3192840	Eu queria reclamar
3192840	3194980	que o jogador não só comenta
3194980	3195540	só no episódio.
3195540	3197840	Ele joga, como ele comenta
3197840	3198820	duas vezes.
3199400	3201180	João, João, te lê, João. Vai lá.
3201500	3203020	Não! Tá bom.
3203400	3205680	Vamos lá. Boa noite, bom dia,
3205820	3207800	boa tarde para todo Guaxaverso.
3208240	3209520	Primeiro, quero agradecer
3209520	3211380	a todos os 50% do episódio.
3211760	3213460	Guaxa com suas histórias incríveis,
3213880	3215940	Zorzal pela edição maravilhosa
3215940	3217780	e os padrinhos pelos NPCs.
3218000	3219400	E as minhas companheiras
3219400	3220640	de missão, que
3220640	3223360	me arrancaram da caverna.
3223360	3224860	É, deixa claro,
3224860	3227100	Tarinê, estou ainda chateado
3227100	3229320	de você ter me tirado da minha zona de conforto.
3229340	3231220	Por ter me arrancado da caverna.
3231420	3233480	Além de ser uma experiência
3233480	3235360	incrível poder conhecer vocês,
3235720	3237260	a melhor parte é aproveitar
3237260	3239120	o gancho... A melhor parte
3239120	3241080	aproveitando o gancho, venha ser
3241080	3243140	um padrinho você também. Sim, você
3243140	3245120	mesmo, ouvinte. Venha para
3245120	3246920	a melhor comunidade da internet.
3247360	3249060	Você será recebido de braços
3249060	3251140	abertos por todos e terá acesso
3251140	3253020	a grupos interessantes e
3253020	3254840	poderá jogar RPGzinho com a sua
3254860	3257100	galera. Não perca mais
3257100	3259340	tempo. Ok, voltando,
3259560	3261420	não tenho muitas teorias do episódio,
3261800	3262680	mas acredito,
3263020	3264940	aí eu vejo que
3264940	3266900	a minha única teoria foi por água
3266900	3268980	abaixo na leitura, eu acredito
3268980	3270980	que não seja do mesmo universo da
3270980	3272900	trilogia da cigarra, caso tivesse
3272900	3274700	ligação entre os episódios.
3274740	3276000	Mesmo sendo zumbis,
3276500	3279120	é uma pegada, é, mesmo sendo zumbis,
3279220	3281240	é uma pegada e uma pegada parecida,
3281400	3282920	os zumbis são muito diferentes
3282920	3284760	e tive a impressão que as datas dão
3284760	3286480	batem. De qualquer forma,
3286880	3289020	vou deixar as teorias para os profissionais.
3289240	3290780	Vou encerrar aqui com biscoitos
3290780	3292600	em formato de vaquinhas e uma
3292600	3294640	ótima noite a todos. Será que
3294640	3296900	invoquei o Vermais? E mojo de olhinho.
3297100	3298460	Pena que não, porque não fui eu que li.
3299900	3300660	Obrigado, João.
3301740	3302560	Próximo comentário,
3302660	3304700	o pessoal tava brigando, Agatha, o Ju,
3305240	3306880	eu, porra, vou ler aqui
3306880	3308780	o comentário dela, nossa
3308780	3310960	maravilhosa Shelly Poison
3310960	3312960	que coloca. Olá, gente linda
3312960	3314660	que escuta, participa e
3314660	3316820	alimenta esse podcast, tal qual
3316820	3318180	os jogadores alimentaram a Sarah.
3318440	3320580	Espero que estejam todos bem, estamos todos bem.
3321360	3321600	O
3321600	3324620	Apocalipse Zumbi é um dos meus temas
3324620	3326680	favoritos, mas realmente precisamos de
3326680	3328820	mais histórias com vacas. Dona Neves
3328820	3330580	está aliviada que a vaca e o
3330580	3332900	bezerro não sofreram maus tratos
3332900	3334260	durante o episódio. É verdade.
3334600	3336580	Os animais só são maltratados nos episódios
3336580	3338060	quando os jogadores também são animais.
3338320	3340280	Tipo os episódios de...
3340280	3342500	de animais. Inclusive, sobre a vaca
3342500	3344580	parindo e a Agatha Sofia usando
3344580	3346400	a desculpa da camisa suja pra
3346400	3348680	sensualizar. Amiga,
3348840	3350660	a calça certamente estaria numa situação
3350660	3352440	muito pior. Perdeu a chance.
3352740	3354700	Andamento da história perfeito. Achava
3354700	3356580	que o grupo resolveria...
3356580	3358200	resolvia muito fácil o objetivo.
3358540	3359940	Só pra ter outro objetivo.
3360420	3362680	Encontra a vaca, encontra o Lourenço,
3363040	3364540	encontra os fios, para chegar
3364540	3365840	nessa reviravolta final.
3366200	3368320	Ô Marcelo Gostinim, reforçando que
3368320	3370000	não se pode gostar de velho mesmo.
3370300	3372540	Que absurdo. E falando na velha, tem uma
3372540	3374420	pergunta de bastidores. O Guaxa deixou o
3374420	3376440	caminho bem pavimentado, com a velha
3376440	3378260	coincidentemente sendo capaz de consertar
3378260	3380300	equipamentos eletrônicos e mecânicos. Bem quando
3380300	3382280	o grupo perde o mecânico deles.
3382600	3384220	Se os jogadores não tivessem se apaixonado
3384220	3386780	pela velhinha, a ideia era ela se oferecer
3386780	3388220	pra consertar o jogador?
3388700	3390320	Ou quanto você pensou em insistir
3390320	3392400	que ela fosse com eles? Ela ia se
3392400	3394560	oferecer, mas ela não ia insistir.
3395540	3396440	É... Eu ia fazer
3396440	3397900	as jogadas difíceis pros jogadores,
3398300	3399860	pra eles dar um jeito de consertar o gerador.
