start	end	text
2368000	2369440	Meninas Superpoderosas
2369440	2370920	Meninas Superpoderosas
2370920	2372460	Ok, maravilhoso
2372460	2374760	Quer deixar algum recado final neste áudio?
2375200	2376060	Um recadinho final?
2376540	2378560	Pra quem não é padrinho, venha ser padrinho
2378560	2385080	A taverninha é o lugar mais aconchegante do planeta Terra que existe
2385080	2385740	É verdade
2385740	2387320	Você conhece muitas pessoas maravilhosas
2387320	2389680	Não tão maravilhosas quanto a Dani
2389680	2392320	A própria Dani
2392320	2393240	E o Felipe também
2393240	2395000	Que no fim se juntaram ali
2395000	2397680	Mas você pode encontrar também sua pessoa maravilhosa
2397680	2398600	Lá de alguma forma
2398600	2400520	E conhecer essas pessoas maravilhosas
2400520	2401620	Querendo ou não ser amigo
2401620	2403880	Da Dani, da Fábio, da Ju
2403880	2406440	Conversar comigo, com o Trota
2406440	2408820	Com a Anabê, com a Agatha
2408820	2411080	Com a Amanda, com a Rafa
2411080	2412380	Com a Mel, o que mais?
2412480	2413020	Um monte de gente
2413020	2415440	Com o Henrique, com o Leonardo
2415440	2417440	Com todo mundo que eu falei antes
2417440	2420620	Quero deixar um beijo no coração de vocês
2420620	2422000	E dizer que eu acho que só existe
2422000	2425260	Tem uma coisa que eu lembrei agora
2425260	2425720	Manda
2425720	2427520	Hoje no dia da gravatação
2427680	2429940	É aniversário do
2429940	2431680	Caio, nosso querido teórico
2432200	2433200	Do Guaxaverso
2433200	2434400	O Craio
2434400	2437360	Então um beijo pro Craio
2437360	2438780	Cara, assim
2438780	2441040	Você é uma pessoa maravilhosa
2441040	2442280	Um beijo no seu coração
2442280	2445700	Saiba que o RPG Guaxa só existe porque você existe
2445700	2448100	E que o Guaxaverso só existe
2448100	2449220	Dani
2449220	2450920	O Guaxaverso existe
2450920	2452840	Infelizmente não
2452840	2454980	Poxa, que pena, né
2454980	2456680	Um beijo, gente, e até a próxima
2456680	2457520	Até mais
2457680	2459680	Tchau
2487680	2488620	Dois acertos
2488620	2489860	A hora que tu balança
2489860	2491040	Deixa eu falar de novo
2491040	2494860	Eu também tô ouvindo o eco da minha voz
2494860	2496260	No áudio da Fabi
2496260	2497860	No meu?
2498460	2499180	Eu acho que sim
2499180	2501660	Eu acho que é no da Dani
2501660	2503980	Por causa da sensibilidade
2503980	2505100	Deixa eu ver aqui
2505100	2509540	O Audacity não tá pegando, né?
2509780	2511280	Não, não, o Audacity não pega
2511280	2513100	Então tá, então vamos lá
2513100	2514220	Vamos ver agora
2514220	2516840	Pronto
2516840	2517660	Acho que não tá pegando
2517680	2518880	Agora vai melhorar um pouquinho
2518880	2521740	Zorzal, ignorando, vamos voltar
2521740	2522980	Dora
2522980	2524280	Dora
2524280	2525040	Dora
2525040	2528140	Eu não sei porque eu esqueci que era Dora
2528140	2531300	Cutuca ela, Felipe
2531300	2534540	Dora
2534540	2537020	Seis e três
2537020	2539860	De novo, calma
2539860	2540460	Respira
