start	end	text
2423640	2425640	Tu vai chegar perto do
2425640	2427640	palhaço? Sim.
2427640	2429640	Os outros dois? Eu quero ver as outras
2429640	2431640	coisas. Os danos, já sei que
2431640	2433640	tá todo mundo morto.
2433640	2435640	Eu vou procurar
2435640	2437640	recursos, né? Comida,
2437640	2439640	o que der pra gente fazer, porque a gente vai ter
2439640	2441640	que sair daqui. E ver se tem alguém vivo.
2441640	2443640	Tá. E a Nyx? Nisso que ele tá
2443640	2445640	procurando algum recurso, eu falo pra ele procurar
2445640	2447640	alguma bandagem pra mim.
2447640	2449640	E... eu quero
2449640	2451640	procurar algo...
2451640	2453640	Bom, por mais que a cena esteja
2453640	2455640	horrorosa, fora do comum.
2455640	2457640	Tem algo fora do comum. Tá bom.
2457640	2459640	Cinzo rola dois dados.
2459640	2461640	Seis e cinco.
2461640	2463640	Pra procurar ali, é uma ação mental.
2463640	2465640	Tu encontra faixas de
2465640	2467640	tecido que tu pode ajudar. Tanto os ferimentos
2467640	2469640	dos teus dois irmãos, né? Em especial
2469640	2471640	da Nyx. Tu encontra roupas
2471640	2473640	limpas de vocês que vocês
2473640	2475640	trocam de um show pro outro. Então vocês tem
2475640	2477640	outras roupas pra vocês ali. Tu encontra
2477640	2479640	comida. Sobrou bastante pão.
2479640	2481640	Um pouco de carne da noite de ontem.
2481640	2483640	Alguma coisa tá caída do
2483640	2485640	chão, mas alguma coisa ainda tá sobre
2485640	2487640	travessas e algumas caixas que sobraram.
2487640	2489640	Mais facas. Mais
2489640	2491640	armas. O que vocês precisarem ali, tu acaba
2491640	2493640	encontrando. Tu consegue o que tu
2493640	2495640	precisava. Ou seja, ninguém vivo, né?
2495640	2497640	Ninguém vivo. Nyx rola dois dados.
2499640	2501640	Três e um. Tu nota que os animais
2501640	2503640	não tem nenhum animal por ali.
2503640	2505640	Nota que as jaulas também não tão ali.
2505640	2507640	A própria lona gigantesca do
2507640	2509640	circo não tá ali. Tu sabe
2509640	2511640	que o ataque ali
2511640	2513640	levou algumas pessoas, mas não tem
2513640	2515640	nada. Não chegou a afetar vinte por cento
2515640	2517640	do total das pessoas
2517640	2519640	que trabalham no circo. E a estrutura
2519640	2521640	principal do circo conseguiu ser elevada.
2521640	2523640	Isso qualquer um que procurasse iria notar.
2523640	2525640	Como tu falhou. Tu não faz ideia
2525640	2527640	de pra onde esse circo foi. Mas
2527640	2529640	tu sabe que tem gente com vida. Eles
2529640	2531640	só não estão por aqui. Agora o
2531640	2533640	Anisus que chegou perto do
2533640	2535640	palhaço branco. Tu chega
2535640	2537640	perto dele. Tu consegue ver que
2537640	2539640	ele tá com uma respiração bem leve.
2539640	2541640	E ele chega a abrir um olho assim.
2541640	2543640	O outro tá muito inchado.
2543640	2545640	Ele tem muitos ferimentos.
2545640	2547640	Aquela roupa branca dele, aquela maquiagem dele
2547640	2549640	tá completamente vermelha.
2549640	2551640	Tu sabe que a maior parte desse sangue
2551640	2553640	nem é dele. Ele move
2553640	2555640	o bigode. E um
2555640	2557640	dos mortos próximo a ele
2557640	2559640	começa a falar. Sem mover a boca.
2559640	2561640	Mas a voz vem dali. Tu sabe que isso é
2561640	2563640	provavelmente um dos truques de ventriloquismo
2563640	2565640	dele. Esse morto fala com uma
2565640	2567640	voz engraçada. O circo se
2567640	2569640	foi. Mas foi com
2569640	2571640	peso no coração em deixar todos
2571640	2573640	nós para trás.
2573640	2575640	Minha jornada acabou.
2575640	2577640	Eu errei muito no passado.
2577640	2579640	Até chegar aqui.
2579640	2581640	Não acho que meu sacrifício
2581640	2583640	vai apagar todos os meus pecados.
2583640	2585640	Mas vocês
2585640	2587640	são jovens.
2587640	2589640	O circo ainda precisa de vocês.
2591640	2593640	Eles foram para a capital.
2593640	2595640	Uma grande
2595640	2597640	festa vai acontecer.
2599640	2601640	E vocês foram convidados.
2603640	2605640	E a boba?
2605640	2607640	A boba foi? Ela ficou?
2607640	2609640	A cabeça dele
2609640	2611640	cai meio de lado em silêncio.
2611640	2613640	Eu começo a
2613640	2615640	vejo que meus irmãos
2615640	2617640	me seguiram e começo a voltar em direção a eles.
2617640	2619640	A gente escuta
2619640	2621640	o que ele falou, né? Não, foi só pro
2621640	2623640	planismo. Eu sento assim, que eu tô cansado
2623640	2625640	e falo assim, capital
2625640	2627640	o circo foi levado. Ou eles foram
2627640	2629640	eu não sei. O grandalhão
2629640	2631640	se sacrificou ficando aqui.
2631640	2633640	Quanto tempo daqui pra capital? É, a gente
2633640	2635640	tem essa noção? Vocês sempre viajaram
2635640	2637640	com o circo, vocês não fazem ideia. E o circo
2637640	2639640	nunca foi na capital.
2639640	2641640	Qual é a cidade mais perto, tirando esse
2641640	2643640	acampamento que a gente tava apresentando?
2643640	2645640	Vocês passaram numa cidade
2645640	2647640	a dois dias de
2647640	2649640	viagem dali.
2649640	2651640	O acampamento ele ficava ali perto
2651640	2653640	ou não? Ficava ali junto do circo
2653640	2655640	e tá tudo destruído.
2655640	2657640	Eu lembro da cidade que a gente passou.
2657640	2659640	Alguém sabe pra onde é que fica a capital?
2659640	2661640	Não. Bom,
2661640	2663640	o circo devia ter algum itinerário. Como
2663640	2665640	uma das aspirações
2665640	2667640	do Cinzo é se tornar
2667640	2669640	o dirigente, né? Não sei
2669640	2671640	como é que é o nome. O cara que cuida do circo
2671640	2673640	eu devo saber se tem
2673640	2675640	onde que tinha itinerário
2675640	2677640	como é que funcionava
2677640	2679640	como é que era o plano
2679640	2681640	Fala lá, dois dados.
2681640	2683640	Três, três. Tu não faz
2683640	2685640	ideia. Ai meu
2685640	2687640	Deus. É
2687640	2689640	se eu procurar no bolso
2689640	2691640	dos mortos, dos soldados mortos
2691640	2693640	alguma coisa assim. Não é bolso, mas
2693640	2695640	é por dentro. Tipo, pra saquear
2695640	2697640	ele. Será que eu encontro algum mapa? Alguma coisa
2697640	2699640	assim? Não. Tu encontra algumas moedas
2699640	2701640	só. Nada demais. O circo não
2701640	2703640	possuía nenhum mapa. Ou se possuía
2703640	2705640	foi levado junto com o que foi. Isso.
2705640	2707640	Quem cuidava de todos esses itinerários
2707640	2709640	normalmente era boba. Eu acho que a gente
2709640	2711640	pode voltar naquela cidade
2711640	2713640	pra perguntar direções. Talvez
2713640	2715640	a gente esteja indo pra direção oposta
2715640	2717640	mas ir a esmo
2717640	2719640	não é uma boa ideia. Ou então a gente pode
2719640	2721640	olhar os rastros do pra onde foi
2721640	2723640	porque toda vez que o circo se movimenta
2723640	2725640	a gente sabe que é
2725640	2727640	um monte de gente, então deve ter
2727640	2729640	rastro, pasto de gente
2729640	2731640	alguma coisa assim. Tem elefante
2731640	2733640	e tudo, sim. Eu acho, mas só uma
2733640	2735640	pergunta. A gente amanheceu com chuva?
2735640	2737640	Tipo, a gente acordou com chuva na gente?
2737640	2739640	Não, era o vale da manhã só.
2739640	2741640	No que ele fala isso, eu começo a olhar
2741640	2743640	as redondezas pra saber se tem alguma
2743640	2745640	direção. Dois dados.
2745640	2747640	Seis
2747640	2749640	e três. O Anísio
2749640	2751640	tirou um acerto crítico, um acerto comum.
2751640	2753640	Pra ti é bem óbvio. Tu vê que tanto a cidade
2753640	2755640	mais próxima, quanto o caminho
2755640	2757640	que o circo fez, é uma
2757640	2759640	trilha só. Pra ti é bem simples
2759640	2761640	seguir aquilo ali. Pessoal, eu
2761640	2763640	achei a trilha. Eu só acho que a gente tem que descansar
2763640	2765640	um pouco. A Nyx tá ferida
2765640	2767640	eu tô ferido. E eu acho que a gente
2767640	2769640	tem que pegar umas armaduras
2769640	2771640	desses soldados. Eu não sei.
2771640	2773640	Eles eram soldados inimigos.
2773640	2775640	A gente tava no reino que eles
2775640	2777640	estavam atacando ou no reino deles?
2777640	2779640	A gente tem essa noção? Você estava num acampamento
2779640	2781640	de refugiados que foi atacado.
2781640	2783640	Provavelmente esse é o lado
2783640	2785640	esse não é o lado deles, né? Embora
2785640	2787640	pareça que eles tão levando a melhor nessa guerra.
2787640	2789640	Significa que da onde eles vieram
2789640	2791640	eles já vieram tocando terror. Sim.
2791640	2793640	Mas eu não acho que
2793640	2795640	fantasiado de soldados
2795640	2797640	que tão atacando esse reino vai ser muito bom
2797640	2799640	numa cidade desse reino.
2799640	2801640	A gente leva as armaduras na bolsa.
2801640	2803640	Caso seja necessário a gente usa.
2803640	2805640	Não precisa ir usando.
2805640	2807640	É, acho que isso é uma boa ideia.
2807640	2809640	Cindy, você encontrou alguma coisa pra
2809640	2811640	eu ver isso aqui?
2811640	2813640	Ah, sim. Desculpa.
2813640	2815640	Eu tenho bandagem, tenho
2815640	2817640	mais armas e tenho
2817640	2819640	comida. Basicamente o que a gente vai precisar
2819640	2821640	pra sair daqui pra lá.
2821640	2823640	Ah, eu quero fazer os meus socorros
2823640	2825640	na Nyx. Levando em
2825640	2827640	consideração que como eu faço a parte
2827640	2829640	com torcionismo, possivelmente eu já
2829640	2831640	machuquei bastante, então eu saiba
2831640	2833640	fazer isso mais naturalmente
2833640	2835640	pra fazer nela. Por favor.
2835640	2837640	Vocês conseguem tranquilamente fazer
2837640	2839640	ali todo o processo de
2839640	2841640	bandagem, né? De cuidar dos ferimentos?
2841640	2843640	E se alimentam e tal?
2843640	2845640	Vocês passaram a noite até
2845640	2847640	de manhã, né? Foram 12 horas pelo menos.
2847640	2849640	E vocês vão seguir então a trilha, é isso?
2849640	2851640	Vocês decidiram ir de armadura ou sem armadura?
2851640	2853640	Sem armadura.
2853640	2855640	Mas a gente tá levando pra caso
2855640	2857640	a gente precise. Perfeito.
2867640	2869640	Vocês viajam por dois dias
2869640	2871640	pra dormir durante a noite, fazem
2871640	2873640	rodízios de vigia, né?
2873640	2875640	Pra não ter perigo. E dois dias
2875640	2877640	depois, quando já tá próximo, assim,
2877640	2879640	o sol tá bem alto,
2879640	2881640	os alimentos vocês já consumiram
2881640	2883640	quase todos. Quem não consumiu
2883640	2885640	já começou a apresentar
2885640	2887640	um cheiro e um gosto não tão agradável.
2887640	2889640	Porque não era comida de
2889640	2891640	viagem, né? A comida foi preparada naquela noite.
2891640	2893640	No meio da floresta
2893640	2895640	deu pra gente pegar alguma coisa?
2895640	2897640	Algumas frutas, alguma coisa, sim. Sem problema.
2897640	2899640	Tem animais também?
2899640	2901640	Vocês não encontraram animais? Não.
2901640	2903640	Vocês nunca foram caçadores, né?
2903640	2905640	Então vocês não conseguiram encontrar nada assim.
2909640	2911640	Vocês chegam na cidade.
2911640	2913640	É uma cidade razoavelmente próspera.
2913640	2915640	Parece que tem bastante construções,
2915640	2917640	bastante gente indo de um lado pro outro.
2917640	2919640	Ela é próxima de uma região que tem algumas
2919640	2921640	montanhas. Não tem soldados ali.
2921640	2923640	Não tem portões, né?
2923640	2925640	A cerca é baixa.
2925640	2927640	Tem alguns cidadãos que estão ali de um lado pro outro.
2927640	2929640	Eles olham pra vocês. Vocês estão com a
2929640	2931640	roupa do circo colorida e tal.
2931640	2933640	É isso? Eu acho que com uma roupa mais casual.
2933640	2935640	Não, é roupa casual.
2935640	2937640	Não a roupa que a gente usa em cenação,
2937640	2939640	mas uma roupa mais casual.
2939640	2941640	Eu imaginei com alguma roupa que eu treino.
2941640	2943640	Alguma roupa mais neutra. Todos estão neutros
2943640	2945640	então. Tá. Aí as pessoas
2945640	2947640	olham assim meio desconfiadas pra vocês.
2947640	2949640	O Anisos rola dois dados pro grupo.
2951640	2953640	Três e dois. Três, certo crítico.
2953640	2955640	Eles olham pra vocês pra ver se vocês
2955640	2957640	são ameaças. Aí vocês
2957640	2959640	conseguiram esconder bem as armaduras
2959640	2961640	e as armas. Então
2961640	2963640	eles olham
2963640	2965640	parece que vocês são inofensivos
2965640	2967640	e as pessoas voltam pro dia a dia
2967640	2969640	delas e tal. O que vocês vão fazer?
2969640	2971640	Guax, a gente passou quanto tempo
2971640	2973640	nessa cidade? Vocês não pararam.
2973640	2975640	Vocês só passaram com a comitiva
2975640	2977640	do circo. A gente não parou
2977640	2979640	pra fazer a apresentação não. Não parou. Não.
2979640	2981640	Bem, a Nyx tem algumas moedas.
2981640	2983640	Eu acho que a gente pode
2983640	2985640	ir numa taberna
2985640	2987640	ou algum estabelecimento de comitiva.
2987640	2989640	Pra comer alguma coisa
2989640	2991640	decente e pedir
2991640	2993640	informação. Vocês
2993640	2995640	procuram uma taberna ali então, né?
2999640	3001640	Assim que vocês entram, vocês
3001640	3003640	notam bastante homens
3003640	3005640	barbudos, meio
3005640	3007640	sujos de pó e de terra.
3007640	3009640	Alguns deles tem uma picareta
3009640	3011640	próxima das suas mesas.
3011640	3013640	Eles olham pra vocês e depois
3013640	3015640	voltam com os pratos de comida, parecem todos
3015640	3017640	bem cansados. O taberneiro abre um
3017640	3019640	sorriso largo pra vocês. Bem-vindos
3019640	3021640	jovens viajantes. Fugindo
3021640	3023640	da guerra? As minas precisam
3023640	3025640	de braços fortes e minha taberna é de uma
3025640	3027640	mocinha esperta para servir as mesas
3027640	3029640	caso estejam procurando empregos.
3029640	3031640	É, obrigado pelo convite, mas
3031640	3033640	nós estamos só de passagem.
3033640	3035640	Oh, então estão indo pra grande festa
3035640	3037640	na capital? Isso, isso.
3037640	3039640	Aliás, ouvi falar dessa grande
3039640	3041640	festa, mas não sei exatamente
3041640	3043640	o que tem. O que vai ter nessa grande festa?
3043640	3045640	Você sabe me dizer? Não sei.
3045640	3047640	Sei que a capital vai estar em festa.
3047640	3049640	Muitos nobres foram para lá.
3049640	3051640	Muita gente com dinheiro.
3051640	3053640	Sei que os jovens como vocês estão
3053640	3055640	indo pra viver uma aventura.
3055640	3057640	Pra ver uma vida que nunca vão viver.
3057640	3059640	Sim. Inclusive,
3059640	3061640	nós... Bem, é a primeira vez
3061640	3063640	que nós estamos indo e nós estamos
3063640	3065640	meio perdidos. Tem como você informar
3065640	3067640	o caminho pra capital?
3067640	3069640	Nós não queremos
3069640	3071640	ficar gastando viagens. Nós descobrimos que o show
3071640	3073640	vai ser em poucos dias.
3073640	3075640	Então, nós queremos ir o mais
3075640	3077640	rápido possível, né? É verdade.
3077640	3079640	A festa começa em breve. Seria
3079640	3081640	bom comprarem cavalos, então...
3081640	3083640	Pois é, é isso que eu ia
3083640	3085640	perguntar. Tenho três bons
3085640	3087640	cavalos. Eles podem ser de vocês
3087640	3089640	por doze moedas.
3089640	3091640	Só dois cavalos eu acho que daria.
3091640	3093640	Também acho. Nove moedas, então?
3093640	3095640	Oito moedas. Uma refeição quente
3095640	3097640	pra cada um de vocês,
3097640	3099640	mais as bebidas e os cavalos
3099640	3101640	e fechamos em dez moedas. Pode ser?
3101640	3103640	Perfeito. Perfeito.
3103640	3105640	Luana, quantas moedas tu achou? Fala
3105640	3107640	em quadrados.
3107640	3109640	Treze.
3109640	3111640	Três moedas.
3111640	3113640	E se ali não se desse
3113640	3115640	um, um e um, né?
3115640	3117640	Certidão. Muito obrigado.
3117640	3119640	Vamos ver três
3119640	3121640	bebidas e alguma comida.
3121640	3123640	Tu consegue, vocês ganham a refeição quente ali.
3123640	3125640	A bebida, ele serviu
3125640	3127640	pra vocês já.
3133640	3135640	Os cavalos, eles mostram
3135640	3137640	branco com algumas manchas cinzas
3137640	3139640	e um cavalo preto também
3139640	3141640	com manchas cinzas. Eles mostram
3141640	3143640	no estábulo pra vocês. Os cavalos
3143640	3145640	de vocês são esses dois.
3145640	3147640	Vocês vêem que tem um terceiro marrom assim, que todo marrom.
3147640	3149640	Aquele continua comigo.
3149640	3151640	Tiveram suas refeições e esses cavalos.
3151640	3153640	Boa sorte a vocês.
3153640	3155640	Muito obrigado.
3159640	3161640	A gente sabe cavalgar,
3161640	3163640	sabe, né? É, a Nix
3163640	3165640	é bem até, doma vários tipos
3165640	3167640	de animais, né? E ela pode ajudar vocês.
3167640	3169640	Todo mundo consegue ali. O importante é
3169640	3171640	vocês são três pessoas e dois cavalos.
3171640	3173640	Como é que é a distribuição de vocês? Certo.
3173640	3175640	Alguém tem que ir com a mochila.
3175640	3177640	A gente tem três mochilas. Um cavalo
3177640	3179640	vai com as mochilas e uma pessoa.
3179640	3181640	E o outro cavalo vai com duas pessoas.
3181640	3183640	Antes que alguém fale, eu guio um.
3183640	3185640	Certo.
3185640	3187640	Então, ela vai com as mochilas
3187640	3189640	e a gente fica com o outro cavalo?
3189640	3191640	Pode ser. Ok, então a Nix num cavalo
3191640	3193640	junto com as mochilas, né? E o outro cavalo?
3193640	3195640	O outro cavalo tá levando o Anísios e o
3195640	3197640	Sims. Vocês
3197640	3199640	vão fazer mais alguma coisa na cidade antes de partir?
3199640	3201640	Eu quero, antes que a gente
3201640	3203640	ir, ver se eu encontro alguém
3203640	3205640	pra ver se eu consigo alguma
3205640	3207640	informação da
3207640	3209640	festa, da capital em
3209640	3211640	si, dos outros povoados.
3211640	3213640	Rola um dado.
3213640	3215640	Quatro.
3215640	3217640	Quatro é o teu atributo. Vocês
3217640	3219640	vão conversando com algumas
3219640	3221640	pessoas, pegam algumas informações e a
3221640	3223640	Nix acaba descobrindo que o motivo da
3223640	3225640	festa é que a guerra tá chegando
3225640	3227640	ao fim. Vão assinar algum tipo de
3227640	3229640	tratado ou coisa do tipo. Então tá indo
3229640	3231640	regente de várias cidades
3231640	3233640	pra lá, pra aproveitar esse
3233640	3235640	momento, né? Que é muito esperado
3235640	3237640	por todos. Que a paz finalmente vai chegar
3237640	3239640	no reino. É isso que vai ser comemorado.
3243640	3245640	Vocês
3245640	3247640	pegam a estrada, seguem o máximo
3247640	3249640	que o cavalo aguenta até parar
3249640	3251640	pra descansar. Fazem seus
3251640	3253640	turnos de vigia, né?
3253640	3255640	Vocês estão na metade do segundo
3255640	3257640	dia. Seria o último.
3257640	3259640	Vocês estão na estrada andando.
3259640	3261640	Na direção oposta, vem uma carroça
3261640	3263640	com o estandarte do
3263640	3265640	exército. Vocês notam que um soldado
3265640	3267640	com armadura similar àqueles que
3267640	3269640	vocês encontraram, tá guiando essa carroça.
3269640	3271640	Ela tá vindo no sentido oposto.
3271640	3273640	Lentamente ali. Eu olho pros dois
3273640	3275640	e vocês acham que vale a pena
3275640	3277640	a gente se armar
3277640	3279640	ou não? Ele já viu a gente?
3279640	3281640	Tipo, daria pra ele já ter visto a
3281640	3283640	gente ou a gente percebeu primeiro?
3283640	3285640	Ele já viu vocês. E não aumentou
3285640	3287640	a velocidade da carroça. Bem, eu acho que a gente
3287640	3289640	pode tentar passar normalmente.
3289640	3291640	Nós somos pessoas indo pra capital
3291640	3293640	ou somos
3293640	3295640	pessoas normais indo pra capital
3295640	3297640	ver o show.
3297640	3299640	Vocês então vão
3299640	3301640	passando ali. Eu vou rolar dois dados.
3303640	3305640	O homem que tá guiando a carroça, ele faz sinal com a
3305640	3307640	mão pra vocês diminuírem a
3307640	3309640	velocidade. Ele começa a parar
3309640	3311640	mais ou menos, puxar a rédea do cavalo dele
3311640	3313640	quando tá chegando mais próximo a vocês.
3313640	3315640	Eu vou diminuir no meu
3315640	3317640	e eu aviso nisso pra fazer o mesmo.
3317640	3319640	Eu falo, boa tarde moço.
3319640	3321640	Tudo bom? Boa tarde, gente.
3321640	3323640	Vocês estão indo pra capital? Ah, sim.
3323640	3325640	Nós ficamos sabendo do grande show
3325640	3327640	e apesar de sabermos que
3327640	3329640	não vamos conseguir entrar, a gente queria
3329640	3331640	pelo menos vislumbrar um pouco.
3331640	3333640	Tá lotado aquilo de lá.
3333640	3335640	Achei que por ser soldado eu conseguiria umas
3335640	3337640	bebidas de graça, mas fui barrado.
3337640	3339640	Muito complicado, a gente ganha
3339640	3341640	guerra e não consegue nem ter um pouco
3341640	3343640	do prazer das
3343640	3345640	festejos. E não é verdade?
3345640	3347640	É muito injusto isso. Batalhamos
3347640	3349640	tanto tempo e essa guerra
3349640	3351640	finalmente acabando, acho que o povo
3351640	3353640	tinha que se recompensar também, principalmente
3353640	3355640	soldados como vocês que lutaram bravamente.
3355640	3357640	Verdade.
3357640	3359640	Vocês tão vindo de onde?
3359640	3361640	A gente tá vindo da cidadezinha aqui atrás.
3361640	3363640	Aquela da mineração?
3363640	3365640	Isso, a cidade dos mineradores. Terra boa.
3365640	3367640	Boa cerveja.
3367640	3369640	Acho que quando a guerra acabar vou procurar um emprego
3369640	3371640	por lá. Ah, inclusive
3371640	3373640	eles estavam procurando mais mineradores
3373640	3375640	quando saímos. Assim,
3375640	3377640	quisemos ver o grande show, mas eles falaram
3377640	3379640	que sempre que voltar lá, procurar emprego
3379640	3381640	eles estão lá. Seria uma boa
3381640	3383640	depois dessa guerra. É uma ideia.
3383640	3385640	Vou me apresentar na fronteira.
3385640	3387640	Qualquer coisa a gente se encontra por lá
3387640	3389640	um dia. Provavelmente.
3389640	3391640	Isso aí, meu amigo. Ô moço,
3391640	3393640	se o Fer vai pra
3393640	3395640	lá, por que você tá indo pra cá?
3395640	3397640	Tá muito cheia a cidade.
3397640	3399640	Não tem cabimento ficar do lado de fora.
3399640	3401640	E você sabe o que vai ser esse grande show?
3401640	3403640	Você que tá vindo de lá?
3403640	3405640	Tem algum anúncio do que pode ser?
3405640	3407640	Vai ser o fim da guerra. Sim.
3407640	3409640	Parece que o príncipe realizou alguma
3409640	3411640	missão especial e deu fim
3411640	3413640	ao conflito. Hum, legal.
3413640	3415640	Deixa eu te fazer uma pergunta, chefe.
3415640	3417640	Tu ouviu falar de algum
3417640	3419640	circo, coisas assim?
3419640	3421640	Porque a gente ouviu falar que tinha um circo andando
3421640	3423640	por aí e a gente não viu nada não.
3423640	3425640	Circo? Não, não vi circo.
3425640	3427640	Tem um pessoal fantasiado,
3427640	3429640	mas circo mesmo eu não vi.
3429640	3431640	Deve ser isso.
3431640	3433640	Ah, tá bom então. Obrigado, hein.
3433640	3435640	Obrigado. Tenha uma boa viagem.
3435640	3437640	Igualmente pra vocês, jovens.
3437640	3439640	E vai andando devagar
3439640	3441640	na velocidade normal. Normal.
3441640	3443640	Ele não parece estar muito motivado
3443640	3445640	nem pra estar voltando, bem devagar.
3455640	3457640	Vocês terminam o resto da viagem,
3457640	3459640	começa a anoitecer, realmente
3459640	3461640	tem muita gente amontoada,
3461640	3463640	os portões da cidade estão fechados,
3463640	3465640	tem uma cidade do lado de fora
3465640	3467640	desses portões e muita gente
3467640	3469640	pelas ruas, muita falação,
3469640	3471640	tem algumas tavernas tocando música,
3471640	3473640	gente dançando. O que vocês vão fazer?
3473640	3475640	Eu quero andar por essa cidade,
3475640	3477640	principalmente aquela do lado de fora, pra procurar
3477640	3479640	alguém do circo.
3479640	3481640	Já que eu imagino que eu passei 10 anos,
3481640	3483640	eu imagino que tem alguém, tipo,
3483640	3485640	que nem a gente, neutro, casual.
3485640	3487640	Vocês chegam na cidade,
3487640	3489640	tem bastante gente bêbada, tem bastante gente
3489640	3491640	dançando, bastante gente incomodada,
3491640	3493640	em especial as pessoas que já moravam ali na cidade
3493640	3495640	antes dessa loucura toda começar a acontecer.
3495640	3497640	E rola um dado cada um.
3499640	3501640	Anisos?
3501640	3503640	Eu tirei um.
3503640	3505640	Nix? Quatro.
3505640	3507640	Quatro é o teu atributo, é um acento crítico.
3507640	3509640	O Cinzo? Dois.
3509640	3511640	Vocês estão passando ali pela rua principal,
3511640	3513640	dentro de uma das casas que parece uma
3513640	3515640	taberna que tá bem cheia,
3515640	3517640	Nix escuta risadas e aplausos,
3517640	3519640	coisas que são comuns pra vida de vocês,
3519640	3521640	mas faz tempo que vocês não escutam.
3521640	3523640	Vem de lá de dentro.
3523640	3525640	Eu... olho pela janela.
3525640	3527640	Tem um palhaço que trabalha no circo, né,
3527640	3529640	ele tá fazendo malabares com bolinhas,
3529640	3531640	aí ele erra as bolinhas caindo na cabeça dele,
3531640	3533640	ele tá lá fazendo umas palhaçadas,
3533640	3535640	o pessoal tá bêbado, tá adorando.
3535640	3537640	Gente, gente, gente! O Renan tá ali dentro
3537640	3539640	da taberna, vem, vem, vem, vem!
3539640	3541640	Eu só, tipo,
3541640	3543640	de cor eu tô entrando.
3543640	3545640	Show, é a mesma coisa, vocês também vão entrando.
3547640	3549640	O lugar tá bem cheio,
3549640	3551640	mas quando ele vê vocês,
3551640	3553640	ele joga as bolinhas pra cima,
3553640	3555640	e ele começa a engolir uma por uma,
3555640	3557640	então ele finge que tá
3557640	3559640	se afogando ali, é um toque
3559640	3561640	velho dele, e aquelas bolinhas
3561640	3563640	elas estouram dentro da boca dele,
3563640	3565640	vocês conhecem o que ele faz?
3565640	3567640	Ele então faz um movimento, todos batem palmas,
