start	end	text
0	17220	Você já notou que a maioria das pessoas nunca viu um diamante de perto?
17900	19760	Mas e você, você já viu um diamante de perto?
20460	23760	Algumas nunca vão receber um anel de casamento como dos filmes
23760	26640	A boba diria que casar é um erro, inclusive
26640	29300	Gente que não se orgulha do seu endereço
30000	31780	Ninguém escolhe onde nasce
31780	33760	Um subúrbio destruído
33760	36580	Ou no caso específico de hoje, um circo
36580	37960	O circo da boba
37960	41920	Já notou como todas as músicas parecem que só falam de dentes de ouro
41920	47080	Vodka, drogas no banheiro, manchas de sangue, vestidos de festa
47080	48780	Gente que não se importa
48780	52400	Gente que dirige cadilaques nos sonhos
52400	57260	No fundo todo mundo quer saber de champanhe, carrões, diamantes em relógios
57260	60360	Jatinhos, ilhas, tigres em coleiros de ouro
60360	61540	Mas não se importa
61540	64400	Pessoas que não são pegas em casos de amor
64400	67680	E nós nunca, nunca seremos da realeza
67680	70940	Isso não corre no nosso sangue
70940	72680	O maldito sangue azul
72680	74360	Esse tipo de luxo não é pra nós
74360	77400	Nós buscamos um tipo diferente de diversão
77400	80060	Deixe a boba ser sua soberana
80060	83180	A sua abelha rainha
83180	87220	A personagem principal da aventura de hoje
87260	88600	Três crianças
88600	90320	Vivendo no circo
90320	92720	E aprendendo muito mais
92720	94780	Do que fazer rir
94780	96000	Episódio de hoje
96000	98660	A boba, o circo e as crianças
98660	100040	Com o Alano Sabeão
100040	102360	Lá do Gerência Sem Experiência
102360	103700	Com o João Paulo Bunch
103700	105040	Do Paralelo B
105040	106940	E com o Wilson Negreiros
106940	109780	Lá do Vozes na Cabeça Podcast
109780	112300	Realidades Paralelas do Guaxinim
112300	114060	O sistema Guaxinim e Gambiarras
114060	117100	Nele, cada jogador possui apenas um único atributo
117260	118200	Vai de 2 a 5
118200	121100	Quanto maior o atributo, mais atlético é o personagem
121100	123440	Quanto menor, mais inteligente e carismático
123440	126220	Sempre que o jogador faz algo com uma chance de errar
126220	128840	Joga dois dados e precisa tirar seu atributo ou menos
128840	130800	Para ataques e ações físicas
130800	132460	E seu atributo ou mais
132460	134100	Para ações intelectuais ou sociais
134100	135920	Se a jogada for fácil
135920	137920	Ou tiver algum auxílio, joga um dado a mais
137920	140360	Se a jogada for difícil, rola-se um dado a menos
140360	142560	Eu sou o Alexandre Yudi
142560	144340	E eu sou o padrinho do RPG Guaxinim
144340	146080	Porque eu amo demais esse projeto
146080	146540	E as pessoas maravilhosas que fazem isso
146540	146600	E as pessoas maravilhosas que fazem isso
146600	146640	E as pessoas maravilhosas que fazem isso
146640	146660	E as pessoas maravilhosas que fazem isso
146660	148720	E as pessoas maravilhosas da nossa comunidade
148720	151340	Não deixe de nos seguir nas redes sociais
151340	153520	Arroba o Marcelo Guaxinim, arroba a RPG Guaxa
153520	155500	Tanto no Twitter quanto no Instagram
155500	156900	Isso é muito importante
156900	158700	Considere também se tornar um apoiador
158700	160560	No PicPay ou no Padrim
160560	163740	Para que esse projeto continue saindo cada vez mais
163740	166040	A gente fala mais sobre isso no Escudo Mestre
166040	166900	Ao final do episódio
166900	168080	Boa aventura
168080	176000	Let me live that fantasy
176000	178040	Oh oh
178040	180040	Oh oh
180040	182040	Oh oh
182040	183040	Oh oh
183040	187040	I'm bigger than I ever dreamed
187040	189040	And will never be free
189040	191040	Oh oh
191040	193040	Oh oh
193040	195040	Aí vocês estão no café, né?
195040	197040	Aí vocês estão no café, né?
197040	199040	Rola os dados
199040	201040	BOLA DE FOGO
201040	203040	Chama o...
203040	205040	Chama o clérigo
205040	205360	Chama o clérigo
205360	205860	Chama o clérigo
205860	208180	Comecei a morrer
208180	209500	Hora iniciativa
209500	210460	Então
210460	212520	Não tem armadilha
212520	213500	Podemos ir
213500	215360	O que vocês fazem?
216640	217460	Tá, tá
217460	219500	É, eu amarro uma corda nelas
219500	220720	E uso como arma
220720	221980	Eu ataco
221980	224480	O magro lança seu thunderbolt
224480	226280	Mais 15 no beholder
226280	231020	Tem algum lugar pra se esconder?
231020	233940	Ah, falha a crítica
233940	235440	Ataque de europeiridade
235440	235840	Ei!
235860	237880	arrumando, chamo o clínico
237880	240960	RPG
240960	244240	Realidades Paralelas do Guaxinim
244240	245780	sua aventura de bolso
245780	247180	na forma de podcast
247180	250120	uma jornada completa a cada episódio
265860	276280	o circo é um lugar de alegria
276280	278700	o local onde adultos e crianças vão para rir
278700	280440	se impressionar, esquecer um pouco
280440	282240	de seus problemas e sonhar
282240	284060	com algo mágico, com algo único
284060	286160	ainda mais em um mundo regido pela espada
286160	288800	onde a tecnologia mais avançada é a roda d'água
288800	290280	os habitantes do circo são
290280	291720	sempre os mais variados
291720	294680	com várias alturas, cores e sotaques
294680	295840	vindo de todos os cantos
295840	297380	que o circo tenha passado
297380	299800	alguns escolhem o circo para viver aquele sonho
299800	302680	outros querem apenas fugir de um pesadelo
302680	304620	um circo em tempos de paz
304620	305340	é uma alegria
305340	307480	um circo num tempo de guerra
307480	309720	é uma distração desnecessária
309720	311440	ao menos é isso que alguns pensam
325840	329800	os três jogadores de hoje não sabem
329800	331520	de que pesadelo fugiram
331520	333500	ou em que sonho chegaram
333500	336040	tudo que sabem é que há 10 anos atrás
336040	337120	eram criança
337120	339500	eles estavam tristes, abraçados
339500	341660	serem irmãos? não parecem ser
341660	343460	mas estavam abraçados, chorando
343460	344660	encatarrados
344660	347060	enquanto de um pequeno vaso saiu uma mulher
347060	348320	uma mulher muito magra
348320	350880	mas que mesmo assim não deveria caber ali
350880	352140	naquele vaso
352140	354720	com sua maquiagem branca, com sua lágrima negra
354720	355820	com seu sorriso largo
355820	357880	com sua roupa preta e vermelha
357880	359400	com seu chapéu de três pontas
359400	361500	ou um guiso em cada uma delas
361500	363820	guisos que tocaram alegres quando seu corpo tremeu
364460	365800	ao recolocar os ossos
365800	367860	que ela havia movido para caber ali
367860	368800	naquele vaso
368800	370540	um tremor de dor que a fez sorrir
370540	373080	mostrando ainda mais seus dentes brancos demais
373080	374220	afiados demais
374220	375620	eu cuido de vocês
375620	377480	disse ela saltando sobre as crianças
377480	379700	naquele mesmo dia eles estavam no circo
379700	381400	aprendendo suas novas funções
385820	397120	o circo viaja pelos reinos
397120	398800	às vezes faz shows de graça
398800	400760	às vezes cobra muito caro
400760	402100	depende da cidade que param
402100	403600	às vezes a boba
403600	405840	como é chamada a mulher que os...
405840	406720	salvou?
407020	407620	sequestrou?
408020	409900	seduz o homem mais rico da plateia
409900	412800	e no dia seguinte o circo precisa se mudar às pressas
412800	415520	os jogadores possuem zero memória de sua vida
415520	416580	antes da boba
416580	419980	mas possuem muitas memórias dos 10 anos que passaram no circo
419980	421600	a maioria delas são boas
421600	423680	Luana, conta pra gente como é o teu personagem
423680	425040	aparência, atributo
425040	427180	eu serei a Nyx
427180	429320	eu tenho 16 anos
429320	431300	uma pele clara como a neve
431300	433360	cabelos negros como a noite
433360	435720	e olhos azuis que lembram o céu
435720	437780	nos seus dias mais lindos
437780	439020	e sem nenhuma nuvem
439020	440560	bom, eu sou a bailarina
440560	443000	mas também a domadora de feras
443000	444860	e como bailarina uso
444860	446900	o que eu aprendi na dança
446900	448880	pra lutar quando necessário
448880	451000	assim como pra domar
451000	452980	bom, e...
452980	454360	meus lindos animaizinhos
454360	456360	quando tentam me comer também ajuda
456360	458760	pra dar saltos e tudo mais
458760	460600	mas...
460600	464040	além de me divertir com meus bebês de dentes afiados
464040	467840	eu também gosto muito de aprimorar os meus golpes
467840	470220	digo, os meus passos de dança
470220	472540	e quando todos estão dormindo
472540	474040	ou distraídos
474040	474840	eu dou uma escapada
474860	477800	em cada cidade que a gente para
477800	480100	pra eu ver como é a vida lá fora
480100	482900	isso às vezes me colocou umas enrascadas
482900	484900	mas como meu irmão fala
484900	486900	o que é uma vida sem aventura?
486900	488900	bom, o meu atributo é 4
488900	489900	perfeito
489900	491900	o JP, fala sobre o seu personagem
491900	493900	bem, hoje eu vou jogar com o Anissus
493900	496900	Anissus é um jovem adulto de 17
496900	498900	vai fazer 18 anos em umas duas semanas
498900	500900	ele tem 1,80m
500900	502900	ele tem uma pele mais escura assim
502900	504000	de queimada de sol
504000	506040	principalmente por carregar caixas e tudo
506040	508040	na hora que tá translocando com o circo
508040	510040	ele tem o cabelo muito castanho
510040	512040	mas o que mais se destaca são seus olhos alaranjados
512040	514040	ele é um grande admirador da Boba
514040	516040	que além de tratá-la como mãe
516040	518040	ele trata ele como uma fã
518040	520040	seguindo até os caminhos dela
520040	521040	ele é o palhaço no circo
521040	524040	muitas vezes contracenando com os outros palhaços
524040	527040	mas ele também treina pra ser o próximo contorcionista
527040	530040	o que deu muita resistência a dor pra ele
530040	532040	ele... por seguir os passos da Boba
532040	534040	geralmente ele se mete em confusão
534040	537040	apesar dele sempre tentar resolver tudo no carisma
537040	538040	por não ser muito forte
538040	540040	ele nunca foge de uma briga
540040	543040	e ele leva consigo uma máscara de bobo da corte
543040	546040	que ele usa nas encenações dele quando ele tá em palhaço
546040	549040	mas também ele usa quando ele se sente sozinho
549040	551040	porque foi um presente da Boba pra ele
551040	552040	e o atributo dele é 3
552040	553040	perfeito
553040	554040	e o Wilson, fala sobre o seu personagem
554040	556040	meu personagem vai ser o Rick Cinzo
556040	558040	depois que a Boba nos adotou
558040	560040	além de eu a chamar de mãe
560040	562040	eu tomei o circo como minha casa
562040	564040	a ideia de poder viajar pelo mundo
564040	566040	conhecendo pessoas e culturas diferentes
566040	568040	poder brincar com as sensações das pessoas
568040	572040	principalmente usando coisas que elas não conhecem
572040	576040	no picadeiro as vezes eu ajo como o palhaço acrobata
576040	578040	que normalmente é o desastrado
578040	580040	que se mete nas confusões e sai ileso
580040	584040	porque tem uma movimentação quase cartonesca
584040	588040	e além disso eu também ajo como atirador de facas no circo
588040	591040	e como o Cinzo tem a aspiração
591040	595040	de ser dono do circo em algum momento
595040	597040	ele acaba tendo um relacionamento com todo mundo
597040	601040	e faz de tudo pra manter a integridade do local e das pessoas
601040	604040	e quando eu digo tudo, eu digo tudo mesmo
604040	606040	até mesmo o que não deve
606040	609040	e ele tem uma tendência a ser charmoso
609040	610040	é até meio bit da galã
610040	614040	e tenta resolver as coisas politicamente antes de usar violência
614040	616040	e o meu atributo é 4
621040	641040	unlikely
641040	643040	哥적 kasimov
643040	644040	hoje não teve bilheteria
644040	646040	as portas do circo estavam abertas
646040	648040	e ele está lotado
648040	649040	a cidade para fora parece muito mais um amontoado de cabanas e caixas
649040	650040	mais um amontoado de cabanas e caixas
650040	651920	caixas do que uma cidade propriamente
651920	653980	dita. Provavelmente são refugiados
653980	655820	de guerra. Gente que teve que abandonar
655820	657780	suas casas para não morrer. A maioria
657780	659560	dos visitantes são mulheres e crianças,
659860	661700	como é comum nesse tipo de assentamento.
662100	663640	Sanduíches de carne e suco são
663640	665980	distribuídos por palhaços e outros funcionários
665980	667880	do circo. Imagino que vocês também estão
667880	669160	ajudando nessa distribuição, né?
669460	671660	Com certeza. Se tiver que fazer alguma
671660	673600	criança rir, tentar distrair,
673880	675860	eu faço isso. Eu começo a puxar
675860	677020	assunto, às vezes com
677020	679780	uma mãe ou outra, uma criança ou outra
679780	682280	perguntando como é a vida fora do circo.
683460	684240	Vocês notam
684240	685700	que, embora muitos
685700	687580	estejam sorrindo por estar no circo,
687880	689800	o olhar de todos eles,
690560	691960	as próprias olheiras,
692360	693680	é um olhar cansado, é um olhar
693680	695920	sofrido de gente que passou muita coisa.
695920	697840	Muitos deles têm arranhões pelo
697840	700340	corpo, ou têm o braço
700340	701740	ou a perna imobilizado.
702160	704140	Eles são pessoas que já passaram
704140	705240	por muita coisa, né?
705620	708020	Assim que a comida é distribuída e
708020	709760	algumas apresentações menores,
709780	711900	acontecem, chega o momento
711900	713960	do Anizos fazer
713960	716100	a apresentação dele. Como é que é a tua apresentação?
716460	717940	O teu momento
717940	719880	no palco, com outras pessoas, como é que ela
719880	722020	acontece? Eu começo, inicialmente,
722080	723640	fazendo uma pequena peça com
723640	725440	o meu irmão, o Cinzo,
725680	727780	justamente pra fazer aquela, tipo, ele ser o
727780	729920	palhaço trapalhão e eu ser o palhaço que tô procurando
729920	731980	ele. Mas é uma peça, assim, só pra instigar
731980	733920	a atenção do povo, até que eu começo
733920	735860	uma cena, tipo, mais
735860	738040	artística, um pouco mais, até um pouco mais dramática
738040	739760	com o palhaço. E como eu sou um palhaço,
739760	741860	um pouco resistente à dor, eu acabo fazendo
741860	744040	alguns movimentos mais arriscados
744040	745620	e tudo mais, por conta do contorcionismo.
745780	747840	Tá, então é mais físico, né? Rola dois dados.
749600	750040	É...
750040	751780	Três e dois. Dois é um acerto,
751920	753900	três é um acerto crítico, teu atributo é três.
754100	755960	A tua apresentação é incrível, assim,
756220	758060	tu faz todos os movimentos que tu falou,
758400	759720	o início é junto com teu irmão, mas
759720	761820	logo ele sai, ele tem o momento dele depois.
762180	763820	Obviamente, o corpo masculino
763820	765740	ele não consegue ser tão elástico quanto
765740	768260	o feminino, mas tu consegue algumas façanhas
768260	769660	ali de contorcionismo,
769760	771600	mesmo de força, né? E isso
771600	773780	pressiona bastante a plateia. Já que
773780	775520	tu foi com teu irmão, ele vai descansar agora
775520	777780	na próxima cena. A Nix, como é
777780	778740	que é a apresentação dela?
779600	781540	Eu tô fazendo a apresentação de
781540	783460	balé, e é uma
783460	786200	música que começa bem calma,
786560	786880	aí
786880	789900	com saltinhos, piruetas,
790180	791940	mas, do nada, a música
791940	793840	ela começa a se ficar
793840	795580	um pouco mais animada, mais
795580	796360	rejeitada.
796360	796740	E
796740	799720	começa,
799760	801280	uma apresentação mais
801280	803200	forte, que
803200	806040	pra época, é estranhamente surpreendente.
806340	806860	Dois dados.
808480	809540	Seis e cinco.
809920	811880	Seis e cinco, tua apresentação
811880	813920	era mais física também. São duas
813920	815800	falhas, na noite de hoje tu não tá
815800	817860	tão inspirado, tu acaba cometendo
817860	819840	alguns erros e caindo ali,
820120	821980	mas palhaços entram em cena
821980	823660	e tentam fingir que era tudo parte
823660	825960	da atuação, e a tua cena termina
825960	827500	com você sendo carregado.
827700	829600	Algumas pessoas riem, outras pessoas
829600	831960	parecem não ter entendido muito bem,
831960	834760	mas hoje não foi um bom dia pra você.
834760	837880	A platéia ta meio, assim, dividida agora.
837880	840080	Cinzo, como é a tua apresentação
840080	842300	pra entrar agora e tentar reconquistar
842300	842880	este público?
842880	844300	Foi difícil, né?
844300	847660	Bom, se eu já me apresentei como palhaço,
847660	848960	agora eu já vou me apresentar como
848960	850420	atirador de facas.
850420	854480	Aí a minha exibição, normalmente,
854480	858060	eu apresento as facas, levanta, faz um
858060	860660	os malabares com elas
860660	862700	e depois atira em alvos
862700	864920	muito complicados. Joga alguma
864920	866420	coisa pra atirar a faca.
866740	868960	Eu não sei se um dos dois participa comigo
868960	870240	como o alvo
870240	872960	no tabuleiro. Pode ser uma outra
872960	874280	pessoa ou pode ser um dos dois.
874500	876480	Eu posso ajudar ele.
876700	878420	Como ele me ajuda na apresentação,
878760	880820	quando ele precisa de um alvo e tudo mais, geralmente
880820	882480	eu vou lá também. Beleza.
882680	884640	Rapaz, era melhor morrer um NPC agora.
884640	890020	Rola dois dados, vai.
891540	892520	Três e três.
892620	894380	Tu tem que acertar um alvo.
894500	896840	Isso conta como um ataque de qualquer forma.
897340	899140	Acertar um alvo sem acertar outro.
899380	900180	Tu tira dois AC.
900640	902260	Tu faz lá. Tu mostra as facas.
902360	903660	Tu faz toda a tua apresentação.
903880	906420	Tu vai atirando elas de maneira perfeita.
906820	908600	Elas acertam muito perto
908600	910460	do teu irmão de criação.
910660	912960	Vocês não têm certeza se são de sangue ou não.
913200	914540	Mas as facas acertam
914540	914620	muito perto do teu irmão de criação.
914620	916180	Muito próximo do teu irmão,
916420	918160	mas não ao ponto de machucá-lo.
918320	920660	E ele confia em ti. Ele ficou paradinho
920660	922780	e tudo deu certo ali. A tua apresentação
922780	924460	ela cria aquela emoção
924460	926480	no público que fica apreensiva
926480	928720	a princípio e depois todos vibram
928720	929800	quando tudo dá certo.
938960	940700	Basicamente, o show está muito bem.
940860	942580	Vocês sentam lá no canto
942580	944520	pra comer alguma coisa. A apresentação
944520	945760	no final é sempre a mesma.
946000	948320	É de um palhaço que não costuma se misturar muito
948320	950780	com os outros palhaços. Ao final do espetáculo
950780	952660	entra um palhaço todo de branco.
953040	954760	Tem alguns detalhes de preto
954760	956140	na roupa dele, mas no geral
956140	958660	tanto a maquiagem quanto a roupa é branca.
958680	960040	Ele é muito, muito alto.
960820	962680	Nunca vocês o viram sem tinta.
963040	964220	Sem a coroa engraçada.
964460	966680	Sem o bigode grisalho que distorce
966680	968360	todo aquele imenso palhaço.
968680	970700	Ele chega carregando uma mala apressado.
970700	972360	A mala se abre e cai
972360	974420	a boba de dentro. A mala
974420	976220	é minúscula e arranca um
976220	978400	ar da plateia. Quando a boba
978400	980480	se levanta e começa a correr sem sair
980480	982560	do lugar. O imenso palhaço então pega
982560	984360	a pequena menina, que estranhamente não
984360	986560	envelheceu nesses 10 anos que se passaram
986560	988500	e a coloca num vaso. Um vaso
988500	990240	tão pequeno como ela entrou ali.
990480	992220	Bonecos de policiais descem
992220	994640	amarrados por cordas e começam a discutir
994640	996540	com o palhaço gigante. A plateia
996540	998760	não nota, mas vocês depois de 10
998760	1000840	anos vendo aquela cena, notam.
1001100	1002840	Os movimentos dos dedos sutis
1002840	1004540	do palhaço e o leve movimento
1004540	1006760	do bigode, enquanto ele faz
1006760	1008740	a voz de todos os bonecos.
1009120	1010680	A cena termina com mais de 10
1010680	1012760	bonecos em cena. Muitos falando
1012760	1014740	ao mesmo tempo. Para a plateia é um
1014740	1016700	trabalho incrível de equipe.
1017060	1018480	Para vocês é o trabalho
1018480	1020640	impossível de um único homem.
1021040	1022720	A cena termina com o vaso caindo no
1022720	1024660	chão e se despedaçando. Todos
1024660	1026480	os bonecos subindo e saindo de cena.
1026780	1028760	O palhaço leva a mão a boca como quem diz
1028760	1030920	ops. As luzes se apagam por um segundo
1030920	1032920	e o holofote mira na plateia.
1033360	1034740	Da plateia, a boba começa
1034740	1036740	a bater palma. E todos a veem
1036740	1038360	se levantam e batem palmas também.
1038700	1040640	Essa é a parte que normalmente ela está
1040640	1042660	no colo do homem mais bonito ou do homem
1042660	1044640	mais rico da cidade. Depende do que ela
1044640	1046680	quer naquela noite. Mas hoje, ela
1046680	1048620	está entre as crianças. Um grupo de
1048620	1050560	crianças desacompanhadas. Provavelmente
1050560	1052660	não tiveram a mesma sorte daqueles
1052660	1054860	que apenas, não tem muita
1054860	1056240	exata, perderam o pai.
1056660	1058720	A boba cena sem sorrir, que é o que vocês
1058720	1060840	nunca viram nela. Uma cara fechada.
1061260	1062580	Vocês vendo aquela cara
1062580	1063600	fechada dela?
1068880	1070900	Will, tu lembra de alguns
1070900	1072480	anos atrás? Tu está
1072480	1074920	numa parte mais de floresta,
1074980	1076720	ao longe, está o circo. Mas
1076720	1078340	tem um grande alvo de madeira.
1078660	1080660	A boba está deitada
1080660	1082580	nele com os braços pra cima.
1082700	1084940	Ela está encostada, como se estivesse presa.
1085140	1086760	Embora ela não esteja.
1086760	1088200	Ela sorri pra ti
1088200	1090660	e tu está com várias facas na mão.
1090920	1092680	Ela estava te ensinando ali.
1092940	1094980	A boba é bem magra. Ela cobre muito pouco
1094980	1096600	do alvo. A parte mais difícil
1096600	1098780	desse exercício, não é o medo de
1098780	1100560	acertá-la e machucá-la.
1100900	1102820	É o medo do que poderia acontecer, caso
1102820	1105040	você a acertasse. Tu está aprendendo
1105040	1105780	ainda. Rola um dado.
1107680	1109220	Ele rolou e tirou seis.
1109560	1110960	O atributo dele é quatro.
1111300	1112960	A faca, ela voa
1112960	1114680	e quando tu começa a ver que
1114680	1116800	ela vai ser certeira, a boba
1116800	1118720	que está com as mãos pra cima do alvo,
1118720	1120720	ela ergue o corpo muito rapidamente.
1120920	1122960	Ela abre a perna
1122960	1125120	como se fosse um T acima do alvo
1125120	1126720	enquanto a faca acerta
1126720	1127420	o meio.
1128220	1130740	É, vai levar um tempo até você
1130740	1132540	poder se apresentar no picadeiro.
1133120	1134500	Pera, ela levou de boa?
1134740	1135340	Ela levou de boa.
1135580	1139120	Você estava em alguma outra parte do circo
1139120	1140520	fazendo alguma outra função
1140520	1142860	enquanto ela tentava ensinar aquilo ali pra ele.
1143200	1145040	Mas, isso foi uma memória
1145040	1146380	que o Cinzo teve ali.
1146740	1148920	Quando olhar aquela cara fechada da
1148920	1150640	boba, ele lembrou que,
1150640	1152640	mesmo com aquela sorrindo e levando de boa,
1152640	1154640	por um momento, ela
1154640	1156640	fechou a cara pra ele.
1156640	1158640	E esse foi o gatilho de ele estar lembrando ali.
1162640	1164640	A... Nyx?
1167640	1169640	Quando viu aquela cara fechada, tu também
1169640	1171640	teve uma memória mais antiga.
1171640	1173640	Não tão antiga quanto a do Cinzo.
1173640	1175640	A boba está em cima de uma árvore, ela está deitada
1175640	1177640	assim sobre o galho. Ela está cantando
1177640	1179640	a música da bailarina, né?
1179640	1187640	É, vocês estão longe do circo. Dessa vez, ao contrário
1187640	1189640	da cena anterior, que o circo estava próximo,
1189640	1191640	tudo que tu escuta são os barulhos
1191640	1193640	da natureza e ela está cantando
1193640	1195640	enquanto você dança. Não precisa
1195640	1197640	rolar dois dados pra dançar. A música
1197640	1199640	nem é boa o suficiente
1199640	1201640	pra isso. Tu está só fazendo alguns passos
1201640	1203640	lá, enquanto a boba está meio
1203640	1205640	deitada no galho, assim, com as costas
1205640	1207640	bem curvadas, né? Como se quase
1207640	1209640	ela não tivesse uma coluna ali.
1209640	1211640	Quando tu escuta barulho, tu vê
1211640	1213640	lobos se aproximando.
1213640	1215640	O que tu vai fazer? Em que direção?
1215640	1217640	Eles estão vagarosamente indo na direção
1217640	1219640	onde tu está dançando. Vou
1219640	1221640	olhar pra ela, tipo,
1221640	1223640	desesperada. Lobos?
1223640	1225640	Lobos?
1225640	1227640	Latéia, finalmente.
1227640	1229640	O que tu faz? Eu vou dançar
1229640	1231640	e ir pra algum lugar mais afastado
1231640	1233640	e subir em alguma árvore.
1233640	1235640	Tá bom, tu vai subir em uma árvore,
1235640	1237640	são dois dados.
1237640	1239640	Com acertos simples,
1239640	1241640	tu para de dançar e vai subir
1241640	1243640	numa árvore. Enquanto tu sobe
1243640	1245640	a árvore, por um momento tu olha pra
1245640	1247640	boba e ela está com a cara fechada pra ti.
1247640	1249640	Ela queria que tu tivesse continuado
1249640	1251640	dançando ali, mas
1251640	1253640	tu parou. Os lobos dispersam,
1253640	1255640	vão pra longe, enquanto tu ainda está
1255640	1257640	tentando subir a árvore. Naquele
1257640	1259640	dia, a boba não cantou mais pra ti.
1267640	1269640	JP, tu tá
1269640	1271640	assim, tem uma árvore cortada,
1271640	1273640	só um toco de madeira
1273640	1275640	no chão, né? Tu tá te apoiando ali
1275640	1277640	com as duas mãos,
1277640	1279640	fazendo uma posição mais
1279640	1281640	complicada assim, se contorcendo.
1281640	1283640	Ah, homens são péssimos
