start	end	text
3567640	3569640	o pessoal agradece.
3569640	3571640	Uma menina sobe ao palco com um bandolim,
3571640	3573640	e ele corre até vocês.
3573640	3575640	Ah, vocês chegaram!
3575640	3577640	Ela disse que vocês iriam chegar, e eu não acreditei,
3577640	3579640	mas vocês chegaram!
3579640	3581640	Cadê a boba? Onde tá a boba?
3581640	3583640	Ela disse que vai encontrar vocês no castelo.
3583640	3585640	Ela falou que é pra vocês se vestirem
3585640	3587640	e irem até o portão, que vão
3587640	3589640	deixar vocês entrarem.
3589640	3591640	Você vem com a gente, Renan? Ou você vai ficar aqui?
3591640	3593640	Não, eu tenho que ficar aqui.
3593640	3595640	E o restante da trouxa? Estão lá dentro,
3595640	3597640	criando distração. Eu quero
3597640	3599640	perceber o jeito dele, Guaxa.
3599640	3601640	Dois dados.
3601640	3603640	Quatro e dois.
3603640	3605640	Ele parece muito preocupado,
3605640	3607640	ele tá sempre olhando em volta,
3607640	3609640	mas ele tá genuinamente feliz
3609640	3611640	em ver vocês, e assim,
3611640	3613640	bem aliviado, e não parece
3613640	3615640	estar mentindo. Ok, então, se não tá
3615640	3617640	mentindo, se parece não estar mentindo,
3617640	3619640	beleza. Imagino que depois
3619640	3621640	nós voltamos aqui pra te buscar, então?
3621640	3623640	Esse é o plano? Eu não sei o que a boba
3623640	3625640	pensa. Ela fez a gente esconder
3625640	3627640	o barracão, e chegamos aqui só com as
3627640	3629640	fantasias. Ela disse
3629640	3631640	que era pra esperar aqui,
3631640	3633640	e para os outros criarem distrações,
3633640	3635640	que ela ia esperar vocês no castelo.
3635640	3637640	Tá, olha, você,
3637640	3639640	a gente tem dois cavalos,
3639640	3641640	é o Pé e o Pano,
3641640	3643640	Pé, Pede e Epano.
3645640	3647640	Você vai cuidar deles enquanto
3647640	3649640	a gente vai lá, tá bom? Cuido, eu cuido sim.
3661640	3665640	Vocês chegam
3665640	3667640	até o portão, já vestidos com as
3667640	3669640	suas roupas espalhafatosas.
3669640	3671640	Os soldados que cuidam do portão,
3671640	3673640	dos dois lados, usam uma
3673640	3675640	armadura que dá um arrepio em vocês.
3675640	3677640	É uma armadura similar àquele homem
3677640	3679640	que sozinho derrubou os três.
3679640	3681640	Tem um de cada lado da porta,
3681640	3683640	um deles olha pra vocês.
3683640	3685640	São da apresentação?
3685640	3687640	Sim. Somos sim. Então faz um truque aí.
3687640	3689640	Eu pego o meu braço
3689640	3691640	e ponho ele numa
3691640	3693640	posição que mais nenhum
3693640	3695640	tipo, homem conseguiria
3695640	3697640	colocar. Tipo, eu faço um truque de contorção.
3697640	3699640	Ah, dois dados.
3699640	3701640	Um e um.
3701640	3703640	É uma ação física, tá desmoldando
3703640	3705640	ali o teu corpo. Bem bizarro isso
3705640	3707640	daí, mas pode entrar.
3707640	3709640	Faz parte do show. Vocês então passam
3709640	3711640	pelos portões, tem um portão principal,
3711640	3713640	vocês passam. Tem uma pequena sala
3713640	3715640	em que em cima dá pra ver
3715640	3717640	que tem setores pra soltar óleo fervendo
3717640	3719640	em caso de invasão, né, se as pessoas
3719640	3721640	romperem o primeiro portão. Antes de
3721640	3723640	romper o segundo seriam queimados, mas
3723640	3725640	aparentemente isso não foi usado
3725640	3727640	contra vocês. O segundo portão então
3727640	3729640	se abre e vocês entram. A festa ali
3729640	3731640	dentro é muito parecida com a que tá lá fora,
3731640	3733640	com a diferença que tem muita gente usando
3733640	3735640	jóias, muitas roupas caras,
3735640	3737640	tem várias pessoas do circo ali
3737640	3739640	dentro, fazendo malabares
3739640	3741640	em pequenos pontos,
3741640	3743640	fazendo palhaçadas, fazendo pequenas
3743640	3745640	apresentações. Tem um fio que passa na
3745640	3747640	rua principal de uma
3747640	3749640	taberna pra outra e um
3749640	3751640	equilibrista anda de um lado pro outro
3751640	3753640	segurando um pequeno guarda-chuva
3753640	3755640	enquanto as pessoas olham.
3755640	3757640	O pessoal tá bem entretido com as coisas
3757640	3759640	acontecendo ali. A gente reconhece alguns
3759640	3761640	como da nossa trupe? Todos
3761640	3763640	são da trupe de vocês. Eu vou
3763640	3765640	no que tiver mais vazio
3765640	3767640	assim, no que tá mais vazio, com menos
3767640	3769640	pessoas assistindo, que a gente pode,
3769640	3771640	a gente sabe que a gente pode atrapalhar o show.
3771640	3773640	Rola um dado.
3773640	3775640	Dois. Tá.
3775640	3777640	Primeiro o Anisus, ele vai pra perto de um
3777640	3779640	palhaço que tava ali se apresentando pra
3779640	3781640	poucas pessoas. Ele olha pro Anisus com uma
3781640	3783640	cara de, não faz isso, não faz isso,
3783640	3785640	mas o Anisus falhou no teste pra observar
3785640	3787640	essa informação. E daí tu parou do lado dele
3787640	3789640	assim, as pessoas começam a olhar meio estranho.
3789640	3791640	Tu nota que quando chega, tu meio que te
3791640	3793640	arrepende, ali fica um clima meio estranho.
3793640	3795640	Era uma apresentação em conjunto?
3795640	3797640	Eu posso tentar reverter
3797640	3799640	isso, tipo, já que eu tô
3799640	3801640	vestido, eu sei qual é a peça dele,
3801640	3803640	meio que improvisar
3803640	3805640	uma peça com ele ali.
3805640	3807640	Um dado.
3807640	3809640	Dois de novo.
3809640	3811640	As pessoas perdem o interesse nesse
3811640	3813640	palhaço, começam a achar meio
3813640	3815640	estranho, e ficam vocês dois ali.
3815640	3817640	Cara, não te deram um recado?
3817640	3819640	Ah, só pra gente
3819640	3821640	entrar, tem que procurar a boba.
3821640	3823640	Sim, ela tá no castelo.
3823640	3825640	Ah, castelo. Então, senhor,
3825640	3827640	foram dias difíceis. Bem,
3827640	3829640	desculpa atrapalhar
3829640	3831640	seu show. Eles estavam encantados,
3831640	3833640	precisamos segurar eles
3833640	3835640	aqui fora. E eu, tipo, meio que
3835640	3837640	saio de mansinho. É, eu vendo
3837640	3839640	isso, não vou mais chegar perto
3839640	3841640	de ninguém, vou bater assim na cabeça
3841640	3843640	dele. Tchau, Juju, até mais.
3843640	3845640	Cara, eu fui direto pro castelo pra procurar
3845640	3847640	a boba. Beleza. Eu tô
3847640	3849640	indo atrás, cabisbaixo.
3849640	3851640	Vocês se aproximam ali da
3851640	3853640	porta do castelo. A porta
3853640	3855640	principal tem bastante
3855640	3857640	soldados, bastante gente, mas vocês notam
3857640	3859640	facilmente uma porta lateral, que tem
3859640	3861640	um único soldado ali encostado, assim,
3861640	3863640	ele tá também encostado
3863640	3865640	na parede ali, ele parece meio distraído,
3865640	3867640	meio apoiado na lança. O que vocês vão fazer?
3867640	3869640	O castelo tá fechado.
3869640	3871640	Tipo, não dá pra entrar pelas portas.
3871640	3873640	Eu vou tentar
3873640	3875640	distrair ele,
3875640	3877640	chamar ele pra um canto, pros meus irmãos
3877640	3879640	entrarem. Quando a gente estiver num lugar mais
3879640	3881640	afastado, que não tiver ninguém, eu
3881640	3883640	desmaio ele. Tá bom, rola dois dados.
3885640	3887640	Quatro e três. Quatro é um acerto crítico.
3887640	3889640	Tu te aproxima, aquele soldado, quando chega
3889640	3891640	bem perto, aquele soldado, ele já tá morto.
3891640	3893640	Ele tá só encostado na parede pra fingir
3893640	3895640	que ele tá cuidando de alguma coisa. Opa.
3895640	3897640	Ah, brigado aí, moço.
3897640	3899640	A gente, tipo,
3899640	3901640	vê a Nyx entrando e a gente, pá, eu vou
3901640	3903640	atrás. Guaxa, pelo tempo,
3903640	3905640	eu posso ver que foi uma obra da Boba
3905640	3907640	ou de alguém da nossa trupe? Pois é,
3907640	3909640	isso que eu ia perguntar. Rola um dado.
3909640	3911640	Três.
3911640	3913640	Três é um acerto crítico. Tu tem
3913640	3915640	certeza que foi a Boba? Ela nunca deixa
3915640	3917640	de ligar. E só eu entro também.
3917640	3919640	Mesma coisa. Também entro junto.
3919640	3921640	Lá dentro, muitas portas,
3921640	3923640	tá meio vazio, mas tem muitas
3923640	3925640	portas, escadas, mas
3925640	3927640	de uma das escadas vocês escutam um barulho de
3927640	3929640	guizos. Falando que a gente vai.
3929640	3931640	Nós também. Vocês vão subindo
3931640	3933640	as escadas rapidamente. Quando
3933640	3935640	chegam no andar de cima, um
3935640	3937640	daqueles homens com armadura,
3937640	3939640	como aquela que derrotou vocês,
3939640	3941640	ele tá parado na
3941640	3943640	frente da escada. Ele, quando
3943640	3945640	nota a aproximação de vocês, ele
3945640	3947640	ergue o escudo e a lança
3947640	3949640	e vocês têm um pequeno tremor ali.
3949640	3951640	Alto lá. Quem são vocês?
3951640	3953640	Nós somos palhaços da trupe.
3953640	3955640	Viemos pra apresentação. Não há
3955640	3957640	apresentação aqui. Vamo embora. Veja bem,
3957640	3959640	nos chamaram. A gente não estaria
3959640	3961640	aqui se a gente não tivesse autorização
3961640	3963640	pra entrar, não? E a minha autorização
3963640	3965640	é de eliminar qualquer um que tente passar
3965640	3967640	por aqui. Eu vou chegando mais perto dele. Mas
3967640	3969640	assim, eliminar você quer dizer por
3969640	3971640	que faça o sinalzinho
3971640	3973640	com o dedo no pescoço? Tu tá
3973640	3975640	bem perto dele? Um tanto.
3975640	3977640	Acho que não, a gente só ficou
3977640	3979640	de frente, né? Eu vou me aproximando assim
3979640	3981640	devagar, se ele faz algum movimento eu paro.
3981640	3983640	Dois dados, Nix.
3983640	3985640	Seis e seis.
3985640	3987640	Ele dá um passo à frente com a parte de
3987640	3989640	trás da lança, ele bate
3989640	3991640	com ela em tilt e empurra pra trás.
3991640	3993640	A próxima é com o lado que corta.
3993640	3995640	Tá bom, tá bom. Desculpa, desculpa,
3995640	3997640	desculpa. Mas, assim,
3997640	3999640	meio que a gente foi chamado pelo príncipe.
3999640	4001640	Como a minha
4001640	4003640	colega aqui falou, se a gente
4003640	4005640	não tivesse autorização, como é que a gente
4005640	4007640	tentaria entrar daqui? Existem
4007640	4009640	muitos soldados lá fora na porta, mas
4009640	4011640	imagina que pra eles deixarem a gente passar
4011640	4013640	a gente tinha que ter autorização. O príncipe chamou a gente.
4013640	4015640	Você tem certeza que você vai desafiar
4015640	4017640	o seu príncipe não deixando a gente passar?
4017640	4019640	Tenho. Aí o problema não é meu.
4019640	4021640	E meio que, tipo, vou
4021640	4023640	voltando, meio que dando de ombros.
4023640	4025640	Os outros? Eu faço
4025640	4027640	a mesma coisa que eles. Não, só pra gente lembrar
4027640	4029640	como é que é o nome do cara que não deixou a gente
4029640	4031640	passar, é senhor...
4031640	4033640	É, se falar seu nome, quando
4033640	4035640	perguntarem por que a gente
4035640	4037640	não foi fazer o show aqui dentro do príncipe,
4037640	4039640	qual o nome que a gente fala mesmo?
4039640	4041640	Ele só sorriu pra vocês,
4041640	4043640	tá esperando vocês irem embora. Tá bom, é o
4043640	4045640	senhor do sorriso legal. Vamo embora,
4045640	4047640	gente. É o senhor da escada.
4047640	4049640	A Nix tá indo embora também? Eu tô indo
4049640	4051640	embora também, só que na hora que eu
4051640	4053640	chego no final da escada eu falo
4053640	4055640	é, você fala isso porque você não tá
4055640	4057640	aqui embaixo pra bater de frente com a gente,
4057640	4059640	né? Caralho. Ele continua
4059640	4061640	lá em cima, ele tem uma ordem bem específica
4061640	4063640	e ele vai sequela. Caramba.
4063640	4065640	Vocês escutam lá pra cima, pro lugar
4065640	4067640	onde ele tá, o barulho do
4067640	4069640	guiso do sino. O lugar onde ele tá
4069640	4071640	é um corredor de pedra
4071640	4073640	e ele tá no meio. É, na verdade lá em cima
4073640	4075640	é um salão maior,
4075640	4077640	mas é o fim de uma escada. Certo.
4077640	4079640	Tava pensando em ser bem agressivo agora,
4079640	4081640	tentar fazer a faca quicar na parede pra
4081640	4083640	acertar ele. É mais difícil que jogar a
4083640	4085640	faca diretamente nele, mas tu pode tentar.
4085640	4087640	Eu posso fazer isso? Pode, um
4087640	4089640	dado. Mas se eu jogar direto nele?
4089640	4091640	Dois dados. Então é isso aí, meu
4091640	4093640	amigo. Tu vai jogar direto, vai
4093640	4095640	sair do lado da escada e jogar a faca?
4095640	4097640	É, exatamente. Na cara, na
4097640	4099640	cara. Dois dados.
4099640	4101640	Seis e dois.
4101640	4103640	Perfeito. A faca acerta a
4103640	4105640	lateral do braço dele, uma parte
4105640	4107640	protegida da armadura, sangra, faz um
4107640	4109640	pequeno corte, nada fatal,
4109640	4111640	ele fica muito bravo
4111640	4113640	ali e...
4113640	4115640	Rola dois dados agora.
4115640	4117640	Seis e dois de novo.
4117640	4119640	Ele pegou aquela lança
4119640	4121640	dele, ele jogou ela contra você,
4121640	4123640	tu pula pro lado ali,
4123640	4125640	essa lança crava na parede com
4125640	4127640	bastante força, mas ela não te acertou.
4127640	4129640	Anisius ou
4129640	4131640	Nyx, ação. Posso pegar essa
4131640	4133640	lança que ele acertou e tacar
4133640	4135640	de volta nele? Pode, dois dados.
4135640	4137640	Cinco e dois.
4137640	4139640	Um acerto simples. Tu conseguiu
4139640	4141640	tirar a lança e tá com ela na mão, só não
4141640	4143640	conseguiu jogar pra ele, ela é bem pesada
4143640	4145640	pra ti. Anisius, ação. Bem,
4145640	4147640	eu vou ficar provocando ele
4147640	4149640	pra ele vir pra cima da gente,
4149640	4151640	já que ele fala assim, e olha lá, tu não tem que vir
4151640	4153640	buscar essa lança aqui não, né? Você realmente
4153640	4155640	pode deixar ela aqui na mão, tipo, dessa criança?
4155640	4157640	Você realmente perdeu uma lança pra uma criança, eu quero
4157640	4159640	ficar provocando ele pra ele, tipo,
4159640	4161640	meio que perder o sentido, ficar com
4161640	4163640	mais raiva ainda e, tipo,
4163640	4165640	meio que vir pra cima da gente. Dois dados.
4167640	4169640	Dois e um. Provocar é o teu
4169640	4171640	botão mais, ele só sorri pra
4171640	4173640	ti, ele vai uns passos pra trás
4173640	4175640	pra escada não ficar tão de frente pra ele,
4175640	4177640	tu escuta o barulho dele sacando
4177640	4179640	alguma coisa lá em cima. Ação
4179640	4181640	cinzo. Eu vou pular na parede
4181640	4183640	só que eu vou jogar a faca pro chão
4183640	4185640	e vou ficar com a outra na mão pra
4185640	4187640	aterrissar em cima dele. A de baixo
4187640	4189640	é só pra distrair. Dois dados.
4189640	4191640	Seis e três.
4191640	4193640	Um acerto simples, ele não
4193640	4195640	se distraiu com a primeira faca, tu
4195640	4197640	pula sobre ele, o que ele sacou
4197640	4199640	das costas foi uma besta que
4199640	4201640	é um tipo de, pra ouvinte que não conhece,
4201640	4203640	que é tipo uma mistura de arco
4203640	4205640	com pistola, né? Ele usa
4205640	4207640	essa besta pra atirar contra você,
4207640	4209640	tu para o teu movimento ali, tu acaba
4209640	4211640	caindo antes do que tu queria pra
4211640	4213640	desviar desse tiro e não atinge
4213640	4215640	ele. Não foi atingido, mas não atingiu.
4215640	4217640	Pelo menos, vai. Ação Nyx.
4217640	4219640	Na mochila que a gente tá,
4219640	4221640	eu tenho uma corda? Pode ter uma corda. Tá bom
4221640	4223640	então, eu laço ele. Dois dados.
4225640	4227640	Cinco e quatro. Quatro é um acerto
4227640	4229640	crítico ou tu consegue laçar ele.
4229640	4231640	Ele é bem pesado, ainda mais com a armadura,
4231640	4233640	mas ele tá meio amarrado, um dos braços,
4233640	4235640	o braço que controla o escudo,
4235640	4237640	ele não tá conseguindo mover ali.
4237640	4239640	A Nisus.
4239640	4241640	Aproveitando que ele tá meio imóvel, eu quero
4241640	4243640	correr com a adaga, tipo, meio
4243640	4245640	que ficar por dentro do capacete
4245640	4247640	ali no pescoço,
4247640	4249640	o que tiver mais, que seja fatal
4249640	4251640	e esteja aberto.
4251640	4253640	Dois dados.
4253640	4255640	Seis e três. Sendo
4255640	4257640	três um acerto crítico, a Nyx puxando,
4257640	4259640	ele tá quase perdendo o equilíbrio,
4259640	4261640	o capacete dele dá uma balançada
4261640	4263640	assim, expondo um pouco do pescoço,
4263640	4265640	é o suficiente pra essa
4265640	4267640	adaga cravar e cortar.
4267640	4269640	Então, o barulho daquele homem imenso
4269640	4271640	caindo ecoa por aquele
4271640	4273640	grande calor.
4281640	4283640	Vocês escutam o guizo vindo de uma das
4283640	4285640	portas. Já saco
4285640	4287640	mais uma faca pra ficar com você,
4287640	4289640	aliás, saco não, eu pego a que caiu no chão,
4289640	4291640	vamos lá, vamos entrar. Eu pego a besta,
4291640	4293640	eu quero pegar a besta dele e os virotes.
4293640	4295640	Eu desamarro ele e tô com a minha
4295640	4297640	corda ainda. Eu já vou entrando.
4297640	4299640	Vocês entram
4299640	4301640	na sala, parece ser um quarto,
4301640	4303640	tem uma cama muito grande, com aquela
4303640	4305640	proteção em cima, né? Tem
4305640	4307640	alguns poucos móveis
4307640	4309640	ali. Rola um dado cada um.
4311640	4313640	Nyx? Um.
4313640	4315640	Falha. Anisus? Quatro.
4315640	4317640	O atributo é três, tu passou.
4317640	4319640	E o Cinzo? Cinco.
4319640	4321640	Ah, a sala não tem nada que chame
4321640	4323640	a atenção da Nyx, mas
4323640	4325640	tanto o Cinzo quanto o
4325640	4327640	Anisus notam um vaso sobre
4327640	4329640	uma mesinha de camiseira, e isso chama
4329640	4331640	a atenção de vocês. Eu vou em direção
4331640	4333640	ao vaso e, tipo,
4333640	4335640	vou cantarolando com
4335640	4337640	qualquer música que a Bulba geralmente
4337640	4339640	cantarola pra mim. Ela gostava
4339640	4341640	da música Baravina. Então
4341640	4343640	eu vou assoviando, né?
4347640	4349640	Eu vou assoviando até chegar
4349640	4351640	no vaso. De dentro deste
4351640	4353640	vaso, sai a Bulba.
4353640	4355640	Ela olha pra vocês.
4355640	4357640	Vocês são muito barulhentos e muito
4357640	4359640	demorados. Falta de
4359640	4361640	prática. Hora do último teste.
4361640	4363640	Escondam-se nesse quarto e
4363640	4365640	não sejam pegos. E ela volta
4365640	4367640	a sumir ali dentro. Certo.
4367640	4369640	Eu dou uma olhada no lugar, vejo o que que
4369640	4371640	tem. Tem lustre? Tem um lustre.
4371640	4373640	Eu quero saltar pra ver se eu consigo ficar
4373640	4375640	em cima, no lustre.
4375640	4377640	É uma ação física, dois dados.
4377640	4379640	Quatro e dois.
4379640	4381640	Ela subiu no lustre. Ele balançou
4381640	4383640	um pouquinho, mas ela se posicionou de uma
4383640	4385640	forma. Ela meio que se enrolou ali
4385640	4387640	na corrente dele. E ela parece
4387640	4389640	mais maleável que o normal.
4389640	4391640	E ela tá bem escondida. Os outros dois?
4391640	4393640	Tem algum caixote, alguma
4393640	4395640	coisa assim? Principalmente aquelas arcas
4395640	4397640	que ficam perto de cama. Tem arcas
4397640	4399640	com roupas, sim. Eu vou me esconder
4399640	4401640	numa arca dessas. Se precisar,
4401640	4403640	tipo, deslocar alguns ossos
4403640	4405640	pra eu conseguir entrar. O treinamento
4405640	4407640	de contorcionista tá aí pra isso. Perfeito.
4409640	4411640	Essa arca
4411640	4413640	fica do lado da...
4413640	4415640	fica do lado da cama? Nos pés da cama.
4415640	4417640	Nos pés da cama? Ah, então, no caso
4417640	4419640	se eu entrar embaixo da cama,
4419640	4421640	a arca atrapalha a visão da porta.
4421640	4423640	Perfeito. Tô aí mesmo.
4423640	4425640	Beleza. Os dois que só se esconderam embaixo
4425640	4427640	da cama ou dentro de uma arca, não precisa rolar dados.
4427640	4429640	Só a Nyx que rolou, mas ela
4429640	4431640	passou no teste. E...
4431640	4433640	o tempo começa a passar e vocês estão ali.
4433640	4435640	Vocês não sabem quanto tempo
4435640	4437640	passou, mas...
4439640	4441640	...
4441640	4443640	...
4443640	4445640	...
4445640	4447640	...
4447640	4449640	Vocês, num momento, estão ali
4449640	4451640	escondidos. Em outro momento,
4451640	4453640	vocês estão numa cidade.
4453640	4455640	A cidade tá em chamas, tem soldados
4455640	4457640	tanto dos normais, quanto
4457640	4459640	daqueles grandes, correndo de um lado
4459640	4461640	pro outro. Que que vocês fazem? Isso é uma
4461640	4463640	lembrança... Pra ti parece
4463640	4465640	bem real. Tu não sabe. A gente tá...
4465640	4467640	tipo, a gente não é criança. A gente tá na nossa idade
4467640	4469640	normal. Tá todo mundo parecendo mais alto,
4469640	4471640	do que vocês. Ah...
4471640	4473640	Ok. Eu quero procurar
4473640	4475640	um vaso. Eu quero que elas vão ver
4475640	4477640	pro povo possa ficar segura.
4477640	4479640	Deixa eu entender... Pera aí. Deixa eu entender primeiro
4479640	4481640	onde que eu tô e o que que tá acontecendo.
4481640	4483640	A galera tá brigando...
4483640	4485640	Eu tô onde? Uma briga envolve
4485640	4487640	dois lados se atacando.
4487640	4489640	Existem soldados
4489640	4491640	atacando as pessoas da cidade.
4491640	4493640	Não é uma briga.
4493640	4495640	É um massacre. E esses caras
4495640	4497640	são os caras que a gente matou no começo?
4497640	4499640	Ou é a galera que a gente tava
4499640	4501640	cuidando? Os estandartes são
4501640	4503640	dos soldados que vocês enfrentaram durante
4503640	4505640	toda essa pequena jornada. Mas vocês
4505640	4507640	são crianças. E tu imagina que
4507640	4509640	se adultos já passaram o trabalho pra derrubar
4509640	4511640	um. Imagina alguns
4511640	4513640	deles por ali. Eu consigo ver
4513640	4515640	os dois? Eles tão ali contigo. Certo.
4515640	4517640	Então eu vou tentar... Como eu sou
4517640	4519640	mais velho, eu vou procurar a melhor
4519640	4521640	forma pra gente se esconder. Que fique
4521640	4523640	longe do que esses caras
4523640	4525640	tão... Onde tá...
4525640	4527640	A confusão... Eu quero me afastar o máximo
4527640	4529640	possível. Os três correm, mas
4529640	4531640	ficam mais ou menos juntos ali. Cada um
4531640	4533640	com um objetivo um pouco diferente.
4533640	4535640	Mas acabam indo pro mesmo lugar. Passam
4535640	4537640	por várias pessoas que vocês nem tinham mais
4537640	4539640	memórias. Amigos,
4539640	4541640	vizinhos, família. Todos
4541640	4543640	caídos ali. Sem muito
4543640	4545640	tempo de defesa.
4545640	4547640	Vocês acabam se escondendo num pequeno quarto.
4547640	4549640	Depois de um tempo, a porta se abre.
4549640	4551640	Dois soldados daqueles grandes
4551640	4553640	entram. E
4553640	4555640	no meio desses dois soldados, um homem
4555640	4557640	usando roupas muito caras,
4557640	4559640	muitos anéis. Ele olha
4559640	4561640	pra vocês. Ele fala pro soldado
4561640	4563640	Deixem as crianças
4563640	4565640	aí. Talvez sobrevivam
4565640	4567640	e se tornem soldados.
4567640	4569640	Eu não sou um rei
4569640	4571640	malvado que mata crianças.
4571640	4573640	Mas queimem o resto
4573640	4575640	da vila e vamos embora.
4575640	4577640	O vaso dá
4577640	4579640	uma pequena balançada. De dentro
4579640	4581640	dele sai a boca.
4581640	4583640	Eu cuido de vocês.
4589640	4597640	Vocês acordam mais ou menos
4597640	4599640	ao mesmo tempo, ouvindo barulhos
4599640	4601640	na cama ali.
4601640	4603640	A Nyx pode observar lá de cima, né?
4603640	4605640	Eu, então, se eu posso
4605640	4607640	observar, eu quero ver. Tem alguém que
4607640	4609640	não consegue. Consegue ver só os pés, porque a cama
4609640	4611640	tem aquela proteção em cima, né?
4611640	4613640	Aquela cama antiga de
4613640	4615640	nobre, de pessoa importante.
4615640	4617640	Mas tem alguém deitado naquela cama.
4617640	4619640	Eu sou doida,
4619640	4621640	então eu vou descer
4621640	4623640	de onde eu estou escondida e me aproximar
4623640	4625640	pra ver quem é. Os outros dois
4625640	4627640	escutam um pequeno guizo.
4627640	4629640	No momento em que eu escuto o guizo, eu saio
4629640	4631640	da arca. O Cinzo viu
4631640	4633640	que a Nyx tocou o chão
4633640	4635640	de maneira muito leve, sem fazer barulho.
4635640	4637640	E que o Anísio
4637640	4639640	saiu da arca dele também, com pouco
4639640	4641640	barulho, e a cama mal se moveu.
4641640	4643640	Vou me aproximar da cama. Eu quero ver quem é que tá na cama.
4643640	4645640	Eu tô ouvindo os passos deles.
4645640	4647640	Tá vendo que eles saíram do esconderijo.
4647640	4649640	Então eu saio também. Os três olham
4649640	4651640	pra cama e, ao mesmo tempo,
4651640	4653640	aquele homem idoso nota
4653640	4655640	vocês. Ele tá
4655640	4657640	com uma cara de choro.
4657640	4659640	Ele parece muito doente, muito acalmado.
4659640	4661640	Ele olha pra vocês.
4661640	4663640	Ei, está aí?
4663640	4665640	Não sei como chegaram
4665640	4667640	aqui. Como
4667640	4669640	conseguiram passar pelos
4669640	4671640	meus guardas.
4671640	4673640	O meu dia já foi terrível.
4675640	4677640	Eu perdi meu filho.
4677640	4679640	Perdi tudo.
4679640	4681640	Eu posso tornar
4681640	4683640	vocês muito ricos.
4683640	4685640	Peguem o ouro e vão
4685640	4687640	embora. Os cofres
4687640	4689640	ficam nesse andar.
4689640	4691640	Essa é a chave do cofre.
4691640	4693640	Podem levar.
4693640	4695640	Esse homem é o mesmo
4695640	4697640	que tava junto com os soldados
4697640	4699640	na infância de vocês.
4699640	4701640	Eu pego a adaga e fico.
4701640	4703640	Enfio no pescoço dele.
4703640	4705640	Eu atacava falando, tipo, você não queria soldados?
4705640	4707640	Na porta vocês escutam
4707640	4709640	um guiso e lá tá a boba.
