start	end	text
0	9460	Se eu pegar essa ilha e esse helicóptero, e aí tudo faz sentido, porque aqui tem um zumbi e ali não tinha, e agora?
10120	15000	É isso! É isso! Eu sabia! Eu sabia! O Guaxaverso existe!
15120	15960	Como assim?
16180	18000	Você entendeu a referência do último episódio?
18240	18980	Olha só, faz tudo!
18980	20020	Não, o Guaxaverso sabe o que faz!
20020	20960	Espera, o que é o Guaxaverso?
21000	22980	Era só uma questão de tempo.
23080	24520	O Guaxaverso sempre existiu!
24520	27180	Eu quero entender o Guaxaverso!
27220	28560	Alguém me explica o que é o Guaxaverso?
28560	32020	É, pessoal, não existe o Guaxaverso.
32080	33720	Eu acredito no Guaxaverso!
33760	36560	Mas supondo que ele exista...
37880	41540	Guaxaverso, onde o que não existe é debatido.
44780	49140	A gente achando que é lutar contra a ditadura, a gente tá lutando contra a monogamia.
51740	52860	Desculpa, Guaxa.
53860	58380	Olá, eu sou Marcelo Guaxinim, narrador, produtor e idealizador do podcast Realidade Paralelo Guaxinim.
58560	66680	E eu espero que todos vocês, antes de mais nada, tenham ajudado o pessoal, nossos amigos do Rio Grande do Sul.
67100	71820	Nas redes sociais eu tenho divulgado lá algumas coisas, especialmente o que o pessoal do Caquitas tem feito, né?
72880	75400	As duas são de Porto Alegre, né?
76060	82380	Embora de uma área mais alta, pelo que eu entendi, uma área que não foi, assim, diretamente atingida, né?
83880	88380	E o que o pessoal tá mandando pra mim, a gente tá divulgando, seja na taberna, lá nas redes sociais,
88560	95000	fiz a minha parte também, espero que todo mundo esteja fazendo a sua parte nesse momento tão difícil.
95460	97860	Pra quem não sabe, o Guaxaverso é o nosso antigo escudo-mestre.
98180	100580	Aqui vamos ler os comentários e discutir as teorias do último episódio.
100920	101360	Alegria!
101620	108420	Que, no caso, foi, como um sabiá, RPG Guaxa 163.
109760	115340	E pra falar deste episódio, eu estou aqui com a nossa querida Doutora Deba!
115680	116560	Olá, Doutora!
116560	116920	Aê!
116920	117380	Doutora!
118560	121700	É só Doutora Deba, não atenda de outra forma.
122500	123700	Boa noite, Guaxa!
124060	131460	Mas pro Guaxa, que é o nosso mestre, e, querendo ou não, mestre é acima de doutor, pode chamar só de Deba, tá podendo.
131920	133660	Eu prefiro Guaxa, inclusive.
134220	136520	Ah, beleza, então não vai mais ser mestre Guaxa, Guaxa.
136920	137520	E aí, Guaxa?
138300	141960	Mas assim, doutora, a ponta dos meus dedos tá formigando, eu devo me preocupar?
141960	147960	Eu acho que... sim, pare de comer perto do teclado, que as formigas vão embora.
148560	153920	A coceira na mão, na verdade, a tua formação não é doutora médica, né?
154060	154360	Não.
154520	156960	Coceira na mão é dinheiro que tá vindo?
157400	164100	Coceira na mão direita é dinheiro que tá vindo, e na esquerda é dinheiro que tá indo embora.
164580	166280	Porra, é só tristeza nessa minha vida.
166820	167340	Vamos embora.
169420	170360	Poxa, Guaxa.
171740	172960	Tá difícil, doutora.
173160	173880	Tá bem difícil.
174240	174720	Difícil.
174720	174780	Difícil.
174780	184300	Pra mais consultas sobre suas finanças associadas a coceiras, mande uma mensagem lá pra mim, no Instagram ou no Twitter.
185400	188280	É uma boa, como é que as pessoas te acham no Instagram ou no Twitter?
188800	198680	Ixi, no Twitter eu tô como arroba outra eu normal, é o meu perfil secreto, onde os meus empregadores não vão me achar, então por favor não divulguem.
199940	201820	E no Instagram eu tô como...
201820	203380	Tu acabou de divulgar, tu sabe, né?
203380	204600	Ah, não, eu sei, Guaxa.
204780	207080	É, eles não falam português, então tá tudo bem.
207540	207840	Ah, ok.
208420	216000	É, e no Instagram eu tô deba.mazeto, é, ultimamente tem tido muitas fotos dos meus papitos.
216520	217640	Ah, pra gente poder te visitar, né?
217800	218200	Sim.
218780	219960	Ah, eles são tão bonitinhos.
220040	228200	Como é bonitinho, né, um casalzinho de senhores, um senhor e uma senhora de 60 anos tirando foto, né, é muito fofo.
228200	230720	É, meu pai foge de foto, né, mas sim.
232240	234200	Ele acha que rouba a alma, eu imagino.
234780	240300	É, é assim, talvez roube por alguns momentos, mas depois ela volta pro corpo.
240640	246360	Na de, na, quando era foto de papel roubava, agora que é de celular eu não sei como é que funciona.
246540	247300	Vai pra nuvem.
247740	252640	Vai pra, fica um tempo na, na internet e depois volta, tem que ler os cookies direitinho.
252840	254880	Você tem que fazer o download, depois é só a alma.
255820	256800	Tem que fazer o download.
259220	260860	Ok, ok, ok.
260860	260960	Ok.
261260	261540	Ok.
261540	261560	Ok.
261560	261580	Ok.
261580	261600	Ok.
261600	261620	Ok.
261620	261680	Ok.
261680	261740	Ok.
261740	261760	Ok.
261760	261780	Ok.
261780	261800	Ok.
261800	261840	Ok.
261840	261860	Ok.
261860	261880	Ok.
261880	262160	Ok.
262160	262180	Ok.
262180	262200	Ok.
262200	262220	Ok.
262220	262240	Ok.
262240	262260	Ok.
262260	262280	Ok.
262280	262340	Ok.
262340	262360	Ok.
262360	263280	Ok.
263280	263300	Ok.
263300	263380	Ok.
263380	264360	Ok.
264360	265320	Ok.
270320	270680	Ok.
270700	271400	Ok.
293280	293880	Ok.
293880	294140	Ok.
294140	294160	Ok.
294160	294220	Ok.
294360	297880	começando do zero, que seria um exagero,
298380	301340	mas assim, voltou, vai voltar pra anos,
301800	303380	uns dois, três anos atrás.
303980	305900	Então, quem ainda não migrou, migre.
306340	308520	Quem quer continuar ajudando,
309100	311480	quem quer começar a ajudar, vai pra lá.
311940	314500	Se por algum motivo você tem uma conta na Aurelo,
315020	316440	na Aurelo também tem o RPG Watch.
316500	318220	Eu prefiro concentrar tudo no Apoia-se,
318540	321340	embora concentrar tudo no lugar não seja realmente uma boa ideia,
321340	325140	mas o sistema do Apoia-se e o apoio que eles estão dando
325140	328500	tá sendo bem bacana, então eu prefiro arriscar.
328640	330460	Mas se você já tiver uma conta na Aurelo,
330520	332060	não quiser fazer uma conta no Apoia-se,
332480	333740	pode ser na Aurelo também.
333840	335180	A Aurelo demora um pouco mais pra pagar,
335400	338500	eles têm um sistema meio complicado de gastar tanto dinheiro,
338940	340420	mas como é pouquinho, não tem problema.
340900	342480	Ô gente, vamos lá, né?
342600	346880	Vamos migrar a conta do Padrim pro Apoia-se quanto antes.
347000	349740	Eu lembro que quando o Padrim anunciou que ia sair,
349740	351320	eu já mandei mensagem de mediador,
351340	352500	diretamente na taverna.
352880	355060	Gente, pra onde tá indo o RPG Watch agora?
355180	357420	Porque não pode ficar um mês sem pagar o RPG Watch.
357680	359340	O buraco é a resposta correta.
359760	361660	Pro buraco, não! Não!
361820	363780	Só se for um buraco com mais guaxinins
363780	367020	pra apoiar essa causa, esse projeto maravilhoso.
367420	369500	Tu é madrinha há quanto tempo? Tu lembra?
369960	371660	I vixe, não lembro não,
371820	375180	mas eu acho que desde dezembro de 2021.
375780	377640	Não, não lembro, mas bem específico.
377740	379100	Pá, dezembro de 2021.
379100	383460	É que eu não sei se o ano tá certo, mas o mês tá certo.
383780	386320	As pessoas perguntaram pra mim quantos anos o RPG Watch tá fazendo,
386420	387060	eu digo, eu não sei.
387560	390360	Eu tenho que ir no Google, digitar RPG Watch 001,
390860	393300	aí eu vejo a data do post, faço as contas,
393380	394660	e daí eu digo, ah, é tanto.
394960	397380	Qual que é o signo do RPG Watch, é guaxa?
397760	399380	É guaxinim, galáctico.
399860	402220	Obviamente, guaxinim com ascendente galáctico.
402600	402960	Obviamente.
403200	403560	Isso.
404340	407220	Nada em corvo antes que alguém venha fazer uma piada.
407220	408140	Nada, nada.
409100	411840	É questão de não ter nada.
412080	414680	Lancei o episódio um dia antes pra não ter nada em corvo,
414760	418240	pra ser uma criança puramente guaxinim galáctico.
419620	421120	Você também pode me seguir nas redes sociais,
421220	423200	é o Marcelo Guaxinim, é o Robert P. Guaxa,
423360	425180	tá no Twitter, no Instagram, no Blue Sky,
425680	427340	e tô tentando começar a usar o Blue Sky,
427760	429480	mas esse sim, eu tô começando do zero.
429840	431500	É muito triste tá abandonando uma rede social
431500	433540	que tem, sei lá, quase 13 mil pessoas,
433880	435800	pra começar uma com, sei lá, 100.
435800	437760	E, poxa.
438260	439060	Então, segue a gente.
439100	441940	Mas, se você for seguir numa rede social só,
442440	444000	o Instagram do RP Guaxa,
444120	444780	quem cuida é
444780	448100	Fábio, Dani, é a Ju, é o Felipe Xavier.
449660	451840	Então, assim, tem uma equipe muito melhor
451840	452860	do que eu cuidando lá,
453320	455540	trazendo muito material bacana, então segue
455540	458040	o Instagram do RP Guaxa.
458240	459800	O Instagram do RP Guaxa
459800	461240	é divertidíssimo, gente.
462200	463520	Esse último jogo
463520	466200	de caça-palavras eu não consegui encontrar.
466740	467580	Tive que ir nos comentários
467580	469080	dar uma roubadinha, porque...
469100	470920	Tava difícil?
471980	474180	Fiquei curiosa. O que vai ser esse próximo episódio?
474880	476060	É engraçado que uma das palavras
476060	478060	era ratinho, e muita
478060	479620	gente não pegou.
479620	480700	Por que o ratinho?
481700	483800	Tá esperando o ratinho até agora,
483940	485040	mas pode falar disso.
485080	485960	A gente fala disso.
487860	489920	O primeiro comentário é do Jorge Marques Santos Silva,
490020	490540	que coloca
490540	493460	vários episódios daqui, merece ser um filme.
494040	495620	Esse merece ser uma novela.
496180	497520	Uma novela épica.
498020	498700	Um bom dia, senhor.
499100	500660	Baixa a convidada de Guaxual.
501040	502380	Tudo bem, queridos? Comigo tudo bem.
502520	504500	Tudo certo.
505040	507320	E agora em diante, todos os tudo bem estão respondidos.
507540	507900	Isso.
508480	509000	Spoilers!
509900	511960	Esse episódio merecia mesmo ser uma novela.
511960	513860	Com mais episódios pra contar
513860	515040	mais dessa história.
515240	517660	Como ficou o novo vereador depois de tudo?
518140	519500	Psicologicamente, digo,
519940	522080	pois não deve ter sido fácil lidar com isso tudo.
522580	524140	Existe mais da história
524140	525140	do Boi que não sabemos?
526000	527760	Sim. Um passado que conte
527760	528880	como ele ficou tão forte?
529100	531140	Trabalho na roça, né, gente?
531220	532460	Trabalho na roça, gente forte.
532720	533660	Meu avô era forte.
534100	537020	Nossa, minha avó era muito forte. Ela picava lenha, cara.
537460	538760	Sabe como é difícil picar lenha?
539200	539880	Sim, poxa.
540420	543340	A única pessoa que consegue fazer isso
543340	544920	no cinema é o
544920	546400	Capitão América. Exato.
546900	548760	Não, é difícil, é difícil, sim, sim, tô ligado.
549160	551140	Meu avô também, meu avô tinha fogão a lenha.
551600	552040	Então, assim,
553080	554520	essa história tem
554520	556460	algumas pitadinhas, assim, de
556460	556500	de
556500	560220	alguns nomes que eu usei, que só
560220	562320	sei lá quem conheceu muito a minha família
562320	564440	vai pegar umas referências,
564560	566300	mas isso não, não estão
566300	567660	pro público. Pô,
567920	569440	casos de família, hein, cara?
571020	571500	Literalmente.
572500	574520	Ele continua. Embora seja um episódio
574520	575800	bem mais realista,
576260	578080	tem algo de incomum em toda a força de alguns personagens?
578560	580540	Sim, eles são exageradamente
580540	582660	fortes. Como eu comentei,
582660	584980	uma das minhas inspirações é um jogo de videogame,
585240	585360	né?
586500	588080	E, porra, no jogo
588080	591160	oito da série, fica o spoiler,
591780	592700	é...
592700	595040	eles socam um tubarão.
595420	596420	Um tubarão, assim,
596820	599080	gigante, sabe? Que a boca cabia, sei lá,
599140	600260	quatro pessoas lá dentro.
601060	603080	É... eles socam o tubarão.
603400	605160	Então, há um certo
605160	607220	exagero, né, que nos primeiros jogos da série
607220	609160	não tem, que vai aumentando.
610140	610580	Ah...
610580	612120	Mas nos primeiros jogos mesmo,
612900	614540	no segundo jogo, o Kiril
614540	616480	enfrenta, sei lá, tigre no soco,
616500	618720	é... jogando vai fazer sentido,
618840	619760	eu juro pra vocês.
620080	621580	Até o tubarão vai fazer sentido.
622080	624720	Tem certeza que é um jogo
624720	626300	em não-velozes e furiosos?
626680	628400	Em que as coisas vão ficando um pouquinho mais
628400	630700	exageradas? É, assim, cada jogo
630700	632600	vai... é porque o
632600	633600	sete, o oito,
634180	636200	o protagonista,
636340	637800	ele é um sonhador.
638200	640460	Ele é um cara que se imagina num jogo...
640460	641720	Olha a metalinguagem massa.
641960	644440	Ele se imagina num jogo de videogame.
644700	646440	Então, grande parte das coisas,
646500	648360	coisas que acontecem,
648360	650280	é mais a loucura dele do que
650280	651660	realmente aconteceu.
652240	653660	Entendi. Que da hora.
654100	656460	Porra, mas ele pega um taco de baseball
656460	658740	e imagina sendo a espada do Dragon Quest,
658740	661120	sabe? E é assim que...
661120	662680	E aí, tipo, todo mundo tem...
662680	663860	Tem um que tem a profissão, sei lá,
664360	666220	um é ex-policial,
666680	668720	a outra é...
668720	670540	Ela cuida de um holster, não lembro como é
670540	672560	a profissão dela. Ele é
672560	675080	herói. Ele se vê como um herói.
676500	677180	Maravilhoso.
677300	679160	Mas, estou divagando,
679260	681100	mas sim, é um exagero nessas
681100	682360	forças, mas
682360	684440	pra contar a nossa história, né?
684600	687180	Dentro daquele mundo, faz sentido.
687580	688000	Uhum.
688600	690900	O carinho colocado nesse episódio na criação
690900	692720	da narrativa, na interpretação dos jogadores,
692840	695020	no cuidado com a história, enfim, foi o que mais
695020	696940	senti, foi o carinho,
697040	699060	é verdade, eu tenho muito carinho por essa
699060	701020	história. Aquele sentimento quentinho
701020	703300	no peito, com certeza, é um dos meus episódios
703300	705100	preferidos. Um grande bolo
705100	706480	com um sabiá,
706500	707920	na cabeça de um boi,
708380	710680	desenhado para toda a comunidade dividir.
711060	712520	Sim, ele é grande e suficiente para todos.
712800	714380	Por hoje eu fico aqui, forte abraço a todos,
714460	716780	força e luz para todos nós, e até mais.
717180	718780	Eu acho engraçado, esse episódio
718780	720600	eu me empolguei muito,
720680	722820	muito, muito, muito. Eu já comentei
722820	725000	com os jogadores, esse episódio
725000	726160	ele é
726160	728380	ele é a
728380	730700	uma primeira parte de uma história
730700	732920	que eu quero contar, que são em duas partes,
733220	734180	no mínimo, né?
734180	735400	São duas partes.
736500	738360	Quando eu lancei o episódio, eu coloquei, pô,
738440	740000	meu episódio favorito,
740460	742360	eu gostei um monte, pô, assim, eu tava
742360	744740	muito empolgado. E daí algumas pessoas
744740	746840	disseram, ah, é mais um episódio
746840	748520	normal, ah, mas não sei o que.
748920	750560	Eu dei uma desanimada, por mais que eu saiba
750560	753140	que foram muitos elogios,
753580	754740	em momento, alguma
754740	756680	pessoa criticou, eu disse, pô,
756740	758720	é, realmente, é só mais um episódio.
759220	760160	Mas é porque...
760160	762580	Quem foram essas pessoas que a gente vai caçar
762580	763860	elas com um sim.
764060	766460	Não, não. Tô brincando.
766460	768520	A gente brincando. Mas, fica atento.
768940	769500	Fica atento.
769600	771480	Assim, é...
771480	774340	Porra, ainda vou contar essa segunda
774340	776420	parte dessa história, depois até tem
776420	778660	um outro comentário que vai trazer
778660	780180	sobre as segundas partes ali.
780720	782340	Mas, poxa, assim, vocês viram
782340	784720	a segunda parte não vai
784720	786400	fazer essa história ficar melhor,
786600	788300	eu acho, ela vai ser só uma outra história.
788780	790240	Até pra diminuir o hype, né?
792240	792720	Mas...
792720	794820	Ainda assim é uma história aqui que eu quero
794820	796180	contar e que eu,
796180	798560	obviamente, vou contar, né? Obrigado pelo seu comentário.
799080	799960	Jorge Marques do Silva.
800300	802180	Ah, essa história foi maravilhosa e realmente
802180	804380	foi muito emocionante. Eu tenho carinho
804380	806140	também muito grande por ela, porque foi muito
806140	807940	legal gravar e jogar essa história.
808360	810380	Bom, vamos pro comentário da
810380	811380	Marina M.
811700	814040	Olá! Boa hora do dia, senhor
814040	816120	narrador mascarado, vulgo guaxa,
816380	818300	guaxanim, guaxonvidade
818300	820060	e todo guaxaclã. Não vim
820060	821940	falar do episódio hoje, afinal,
822140	824240	ainda não ouvi. Apenas vim marcar
824240	826160	presença e dizer que depois de um longo,
826180	828340	longo, longo período sem ouvir
828340	830140	meus podcasts, estou voltando
830140	832120	nesses últimos meses, mas só
832120	834120	agora consegui comentar algo. Acho
834120	835740	que é a terceira vez que comento aqui.
835900	838460	RS, RS. Ainda não cheguei nos episódios
838460	840180	atuais do RP Guaxa, mas
840180	842400	logo chego. Espero. Atualmente
842400	844080	ouvi o episódio 148,
844260	845760	o pré 1 e o roubo do
845760	848140	coração. Emoji de
848140	850180	carinha feliz. Obrigada por
850180	852260	esse projeto lindo demais, sucessos,
852380	854100	felicidades e brownies pra
854100	855300	todo mundo envolvido.
856180	858860	Uma hora você chega lá nos episódios
858860	860700	atuais, Marina, e
860700	862820	te entendo. A vida, às vezes, não nos
862820	864680	permite ouvir podcasts todos
864680	866920	os dias. Tipo, a presença dos seus
866920	868780	pais em casa e você não pode ouvir um
868780	870800	podcast um pouquinho mais
870800	872680	de esquerda que já começa uma discussão
872680	874620	imensa dentro de casa. Ai, ai.
875100	876900	Isso foi bem específico.
876960	878780	Foi. Foi muito específico porque
878780	880820	aconteceu. E eu falei, quer saber?
881480	882540	Vou ouvir depois meus
882540	884640	podcasts em paz, que daí
884640	886480	vou dar atenção pros meus pais aqui.
888180	888900	Ok, ok.
889140	890940	Ai, ai. O próximo comentário
890940	892740	é do Marcelo Guaxinim.
894740	896740	Quem é essa pessoa, Marcelo Guaxinim?
896740	898600	Eu queria
898600	900500	reclamar do narrador.
905300	906320	Vamos lá.
907080	908340	Oi, Guaxa do Futuro.
908780	910240	Vim te lembrar de falar sobre
910240	912780	continuações. Beijos,
912920	914220	às vezes você acerta.
914640	915760	Obrigado, eu mesmo.
916820	919020	Guaxa do passado, de seis dias
919020	919440	atrás.
920440	922680	Eu tava dando uma olhada nos comentários no Spotify.
922960	924920	Bastante coisa boa. Agradeço muito, gente.
925340	927220	Quem me xinga ou não
927220	928940	ou dá spoiler
928940	930940	muito forte, eu não aceito o comentário.
931380	932980	Mas os outros comentários eu tô aceitando
932980	933880	todos, né?
934420	937140	E teve um comentário que não foi me xingando.
937640	938980	Que foi pedindo
938980	940500	pra que quando tivesse
940500	942900	o episódio fosse continuação, que se
942900	944280	avisasse no começo.
944640	946720	E não, não vai acontecer.
947320	948460	Porque, tipo, quando for
948460	950800	tipo, Cavaleiros do Bicho, eu sempre
950800	952920	aviso. Ah, ele é a continuação de um episódio
952920	954940	pipipipipopó. Porque ele é
954940	956680	uma continuação direta.
957200	958900	No episódio que ele comenta
958900	960860	e aqui vai um spoiler do
960860	962860	Cheirinho do Armário. Quem não quiser tomar
962860	964940	esse spoiler e tiver ao vivo
964940	966860	aqui entre os padrinhos, tira o fone um pouquinho.
967220	969020	E quem tiver ouvindo editado, pula
969020	970200	um pouquinho pra frente.
970660	972940	Cheirinho do Armário, ele tem um...
973600	974520	Eu acho que eu nem preciso entrar
974520	977180	no spoiler, mas ele tem um personagem
977180	978860	que é de uma outra história
978860	981140	e que parte da graça
981140	982100	do episódio
982100	984820	é descobrir que este personagem
984820	987080	é o mesmo
987080	988100	do outro episódio.
989200	991020	A história ainda funciona
991020	992840	fechada. Ela ainda tem
992840	994360	um início, um meio e um fim.
994900	997100	Ela ainda funciona mesmo que, na minha opinião,
997640	998940	mesmo que tu não tenha ouvido o episódio
998940	1000940	original. Só que se tu ouvir o episódio
1000940	1003040	original, ela vai ter aquele tchan a mais
1003040	1005160	de, nossa, é a fulana.
1005800	1006500	Sabe? Então,
1007120	1009460	tem vários episódios que acabam conversando,
1010220	1010600	mas
1010600	1012920	não são necessariamente
1012920	1015060	continuações que eu acho que
1015060	1017840	avisar iria estragar um pouco a brincadeira.
1018460	1019520	Eu acho que a maioria
1019520	1021160	esmagadora dos episódios da RPG Guaxa
1021160	1023320	são fechados, né?
1023360	1024480	Com início, meio e fim.
1024960	1027700	Mas que, às vezes, por ter uma...
1027700	1029500	um outro episódio
1029500	1030900	pra te estar...
1030900	1032900	Se tu tiver ouvido um outro episódio, tu vai aproveitar
1033040	1035400	melhor. Pelo menos essa é a minha
1035400	1036720	visão.
1037360	1039240	Eu podia fazer todos os episódios
1039240	1041200	fechados, sem, sabe,
1041820	1043240	sem ligação com outros.
1043600	1045040	Mas, poxa, a gente já chegou a 163
1045920	1046620	episódios.
1047180	1048960	E eu acho que dá um
1048960	1050100	tempero a mais
1050100	1052960	obviamente não interligar os episódios
1052960	1054580	a ponto de eles criarem um Guaxa Verso.
1054840	1056760	Mas ao ponto de ter uma pequena
1056760	1058580	referência, um easter egg,
1059100	1060820	ou pelo menos um
1060820	1062820	Q de continuação, sem ser
1062820	1064400	uma continuação, então
1064400	1067060	eu pretendo continuar tendo episódios
1067060	1069040	assim. Tanto que
1069040	1071220	não vou dizer quais,
1071660	1072760	mas existem outros episódios
1072760	1074880	pra frente, que ele é
1074880	1076700	um episódio fechado, ele tem uma história fechada,
1077240	1078960	mas, se tu tiver ouvido
1078960	1080380	um outro episódio,
1081040	1083020	ele vai ter um
1083020	1084820	plus a mais que vem pra somar.
1086000	1086960	Acho que é isso.
1087080	1087800	O que você acha, Deba?
1088020	1090820	Eu acho que essa é uma das grandes...
1090820	1092660	é uma parte da...
1092820	1093880	meu Deus, tá difícil.
1094280	1096780	Essa é uma das graças do RP Guaxa, que é você
1096780	1098760	ouvir um episódio que é fechado em si.
1099340	1100800	Então, tipo, às vezes você
1100800	1102740	quer... tá todo mundo hypado no episódio,
1102860	1104620	você não chegou lá ainda, então você quer ouvir logo,
1104680	1106300	você pode pular sem problema nenhum.
1106900	1108800	Depois você volta e ouve todos eles.
1109480	1110680	E a graça é você
1110680	1113280	tentar achar as conexões entre os episódios
1113280	1114700	e vir aqui comentar
1114700	1116540	no post
1116540	1118780	pra descobrir como essas conexões
1118780	1120900	se encontram. Essa é uma das graças do RP
1120900	1122800	Guaxa, você ver um easter egg,
1122820	1124980	ver uma ligação ali, um personagem
1124980	1127080	que volta, um personagem recorrente
1127080	1128660	e falar, caraca,
1128900	1131000	eu entendi essa referência. Isso faz
1131000	1132720	parte da magia desse
1132720	1134760	Guaxaverse. Uma coisa que eu podia
1134760	1135920	parar... Guaxaverse não existe.
1136580	1138920	Eu podia... eu acho que assim, se eu não
1138920	1140880	avisasse, tipo, chegasse no escudo
1140880	1143000	do mestre e não falasse, ah, esse personagem
1143000	1144940	aqui é aquele mesmo personagem que você
1144940	1146780	viu em outro episódio. Essas
1146780	1148800	pessoas que estão pulando e tal,
1149200	1150740	elas vão ouvir o episódio e nem
1150740	1152740	notar. Eu acho que as vezes...
1152820	1154980	as vezes a pessoa se sente enganada. Ah, me enganou!
1155120	1156900	Achei que era um episódio fechado e não
1156900	1158980	era. Mas se eu não tivesse avisado,
1159500	1161140	se eu não tivesse mostrado
1161140	1162680	que a cartola tem um fundo falso
1162680	1163740	de onde eu tirei meu coelho,
1164320	1166200	as pessoas tendem a notar, eu acho.
1166340	1167620	Eu acho que
1167620	1169960	é natural que
1169960	1172860	as histórias diferentes chamem a atenção de pessoas
1172860	1175000	diferentes, mas é natural
1175000	1176900	também que a curiosidade seja
1176900	1178720	instigada e as pessoas vão atrás
1178720	1180980	e vão falar, caramba,
1180980	1182780	mas eu quero saber mais sobre isso. O que a
1182820	1183780	coisa aconteceu com esses personagens?
1184600	1186480	E elas vão atrás. Essa é a parte
1186480	1188760	divertida. E se você tá ouvindo
1188760	1190720	a RPG Guaxa de maneira a não
1190720	1192760	ir atrás do fundo falso da cartola,
1192880	1194740	você tá ouvindo errado. Volta, ouve
1194740	1196800	tudo de novo e
1196800	1198160	chega aqui pra conversar com a gente.
1198620	1200700	Isso. E pessoas no Spotify
1200700	1202880	que comentam, ah, quando eu terminar de ouvir
1202880	1204520	tudo eu assino. Vocês estão todos errados.
1204760	1206240	Exato. Você assina,
1206800	1208260	porra, vai esperar até o final.
1208760	1210880	Aí tá enrolando, aí ele não escuta
1210880	1212780	o episódio que sai que é pra não ter que assinar.
1212820	1215360	Ah, serasa pra todos vocês.
1215480	1217160	Isso aí é amigué, é absurdo
1217160	1218900	e você tá fazendo errado
