start	end	text
3484360	3486420	imobilizar ela. Eu falo, prisão
3486420	3488420	das cerejeiras. E eu começo
3488420	3490420	a tentar fazer um tufão em volta dela
3490420	3492300	pra tentar
3492300	3494600	tirar o equilíbrio dela e não deixar ela ficar andando.
3494780	3495260	Três dados.
3496700	3498740	Eu tirei cinco, dois e quatro.
3498980	3500440	Cinco e quatro são erros, mas o
3500440	3502560	dois é um acerto crítico.
3503240	3503660	Vocês
3503660	3506360	conseguem prender
3506360	3508460	a Kemi, né? A Yumi
3508460	3509960	também tá presa.
3510280	3512340	Aurora pode apagar
3512340	3514340	a tua barreira
3514360	3515820	se quiser. Eu olho assim e eu
3515820	3518260	ai, ai, ai, eu não queria que fosse algo
3518260	3520200	tão grande assim. Aí quando eu vejo
3520200	3522280	eu tipo, sei lá, eu balanço assim
3522280	3523840	um pouco a espada pra ver se
3523840	3526180	apaga, que eu ainda não tô controlando muito bem
3526180	3528560	meus poderes. Aí eu cessar fogo.
3528780	3530140	Chega! Acabou!
3532260	3534120	O Verso, ele corre ali pra
3534120	3535960	perto de vocês? É, ainda bem, né?
3536060	3538160	Ainda bem. Estamos sem bombeira na cidade.
3538260	3540400	Ai, desculpa, Verso. Eu não queria.
3542020	3544140	Eu ainda tenho que aprender a controlar melhor
3544140	3546020	meus poderes. Se precisar de alguma coisa
3546020	3546840	eu consigo apagar.
3547500	3549260	Tirem o pingente delas.
3549580	3551900	Espera, eu vou pra Kemi
3551900	3553200	e falo, vocês
3553200	3556180	se amavam até agora pouco, o que aconteceu?
3556640	3557620	Todo mundo escutou isso?
3557880	3559340	Rola dois dados, tu atributou mais.
3560760	3562240	Eu tirei seis e cinco.
3562300	3563360	São dois acertos.
3564260	3565880	Ela, o olhar dela
3565880	3567000	tava vazio assim.
3567720	3570100	Parece que ela finalmente te enxerga
3570100	3572100	e ela começa a chorar.
3572860	3574100	Meu pai proibiu a
3574140	3575840	gente de se ver.
3577000	3578320	Eu só queria provar
3578320	3580700	que ela não era nada pra mim, mas
3580700	3582120	eu tava errada.
3583500	3584820	Por que eu tô fazendo isso?
3585360	3586620	Aí eu só cutuco a Melody.
3586820	3588220	Elas eram um casal?
3588880	3590180	Você tinha percebido isso?
3590540	3592680	Uma vez eu vi elas de mãos dadas, mas eu pensei
3592680	3594460	que elas estavam com medo.
3595080	3596480	Me pegou desprevenido também.
3596860	3598780	Como a Persephone tá falando com a Kemi,
3598780	3600860	eu vou ir em direção da Yumi, tá?
3601640	3602640	Pra conversar com ela.
3602980	3604120	Mas ela está dentro de um arredor.
3604140	3606620	A Kemi agora que tá
3606620	3609060	entendendo, ela tá presa
3609060	3610720	dentro do vento,
3610720	3612760	mas ela alcança o próprio pingente
3612760	3614500	e ela desfaz e ela vai embora.
3615960	3617120	Quem foi que foi até a Yumi?
3617620	3618160	A Aurora.
3618340	3620160	Mas eu cheguei perto também, porque...
3620160	3621660	Porque o outro tá resolvido.
3621660	3623560	Eu desfaço a prisão da Kemi.
3623820	3625760	Eu chego assim pra Yumi e eu...
3625760	3627240	Yumi, você tá legal?
3627480	3629360	Eu imagino que
3629360	3632720	essa situação assim, né,
3632720	3634120	de relação,
3634140	3635200	de relacionamento, às vezes,
3635780	3638200	é um pouco complicado, mas se você quiser
3638200	3639780	alguém pra conversar, você
3639780	3641820	pode falar comigo, tá?
3642540	3644000	Vocês vão ver, vocês vão se entender.
3644200	3645360	Vai dar tudo certo, sim.
3645420	3648160	A Yumi é bem mais casca grossa que a Kemi, um dado.
3649000	3649720	Atributou mais.
3651220	3651700	Seis.
3652100	3653680	Ela também tava com um olhar
3653680	3656040	distante, ela parecia não estar nem vendo
3656040	3658160	vocês, então ela finalmente
3658160	3660100	olha pra vocês.
3661160	3662280	Ela abre a boca
3662280	3663680	pra dizer
3664140	3666580	e ela só desfaz a transformação
3666580	3668020	e desaparece.
3668320	3670600	Ah. Eu olho assim pra Melody
3670600	3672080	e falo, ah,
3672780	3674340	entrega aquela bolsa ali
3674340	3676440	pro senhor... pro senhor
3676440	3678580	sábio rato. E aí eu puxo o meu
3678580	3680160	porque eu quero ir atrás delas, porque eu tô com medo
3680160	3681640	delas começarem a brigar lá fora, tá?
3682740	3683460	Tá bom.
3684560	3686580	A Melody ficou. A Persephone?
3686780	3687300	Eu fiquei.
3687780	3690480	A Kemi desfez também? Também, as duas
3690480	3692580	sumiram. Ok. Eu olho pra...
3692580	3694100	É o verso que tá ali ou é o...
3694100	3695500	É o verso.
3695500	3698200	O verso total tá ali. Foi ele que falou que
3698200	3700100	a cidade tava sem... Tá sem
3700100	3702200	bombeira. Eu olho
3702200	3703380	pro resto das coisas e falo
3703380	3706220	depois a gente vê como
3706220	3707660	é que a gente vai construir isso aqui, tá?
3708060	3709820	Pessoal, na construção civil a gente tem.
3711220	3711700	Ok.
3712680	3714020	Eu tiro o brinco.
3714840	3716160	A Melody ficou pra
3716160	3718000	conversar com o sábio, né? Pra entregar
3718000	3719960	o mangás. E pra ajudar
3719960	3722220	a apagar o fogo, se tiver algum fogo aí ainda.
3722220	3723980	Tu pode guardar
3723980	3726180	essa informação ou tu vai fazer com ela
3726180	3726700	depois.
3727860	3730240	Enquanto tu ajudar a avaliar a população,
3730900	3732120	tu descobre onde é que estão os
3732120	3733500	celulares desaparecidos.
3734200	3736100	As casas dos ratos
3736100	3738400	têm, em sua maioria, um celular.
3738920	3740080	Que eles usam, parece,
3740240	3742140	pra assistir vídeos. E tu
3742140	3743980	viu muitos deles num site
3743980	3746180	clicando na foto
3746180	3748020	de uma rata vestida de bombeiro.
3749680	3751880	Aí eu falei, deve ser aí que tá uma rata.
3751880	3753940	Eu falo, verso, de onde é que
3753940	3755140	vieram esses celulares, hein?
3755140	3757940	Eu tenho a nota
3757940	3760320	fiscal de todos eles, eu...
3760320	3761520	Só que...
3761520	3763080	Ficou na minha outra calça, sabe como é?
3763080	3765960	Aí eu olho assim pra ele, você não tá usando
3765960	3766700	calça.
3768340	3769920	Ele sorri
3769920	3771360	e dá um tapinho nas tuas costas.
3773060	3773560	Aí, então,
3773760	3775960	beleza. Aí eu vou lá com o senhorzinho,
3776180	3778000	qual é o nome dele? Esqueci, tá aqui
3778000	3779700	em cima. Mirmidão.
3780100	3781020	E aí eu falo,
3781740	3783740	senhor Mirmidão, a Aurora deixou
3783740	3785340	esses...
3785340	3789040	Na verdade, como ela encolheu
3789040	3790060	o negócio,
3790680	3791440	encolheu com ela.
3791560	3793340	Esses mangás são menores do que os dele, né?
3793340	3795620	O senhor tem
3795620	3797160	algum detetive aqui?
3797380	3799060	Pode ser que uma lupa ajude, sabe?
3799120	3800640	Ela deixou isso aqui pro senhor.
3800740	3803020	Ah, muito obrigado. Ele pega assim.
3803800	3805540	Assim? Posso ler sem precisar
3805540	3807100	de um rato para virar a folha.
3807540	3809480	Ah, sim. Ah, verdade, verdade.
3809600	3810140	Boa, boa.
3810800	3813160	Vocês estão precisando de mais alguma coisa? Eu posso ir?
3813160	3815200	Não, não. Vocês já fizeram muito.
3815300	3817520	Ele segura tua mãozinha. Muito obrigado.
3818040	3819340	De nada, de nada.
3819460	3820360	Até a próxima, viu?
3821080	3823200	Tchau, tchau. Eu vou e tiro o pingente
3823200	3823660	do cabelo.
3829760	3831380	Só que tudo isso
3831380	3832820	aconteceu antes, né?
3833480	3835040	A primeira a sair
3835040	3836680	foi a Aurora.
3837440	3838660	A Aurora, tu chega,
3839140	3841020	tu vê uma Kemi e um Yumi
3841020	3842540	abraçada, assim, chorando,
3842540	3843980	sentadas no chão.
3844000	3846220	Eu vou me aproximando delas, né?
3846240	3848760	Que agora que eu sei que elas são um casal, né?
3849420	3850700	Eu chego perto delas e eu
3850700	3852700	Ei, meninas, vocês estão
3852700	3853940	tão legais?
3854140	3856760	Vocês já fizeram as pazes?
3857440	3858460	Ah, a Kemi
3858460	3860280	fala. Eu...
3860280	3861560	E Nia sussurra e apercebe.
3861920	3863940	Eu vejo o climão, assim...
3863940	3865580	Ah, eu acho que eu tô intrometendo, né?
3865600	3867640	Não, não, não. Não tá, não.
3868680	3870460	É... Eu e a Yumi decidimos
3870460	3872520	que vamos manter segredo o namoro,
3872520	3873740	até a gente se formar.
3874220	3875140	Depois a gente vê.
3876380	3877520	Depois de uma idade,
3878360	3880620	nossos pais não vão poder mais mandar na gente.
3880840	3882500	É, no que elas falam isso, eu...
3882500	3884360	Sabe aquela coisa? Elas tão abraçadinhas, sabe quando você
3884360	3886820	segura, puxa, assim, a mão de cada uma, né?
3887360	3888060	E segura junto.
3888440	3889980	E eu... Ai, que lindo!
3890220	3892720	Eu super apoio vocês e vocês estão certas.
3893140	3894580	Vocês vão conseguir, vocês são
3894580	3896340	um casal super fofo e podem
3896340	3897080	contar com a gente.
3897560	3900660	Nós somos amigas agora, a gente pode falar isso.
3900840	3902500	Então, vocês podem contar com a gente.
3902520	3903160	Né, Persephone?
3903680	3906200	Sim, e eu só quero falar uma coisa que...
3906200	3908360	Às vezes os pais não conseguem mandar na gente.
3908480	3910560	Eu mostro um piercing na orelha, que eu
3910560	3911660	geralmente tapo com o cabelo.
3912020	3914500	A Kemi, ela dá um abraço
3914500	3916520	em cada uma de vocês.
3917400	3918380	A Yumi, então,
3918620	3920200	olha primeiro pra Aurora.
3921020	3922580	Depois ela olha no fundo
3922580	3924140	dos olhos da Persephone.
3924780	3926140	Ela abre a boca
3926140	3927480	e a Melody surge.
3928340	3931160	Pá, cheguei. Tá tudo bem?
3931160	3932160	A Kemi diz...
3932520	3933300	Tá tudo certo.
3934840	3936140	A gente vai fazer o que é certo.
3936780	3937800	Muito obrigada, meninas.
3938740	3939940	Até a gente se ajeitar,
3940680	3941580	contamos com vocês.
3941720	3943460	E as duas saem da sala.
3943620	3945220	No que elas estão saindo, eu só vou correr.
3945380	3947300	Eu grito na porta.
3947600	3950580	Ei, eu vou criar um grupo pra gente conversar
3950580	3953080	pelo celular, tá bom? Vou colocar vocês duas.
3953540	3954720	A Kemi
3954720	3956600	só levanta a mão e faz um...
3956600	3958520	Ai, a gente finalmente é amigas.
3959220	3959900	Ai, que legal.
3959900	3960840	E aí eu pego, né?
3960840	3962540	Eu busco meu celular e começa
3962540	3964680	a criar o grupo.
3964780	3966640	Aí o nome do grupo, nada discreto,
3966740	3967980	tá lá, Guerreiras Mágicas, tá?
3968080	3970400	E um emoji de guaxinim.
3973140	3974580	Aí eu falo assim, meninas,
3974660	3975920	vocês não vão acreditar.
3976820	3978400	Os celulares que sumiram
3978400	3980120	estão tudo lá na casa dos ratinhos.
3981100	3982540	Eles estão usando como se fosse
3982540	3983840	uma televisão.
3984680	3987000	A professora entra pela porta.
3987600	3988860	Onde estão os celulares?
3988860	3990820	Na casa dos ratinhos, professora.
3990840	3991840	Ratinhos?
3992540	3994320	Ratinhos. São tão bonitinhos.
3994420	3996460	Eles ficavam vendo o vídeo da ratinha bombeira.
3996660	3997540	Coisa mais linda.
3998160	4000540	Aí até a Aurora olha assim pro lado, né?
4000620	4002720	E fala assim, é um anime.
4002800	4004980	É um anime novo, professora, que a gente tá assistindo.
4005080	4006640	Que tem ratos, que tem celulares.
4007220	4008440	Né, meninas? É legal, né?
4008560	4009640	Eu vi muita coisa.
4010180	4011800	Agora eu acredito que eles roubaram o celular.
4012480	4014540	Malditos. Eu tô usando um iPod
4014540	4016400	desde que eu tive que eles roubaram o meu celular.
4017020	4018620	Ela tá tão brava que ela nem
4018620	4019920	tá ligando que a professora tá ouvindo.
4020240	4020640	Vocês,
4020840	4022880	vocês vão pra casa
4022880	4024940	eventualmente? Aquele dia
4024940	4026900	termina. Ei, quando eu chegar em casa,
4026920	4028920	quando eu chegar em casa, eu quero procurar na internet
4028920	4030640	e ver se eu acho a ratinha bombeira. Eu digito
4030640	4032920	ratinha bombeira. Tu descobre
4032920	4034480	que tem um reality show
4034480	4036740	num site
4036740	4038840	que tem várias personagens estranhas.
4039420	4040720	Eu descubro qual é o nome da ratinha?
4041300	4042300	É, me irrita.
4042820	4044780	Ah, depois eu vou falar pras meninas.
4045460	4046720	Gente, o pessoal viaja
4046720	4048240	entre os mundos mesmo. Que legal.
4048240	4050100	Mais alguém quer deixar alguma coisa?
4050100	4052740	Eu só vou mandar uma mensagem no grupo, né?
4053900	4054420	Perguntando
4054420	4055780	como estão as duas, né?
4056540	4057900	E mandando, tipo, uma
4057900	4060100	figurinha, assim, com
4060100	4062180	um coraçãozinho LGBT,
4062520	4064340	sabe? Com as bandeirinhas do
4064340	4065460	arco-íris pra elas.
4066000	4067120	E, tipo, toda sorridente.
4067280	4069060	Eu chego em casa,
4069420	4072300	surpreendentemente, essa é a primeira vez
4072300	4073280	que não tem briga
4073280	4074780	com meus pais.
4075840	4077820	E, tarde da noite, eu deito na cama
4077820	4079560	e dá aquele suspiro.
4080100	4081800	Eu olho pro grupo.
4083120	4084120	Ah, eu achei
4084120	4085740	que eu não ia ter que
4085740	4087020	mais passar por isso.
4087920	4090140	Óbvio que a primeira pessoa que eu ia ter
4090140	4092080	crush era alguém comprometida.
4092480	4092800	Ah, ué.
4093500	4095540	E ela vira pro lado
4095540	4097600	e começa a mandar memes no grupo.
4097900	4099660	Eventualmente, depois vocês dormem.
4100100	4102220	Naquela noite, um celular
4102220	4103980	foi esquecido, talvez,
4104660	4105800	sobre uma das mesas
4105800	4107080	das salas de aula.
4107080	4109480	Um guaxinim
4109480	4110080	com asas.
4110100	4112120	Ele passa por ali.
4112640	4115140	Ele tá com comida na boca.
4115800	4116900	Ele parece ter feito a limpa
4116900	4118240	nas latas de lixo
4118240	4119500	da cantina.
4120000	4121480	Ele, então, vê o celular.
4121680	4123020	Ele pega com as patinhas.
4124340	4126260	Mais uma casa terá TV.
4126420	4128400	Ele guarda na sacolinha dele
4128400	4130020	e ele desaparece.
4130520	4132340	Na sala dos professores,
4132720	4134820	a professora abre o computador
4134820	4136640	e ela começa a rastrear
4136640	4138660	o celular. Então, fazendo carinho
4138660	4139980	no gato, ela diz.
4140100	4143640	Então, eles estão
4143640	4145380	debaixo do colégio.
4149920	4151320	Escudo do mestre.
4151480	4153200	O escudo do mestre é aquela estrutura de papelão
4153200	4155020	ou madeira que o mestre usa para as condições de anotações
4155020	4157180	e lançamentos de dado. Mas aqui,
4157420	4159500	eu baixo essa estrutura e conto pra vocês
4159500	4161480	tudo o que aconteceu no episódio.
4161760	4163400	Quem acompanha os guaxaversos,
4163660	4165180	isso é metade do meu público,
4165180	4166980	fica aí a crítica, sabe
4166980	4170020	a Belo se meteu em várias aventuras.
4170100	4171540	Terríveis, tadinho.
4172160	4174100	E ela me pediu uma aventura alegre.
4174700	4176100	A Agatha também estava
4176100	4177900	querendo alguma coisa ligada a
4177900	4180020	Guerreiras Mágicas. E acho que a Fer
4180020	4181940	é fã, só, do processo.
4182080	4183560	E a gente botou ela nessa brincadeira.
4183760	4185800	Tinha várias madrinhas que se encaixavam
4185800	4187600	no perfil, mas
4187600	4189780	pra esse primeiro episódio, né,
4190120	4191620	a gente chamou essas três.
4192080	4194100	A minha ideia com ele era que ele ficasse
4194100	4195780	meio dividido em dois episódios,
4196060	4197920	mas como é um RPG, a gente não consegue
4197920	4199920	controlar bem isso. O segundo episódio
4200100	4201940	ficou um pouco mais curto.
4202160	4204060	Se você pensar aqui, elas
4204060	4205580	resolvem o primeiro problema do gato,
4205920	4207660	e aquilo seria o fim do primeiro episódio,
4208000	4210000	com as meninas indo pra casa dormir, né,
4210440	4212040	e um segundo ato, quando
4212040	4213900	elas voltam e tem que separar
4213900	4215940	as duas meninas. Se você acompanha
4215940	4218020	animes, tem vários clichês que você vai
4218020	4220060	encontrar aqui, embora a questão
4220060	4221520	do casal... É engraçado
4221520	4224080	que em momento algum eu sugeri
4224080	4226080	pras jogadoras das suas personagens,
4226480	4227980	mas quando a aventura foi escrita,
4227980	4230060	por serem todas as
4230060	4232240	meninas mágicas, eu sabia que tinha duas
4232240	4234020	que formariam um casal, né,
4234520	4236320	então eu já...
4236320	4238320	Esse ponto tava definido.
4238960	4240080	A questão de que outras
4240080	4242200	jogadoras se identificariam, como foi o caso
4242200	4244120	das pessoas da Agatha, a questão do lugar
4244120	4246040	que elas sentaram na sala de aula
4246040	4248360	foi bem orgânico, acho que ficou no início do episódio,
4248560	4249700	né, ele foi gravado
4249700	4251980	há mais tempo, e eu ouvi ele há mais tempo,
4252220	4253880	mas acho que ficou lá, como foi tudo
4253880	4255520	dinâmico e acontecendo.
4255520	4257580	A vilã ficou clara no final
4257580	4259780	do episódio, né, quem foi que armou
4259780	4261660	aquilo tudo, foi a mesma que trouxe o gato,
4262020	4263800	não ficou claro ali, mas é óbvio
4263800	4265540	que as duas meninas tiveram uma
4265540	4267620	orientação, entre aspas,
4267800	4269700	talvez da própria professora, talvez tenha
4269700	4271740	mais gente envolvida no colégio,
4271980	4273880	talvez tenha alguém acima desta professora,
4274180	4275600	mas o fato é que este
4275600	4277720	item mágico que está abaixo da cidade,
4278000	4279880	que não adianta perguntar, eu não vou dizer o que é,
4280120	4281980	porque ele é foco de, sei lá, episódios
4281980	4283780	futuros, óbvio esse episódio
4283780	4285640	cabe em continuações, ele foi
4285640	4287800	planejado pra ser fechado,
4287800	4289720	né, a menos que vocês peçam um
4289720	4291820	muito, e surge uma ideia
4291820	4293680	muito boa, não tão
4293680	4295540	clichê quanto foi esse primeiro episódio,
4295960	4297740	talvez a gente tenha uma continuação
4297740	4299720	disto um dia, mas
4299720	4301900	vamos lá, eu quero ler os comentários de vocês,
4302000	4303780	vou ler lá na Twitch, twitch.tv
4303780	4305680	barra rpeguax, na semana que vem,
4305900	4309220	então vai lá no post, deviant.com.br,
4309660	4311260	procura o post desse episódio,
4311700	4313760	deixa lá teus comentários, eu vou ler
4313760	4315580	ao vivo na Twitch com o pessoal do chat,
4316000	4317880	vou tirar suas dúvidas, provavelmente
4317880	4319700	alguém que participou do episódio vai estar lá,
4319720	4321640	comigo também, então não esqueça de deixar
4321640	4323900	os seus comentários lá. Uma coisa que mantém
4323900	4325800	o podcast vivo, que paga o editor,
4325920	4327740	o nosso querido amigo Zorzal, faz esse
4327740	4329420	projeto ser possível, gente,
4329600	4331500	é o nosso patronato,
4331840	4333360	são as pessoas que ajudam,
4333680	4335700	se você gosta muito da rpeguaxa,
4335940	4337680	venha nos ajudar, seja
4337680	4339380	a partir de um real, você ajuda a pagar o editor,
4339880	4341700	seja a partir de dez reais,
4341920	4344180	com um real, eu vou ler teu nome no próximo guaxaverso,
4344340	4345860	a partir de dez reais você faz parte do nosso
4345860	4347540	grupo do Telegram, que tem vários
4347540	4349520	subgrupos, com vários outros temas,
4349720	4351540	tá rolando aventura de RPG
4351540	4353700	direto, quer jogar uma aventura
4353700	4355540	de RPG, entrou no grupo,
4355680	4357780	fala, ah, eu queria jogar uma aventura
4357780	4359700	de RPG, marca o Felipe
4359700	4361500	ou a Jumozinha, o Felipe tá ajudando bastante agora,
4361740	4363780	marca alguém lá, ou me
4363780	4365720	marca, que eu marco alguém mais competente,
4366040	4367880	que a gente arruma um padrinho
4367880	4369760	pra mestrar, uma mesa pra desinfiar,
4370040	4371500	tu vai encontrar a tua tribo,
4371880	4373720	então seja nosso padrinho por uma série de
4373720	4375780	vantagens, e também pra acabar ajudando
4375780	4377780	esse projeto. Se quiser só
4377780	4379580	fazer um pix, rpeguaxa,
4379720	4381920	arroba gmail.com, não vai ter
4381920	4383940	vantagem alguma de entrar em grupos
4383940	4385800	e tal, a única vantagem é estar
4385800	4387220	ajudando esse projeto a continuar
4387220	4389980	a crescer e a existir.
4390240	4391560	Outra forma de ajudar a gente,
4392040	4393260	seguir nas redes sociais, arroba
4393260	4395760	rpeguaxa, tanto
4395760	4397380	no Twitter, quanto no Instagram,
4397800	4399640	em breve a gente vai ter a votação de quais foram os
4399640	4401500	melhores episódios do primeiro semestre,
4401760	4403660	então vai lá, vai opinar, porque o episódio
4403660	4405840	que ganhar no primeiro semestre, vai ser
4405840	4407780	mais ou menos um norte, do que tipo
4407780	4409580	de aventura vocês gostam de ouvir,
4409720	4412040	e vai guiar as próximas
4412040	4413760	aventuras que vão surgir.
4413980	4415840	Muita gente reclamou de episódios tristes,
4416000	4417680	então vamos lá, prova pra mim o que eu
4417680	4419860	acho que episódio triste é o que
4419860	4421920	todo mundo mais gosta, mas prova pra mim
4421920	4424080	que eu tô errado, vai lá, vote, exerça
4424080	4426080	a democracia, vai treinando,
4426380	4427840	porque a gente vai precisar disso mais pra frente
4427840	4429700	também. Mudando de assunto, começou
4429700	4432080	o Catarse do Solaria, procura
4432080	4434200	lá, catarse.me
4434200	4436180	barra solaria.
4436800	4437860	É um RPG que já
4437860	4439320	se pagou, ele tinha uma meta,
4439720	4441820	e essa meta já foi cumprida, então não tem
4441820	4443860	perigo de você investir e o negócio
4443860	4445800	se perder. No momento que eu tô gravando
4445800	4447880	isso, onde as padrinhas recebem antes, tem mais
4447880	4449660	de um mês pra apoiar,
4449980	4452300	e o projeto já tá com 118%,
4452300	4454180	então agora é só meta extra,
4454520	4455900	então vai lá, baratinho,
4456120	4457460	lindas as ilustrações,
4457820	4459820	ele é um RPG bem good vibes,
4460200	4461740	não porque ele é brasileiro, embora ele seja
4461740	4463840	brasileiro, seja bem bacana, dá luzinha
4463840	4465540	maravilhosa lá. Joguei com ela,
4465540	4467460	no canal dela, deve ir pro YouTube
4467460	4469580	em breve, durante a campanha, você vai
4469720	4471920	ver o YouTube, eu divulgo novamente pra vocês,
4472300	4473560	mas dá uma conferida lá,
4473640	4475480	é solar punk, com foco mais
4475480	4477600	ecológico, mais sustentável, tem
4477600	4479740	bastante, ele usa aquele sistema feite, se eu não
4479740	4481620	me engano, tem um foco maior da
4481620	4483720	natureza, ele tem um Q&A
4483720	4485480	de fazendinha, né, de
4485480	4487820	sustentabilidade mesmo, ele é bem diferente,
4488340	4489620	ele é bem bacana, ele
4489620	4491640	tá lindo, dá uma conferida lá,
4491940	4493700	catarse.me
4493700	4494940	barra solaria.
4495360	4496760	Quero agradecer aos jogadores,
4497500	4499300	quero agradecer a Agatha Sofia,
4499720	4501880	a deusa do Guaxa Verso, que não existe,
4502180	4503980	ela, além de abrilhantar
4503980	4505920	os episódios do RPG Guaxa, ela faz parte
4505920	4507720	do projeto Drama, projeto de
4507720	4509620	audiogeodrama maravilhoso, tem edição
4509620	4511700	do Zorzal que edita aqui também, e
4511700	4513760	surgiu e cresceu entre
4513760	4515980	os padrinhos do RPG Guaxa, é um
4515980	4517560	podcast muito bacana de audiogeodrama,
4517920	4519380	então conheçam o projeto Drama.
4519780	4521640	Ela faz parte do caso das Agathas,
4521820	4523660	que também surgiu dentro do grupo
4523660	4525580	de padrinhos do RPG Guaxa, pois lá
4525580	4527700	a Agatha conheceu a Agatha, e as
4527700	4529260	duas fizeram um podcast,
4529720	4531120	Casa das Agathas.
4531640	4533080	Ela participa também do EwaCast,
4533620	4535240	é um podcast de humor lá da
4535240	4537820	porteira, recomendo bastante, tem outros,
4538180	4539680	esse não surgiu dentro do grupo
4539680	4541700	de padrinhos, mas tem vários padrinhos
4541700	4543780	que gravam lá, como por exemplo
4543780	4546140	Rafael Tellerman. A Fer Cortez,
4546300	4547700	além de estar aqui abrilhantando
4548240	4549620	o RPG Guaxa, sempre que pode,
4550040	4551580	ela faz parte do Estação 21,
4551940	4553700	atualmente faz parte lá do
4553700	4555380	site Leitor Cabuloso, né?
4555640	4557780	Mas é um podcast que fala sobre cultura pop,
4558300	4559700	tem episódios muito bacanas,
4559720	4561540	pra você conhecer.
4561880	4563860	E a Fabiola Belo, que é uma das cabeças
4563860	4565980	que comandam o Instagram do RPG Guaxa,
4566040	4568000	ele só funciona hoje com aquele monte de postagem
4568000	4569640	maravilhinda, porque
4569640	4571960	ela, a Jumazinha, a Dani, o Felipe,
4572240	4573940	estão encabeçando, estão fazendo as coisas,
4574060	4575860	então agradeço muito a elas,
4576060	4577900	em especial a Fabi, porque ela também
4577900	4579960	abrilhantou este episódio.
4580260	4582200	Quero agradecer ao editor Rafael Zorzal,
4582740	4583960	ele tem um podcast maravilhoso
4583960	4585420	chamado Arquivos da Patrulha,
4585840	4587980	tem eu, não vou dizer
4587980	4589280	qual episódio tem eu,
4589720	4591420	dessa temporada atual, mas
4591420	4594040	tem eu. Então vão lá,
4594080	4595700	escutem tudo, porque não faz sentido ouvir ele
4595700	4597820	aleatoriamente, né? São podcasts
4597820	4599800	curtos de audiodrama, muito bem
4599800	4601840	editados, porque se o Zorzal
4601840	4603700	já edita bem pro RPG Guaxa,
4604040	4605460	imagina ele editando pra ele,
4605800	4608000	no projeto dele, ele roteiriza
4608000	4609660	e tudo, então conheçam lá.
4609980	4611740	E precisou de edição, fala com o Rafael
4611740	4613620	Zorzal. Esse episódio
