start	end	text
3553960	3555080	Olha, olha
3555080	3555140	Olha, olha
3555140	3555220	Olha, olha, olha
3555220	3555280	Olha, olha, olha
3555280	3555320	Olha, olha, olha
3555320	3555360	Olha, olha, olha
3555360	3555420	Olha, olha, olha
3555420	3555480	Olha, olha, olha
3555480	3555600	Olha, olha, olha
3555600	3555880	Olha, olha, olha
3555900	3556540	Olha, olha, olha
3556540	3559900	E daí aparece
3559900	3561460	As outras profs estão
3561460	3562180	Tão tudo nem pra vocês
3562180	3563400	Estão vendo o jornal local
3563400	3565560	E mostra a profe Jéssica
3565560	3567860	Com metade da fantasia de cuca
3567860	3569600	E ela olha pra câmera
3569600	3570440	E ela diz
3570440	3572020	E eu teria conseguido
3572020	3573900	Se não fossem aquelas crianças enxeridas
3574600	3576360	E aquele coelho idiota
3576360	3577220	Eu olho pra
3577220	3579200	Pra cara da loiva da Anitta
3579200	3580520	Coelho?
3581000	3582160	É, o Sr. PP
3582160	3584560	E aí a loiva aponta assim
3584560	3585820	Pra nova casa do Sr. PP
3585820	3585880	Que é a casa da Anitta
3585880	3587820	que agora é a cabeça da Cuca com a boca aberta,
3587980	3589440	assim, e o Sr. Pepe mora lá dentro.
3590000	3590960	E é nosso herói.
3608400	3609580	Escudo do Mestre
3609580	3611720	Escudo do Mestre é uma estrutura de papelão,
3611780	3613940	madeira que o mestre usa para fazer as anotações no semente de dado,
3613940	3615920	mas é aqui. Aqui eu baixo a estrutura e conto
3615920	3618220	para vocês tudo o que aconteceu na aventura.
3618540	3619960	Se tornou uma tradição, no primeiro
3619960	3621860	episódio de outubro ser o episódio
3621860	3623900	de Dia das Crianças, e o
3623900	3625880	último episódio ser o
3625880	3627960	Halloween. Essa tradição será mantida este
3627960	3630220	ano. Temos então um incrível episódio
3630220	3631900	de Dia das Crianças, que eu espero
3631900	3632940	que vocês tenham curtido.
3633620	3635740	Outra tradição, que eu não sabia, mas fui
3635740	3637800	lembrado pela Shelly, é que a Shelly sempre
3637800	3640080	está no episódio de outubro. Eu não sei
3640080	3641840	de onde saiu, mas ok,
3641840	3643200	se a Shelly disse isso.
3643940	3646180	Não posso negar. É porque normalmente ela está
3646180	3648440	nos episódios, ou nas tentativas de episódios
3648440	3650240	de Halloween. O desse ano, como
3650240	3652360	vocês sabem, era para ser o Olho de Deus,
3652760	3654180	mas o episódio
3654180	3656460	acabou ficando um pouco mais leve
3656460	3658420	do que o esperado, e ela acabou
3658420	3660120	saindo antes, então ela veio
3660120	3662020	reivindicar seu direito de estar em outubro.
3662260	3664400	Como o episódio que realmente sai
3664400	3666280	daqui a 15 dias
3666280	3667700	já estava gravado,
3668200	3670760	ela veio para gravar este episódio de Dia das Crianças.
3670980	3672240	Junto dela tem o Felipe Xavier,
3672520	3673920	temos a Shelly, que é a pessoa que
3673920	3675880	mais grava a RPG Guaxa, temos o Felipe
3675880	3677660	Xavier, que é o nosso segundo colocado,
3677880	3680180	o único menino no top 5, se eu não me
3680180	3682220	engano. Então ele veio aqui também a brilhantar
3682220	3684020	este episódio. E por último,
3684280	3685860	a Ju. A Ju foi
3685860	3688060	inspiração para este episódio. Muita gente
3688060	3690320	acha que logo ela chegará na top 3
3690320	3691820	gravações da RPG Guaxa.
3691940	3693900	Eu acho que é um absurdo essa hipótese,
3694200	3696080	mas estamos aí. Eu estava uma vez
3696080	3697460	fazendo minhas coisas, jogando videogame,
3697960	3700260	e lá no grupo do Discord,
3700520	3702160	para quem é padrinho do RPG Guaxa,
3702160	3703880	sempre está rolando mesa de RPG em
3703920	3706260	volta e meia, eu paro lá para dar uma ouvida.
3706580	3708080	Normalmente eu troco meu nick para de outro
3708080	3710260	padrinho, para que ninguém saiba que o Guaxa chegou,
3710540	3711980	mas normalmente me identificam,
3712080	3714360	é o que é um problema. E daí, uma dessas mesas
3714360	3716200	era uma aventura que a Ju estava
3716200	3717960	mestrando, de um RPG chamado
3717960	3720040	Otia. Nesse RPG, os jogadores
3720040	3722020	são crianças, né? E Otia
3722020	3724320	vem de creche, de escolinha,
3724380	3726040	né? E
3726040	3727980	ouvindo a aventura dela, eu tive ideia
3727980	3729960	desta aventura
3729960	3731940	que vocês estão ouvindo. A versão
3731940	3733900	dela não daria para transmitir,
3733920	3735660	para crianças, não daria.
3736000	3738260	Mas a minha versão deu, né?
3738700	3740100	Pegou até algumas inspirações
3740100	3741940	da aventura dela. Eu lembro
3741940	3744160	que na aventura dela, a professora
3744160	3745440	estava fazendo coisas ruins,
3746080	3747960	e daí os alunos estavam investigando,
3748000	3749640	ela estava falando me falso, uma loucura assim.
3749940	3751820	É meio, a Ju como
3751820	3754100	mestre sempre tende a novela mexicana
3754100	3755860	em algum momento. Queria deixar
3755860	3757920	aqui a constatação.
3758980	3759920	Então foi ouvindo a aventura dela
3759920	3761960	que eu tive ideia para esta aventura, e
3761960	3763780	eu precisava de alguma,
3763920	3765900	um ser mitológico,
3765960	3768020	alguma coisa que assustasse as crianças, entre muitas
3768020	3770060	aspas, e que pudesse ser a fantasia
3770060	3772060	da professora, né? E foi, aconteceu.
3772460	3774080	Esse episódio vai ter um gostavesso
3774080	3776080	caidinho, eu espero. Não tem
3776080	3777980	milhões de teorias, nem perguntas.
3778540	3780220	Por mais que eu tenha falado em corvo
3780220	3782140	lá na abertura, eu só quis
3782140	3784260	instigar vocês. É basicamente
3784260	3786040	a Jéssica, ela foi
3786040	3788020	trabalhar na escola, sem ser
3788020	3789940	realmente professora, ela tinha a intenção
3789940	3791940	de cavar um túnel até
3791940	3793900	o banco. Por mais absurdo que isso seja,
3793900	3795540	que isso possa acontecer, ela conseguiu.
3795720	3797940	E ela pretendia usar a roupa de cuca
3797940	3800040	naquele dia, pra poder
3800040	3801980	não ser reconhecida. É o que ela
3801980	3803320	tinha como máscara, né?
3803880	3805980	Pra não ser reconhecida, tirando
3805980	3807980	o dinheiro lá do cofre do banco.
3808220	3809920	Mas tudo foi estragado pelas crianças,
3810080	3811540	como vocês ouviram.
3811800	3813660	Quero pedir que você siga a gente nas redes sociais,
3813740	3815820	é muito importante.
3816120	3818080	Quero que você vá lá onde você escuta
3818080	3819900	o RPG Guax, se ele tiver a opção de dar
3819900	3821920	estrelinha, de avaliar, de deixar
3821920	3823700	um comentário, deixe um comentário,
3823900	3826120	põe lá as estrelinhas, pra mais pessoas
3826120	3828060	conhecerem esse projeto maravilhoso
3828060	3829840	e ajudar ele a continuar saindo
3829840	3831260	de graça aí no seu feed.
3831760	3833640	E falando em sair de graça,
3834080	3835700	você podia pagar um pouquinho, né?
3835720	3837500	Um realzinho que fosse já me ajudava muito.
3837580	3839800	Se cada ouvinte desse um real, gente, pelo amor de Deus.
3840240	3842080	O RPG Guax é totalmente um hobby
3842080	3844120	pra mim, né? Eu pago edição,
3844360	3845960	eu tenho uma série de gastos
3845960	3847800	com o podcast, e adoraria
3847800	3850040	se você pudesse me ajudar a fazer
3850040	3851480	cada vez mais.
3852000	3853780	Como é que você faz isso? Vai lá no PicPay,
3853900	3855460	e procura por RPG Guax,
3855600	3857900	ou não quer um aplicativo,
3858560	3859680	não quer usar o PicPay,
3859860	3862500	você pode ir no Padrim, padrim.com.br,
3862700	3863840	procurar por RPG Guax, acho que é
3863840	3865980	barra RPG Guax, ou procura por RPG Guax
3865980	3867860	lá, e você pode apoiar esse projeto.
3867940	3869900	Um realzinho você tá me ajudando. Como eu falei,
3869980	3871960	se cada um desse um real, eu tava muito feliz.
3872580	3874020	Mas se você quiser fazer parte
3874020	3876000	do nosso grupo do Telegram, é só
3876000	3877660	a partir de 10 reais você ajuda.
3878020	3879620	No grupo do Telegram tu tem acesso ao Discord,
3879740	3881880	onde tem várias aventuras, onde você
3881880	3883860	tem a oportunidade de ter a Ju mestrando,
3883900	3885580	pra você. É só conversar com ela,
3885800	3887500	que ela não nega aventura a ninguém.
3887780	3889940	E milhares de outros padrinhos que tão sempre lá
3889940	3891900	mestrando. Tem a Carol, que volta e meia
3891900	3894020	tem a sua clássica aventura da Operação no Olho.
3894260	3896000	Então, se quiser também, pergunta pra Carol
3896000	3897920	sobre esta aventura. Luana também
3897920	3899840	tá sempre mestrando. Eu tenho um monte de gente que tá
3899840	3901840	sempre mestrando lá. Não vou citar todo mundo aqui,
3901900	3903860	porque eu vou esquecer. Mas vamos lá. E se você
3903860	3905920	quiser mestrar, você pode ir lá. Jogador não falta
3905920	3907740	também. Quer testar um sistema novo?
3907820	3909060	Quer jogar um Guaxens e Gambiarras?
3909180	3911640	O que você quiser. É só chegar lá e dar um oi,
3911640	3913580	que eu tenho certeza que você não vai ser
3913580	3915640	arrepender. Como eu citei os jogadores
3915640	3917760	antes, a Shelly, além de... Todos os
3917760	3919780	três são padrinhos do RPG Guaxa. São aqui de casa.
3919920	3921240	Já gravaram um bilhão de vezes.
3921700	3923580	Mas a Shelly também faz parte do RPG Next,
3923700	3925320	que foi onde eu a conheci, onde eu a convidei.
3925580	3927860	O RPG Next é uma das inspirações pra criação
3927860	3929480	do RPG Guaxa. O RPG Next,
3929700	3931120	embora tenha aventuras one-shot,
3931620	3933160	lá, no geral,
3933500	3935580	tem campanhas, ou seja, séries
3935580	3937560	de aventuras que contam uma história maior.
3937860	3939620	Eles encerraram uma campanha grande
3940160	3941640	recentemente, que tinha até a participação
3941640	3943540	da Shelly, com uma meio-orca e
3943540	3945420	paladina, barra, algumas outras classes.
3945620	3947520	O D&D tem essas loucuras. Então dá uma conferida lá,
3947620	3949600	conheça o RPG Next. O Felipe Xavier,
3949760	3951420	como eu falei, ele faz parte do
3951420	3953540	Arquivos da Patrulha, que também é uma obra
3953540	3955120	do Zorzal, nosso editor aqui.
3955420	3957280	Então eu falo mais quando for falar do Zorzal.
3957440	3959480	E do Nossa Poesia. O Nossa Poesia sempre
3959480	3961800	traz uma poesia de domínio público,
3962280	3963620	lida por vozes maravilhosas.
3964420	3965380	São episódios curtinhos,
3965520	3967560	ótimos pra relaxar. Eu recomendo muito,
3967660	3970020	então conheçam lá o Nossa Poesia.
3970260	3971980	E tem a Ju, como eu citei,
3971980	3973520	é a pessoa que revisa os episódios,
3973540	3975640	esse episódio foi revisado, inclusive, pela Ju
3975640	3977120	e pelo Felipe Xavier.
3977440	3979220	E a Ju também é uma das pessoas que mais me ajudam
3979220	3981600	aqui no RPG Guaxa. Sempre que eu tenho uma ideia,
3981800	3983080	eu acabo discutindo com ela.
3983480	3985080	Ela me ajuda lá no Instagram.
3985580	3987580	Então agradeço muito a Ju, agradeço
3987580	3988700	muito a esses três.
3989440	3991180	Como eu falei, a edição é do Rafael Zorzal.
3991500	3993500	Precisou de editor? Fala com o Zorzal.
3993760	3995840	Quer aprender a editar? Fala com o Zorzal.
3996060	3997940	E conheça também o projeto do Zorzal,
3998020	3999180	Arquivos da Patrulha,
3999300	4001360	podcast de audiodrama. Chegou a ser
4001360	4002900	o episódio final recentemente.
4003540	4005580	Tem bastante coisa pra ouvir, mas tu vai ouvir com aquela
4005580	4007680	certeza de que é uma história fechada,
4007800	4009700	que não vai ser abandonada, que você vai
4009700	4011480	chegar a um final maravilhoso.
4011720	4013300	Como o último episódio saiu recentemente,
4013480	4015440	ainda há tempo de ouvir tudo e participar
4015440	4017380	das discussões de teorias
4017380	4019520	e de coisas. Até com padrinhos
4019520	4021040	do RPG Guaxa, se você for padrinho também.
4021320	4023540	Mas se não, só de ouvir, tenho certeza que você vai ficar
4023540	4025940	muito feliz. Conheçam Arquivos da Patrulha.
4026340	4027720	O pessoal do Baile de Taberna,
4027800	4029620	lá o canal da Twitch, tá fazendo uma
4029620	4031280	comemoração 100% online
4031280	4033280	entre o dia 3 e o dia 31.
4033540	4035320	31 de outubro. Tá tendo bastante
4035320	4037700	mesa de RPG lá no canal deles
4037700	4038980	da Twitch, dá uma conferida.
4039320	4041380	Eu vou deixar a programação aqui no
4041380	4043520	post. Algumas mesas já foram,
4043640	4045540	obviamente, mas eu estou
4045540	4047180	aqui pra avisá-los que dia
4047180	4049380	31 de outubro, uma
4049380	4051100	segunda-feira, lá em
4051100	4053140	twitch.tv barra
4053140	4055220	Baile de Taberna,
4055620	4057740	eu vou estar jogando uma aventura de terror
4057740	4059300	junto com o Zorzal, que é
4059300	4061400	o nosso editor aqui, e grande
4061400	4063380	elenco. Então se você quer ouvir uma
4063380	4065620	aventura ao vivo, de terror
4065620	4066720	e principalmente
4066720	4069480	ver eu e o Zorzal
4069480	4071800	livres, atuando,
4072280	4073500	jogando, se divertindo,
4074620	4075440	segue lá a Twitch
4075440	4077100	do Baile de Taberna.
4077580	4079320	Segue o Twitter deles também pra saber
4079320	4081300	direitinho os horários e tal.
4081400	4083100	Eu sei que é na segunda-feira, à noite.
4083500	4084980	Eu não sei exatamente
4084980	4087440	qual vai ser o horário.
4087440	4088900	Dá uma conferida lá.
4089200	4091420	O RPG Gosta tem lá os parceiros, dá uma olhadinha no post.
4091740	4093300	E esse episódio teve vozes de
4093300	4095480	NPCs, né? Todos os padrinhos
4095480	4097460	do RPG Gosta e eu queria agradecê-los.
4097560	4099580	Esse episódio tem algumas particularidades.
4099740	4101460	Quando eu escrevi a aventura, eu pensei
4101460	4103040	na Mel, né? Na Jéssica.
4103240	4105000	O nome dela é Jéssica e o apelido é Mel.
4105200	4107380	Não pergunte. Mel batiza
4107380	4109400	a creche e batiza a
4109400	4111560	professora, embora não sejam a mesma pessoa,
4111600	4113600	né? A Mel é a diretora
4113600	4115320	da escola, que também tem ligação
4115320	4117240	com a feira, né? E Jéssica seria
4117240	4119440	a professora que aprontou.
4119580	4121340	É óbvio que nada disso tem a ver com a própria
4121340	4123240	Jéssica, por sinal, não chamem a Jéssica de...
4123300	4125160	de tia, né? Ou a Mel de tia.
4125340	4127220	É num ambiente escolar, não é legal.
4127400	4129160	Mas pra essa aventura, ela adorou a ideia,
4129300	4131340	fiquei muito feliz. E foi uma homenagem a essa pessoa
4131340	4133220	também que gravou bastante aqui. Mais do que
4133220	4134900	madrinha, é uma amiga pessoal.
4135160	4137000	Então ela fez a voz da professora Jéssica.
4137220	4139680	Ana Beatriz é uma figura maravilhosa
4139680	4141360	lá da taberna. Eu tô devendo chamar
4141360	4143320	ela pra aventura. É uma que tem
4143320	4144300	um cavalo, inclusive.
4145220	4147200	E quando eu pensei... E ela é muito amiga
4147200	4149340	da Ju, né? Quando eu pensei em
4149340	4150400	criança empolgada,
4151000	4152800	eu pensei na Ana B.
4153300	4155340	Provavelmente, Ana é um nome comum, deve ter
4155340	4157340	mais de uma Ana naquela sala. Então,
4157480	4159600	além da Ana... Aí, quando a gente
4159600	4161560	tem crianças com o mesmo nome, tu chama
4161560	4163620	pelo sobrenome ou pelo
4163620	4165400	ponto ali. Talvez a outra chama
4165400	4167680	Ana Amélia, e daí a outra é a Ana A
4167680	4169580	e tem a Ana B. E daí a
4169580	4171860	voz foi feita pela própria Ana Beatriz.
4172280	4173520	A criança empolgada que aparece no final
4173520	4175400	do episódio é filha do Anderson
4175400	4177160	Catamari Villasboas.
4177500	4179200	Ela se chama Liliana, né?
4179480	4181340	Além de fazer a criança empolgada,
4181620	4183240	ela também gravou as regras
4183300	4185120	lá no início do episódio. Espero que tenham
4185120	4187560	curtido. E o soldado, o policial,
4187880	4189600	ele não tem ligação alguma
4189600	4191120	com a criação do episódio.
4191360	4193360	Ele é um padrinho que eu falei, ah, preciso de
4193360	4195340	NPC. E ele disse, eu. E daí
4195340	4197260	ele gravou. Agradeço muito
4197260	4198960	Marcos Matias.
4199540	4201340	Quer ter sua voz aqui no NPC?
4201720	4203360	Quer ter sua voz nas regras lá no
4203360	4205180	início? Ou de um parente seu, como foi o caso
4205180	4207440	da maravilhosa Lilia,
4208040	4209080	a filha do Anderson?
4209580	4211500	Seja nosso padrinho. E enquanto
4211500	4213280	você não assinou ainda o RPG,
4213300	4214980	guacha, ou pra você que já assinou,
4215200	4217140	lembrem sempre, rola em 6, rola em 20,
4217420	4219360	mas tudo errado rola no chão, que apaga
4219360	4221340	o fogo e diverte. Um beijo
4221340	4222340	no coração de vocês.
4243300	4273280	Um beijo no coração de vocês.
4273300	4303280	Um beijo no coração de vocês.
4303300	4304500	Um beijo no coração de vocês.
