start	end	text
1110720	1111520	Mas, segundo a Shelly,
1111600	1113580	o jeito que eu falei era melhor que o original.
1114100	1114640	Aí não sei.
1115040	1115720	É estúpido, acho.
1115920	1119040	O próximo comentário é do Rodrigo Bodas, que coloca...
1119040	1119760	Gostei do episódio.
1120180	1121560	Faria igual, com certeza.
1122020	1123940	Mas me pôr no lugar do Richard...
1123940	1124680	Carácolis!
1124760	1125240	É verdade.
1125760	1127700	O Richard ali, porra...
1127700	1129700	A sorte é que ele tinha um ego muito grande.
1129760	1131300	Senão ele teria feito uma besteira.
1131780	1132580	É, o Richard...
1132580	1134040	Realmente, o ego do Richard...
1134040	1135520	Precisava de uma cápsula só para ele.
1135900	1138640	E o próximo comentário é da Sara Barbosa.
1138920	1139300	E...
1139300	1139740	Oh, não!
1140280	1141160	Um ver mais!
1141660	1143380	Vou até clicar para ele subir logo da minha reta.
1143680	1145740	Olá para o ilustre Oda Brasileiro.
1145840	1146280	Concordo.
1146560	1147620	Também conhecido como...
1147620	1148420	Porra, não!
1148620	1149380	Olha só, olha só.
1149820	1150260	Menos.
1150400	1151140	Porra, muito menos.
1151520	1152400	Eu não tenho a girafa.
1153040	1153480	É...
1153480	1154300	Serve de pelúcia?
1154780	1155780	Não tem nem de pelúcia.
1155900	1156540	Tem vários gostinhos.
1156600	1157040	Muitos gostinhos.
1157060	1157260	Não tem problema.
1157260	1159740	A gente envia uma de pelúcia para você.
1160300	1160840	Não, não.
1160880	1161220	Obrigado.
1161520	1162880	Também conhecido como Guaxa.
1163080	1164560	Guaxão Vidade do dia.
1165120	1169560	E para você que está ouvindo, seja ao vivo ou em qualquer outra plataforma, este Guaxa
1169560	1173780	verso que é só uma leitura de comentários e não tem nada a ver com realidades paralelas.
1174160	1175800	Emoji de dois olhinhos esbugalhados.
1176100	1178240	Talvez o comentário fique meio longo.
1178860	1179300	Meio...
1179300	1180540	Sem problema.
1180720	1181280	Eu estou bem tranquilo.
1181280	1181720	Meio...
1181720	1182080	Oh, não!
1182180	1182520	Um ver mais!
1182540	1183740	A bondade soa, Sara.
1183840	1184480	Mas vamos nós.
1184880	1188200	Sara, que eu chamei para jogar domingo e me disse não.
1188360	1189040	Fica em registro.
1189240	1189600	Me perdi?
1189920	1192120	Mas é porque ela tinha um compromisso, obviamente.
1192640	1193480	Não, mas não dá...
1193480	1197000	Talvez o comentário fique meio longo, mas não dá para segurar a empolgação com o
1197000	1197760	plot da aventura.
1198260	1202860	Confesso que, quando estou focado em um filme, série, episódio do RPG Guaxa ou numa mesa
1202860	1207200	de RPG, eu presto atenção em cada mínimo detalhe para ir conectando as informações
1207200	1208280	que são apresentadas.
1208280	1211480	Eu contei os comentários e acho que não vai cair para o Guaxa.
1211580	1212860	Me perdoe, Guaxão Vidade.
1213220	1216280	Emoji de mãozinha, né, impresse.
1216920	1219020	Eu acho que tinha mais um emoji, mas não carregou para mim.
1219120	1219740	Está só um quadrado.
1219760	1220960	Não tem problema, Sara.
1221000	1221640	Eu te perdoe.
1221940	1223900	Parece um negócio roxo, não sei o que é isso.
1224060	1226260	Não sei, mas para mim está um quadradinho e não carregou.
1226640	1226880	Ok.
1227520	1227960	Spoilers.
1228320	1232080	Quando escutava o episódio, fui analisando as informações e montando conexões entre
1232080	1236120	o que o Guaxa narrava para os jogadores e o que os mesmos iam descobrindo ao longo da
1236120	1236700	aventura.
1236760	1241220	Quando a Capitã Nívia e o Vitor estavam indo para outra sala e a Karinei mostrou o
1241220	1244360	vídeo para o Vitor, fiquei confuso nesse momento com as informações.
1244900	1249120	Logo depois, veio o flashback do Vitor e ele lembra do casamento com a Cristal.
1249120	1250940	O casamento foi celebrado pela Capitã Nívia.
1251360	1256220	Então, corta para o Richard interagindo com a Karinei e ele tem um flashback sobre os
1256220	1261440	dois prêmios Nobel dele e falando da filha e do vídeo que ela fez sobre o governador
1261440	1263900	da federação, só para chamar a atenção do pai.
1264360	1266960	Nesse momento, surtei e pensei, ela é a filha dele!
1267400	1270840	Ela deve estar usando alguma IA para manipular as imagens que mostrou para o Vitor.
1271240	1272000	É a filha dele!
1272200	1272820	Que safada!
1273640	1275860	Ainda bem que tu não estava nessa aventura, Sara.
1275920	1276200	Obrigado.
1276620	1278780	A menina com 10 anos já era um gênio.
1278780	1281100	O segundo assistente do Richard disse na lembrança.
1281520	1283800	A guria era muito insurgente contra o Richard.
1284080	1287920	Então, imediatamente, fiquei triplamente focada no que escutava e pensando.
1288400	1288960	Guaxá!
1289380	1291440	Que plot a vossa pessoa está desenrolando!
1292000	1295280	A Capitã Nívia foi ligeira a entender o que estava rolando com a Karinei.
1295700	1297520	Depois, descobriram as montagens dos vídeos.
1297840	1301040	Aqui vibrei, pois minha linha de ressuscita estava certa.
1301360	1303200	Termozinho de...
1303200	1306680	Aqueles party popers, aquele confete que você gira e estoura.
1307100	1307220	É.
1307620	1307820	É.
1307820	1307860	É.
1308780	1312880	O tipo de ferimento das vítimas não tinha nada a ver com os alienígenas, mas sim com facadas.
1313060	1316240	Aqui bateu uma tristeza profunda pelas mortes dos tripulantes inocentes.
1316500	1319280	Karinei foi muuuito longe para chamar a atenção do pai.
1319680	1321640	Fiquei de queixo caído com a perversidade dela.
1322000	1322960	Karinei foi podre.
1323340	1326120	Ela ultrapassou todos os limites só para chamar a atenção do Richard.
1326480	1330080	Fiquei mal pelos personagens do Tiki e da Shelly, que não tinham nada a ver com isso.
1330620	1334240	Principalmente pelo personagem Vitor, do Tiki, que perdeu o amor da vida dele.
1334560	1338560	Bateu uma tristeza pelo Richard, que ainda não tinha sacado que havia colaborado com a morte
1338780	1341200	da própria filha, que ficaria a deriva no espaço.
1341500	1345360	Karinei parecia ter um certo prazer em torturar psicologicamente cada um deles,
1345700	1348000	especialmente ao interagir com o pai dela, o Richard.
1348260	1349300	Que plot de cinema.
1349720	1351600	Um emojizinho de uma câmera de cinema.
1351940	1353020	Projetor de cinema, perdão.
1353360	1355580	Quando eu terminei o episódio, só consegui dizer.
1355960	1356800	Absoluto cinema.
1357160	1358060	Guaxa, parabéns.
1358140	1358600	Que história.
1358720	1359220	Que história.
1359700	1363700	Ainda estou processando o plot desse episódio, assim como foi o filme A Ilha do Medo,
1364020	1365020	na primeira vez que assisti.
1365300	1365740	Filmaço.
1366160	1366820	Filmaço também.
1366860	1367220	Muito bom.
1367620	1368020	Parabéns.
1368020	1368980	Do menino de Capra.
1369100	1369380	Isso.
1369660	1373860	A Ilha do Medo é eu com ele, porque tem o Refúgio do Medo também, que é outro
1373860	1377040	filmaço, que não é com ele, mas é um filmaço também.
1377140	1377800	Vale muito a pena ver.
1378260	1381080	A Ilha do Medo eu acho que é com o Hulk, com o Mark Ruffalo e com o...
1381080	1381600	Com o de Capra.
1382040	1382600	Com o de Capra.
1382860	1383260	Maravilhoso.
1383780	1387540	Parabéns aos Orzal pela edição impecável e parabéns aos jogadores que se entregaram
1387540	1388180	aos personagens.
1388560	1391240	E para as madrinhas e padrinhas que deram voz aos NPCs.
1391680	1392080	Perguntas.
1392240	1392620	Primeiro.
1393000	1395440	Por que a Karinei queria tanto chamar a atenção do pai dela?
1396000	1397900	Então, isso é uma coisa que acontece no mundo...
1397900	1401480	Hoje, em 2024, é uma coisa...
1401480	1404600	Principalmente quando a filha é deixada de lado, ou o filho, né?
1404980	1407160	Ou, às vezes, até pessoas específicas.
1407820	1410400	O Tiki vai poder falar melhor do que eu que isso, né?
1410400	1411300	Eu sou só um...
1411300	1414700	Eu só escrevi a história baseada em porra nenhuma que eu sei.
1415220	1421940	E eu imagino que um mundo muito futurista, assim, mega, mega ultracapitalista, que está
1421940	1423440	completamente em colapso.
1423900	1426240	Muito, muito mais do que o nosso hoje, né?
1426780	1427240	Um mundo bem...
1427240	1427740	Um mundo bem...
1427900	1430440	Individualista, talvez, para quem ficou na Terra.
1431720	1432160	E...
1432160	1437100	Então, na minha cabeça, ela tinha alguma psicopatia, alguma coisa ali.
1437300	1439100	Mas, mesmo assim, ela se...
1440060	1444560	Ela achava que ela estava perdendo alguma coisa por culpa do pai dela, né?
1444980	1446100	Tanto que não se fala na mãe.
1446180	1448840	Talvez essa mãe até tenha morrido em algum ponto da história.
1449320	1451100	Então, na minha cabeça, é justificado...
1451860	1457300	Quer dizer, não é justificado o que ela faz, mas a mentalidade dela ao fazer, para mim,
1457320	1457860	é justificada.
1457900	1459160	É, assim...
1459160	1464060	Eu posso responder isso com uma fala que a paciente falou para mim hoje.
1464600	1466100	Ela virou para mim e falou...
1466100	1469260	Minha mãe me abandonou com quatro meses com a minha avó.
1469760	1473240	E, assim, na mesma conversa, ela depois falou...
1473240	1478280	E eu olho para a minha mãe, eu vejo ela cercada de arco-íris com uma coroa de rainha.
1478380	1479480	Nuvens ou a coroa de rainha.
1479920	1484500	Então, assim, a pessoa foi abandonada e, ainda assim, de alguma forma, ela quer essa
1484500	1485600	atenção, quer esse amor.
1486780	1487220	Porque...
1487220	1487740	Acho que...
1487740	1490720	Eu e o Guaxa, somos pais e a gente pode falar...
1490720	1492300	Cara, é...
1492300	1494400	Para mim, é o maior amor do mundo, assim.
1495220	1495660	Incrível.
1496140	1503660	Então, assim, o Richard, tipo, está lá descobrindo o planeta no dia do parto da filha.
1505280	1509460	Então, eu até comentei isso mais para frente, mas, sabe, eu lembrei do dia do parto da minha
1509460	1509880	filha.
1510300	1512360	Eu chorava de felicidade, assim.
1512700	1513940	Sim, pofa, um pouco.
1513940	1514920	Como criança, sabe?
1515060	1517720	Lembrar que eu estava lá, eu cortei o cordão umbilical, sabe?
1517740	1519240	Então, assim, tem...
1519240	1520740	Nossa, eu tenho lembranças incríveis.
1521580	1523040	Eu já estou já emocionado aqui de novo.
1523500	1526000	E saber que ele estava, tipo, ok, descobriu um planeta.
1526540	1526860	E aí?
1527360	1528360	Mas sua filha está nascendo?
1528480	1528820	Ah, tá bom.
1528960	1529760	Manda um...
1529760	1531820	A minha assistente já mandou uma cesta, sabe?
1532280	1534240	É, e a...
1534240	1539800	E ainda tem que lembrar da girada de faca, que é o seguinte, quando finalmente o pai
1539800	1546880	entra em contato com a filha, é via a estagiária barra secretária e ela é convidada para
1546880	1547680	viajar com o pai.
1547680	1550940	Ela vai para o novo planeta, ela deve ter se empolgado, até que ela descobriu algo.
1551080	1555640	O teu pai vai ficar dormindo e tu vai passar a tua vida trabalhando nesta nave aqui.
1556120	1560420	Eu acho que deve ter sido a gota d'água para ela fazer o que fez, né?
1561520	1565060	Até porque ela era uma não-militar no meio daquele povo ali.
1565440	1569640	Ela estava ali, ela foi trazida para aprender, né?
1569820	1574260	Para ser punida, talvez, ao contrário dos outros que estavam ali porque queriam.
1574260	1576680	É, ela foi, tipo assim, ah, é para...
1576680	1577660	Eu acho que foi aquela coisa de...
1577680	1579680	É a sua filha, então você tem...
1579680	1581660	Para não ficar feio, você tem que levar ela.
1582060	1586620	Só que, poxa, como é que vai tirar o local da galera que pagou?
1586800	1588060	Ah, bota lá para trabalhar, então.
1588540	1590340	Aí é bom que ela toma jeito.
1590800	1591800	É assim que funciona.
1592260	1593360	Assim, é isso?
1593840	1598960	Eu acho que, inclusive, a gente acabou respondendo a segunda pergunta, que é a Karen nem queria
1598960	1603660	se vingar do próprio pai durante esses vinte e tantos anos de castigo que ficou de serviço
1603660	1606200	enquanto o Richard estava repousando ou tinha algum outro motivo?
1606360	1607620	Era bem isso, assim.
1607680	1610940	E, no fim, ela acabou deixando ele vivo, né?
1612000	1617340	Talvez ela tinha lá tudo que ela fez para chamar a atenção dele e não teria por que
1617340	1618080	ele morrer, né?
1618480	1619860	Ela queria...
1619860	1626260	Talvez que ele visse ela como heroína daquela nave, ela tendo uma família ali com o Victor,
1626400	1626560	né?
1626960	1629380	Talvez o desejo, no fim dela, ainda era a aprovação.
1629780	1633160	E a terceira pergunta é, guaxa, de onde veio a sua inspiração para esse episódio?
1633840	1634320	Eu...
1634320	1637580	O meu amigo, Johnny Santos, ele deu um RT no falecido.
1637680	1640340	Ele deu um RT no Twitter, em alguém que respondeu a seguinte pergunta.
1640700	1640940	É...
1640940	1643140	Star Trek não faz sentido...
1643140	1643580	Não era pelo...
1643580	1645160	Não, era uma afirmação, e daí alguém falou e quebrou.
1645620	1645920	É...
1645920	1651040	Star Trek não tem sentido nenhum, porque todos os episódios seriam resolvidos com câmera
1651040	1651700	de segurança.
1652220	1656740	Como é que as pessoas inventaram de viajar entre os planetas e não inventaram câmera
1656740	1657420	de segurança?
1657840	1659580	E a resposta embaixo era a seguinte.
1660140	1665560	Se hoje em dia já se consegue fazer vídeo de Iá, que quase não dá para distinguir
1665560	1667560	da realidade, imagina numa realidade...
1667680	1670900	Em que as pessoas podem viajar entre galáxias.
1671620	1671940	É...
1671940	1677300	Nenhuma fonte de gravação seria considerada prova, porque provavelmente não teria como
1677300	1679320	se provar o que é verdade ou não.
1679780	1683060	E foi com base nessa frase que eu tive a ideia da aventura.
1683500	1684120	Faz muito sentido.
1684600	1685120	É...
1685120	1688900	Não vou lembrar quem é, porque o X, no momento, continua banido.
1689020	1690140	Mas siga a gente no Blue Sky.
1690560	1691720	E eu não vou voltar para o X, gente.
1692200	1693360	A menos que alguém compre, sei lá.
1693740	1695140	Que não seja a Rowling, né?
1695560	1696420	Talvez a gente volte.
1696880	1697600	Eu vou ler o próximo, né?
1697680	1699640	O próximo comentário é do Ed Bahia.
1699780	1704880	Dia, tarde ou noite, guaxa, guaxavidade, juvidade, xelevidade ou agatavidade.
1705360	1707320	Guaxual, guaxalera e guaxamilha.
1707440	1708700	Tinha que você foi amaldiçoado.
1709200	1712940	Você é um guaxavidade, um juvidade, um xelevidade, um agatavidade.
1713440	1715820	Você é um guaxual, um guaxalera ou um guaxamilha.
1716220	1719420	Então, eu sou um guajuvidagata.
1719860	1720200	Poison.
1720620	1723080	Só para botar xele no meio também, para não ficar faltando.
1723700	1724600	Guajuvidada poison.
1724680	1724900	Ok.
1725380	1725900	Não.
1725900	1726460	Eu fui excluído?
1726760	1727020	Ah, não.
1727080	1727560	Tem um guaxa.
1727680	1730160	É um guajuvidagata poison.
1730600	1731000	Poison.
1731220	1731500	Entendeu?
1731900	1735900	E faço parte da guaxalera e da guaxamilha.
1736160	1736640	Perfeito.
1736820	1738420	Pelo amor de Deus, Mr. Guaxa.
1738460	1739760	Que episódio barril foi esse?
1740220	1743740	Cheio de mistérios, dramas, emoções e um plot twist digno de um filme O Sexto Sentido.
1743840	1744260	Porra, obrigado.
1744360	1745140	Gosto muito de O Sexto Sentido.
1745540	1747420	Gosto muito da maioria dos filmes do Shyamala.
1747520	1750100	Acho que só não gosto do Dama da Água.
1750540	1753680	Alguns eu não gosto de Como a História Se Desenvolve, mas são plots muito bons.
1754100	1756460	Esse episódio me prendeu do início ao fim.
1756460	1759100	Que quando eu dei por mim já tinha acabado e eu fiquei...
1759100	1759500	Como assim?
1759620	1760200	Quero mais.
1760640	1763020	Esse episódio a ideia era ele ser um pouquinho menor mesmo.
1763460	1767200	Com a ideia de divulgar para os seus amigos esse episódio para a gente poder furar a bolha.
1767700	1768740	Espero que vocês façam isso.
1769140	1771440	Mas como o Guaxa Verso não existe, vou me contentar.
1771760	1773460	Agora os elogios para essas pessoas maravilhosas.
1774500	1776900	A sagaz, majestosa, formidável Shelly.
1777440	1779680	Porra, três elogios merecidos para a Shelly.
1780020	1781000	O cativante Jean.
1781160	1781520	Parabéns.
1781760	1782160	Parabéns.
1784420	1784860	Então.
1785580	1786180	Hashtag.
1786460	1790300	A culpa não é do Ed Bahia.
1790400	1791060	A culpa é minha.
1791540	1794920	Porque quando o episódio saiu, era madrugada.
1795060	1796080	Peço desculpa para o Tiki.
1796600	1799040	Eu escrevi Jean como um dos jogadores.
1799160	1800520	Eu botei Trota, Shelly e Jean.
1801000	1804140	Então o Ed Bahia deve ter pego ali e colocou.
1804220	1805880	Mas aí o próprio Jean me avisou.
1806440	1808440	E eu falei, mas vocês não são a mesma pessoa?
1808580	1809540	Ele disse que não.
1810060	1811460	Pediu RG, confirmei.
1811780	1812700	E daí eu botei Tiki.
1812860	1813880	Então a culpa não é do Ed Bahia.
1813880	1815620	Mas foi cativante, Tiki.
1815780	1816440	Peço desculpa.
1816460	1816800	Que bom.
1817080	1817960	Eu fui cativante.
1818040	1818540	Fico feliz.
1818880	1820540	O talentoso Adriano Trota.
1820720	1821900	Trota é muito talentoso.
1822380	1825020	E o esmerado Mr. Guacho.
1825440	1826780	Não, o esmerado Mr. Guacho.
1826860	1827820	O que é esmerado?
1828340	1830400	É a pessoa que faz as coisas com esmero?
1830520	1831040	Com capricho?
1831500	1831960	É, ok.
1832220	1832660	Justo.
1833840	1834320	Esmerado.
1834580	1835520	E se esmerou.
1835680	1837480	Feito com capricho, com empenho.
1837580	1837840	Assim.
1838460	1840980	Eu deveria me fazer com mais capricho e empenho?
1841060	1841360	Talvez.
1841940	1843460	O harmonioso Rafael Zorzal.
1843520	1843900	Verdade.
1843900	1845900	Todos vocês foram com barril quadruplicado.
1846460	1849040	Quero deixar bem claro que não tem favorito.
1849480	1851720	Todos vocês são barril dobrado.
1852020	1852280	Ok.
1852540	1853340	Não tem favorito.
1853640	1855000	Talvez o Jean, que nem estava no episódio.
1855720	1856200	Aparentemente.
1856760	1858400	O Jean é o baço do Ed Bahia.
1858520	1859320	Desculpa, Ed Bahia.
1860000	1860440	Vamos lá.
1860600	1862300	Próximo comentário é da Maria Clara.
1862740	1865980	Esse episódio me lembrou muito o filme Passageiros, com o Chris Pratt.
1866340	1866780	Viu?
1866900	1867280	Era aquele?
1867360	1868600	Pois eu já concordei com você.
1868980	1870320	Mas eu queria reafirmar.
1870340	1870980	Então, desculpa.
1871320	1871880	Oi, Guacha.
1872300	1873040	Gua-chavidade.
1873540	1875700	E todos os passageiros dessa nave maravilhosa.
1875700	1876240	Tudo bem?
1876460	1877000	Tudo bem.
1877040	1879960	Agora, então não é bem spoiler.
1880140	1882480	Mas eu comecei a escutar esse episódio vestida de branco.
1882560	1883740	Então me senti bem inclusa.
1883880	1884440	KKKKK.
1884960	1887760	Enquanto estou me recuperando de uma crise de enxaqueca.
1887940	1891500	Muitos estímulos e clima estão me deixando ruim ultimamente.
1891840	1894200	Estava te escutando.
1894520	1896320	Realmente, escutar é um jeito de melhorar.
1896440	1897820	Me ajuda a distrair e a me regular.
1898360	1898880	Ah, que legal.
1899360	1900380	Eu combato a fumaça.
1900680	1902820	Eu tive crise de enxaqueca hoje no plantão.
1902920	1903520	Não foi maneiro.
1903800	1906440	Cara, eu à tarde estava no centro de Blondine.
1906460	1908460	Em Blumenau, eu não me senti muito bem.
1908700	1909440	Não sei o que era.
1909880	1910760	Talvez seja isso.
1911160	1913240	Embora aqui, por ser um vale, ter bastante verde.
1913540	1916360	Quer dizer, em Gaspar, eu sinto que não estou sendo tão afetado.
1916840	1918580	Em Blumenau, talvez um pouco mais.
1918940	1919920	Talvez tenha sido isso.
1920020	1920380	Não sei.
1921420	1923660	Eu tinha muitas perguntas.
1923780	1926340	Mas com o plot do final, eu acabei desistindo delas.
1926740	1928900	Imaginei que era o mundo dos insetos espaciais.
1929000	1931280	Mas, pelo visto, é o mundo dos jogos de alienação.
1931680	1934020	Talvez seja o mesmo em tempos diferentes.
1934800	1935160	Não sei.
1935160	1935200	Não sei.
1936460	1938740	Mas, em 1975, você é o melhor.
1939420	1940280	Leia-se cantando.
1940640	1941420	Devidamente feito.
1941720	1943500	Que saudade que eu estava dessa referência.
1943740	1945340	Já disse que ama os episódios de Natal?
1945860	1946020	Ah.
1946160	1946540	É verdade.
1946920	1948280	Não sei o que eu vou fazer esse ano.
1948580	1949040	Mas, que bom.
1949460	1949680	Ah.
1949980	1954020	Comecei a apresentar o podcast para uma amiga minha com o episódio Os Herdeiros de Tite.
1954460	1955080	E ela amou.
1955540	1959020	Inclusive, ela deu a ideia de ter mais episódios sobre mitologia greco-romana.
1959420	1964540	E, graças a você, estou pensando em projetar um RPG com o seu sistema, baseado em Percy Jackson.
1965020	1965460	Maravilha.
1965460	1965540	Maravilha.
1965540	1974660	Eu estou devendo, a culpa é minha, eu sei, jogar, como jogador, a continuar o one-shot do Pedro.
1974760	1975140	Do Pedro.
1975360	1976160	Do João Panda.
1976700	1983940	Que sou eu, a Bia, a Rafa Maleszewski de jogadores e ele de mestre.
1984080	1984860	De guacha, perdão.
1985120	1985580	De guacha.
1985980	1990440	Para finalizar, obrigado a Trota, Shelly, Jean, Zorzal e Guacha.
1990560	1991780	Estou começando a jogar pessoal.
1992040	1995520	Todos foram essenciais para a minha estabilidade e para o episódio Topper.
1995540	1998820	Um beijo e até daqui 15 dias.
1999000	2001420	Tem dois emojis que também não carregaram para mim.
2001640	2003600	É, duas mãozinhas fazendo coração.
2004100	2004900	Obrigado, Maria Clara.
2005320	2006020	Próximo comentário.
2006500	2007920	Coruja das Torres, que coloca.
2008220	2010540	Bom dia, boa tarde e muito boa noite, guaxinim do espaço.
2010600	2010920	Tudo bem?
2011000	2011320	Tudo bem.
2011740	2012500	Que episódio incrível.
2012660	2015800	Fiquei roborizada com esse final.
2015960	2016340	Ah, que legal.
2016820	2021340	O mestre guaxinim, emoji guaxinim, sabe mesmo deixar os ouvintes de queixo caído.
2021460	2025140	Fiquei um tempo sumido nos comentários, mas sempre escuto os episódios no mesmo dia que sai.
2025540	2027740	Emoji sorrindo de bochechinha vermelha.
2027800	2028220	Estou feliz.
2028560	2031720	E guacha, você me surpreende sempre, positivamente, claro.
2032180	2032500	Que bom.
2032840	2037200	Fiquei tão feliz em ouvir mais uma vez a voz da Shelly e do Trota juntos em um episódio.
2038580	2039720	Vou só repetir, tá?
2040180	2042380	Muito feliz em ouvir a voz da Shelly e do Trota, ponto.
2042720	2045960	Os jogadores foram incríveis e eu amo quando os dados ajudam.
2046080	2046400	Risas.
2046820	2048100	Bom, vou ficar por aqui.
2048320	2049300	Um beijo e até mais.
2049420	2051420	Eu estou achando que minha internet vai cair daqui a pouco.
2051520	2052020	Não sei por quê.
2052540	2053780	Não vai não, por favor.
2053780	2053880	Por favor.
2053880	2056160	Eu ponho outra pessoa para ler no teu lugar aqui.
2056460	2056860	Cadê?
2057320	2059900	O Trota deve ficar aquecendo na lateral do campo, gente.
2059920	2060220	Vamos lá.
2060560	2062840	Próximo comentário do Luiz Edvaldo Correia.
2063260	2066520	Olá a todos vocês, pandas vermelhos com um olho ciborgue.
2066780	2068040	Eu entendi essa referência.
2068420	2069860	Episódio sensacional.
2070340	2071340	Piada com spoiler.
2071800	2072920	He-Man falando para a tela.
2073020	2076880	Crianças, hoje já aprenderam no RPG Guaxa que rolê só de três pessoas...
2077400	2079100	Que rolê só de três pessoas.
2079260	2082340	Se surgir uma quarta que vocês não conhecem, corram.
2082340	2083120	Nego.
2083120	2087380	Se você está tocando um violoncelo, que tentáculos são esses?
2088020	2089320	Outra referência obscura.
2089340	2089960	Eu boiei.
2090320	2096300	Eu não sei se a parte do violoncelo era do violino da Lídia ou se era alguma outra coisa, mas eu boiei.
2096620	2098620	Zorzal, que livro bom que você escreveu.
2099000	2100600	Pesado, mas muito bem escrito.
2100960	2103500	Pessoal, corre na Amazon e compre seu exemplar.
2103800	2106240	Abraços a todos vocês e seus criativos lindos.
2106480	2109680	Perfeito. Procure lá, fraternal, do nosso querido Zorzal.
2109680	2112680	A referência do panda vermelho com o oceborg é do...
2113120	2113880	Raul do Arquivo.
2114300	2114500	Sim.
2114980	2117400	Mas e o He-Man ali com o gorpo tocando violoncelo?
2117420	2119440	Eu conheço a referência do He-Man e do gorpo, o resto não.
2119840	2120060	Ok.
2120440	2121980	Eu sabia essa com laranjas, né?
2122100	2122960	É, tipo isso.
2123360	2126400	O próximo comentário é do Vegano Thiago, que coloca...
2126400	2127580	Olá, Guaxuar.
2128340	2130160	Que é o guaxual mineiro.
2130420	2131860	Cheguei até os episódios atuais...
2131860	2131880	O Pirata.
2132000	2132760	No caso, o Guaxa...
2132760	2134040	O Pirata, pode ser.
2134460	2136460	Espero que não baixem os episódios originais, gente.
2136520	2137840	Não baixem, é porque eu gosto de Pirata.
2138340	2140860	Cheguei até os episódios atuais, no caso, o Guaxaverso anterior.
2141120	2141980	Vim aqui comentar.
2142380	2142940	E assim que eu vi o episódio...
2142940	2144060	O episódio, eu volto pra comentar.
2144420	2147000	Ele chegou nos atuais, aí quando ele tava atrasado, ele veio comentar.
2147020	2147760	Vim comemorar.
2147800	2148760	Antes de tudo...
2148760	2149780	Mas comentou, né?
2149900	2150140	Sim.
2150420	2151880	Antes de tudo...
2151880	2152900	Pode falar.
