start	end	text
0	8140	Se eu pegar essa ilha e esse helicóptero, e aí tudo faz sentido, porque aqui tem um
8140	9460	zumbi e ali não tinha, e agora?
10160	10700	É isso!
10900	11440	É isso!
11900	12540	Eu sabia!
12680	13240	Eu sabia!
14020	15020	O Guaxaverso existe!
15140	16000	Como assim?
16200	18160	Você entendeu a referência do último episódio?
18280	19000	Olha só, faz tudo!
19000	19620	Não, o Guaxaverso sabe!
19620	20980	Espera, o que é o Guaxaverso?
21000	23000	Era só uma questão de tempo.
23100	23440	Todo mundo conheceu o Guaxaverso!
23440	24760	O Guaxaverso sempre existiu!
24780	25460	Até o nosso final!
25540	27200	Eu quero entender o Guaxaverso!
27240	28560	Alguém me explica o que é o Guaxaverso?
28560	32040	É, pessoal, não existe o Guaxaverso.
32100	33740	Eu acredito no Guaxaverso!
33820	36560	Mas supondo que ele exista...
37900	41560	Guaxaverso, onde o que não existe é debatido.
45280	45840	Gravão.
45940	46420	Gravão.
47020	49680	Seu corpo é o mar por onde quer navegar...
49680	50620	Cadê o roteiro aqui?
51280	54500	Olá, eu sou Marcelo Guaxinim, narrador, produtor e analisador do podcast Galerias para o Guaxinim
54500	58500	e o próximo episódio que eu vou escrever é o de...
58560	58980	Halloween.
59380	60900	Que é o extra de Halloween.
61300	62560	Mas deixa eu conferir uma coisa.
62980	63460	Ah, tá.
63720	64500	Ah, eu fiz errado.
64680	65060	Mas tá bom.
65820	70180	A meta pro episódio extra de Halloween já foi batida e eu já tinha prometido ele também.
70620	75440	Então eu nem posso obrigar vocês a assinarem lá no apoia.se barra rpguaixa, mas eu peço
75440	79900	que você vá em apoia.se barra rpguaixa, a partir das 10 reais você faz parte de um
79900	81940	grupo incrível, tá vendo, Guaxinim?
82420	83420	Então apoia a gente lá.
83840	85220	Tá quase batendo a próxima meta.
85540	88480	Eu estou aqui hoje com alguém que ajuda a bater.
88480	88540	Eu estou aqui com alguém que ajuda a bater.
88540	90560	Eu estou aqui com alguém que está...
90560	91520	Ah, não, olha só.
91980	94760	O episódio extra de Halloween é a próxima meta que não foi batida.
95160	97260	Mas eu já tinha prometido esse episódio e isso vai ficar pro ano que vem.
97580	98640	Mas fingem que não.
98780	100300	Então vão lá ajudar, senão pode ser que não tenha.
101240	105200	Eu estou aqui com alguém que ajuda com essa meta, que é o nosso querido Dr.
105400	105620	Tic.
105800	106400	Tudo bem, querido?
106680	107280	Fala, Guaxinim.
107280	107640	Tudo bem.
107740	108300	Graças a Deus.
108540	109300	Cansado, mas bem.
109720	111340	Tic que jogou o episódio.
111840	114360	A gente está aqui pra falar do episódio e de cartas de tarô.
114740	117100	Eu não sei se tem perguntas sobre as cartas de tarô.
117580	118380	Vou esperar.
118540	123240	Mas caso chegue no final e eu não tenha o que falar, eu quero falar sobre as cartas de tarô
123240	130400	e sobre uma coisa que eu disse pro Tic e pra Agatha, que era início de setembro.
130900	131640	Me lembrem disso.
131740	132280	Eu tinha falado.
132400	133000	E eu lembro que é.
133160	134140	Então é pra explicar.
134620	136200	Envolve uma carta de tarô também.
136580	138240	Tic, como é que as pessoas te acham na internet, querido?
138580	144620	As pessoas me acham na Tabernáculo Guaxinim e seus grupos adjacentes, no RP Guaxa.
144620	147960	E eu estou tentando usar o Blue Sky.
147960	154960	E, tanto na Taberna, no Telegram, quanto no Blue Sky, é o arroba Tic308.
155920	157140	T-I-C-K.
157520	158960	T-I-C-K-308.
159840	160420	Achei aqui.
160980	161780	Já estava seguindo.
161880	162400	Estou feliz.
162680	163620	Sigam lá vocês também.
164100	167780	Tem a foto do Tic e de uma coisa maravilhosa vestida de tigre.
168220	168980	Vamos lá descobrir.
169200	170420	É verdade.
170940	173180	Ou seja, é o Guaxa Versa afetando a vida de uma pessoa.
173580	173920	Talvez.
174260	176420	Assim, não é a pessoa que eu mais afetei a vida.
176420	178540	A gente estava fazendo um top hoje à tarde.
179100	180500	Eu sou o um, obviamente.
181280	186080	E tem uma outra pessoa que eu afetei nome, casamento, tudo.
186440	188420	E eu tinha aqui uma roupinha para tiquito.
189300	190320	Não só, né? Mas...
190320	191540	É, assim, assim.
191960	193560	Eu também estou lá no Blue Sky.
193740	198420	Então sigam arroba Marcelo Guaxinim, arroba rpguaxa.biscate.social.
199200	200180	Não lembro como é que funciona lá.
200560	205420	Mas procurar por Marcelo Guaxinim e por RP Guaxa, você consegue me achar lá.
205420	206420	Então me sigam.
206420	206940	Me sigam.
207480	209080	É uma rede social nova.
209220	210540	Estamos reconstruindo do zero.
211020	215240	Muita gente fala, ah, o engajamento no Blue Sky é muito melhor que o do Twitter.
215540	216240	Isso é verdade.
216660	221360	Eu com quase mil ali consigo engajamento muito melhor do que eu tinha com 12 mil
221360	224160	nesse último ano do X, né?
224720	228320	Mas, quando a gente vai falar com uma fanta, por exemplo,
228840	230420	a gente tem que apresentar números.
230820	233420	Porque eles são todos de...
233420	235980	Mas são pessoas de humanas que idolatram exatas,
235980	236660	pelo que eu entendi.
237180	238500	Então precisa de números altos.
238620	239380	Então segue a gente lá.
239820	243580	Dá uma moral pra gente que vai ajudar o RP Guaxa a conseguir mais coisas.
244080	245780	A fanta lançou aí um fanta caju.
245880	247260	Não encontrei pra vender aqui no Sul.
247840	250020	Agora tem um fanta mistério.
250940	251300	Spoiler.
251560	252260	É maçã verde.
252740	254040	Pô, eu queria muito estocar aquilo.
254320	254900	E seria...
254900	255980	É do Beetlejuice, né?
256100	256760	É do Beetlejuice.
257260	258040	Ela é verde, assim.
258160	260120	Parece radioativa, mas...
260120	261100	Dizem que é maravilhosa.
261160	262580	Eu ainda não tomei, mas a Fábio tomou.
262980	264360	E assim que eu achar, eu vou estocar.
264700	265080	Muitas.
265080	265520	Muitas.
265520	265540	Muitas.
265540	265560	Muitas.
265560	265580	Muitas.
265580	266380	Porque é só latinha, né?
266380	267840	Eu queria os dois litros.
268080	270100	Então segue a gente também no Instagram.
270260	271900	Arroba maçã gostinha, arroba RP Guaxa.
272320	273580	Lá sim, tem bastante gente.
273780	275220	O Instagram do RP Guaxa.
275580	276720	Ele é maravilhoso, assim.
276780	277720	Ele tem muito conteúdo.
278140	279460	Vocês deviam lá conhecer.
280100	281860	Tem pessoas maravilhosas cuidando dele.
282240	286740	A Fabi, a Ju, a Dani e o Felipe também ajudam, né?
287060	288980	E tem mais gente lá que ajuda também.
289440	291480	Então muito obrigado a todos vocês.
292020	295160	Estamos aqui pra ler muitos comentários do episódio
295160	297320	Memórias Nebulosas.
297800	300500	Assim, de novo, se não perguntarem a inspiração do episódio,
300640	301560	que foi algo bem bacana,
302100	303800	eu no final, se eu lembrar, falo.
303840	305680	Vamos torcer que no final a gente lembre de alguma coisa.
306160	308400	Mas o primeiro comentário é do Jorge Marcos Santos Silva,
308900	309560	que coloca...
309560	314300	Chega a ser impressionante como esse episódio foi cinematográfico na minha cabeça.
314500	315060	Na minha também.
315500	317180	Um bom dia, Sr. Guaxa, que sou eu.
317780	318660	Convidante, que é o Tic.
318800	319280	Certo, Tic?
319360	319680	Certo.
320000	321260	Tentei ser a Shelly, mas falei.
321660	324100	E Guaxual, que é o Guaxa sensual.
324500	325120	Tudo bem, queridos?
325160	325660	Comigo tudo bem.
325740	326320	Tudo bem contigo, Tic?
326340	327340	Tudo bem também, graças a Deus.
327800	328200	Spoilers.
328320	330000	Tudo foi motivado pelo quê, exatamente?
330240	332480	Loucura, inveja, frustração ou um pouco de tudo?
332820	333500	Pai ausente.
334020	339600	Toda a ideia da aventura é uma criança que foi totalmente negligenciada.
340920	345100	Todas as vezes que ela era referida nos poucos flashbacks
345100	349320	que o personagem do Trota teve, o Richard,
349480	354080	era, poxa, ele não estava no parto da menina,
354080	360540	a menina vai presa, tudo ela faz para chamar a atenção do pai,
360640	363480	seja com 10 anos, seja no futuro ali.
363880	365300	Você tinha algum plano para um final diferente?
365840	372380	Eu não planejei um final, eu sabia todo o plot de que a Karinen estava
372380	376680	realmente manipulando as imagens, que ela escolheu manter a Capitã
376680	379580	porque é a única que tem autorização para comandar a nave,
379580	382580	que ela escolheu ter um Adão para a nova...
384080	386540	para a nova vida que ela ia ter.
387320	390980	E daí sim, por inveja do amor que ele tinha com a Cristal,
391500	394180	ela acaba tentando roubar ele para ela.
394800	398120	O Tiki que está aqui, o Victor, na aventura original.
399260	402820	Mas o que eu esperava no final é que ela fosse descoberta de alguma forma.
404120	405880	Talvez ela pudesse ter chego...
405880	408080	Os jogadores podiam ser muito trouxas e cair na história dela
408080	412720	e chegar no planeta e o Trota ia lembrar só quando fosse tarde demais.
413060	413960	Era uma possibilidade.
414080	418520	Mas assim, eu normalmente não me foco muito em pensar finais de aventura.
419000	421640	Eu me foco muito em escrever o começo da aventura
421640	424140	e deixo os jogadores moldarem as ideias.
424540	429700	Embora tudo que a Karinen fez e ia fazer e o reflexo disso
429700	434220	em cima do que estava acontecendo, obviamente era planejado com antecedência.
434560	437920	Eu não inventei o que a Karinen fez à medida que a aventura avançou.
437920	440840	Mas todas as atitudes dela e as consequências
440840	443120	foi uma criação junto com os jogadores.
444080	447760	Como está a Terra nesse universo ou tempo, além do que foi dito?
448060	450300	É o que foi dito na introdução da própria Shelley.
450740	454880	É uma Terra que as mudanças climáticas, a poluição,
455380	457880	está tentando eliminar a raça humana, né?
458360	460960	Mas o ser humano está numa guerra eterna
460960	465560	e está tentando ser mais rápido que o próprio planeta em se destruir.
465560	468800	Por isso, um novo planeta verde, etc.,
468800	472560	ele é realmente algo muito importante para a humanidade.
474080	476940	As pessoas separadas naquela área de carga
476940	479480	são pessoas com muito dinheiro,
479820	482100	são pessoas que pagaram para essa viagem
482100	484680	para ter uma nova chance, né?
485120	488700	Então, talvez futuramente cheguem novas naves,
488820	490740	embora leve muito tempo para chegar até lá, né?
491120	494120	E como as demais pessoas lidam com o ocorrido?
494360	496220	Como as demais pessoas lidam com o ocorrido, o que ocorrido?
496320	497820	Na Terra, as pessoas estão morrendo.
497820	499040	É tipo agora.
499060	502860	Seria como as pessoas lidaram com o ocorrido dentro da nave.
503260	504020	Como essas outras duas...
504020	509200	Então, quando tu chega no fim da rodoviária,
509760	511800	se o motorista do ônibus mudou no caminho,
512220	514020	não te faz diferença, tu chegou no final.
514560	516900	Para aquelas pessoas, elas não tinham contato nenhum,
517320	519460	elas passaram 50 anos dormindo,
520020	522860	elas sabiam que elas iam fundar um novo planeta
522860	524400	que teria uma nova regência.
524400	528160	A regência estava lá, o próprio personagem da Shelly, né?
528640	530200	Então, para as pessoas em geral,
530600	533860	a menos que os jogadores queiram abrir a história toda para todo mundo,
534400	536300	para eles é indiferente.
536660	539460	Todo mundo já foi mais ou menos lá com seus parzinhos,
539580	542900	com as suas ideias do que ia fazer naquele novo planeta, né?
543260	545700	Vou deixar outras perguntas para os meus colegas mais inteligentes,
546080	547280	que é isso, foram perguntas muito boas.
547660	551980	Os jogadores foram incríveis, mas a campanha e a edição fizeram uma imersão maravilhosa.
552320	554760	Biscoitos com desenhos de aliens holográficos para todos.
555100	555500	Obrigado.
555860	556780	Por hoje é isso, fico por aqui.
556780	559600	Forte abraço a todos, força e luz para todos nós e até mais.
559720	560740	Até mais, querido Jorge.
561140	563200	Vamos lá, próximo contário é do Pedro Peron.
564020	565940	Guaxa e Guaxamigo, vocês estão bons?
566420	568420	Que episódio incrível.
568940	572320	Me arrepiei todo nesse final, mas confesso que cheguei a pensar
572320	574920	será que essa filha não é a Karinen?
575380	577580	Mas deixei para lá e o final me pegou de jeito.
578080	578920	Sensacional demais.
579100	581240	Obrigado por essa obra-prima, Sr. Guaxa.
581440	582820	Um beijo e um abraço para vocês.
583160	584080	Um beijo e um abraço.
584240	584560	Ah, sim.
585140	586160	Um beijo e um abraço, querido.
586160	590140	Eu estava com medo dos jogadores chegarem a essa conclusão no meio da aventura
590140	593960	e não aconteceu, até porque no meio da aventura é mais difícil, né?
593960	598740	O jogador está mais focado em outras coisas, mas era o meu maior medo.
599060	602480	Eu defendi que o nome do episódio deveria ser Karinen,
602920	607440	mas a Shelly me disse que isso daria muito na cara e mais pessoas chegariam à conclusão.
608580	611920	E como a pasta estava como Karinen, que é o nome da aventura quando eu escrevi,
612540	616580	quando eu mandei para o Caio o arquivo para revisão era Karinen.mp3,
616940	618460	que foi como o Zorzal salvou.
618900	620100	Eu não tinha me ligado disso.
620100	623840	E o Caio, Caio Lourenço, que está aqui assistindo a gente hoje,
624300	629600	ele sacou por conta do nome do episódio, provando que a Shelly estava certa e eu estava errado.
629940	633180	Cara, a gente fica... parece que a gente fica meio burro quando está jogando
633180	636580	e quando a gente está ouvindo, a gente está com o nosso cérebro normal.
637060	639840	Então, assim, é mais difícil, assim.
639900	644900	As coisas parecem que não se encaixam direito quando você está jogando
644900	648460	e, de repente, você consegue encaixar para a gente.
648460	650040	E aí tu fala, caralho, como assim?
652060	652460	O...
652460	653660	Ele continua sensacional demais.
653740	653940	Obrigado.
653960	656040	Obrigado por esta obra-prima, senhor Guaxa.
656100	656580	Que exagero.
656940	658140	Um beijo e um abraço para vocês.
658500	659440	Um beijo e um abraço, querido.
660020	660400	Duas coisas.
660500	663080	Um, eu que estava olhando esse e eu terminei de ler.
663500	663960	Ah, desculpa.
664060	664840	Eu sou...
664840	666620	Pô, eu realmente estou ruim aqui hoje.
666920	667780	É verdade, é o segundo.
668280	669260	Próximo comentário.
669880	670200	Lari...
670200	671460	Não vou cortar nada disso, gente.
671680	673880	Próximo comentário, Lari Zorzenone.
674400	676780	Voltando a comentar aqui depois de um século.
677780	678220	Carinha...
678220	678900	Que carinha é essa?
679420	681200	Uma carinha meio...
681200	682440	Aquele sorriso, tipo...
682440	683880	Ih, fiz merdinha.
683960	684900	Ah, ok.
685500	686960	Bom dia, boa tarde, boa noite.
687260	689420	Guaxalera, que é a chaleira do Guaxo.
689660	691460	Todos os biscoitos a vocês, mestre Guaxo.
691520	692680	O episódio ficou bom demais.
693080	696360	Me lembrou o super do filme Passageiros.
697660	699920	Passageiros é do...
699920	702060	Do menino do...
702060	704700	Guardiões da Galáxia e da Bonitinha?
705220	706940	Não, filme de 2008.
707600	708680	Não, 2016, né?
708780	711180	Não, esse filme Passageiros é um filme de 2008.
711520	711960	O Anne Hathaway...
712580	712900	Eu achei.
712900	713640	Vamos lá.
713640	716780	Claire Summers, Anne Hathaway, é uma jovem terapeuta designada...
716780	718280	É o de 2016, que é o que eu vi.
718460	720860	...por Perry André Brower, seu mentor.
721340	721920	Não, é o...
721920	723920	A dar orientação psicológica aos cinco sobreviventes
723920	725260	num terrível acidente aéreo.
725320	725820	2016.
725900	728800	Ela enfrenta problemas ao ser confrontada por Eric, Patrick Wilson,
729280	732380	que recusa sua ajuda e usa o acidente para tentar cortejá-la.
732760	735840	Isso faz com que, paralelamente, Claire lute contra as iniciativas de Eric
735840	739140	e os demais pacientes enfrentem dificuldades com as lembranças do acidente.
739460	742600	Distinta das explicações oficiais fornecidas pela companhia aérea.
742600	743620	Não, é outro filme.
743640	745560	É o de 2016 que ela está se referindo.
746400	746800	Tem...
746800	747540	Tem...
747540	749500	Tenho certeza.
749780	750220	2016.
750620	752080	Que é um filme que eu realmente assisti.
752540	752920	Ah, é?
752980	753860	Deixa eu colar aqui no Wikipedia.
755240	755680	É...
755680	757140	Sim, é um filme...
757140	758640	Basicamente, a ideia...
759180	761400	O plot funciona um pouco diferente, né?
761820	765220	Mas a ideia é essa, é uma nave indo para um novo planeta e tal.
765740	768660	Lembro de ter assistido, sim, e, obviamente, me influenciou.
769060	770680	Não direto, não conscientemente,
770680	772680	mas, obviamente, é uma...
772680	773180	É uma...
773180	773580	É uma...
773640	774340	É uma leitura, né?
774340	776420	Um filme que eu vi e que acaba influenciando.
776700	777360	Preciso rever.
777520	778140	Vou colocar aqui.
778360	778740	Quer dizer, eu não...
778740	779400	É, ok.
779880	781020	Mas voltando, desculpe.
781340	783520	Parabéns, como sempre, a todos os participantes.
783960	786200	Todos maravilhosos, embarcando super,
786660	788680	confiando nos fragmentos de memória que tem.
789100	792660	Eu nem consigo imaginar como seria a minha reação de acordar desmemoriada.
793080	793500	Também não.
793900	795980	Só para saber, está na mesma linha de Eva?
796580	797460	Não sei, talvez.
797960	798480	Pode ser, né?
798480	799740	O mundo estava se acabando lá.
800300	802000	Mas não quero cravar nada, não.
802140	803560	Quer dizer, não existe um gacha verso,
803560	804060	né, Lari?
804220	806300	Para de tentar jogar armadilha por cima de mim.
806620	809300	Sobre acordar desmemoriado, já aconteceu comigo,
809440	810440	mas eu não lembro.
810740	811680	Desculpa, qualquer coisa.
812380	814740	Eu uma vez fui picado por uma abelha
814740	816860	e desmaiei no hospital
816860	818900	e horas da minha vida sumiram
818900	820860	e eu não sei o que aconteceu enquanto eu estava desmaiado.
821160	823200	E é muito estranho ter uma lacuna na tua cabeça.
823540	824340	Embora eu sei o que aconteceu.
824440	826220	Eu estava deitado e meu pai estava preocupado do meu lado.
826880	828580	Anestesia é mais ou menos isso aí, né?
828580	829360	É um tempo perdido.
829820	831080	Desliga e liga de novo, assim.
831440	832240	Ué, o que aconteceu?
832240	832800	Porra, eu queria...
832800	834880	Eu queria que o meu canal fosse uma dessa.
835340	836400	Porque puta que pariu.
836580	839060	Mas vou lembrar para sempre daquele momento.
839440	839740	Vamos lá.
839880	841740	Próximo, o atalho da Iwakika.
842280	843900	Olá, guacha criaturas.
844300	845400	Foi muito bom esse episódio.
845720	849040	Parece que você tem um toque mágico em episódios em naves espaciais.
849400	851260	Esse começo dos personagens sem memórias
851260	853160	me lembra alguns episódios mais antigos.
853600	855780	É bom ver que ainda funciona bem esse estilo.
856160	858160	Sempre me deixa com vontade de ver outra pessoa
858160	859560	botando esse plot em prática.
859800	861240	Biscoitos espaciais para todos.
861460	862200	Muito obrigado.
862320	862640	Um beijo.
862800	863880	Muito grande para a Iwakika.
864440	866800	Encontrei a Iwakika no sábado.
867340	869620	Teve um evento que eu citei lá no episódio mesmo.
869820	872480	A PopCon na Escola Luiz Delfino.
872560	873880	Um evento desses bem...
873880	875680	Eu me lembrei muito da época que eu era adolescente
875680	877600	em evento de anime de escola, sabe?
878160	880160	E, assim, porra, incrível, incrível.
880260	881920	Encontrei a Iwakika, o Iwakiko.
882560	883600	Encontrei o Diogo.
883860	885400	E acho que a namorada dele é a Ana.
886360	887880	E a irmã da Iwakika.
888080	890320	Que é a Iwakika, três anos mais nova.
890320	892320	Que ela estava descalça,
892320	893900	mas era o cosplay dela, pelo que eu entendi.
894340	895760	E a Iwakika estava de mágica.
895860	896320	Sabe aquele mago...
896980	897940	Sabe o jogo mágica?
898040	900140	Que tem os magos coloridos que juntam os poderes?
900160	900340	Sim.
900780	902500	Então estava ela e o Iwakiko disso.
902860	905780	E daí a Iwakika passou por mim mais de uma vez durante o evento.
906140	907920	Mas ela estava com o negócio fechado, né?
907920	908700	Não dá para ver o rosto.
909160	910140	Ela me ignorou.
910660	912040	E daí depois ela decidiu.
912060	913220	Agora eu vou falar com o guacho dela.
914000	915200	Revelou o rosto dela.
915360	917520	E daí eu quase não reconheci.
917560	919220	Porque todo evento que eu encontrei a Iwakika,
919720	921020	ela estava usando cosplay.
921020	922020	E o seu Iwakika...
922320	923860	O Iwakika também estava de cosplay, todas as vezes.
924220	925600	Eu acho muito irado o cosplay,
925720	927880	mas ela tem a menor habilidade para isso.
927880	928240	Não, é muito...
928240	928840	É...
928840	930480	Não, bem bacana, assim.
930500	931940	O cosplay que eles falam que esse que eles estavam usando
931940	932780	era um bem antigo.
933660	934060	E...
934060	934740	Pô, maravilhoso.
934900	935540	Beijo, Iwakika.
935640	936200	O Iwakiko.
936900	938460	Diogo, Ana, acho que...
938460	939600	E irmã da Iwakika.
939920	942440	Próximo comentário, Renan Loprest Laje.
942900	943780	Olá, guachalera.
943880	944800	Que é a chalera do guacho.
945120	946280	Primeira vez comentando aqui.
946480	947880	Entrei há pouco tempo na taberna.
947960	948660	Bem-vindo, querido.
949040	950380	Estou amando estar lá.
950380	951760	Ah, seja você também um padrinho, gente.
952100	954460	Além de ser o primeiro episódio que escuto adiantado,
954560	955880	uma vantagem de ser padrinho,
956320	957760	parabéns pelo...
957760	960920	De novo, parabéns por este episódio magnífico.
961380	963800	Trota como astronauta ficou sensacional.
964340	965580	Só para quem viu lá no Instagram,
965700	966600	o Instagram...
966600	968020	O Trota é realmente uma pessoa incrível.
968160	969720	Fez uma animação lá muito bacana.
970260	971780	Procure, sei lá, Trota Instagram.
972480	974460	Vou deixar as perguntas para os amigos guaxininhos.
974600	975320	Abraço a todos.
975420	975960	Abraço, querido.
975960	980260	Bem, próximo comentário é do Rafael Zorzal.
980380	981940	Não costumo ver ele por aqui.
982020	982880	Você sabe quem é, guacho?
983380	988060	O Rafael Zorzal é o autor do livro fraternal lá na Amazon.
988220	989080	Procurem o livro dele.
989380	990000	Bom dia...
990000	990500	E aí, editor.
990960	992020	Bom dia, boa...
992020	992520	Vai, fala.
992780	994220	Não, desculpa, só...
994220	997660	Bom dia, boa tarde, boa noite, guaxininhos que moram nesse espaço digital.
998220	1001120	Aqui, quem vos fala é o seu editor, Zorzal.
1001440	1001840	Verdade.
1002020	1003140	Discussão com spoiler.
1003140	1006180	Eu só queria dizer que enquanto eu estava editando esse episódio,
1006400	1008400	na gravação, na fala final,
1008780	1010180	o guaxa não deixou tão claro
1010380	1012740	que a filha do personagem do Trota era a Karinem.
1013160	1015660	Então, eu editei o episódio todo achando
1015660	1018740	que ela era só uma mulher que surtou pelo espaço.
1019220	1021760	Anotei as falas tudo certinho, como sempre faço,
1021960	1023580	e joguei no colo do nosso guaxinim
1023580	1025540	para ele pegar os NPCs compadrinhos.
1025840	1028880	Mas o guaxa, quando passou para a pessoa que foi fazer o NPC,
1029240	1031980	consertou a fala para deixar muito claro
1031980	1034100	que a Karinem era a filha do Trota.
1034400	1036220	E eu só explodi quando percebi
1036220	1038460	ao encaixar a fala final do NPC.
1039020	1039760	Arrepiei todo.
1039760	1041460	Isso significou todo o episódio
1041460	1043280	e não parei de pensar nele desde então.
1043680	1046220	É por essas e outras que eu amo editar para esse projeto
1046220	1049420	e esse foi um dos melhores plot twists de todo o Guaxaverso.
1049640	1051160	Um beijo para vocês e até a próxima.
1051440	1052520	Até a próxima, querido.
1052860	1055280	É engraçado porque os jogadores
1055280	1057760	sacaram na fala que eu dei na gravação.
1058560	1058820	Não é?
1058860	1058980	Sim.
1059460	1061520	Então, o problema está...
1061520	1064180	Sei lá, não gravou direito, não sei o que aconteceu, Zorzal.
1064460	1065800	Mas na gravação estava.
1066180	1066760	Eu gravei...
1067320	1068400	Quando eu gravei, realmente,
1068400	1069400	eu quis deixar muito...
1069760	1072640	Muito claro que era a Karinem.
1073140	1075680	E daí, quando a Shelly ouviu o episódio
1075680	1077700	antes dos padrinhos normais,
1077900	1079540	que ela pediu para revisar também,
1079980	1081280	que é uma vantagem de ser a Shelly, né?
1081660	1084520	Ela disse que ela não gostou da fala final
1084520	1086480	porque quando eu tinha falado,
1086580	1088420	tinha sido uma explosão de cabeça maior.
1088820	1089720	E daí eu fiquei nessa dúvida
1089720	1091320	porque o Zorzal disse que não ficou claro
1091320	1094840	e as outras revisores todas acharam que estava ok.
1096460	1096900	É...
1096900	1097880	E, porra...
1097880	1099560	O NPC foi feito pela minha esposa.
1099760	1100760	Eu quase disse para a Shelly,
1100820	1101920	você está criticando a minha esposa.
1102720	1103620	Ela assim...
1103620	1105240	Eu sei que as falas são sem direção.
1105380	1107240	Não, a dela eu estava dirigindo, inclusive.
1107420	1107820	Desculpa.
1108680	1109080	Mas...
1109080	1110340	Eu acabei mantendo como está.
