1018660;1020920;"03";Quer dizer, a resposta certa é o guaxa-verso
1020920;1023000;"03";não existe. Cada episódio é
1023000;1024900;"03";único. O que aconteceu com a Terra
1024900;1026900;"03";nesse momento? Deve estar tipo agora,
1027060;1028260;"03";só que com um pouco mais de lixo.
1028700;1030800;"03";E inabitável. O Sol de alguma forma
1030800;1032820;"03";é relacionado a esse deus insetos?
1033320;1034760;"03";Eu pensei na ideia do calor
1034760;1036760;"03";de ter o dobro
1036760;1038900;"03";de, sei lá, de raios
1038900;1041080;"03";solares. E eu fiz geografias.
1041540;1042980;"03";Mas ele acordou os insetos.
1043140;1045240;"03";Essa é a ideia. Era o start dos insetos
1045240;1046880;"03";por algum motivo. Seja por uma
1046880;1048940;"03";programação, seja porque o calor
1048940;1050960;"03";aumentou, seja porque o
1050960;1052880;"03";segundo Sol tinha uma radiação
1052880;1054760;"03";gama, é...
1054760;1056700;"03";três prótons a mais, sei lá.
1057180;1059200;"03, 02";É... Alguma coisa aconteceu quando...
1059200;1060620;"03, 02";Todos eram descendentes do Superman.
1060820;1062940;"03, 02";É, quando o segundo Sol chegou, ele realinhou
1062940;1064320;"03";as horas de todos os planetas. Não sei.
1064760;1066740;"03";Foi N quem criou a civilização antiga?
1066760;1068860;"03";Não. O que levou a queda
1068860;1070660;"03";dela? Ah...
1070660;1072960;"03";Não faço ideia. Talvez os próprios
1072960;1074960;"03";insetos. Seria bacana pensar
1074960;1076500;"03";de uma civilização antiga
1076500;1078800;"03";que criou os insetos como arma de
1078800;1080620;"03";guerra e ela sai do controle
1080620;1082760;"03";e eles morrem. Eu acho que é a mesma
1082760;1084820;"03";ideia pros Prometeus da
1084820;1086420;"03";vida, né? Pros filmes do Alien.
1086960;1088540;"03";É a mesma ideia pro universo
1088540;1090700;"03";Mass Effect. É...
1090700;1092400;"03";Na verdade lá não é inseto, né?
1092840;1094780;"03";O Mass Effect tem um ciclo
1094780;1096680;"03";de a raça dominante,
1096760;1099140;"03";que cria uma raça de escravos,
1099140;1101340;"03";né? Normalmente robôs. Esses robôs
1101340;1103020;"03";em algum ponto se tocam. Caramba!
1103260;1105060;"03";Ser escravo é errado, né? E daí
1105060;1107220;"03";se revolta e mata a
1107220;1109000;"03";raça que os criou. Ou pelo menos
1109000;1111040;"03";cria uma guerra grande o suficiente pra
1111040;1113420;"03";ferrar com tudo. Então...
1113420;1115220;"03";Isso não acontece só uma vez em Mass Effect.
1115540;1117480;"03";A ideia é que isso tem um ciclo.
1117540;1119060;"03";E é um jogo de, sei lá, 40 anos
1119060;1121160;"03";atrás, gente. Mass Effect era, sei lá, do NES,
1121260;1122940;"03";se eu não me engano. Então não reclamem de spoiler.
1123340;1125060;"03";E não é sobre isso. Mass Effect tem mais coisas.
1125420;1126640;"02";Isso também é a história do Transformers.
1126760;1128700;"02";Transformers. A parte que eles estavam lá no
1128700;1130500;"03, 02";planeta deles. Transformers,
1130580;1131920;"03";He-Man, é tudo na mesma história.
1132400;1134840;"02";Antes da Revolução Comunista, era robótica.
1134940;1136120;"03";É. He-Man,
1136440;1138280;"03";He-Man, todo malhado.
1138740;1140840;"03";Rei, malhado. Pessoal do castelo,
1140940;1142300;"03";malhado. Povo,
1142800;1144080;"03";sempre faminto.
1144640;1146580;"03";Pode ver. Todo episódio
1146580;1148320;"03";que aparece alguém de fora do castelo,
1148660;1150440;"03";o cara tá morrendo de fome.
1151160;1152380;"03";Esqueleto, nunca errou.
1152780;1154380;"02, 03";Vamos continuar. É...
1154380;1156520;"02";O esqueleto tá tão complicado que ele ficou com malha
1156760;1158420;"03, 02";elétrica, né? Esqueleto é porra, olha só.
1158920;1160160;"03";Ele levou as unhas. Ele falou,
1160520;1162640;"03";só irei comer quando o povo puder
1162640;1164700;"03";comer também. É, isso é a história
1164700;1166660;"03";de He-Man. Eu acho.
1167140;1168960;"03";Mas vamos lá. Amo o Mass Effect.
1169300;1170820;"03";Queria dizer, a Agatha
1170820;1172200;"03";disse uma mesa de Mass Effect.
1172620;1174420;"03";Tem ideias de aventuras de Mass Effect,
1174960;1176320;"03";mas não trabalho
1176320;1178740;"03";com marcas.
1179100;1180780;"03";Eu só faço as minhas próprias criações.
1181060;1182740;"02";A gente não vai fazer o Mass Effect, vai fazer
1182740;1184740;"03, 02";o Volume Effect. Isso, vai ser
1184740;1186420;"03";o Marcelo Effect.
1186760;1188100;"03";É... Descontinuar.
1188480;1190920;"03";Óreo se tornou parte da entidade ou a controla?
1191160;1192800;"03";Não, ele não... Assim, eu falei
1192800;1194560;"03";que tem muita coisa em aberto, mas
1194560;1196460;"03";não. Óreo não controla
1196460;1198580;"03";nada. Os insetos venceram.
1198880;1200840;"03";Os insetos têm alguma forma de possuir as pessoas?
1201780;1202980;"03";Aparentemente, sim.
1203080;1204480;"03";Ou pelo menos a forma delas
1204480;1207140;"03";ou de alguma forma reanimar cadáveres.
1207400;1208900;"03";É sempre bom um cadáver reanimado,
1208980;1210960;"03";mesmo em aventuras espaciais. Mas é isso.
1211480;1212600;"03";Vida longa e
1212600;1214740;"03";aguaxa na milha. Muito obrigado, querido.
1214740;1216740;"03";Dead Space é...
1217280;1218280;"03";Morto reanimado.
1218600;1220840;"03";Spoiler de Dead Space. Dead Space também é
1220840;1222120;"03";antigo. É do Mega CD.
1222600;1223300;"02, 03";Trinta anos atrás.
1223620;1226760;"02";A coisa que eu fiquei me perguntando. O Óreo, ele virou presidente
1226760;1228360;"02";velhinho Biden?
1228800;1230440;"02";Ou ele ficou jovem?
1231140;1232060;"03";Velhinho Biden.
1233040;1235040;"03";Não precisou de ir com a mala.
1235540;1236740;"03";Essa foi a piada mais atual
1236740;1237980;"03";que registrar, pessoal.
1238420;1239560;"03";Desculpa, pode seguir, Thales.
1240300;1243100;"02";Depois disso, a gente teve o comentário da Maria Clara,
1243100;1244840;"02";que tem, inclusive, uma
1244840;1246740;"02";foto de perfil bem interessante.
1246760;1249020;"02";Queria só deixar isso escrito
1249020;1249620;"02";aqui pra ela.
1249700;1252360;"03";Agora tu vai ter que descrever a foto preferida.
1252680;1254840;"02";É um desenho
1254840;1256520;"02";de um rosto feminino
1256520;1259080;"02";branco, com batom,
1259240;1261140;"02";maquiagem e cabelos
1261140;1262900;"02";longos, ondulados, preto
1262900;1264880;"02";com tons
1264880;1266760;"02";de verde e rosa. Bastante artístico.
1267580;1268640;"02, 03";Verde e rosa é
1268640;1269380;"02";Mangueira, não é?
1270060;1272080;"04, 03, 02";Será que era carioca? Não sei.
1272280;1274260;"03";O Jean é. Queria registrar. É verdade.
1274260;1276340;"03";Por sinal, triste,
1276760;1277820;"03";falando em Mangueira,
1278280;1280960;"03";morreu uma...
1280960;1282760;"03";Foi de lá que morreu a mulher da Rosa?
1283000;1284540;"02, 03";Não sei. É carnavalesca?
1284980;1286940;"02";É. Não sou capaz
1286940;1289000;"02";de opinar. É. Era rosa alguma coisa.
1289300;1290500;"03";Então, vai em paz.
1290820;1292620;"03";O meu tio também se foi, queria registrar.
1292920;1294800;"03";Esse episódio é dedicado a essas duas pessoas.
1295140;1296580;"02, 03";Pode seguir, Thales. Vamos lá.
1297000;1298620;"02";Diferente das outras pessoas, a Maria Clara
1298620;1300440;"02";não deu um olá, mas eu vou falar um olá
1300440;1301080;"02";à Maria Clara.
1301640;1303200;"02";Sempre que me falam de dois sóis,
1303200;1305500;"02";eu só penso em Tatooine de Star Wars.
1305920;1306700;"02";Isso que acontece,
1306780;1308720;"02";quando tem quase cinco anos de relacionamento
1308720;1310980;"02";com um fã da saga. É, faz sentido.
1311460;1312940;"02";Oi, todo mundo. Agora ela falou.
1313200;1314860;"02";Eu queria que tu se retratasse agora.
1315280;1316680;"02";Ela falou. Guaxa,
1317000;1318560;"02";convidado, olá,
1319020;1321240;"02";ouvintes e eu mesmo daqui a uns dias.
1321780;1323520;"02";Em meio a umas férias tão corridas,
1323540;1325240;"02";já chegando ao fim, aqui estou eu
1325240;1326880;"02";para agradecer a mais um episódio.
1327260;1328840;"02";Olha só, o Guaxa também tava de férias.
1329320;1330900;"02";Foi esplêndido cada segundo
1330900;1332500;"02";desse podcast. Ok,
1333060;1334800;"02";que em alguns momentos meu déficit de atenção
1334800;1336680;"02";falou mais alto, eu não entendi como o Oro,
1336680;1338660;"02";foi parar onde está. Mas tudo bem,
1338960;1340020;"02";aceito explicações.
1340660;1342820;"03";Os insetos tomaram conta do corpo dele,
1343320;1344500;"03";ele escandatou e venceu.
1344880;1346960;"03";Graça, assim, provavelmente os insetos
1346960;1348980;"03";tomaram conta de muita coisa, né,
1349420;1351100;"03";e ajudaram
1351100;1351960;"03";o Oro a se eleger.
1352400;1353860;"02";A dúvida é se
1353860;1356700;"02";a população tá a nível de eleger
1356700;1358520;"02";um morto muito louco,
1358880;1360780;"02";ou se os insetos
1360780;1361840;"02";votaram nele mesmo.
1361840;1363220;"03, 02";Então tu só precisa dominar
1363220;1365800;"03";3, 4 youtubers, ou sei lá,
1365800;1367800;"03";apresentador de programa de domingo,
1368380;1370240;"02, 03";e tu, porra, metade dos votos tu leva.
1370640;1371220;"02";É verdade.
1371820;1373420;"02";Continuando, sem brincadeira,
1373740;1375860;"02";eu imaginei tranquilo a Isa,
1376000;1377780;"02";tipo a gata que a Emione vira quando
1377780;1379820;"02";toma a poção polissuco
1379820;1382060;"02";errada. A Isa que ela tá falando,
1382140;1383960;"02";na verdade, eu acho que é a
1383960;1385440;"02";Asi. Isso.
1386100;1387700;"02";Que o nome inteiro era
1387700;1389540;"02";Asimut, que a gente fez piada
1389540;1391800;"02";no backstage
1392700;1393500;"02";do episódio,
1393500;1395580;"02";que Asimut, se eu lembro bem, é o nome do
1395580;1397500;"02";criador do Omnitrix do Ben 10.
1397920;1399180;"02";Perfeito. Obrigado pela informação.
1399560;1400340;"02";Aqui tem a informação.
1400840;1402540;"02";Foi muito bom ter essa imagem na cabeça.
1402880;1405320;"02";A gata com seus belíssimos dramas amorosos,
1405560;1407060;"02";como sempre. Continue.
1407220;1408460;"02";Vou pegar pipoca no próximo.
1408960;1411280;"02";E por fim, Telemann sendo um idosinho que parece
1411280;1413360;"02";meu avô no quesito que faz tudo tranquilo
1413360;1415280;"02";e na verdade que está. No caso,
1415380;1417520;"02";92 anos. Tô aqui pra isso.
1418880;1419500;"02";Às vezes
1419500;1421020;"02";eu sinto que os mestres me odeiam porque
1421020;1422840;"02";eu faço tudo virar
1422840;1425420;"02";galhofa, mas eu não consigo.
1425580;1427020;"02";De outro jeito. Eu não te odeio.
1427900;1428340;"02";Obrigado.
1428760;1430820;"02";Os velhinhos da quinta série foram ícones.
1431160;1433200;"02";Verdade. Agora, tem uma pergunta.
1433820;1435140;"02";Se algum dos jogadores
1435140;1437000;"02";aceitasse o caminho dos insetos,
1437000;1438920;"02";que por sinal, imaginei estilos
1438920;1440520;"02";insetos do Detona Ralph 1,
1440860;1441960;"03, 02";o que aconteceria com ele?
1442440;1444480;"03";Ele continuaria jogando aventura normalmente
1444480;1447140;"03";pra no final do episódio, sei lá, um inseto
1447140;1448980;"03";pular da barriga dele, igual o Alien,
1449480;1450840;"03";ou simplesmente ele tomar uma atitude
1450840;1451860;"03";de trair o grupo.
1453080;1454880;"03";Mas assim, ele ia continuar na aventura,
1454960;1455560;"03";mas
1455580;1456880;"03";o personagem do final era meu.
1458540;1459780;"02";Ainda bem que eu não fiz isso.
1460140;1461660;"02";Só pra comentar, antes de falar
1461660;1463360;"02";do que queriam investigar mais
1463360;1465380;"02";o planeta, eu tinha
1465380;1467500;"02";pensado em fazer isso, mas aí o Guaxa
1467500;1469500;"02";falou, ah, os insetos tão vindo, mataram
1469500;1471280;"02";todo mundo, o que vocês fazem? Aí eu fugi.
1471980;1473340;"02";É. A arqueologia
1473340;1475220;"02";não funciona nesses lugares.
1475520;1477100;"02";Ah, uma coisa que li uma vez.
1477560;1479500;"02";Parece que quanto mais vermelho uma estrela,
1479600;1481120;"02";mais quente e velha ela é,
1481520;1483320;"02";e quanto mais azul, mais fria.
1483740;1485480;"02";Logo, como que aquele segundo sol
1485480;1487400;"02";esquentava? Brincadeira, segue
1487400;1489260;"02";o roteiro. Assim, uma chama
1489260;1491140;"02";menos fria, ainda é quente.
1491620;1493120;"02";É verdade. Obrigado.
1493480;1495320;"02";Obrigado a todos por melhorarem meu fim
1495320;1496980;"02";de férias com esse episódio esplêndido.
1497340;1499540;"02";Um beijo para todos e até a próxima.
1500120;1501180;"02";Um beijo pra todo mundo.
1501560;1503240;"03, 02";Um beijo pra todo mundo. O fogo
1503240;1504380;"03";do fogão é azul.
1504920;1505980;"03";O da Azula também.
1507120;1509080;"03";Eu queria fazer uma pausa, foi lembrado
1509080;1511200;"03";que a Agatha sempre tem um romance.
1511760;1513520;"03";Eu lembrei que o último episódio
1513520;1515320;"03";que eu gravei antes de entrar de férias foi
1515320;1516900;"03";com a Agatha. Agatha,
1517460;1519520;"03";sem dar spoiler, teve romance?
1520100;1520640;"03";Não, né?
1521060;1523180;"03";Que episódio que foi? Ah, tá, não.
1523280;1525320;"03";É, ok. Seria complicado.
1525840;1527320;"03";Seria complicado. Ok.
1527860;1529440;"03";Verdade. Eu vou até cortar
1529440;1530600;"03";o que eu respondi
1530600;1533280;"03";pra vocês ficarem curiosos, porque
1533280;1534580;"03";só quem tava aqui ouviu, viu.
1535280;1537180;"03";Próximo comentário é do Henrique Dairique,
1537440;1538500;"03";que tem uma ótima
1538500;1541060;"03";sonoridade, né? Henrique Dairique.
1541480;1543400;"03";Isso não é um drink? Não sei,
1543400;1545300;"03";eu não bebo. Olá, Guaxa,
1545320;1547460;"03";galera, que é a chaleira do Guaxa.
1547460;1549480;"03";É verdade. Vim deixar meus agradecimentos
1549480;1551700;"03";e elogios para este episódio. Maravilhoso.
1551840;1553240;"03";Adoro aventuras espaciais.
1553520;1555440;"03";O nome do episódio só me fez lembrar da música da Cassia
1555440;1557280;"03";Heller. Espero que nos extras tenha alguém
1557280;1559320;"03";cantando ela em kkkkj.
1560460;1561200;"03";É, acho que não.
1561600;1562740;"03";Talvez, não sei.
1563580;1565320;"03";Talvez, na hora que eu falei do Segundo Sol,
1565660;1567180;"03";o Tellerman é uma coisa que o Tellerman
1567180;1569540;"03";faria, eu acho. Então, tô chutando, não lembro.
1569660;1571420;"03";Tô chutando. Não, eu acho que essa
1571420;1573260;"03";não. Só vim deixar esse biscoito
1573260;1575300;"03";em formato de kabutomushi,
1575320;1577820;"03";que kabuto é...
1577820;1579060;"03";é...
1579060;1580740;"03";é beetle. Como é que é?
1580960;1583260;"03";Eu tô muito poliglota. É kabuto,
1583500;1585040;"02, 03";é... É capacete.
1585700;1587360;"03";Não, não, não. Eu tenho um inseto
1587360;1589360;"03";que é o beetle. Como é que é o nome dele?
1589940;1591680;"03";Besouro. Besouro.
1591720;1593640;"03";É besouro, porque eu sei que tem um...
1593640;1595240;"03";Um dos meus... Provavelmente
1595240;1596940;"03";meu kamen ride favorito era o kabuto.
1597400;1599320;"04, 03";E tem o pokémon kabutops.
1599800;1601520;"03";É, e não sei o que. Mushi eu não lembro agora.
1601900;1603160;"03";E agradecer por mais esse episódio
1604160;1605260;"03";espacial que ele fez
1605260;1607540;"02, 03";no trocadilho com o especial. Obrigado pelo comentário,
1607640;1609360;"02";querido. Mushi é quase Mesh
1609360;1611000;"02";que lembra Dungeon Mesh, quer dizer
1611000;1613340;"02";assistam Dungeon Mesh. A...
1613340;1614800;"02";A Jujulini
1614800;1615960;"02";falou...
1615960;1618780;"02";Olá, Guaxa. Guaxonvidade. Olá.
1619100;1621360;"02";E Guaxamilha. Tudo bem com vocês?
1621860;1623060;"02";Tudo bem, sim? Tudo.
1623520;1625180;"02";Que trio incrível. Obrigado.
1625600;1627640;"02";Foram maravilhosos, deixando a aventura
1627640;1628640;"02";ainda mais perfeita.
1629140;1631420;"02";Estava com saudade de aventura com tema espacial.
1631420;1633260;"02";Me lembrou muito o Han Solo
1633260;1634920;"02";com o Chewie e a Millennium Falcon.
1635260;1637540;"02";É, o Chewie nesse caso era a Ju.
1638040;1639900;"02";Isso. O Han Solo
1639900;1642040;"02";era a Agatha
1642040;1643560;"02";e tu era a Millennium Falcon.
1643920;1644420;"02";Exatamente.
1645240;1646800;"02";Nota mil pra todos vocês.
1647160;1648620;"02";Obrigado, tava precisando de uma.
1649080;1651440;"02";Não deixei também de lembrar do episódio
1651440;1653500;"02";das galinhas espaciais. Desculpa
1653500;1655360;"02";em não lembrar o título. Mas tem alguma
1655360;1656860;"02";ligação? É a mesma linha?
1657920;1659420;"02";Possivelmente. Quem sabe.
1659740;1661420;"02";Enfim, biscoitos de escaravelhos
1662140;1663380;"03";crocantes pra todos
1663380;1664340;"03";e até a próxima.
1665260;1667920;"03";Bate que ela não disse biscoitos em forma de escaravelhos.
1668160;1669260;"03";São biscoitos
1669260;1671020;"03";de escaravelhos.
1671300;1673720;"03";Crocantes. Ela também não explicou se o biscoito
1673720;1675620;"03";que é crocante ou se o escaravelho que é crocante.
1676160;1677940;"03";Não, assim, se tem escaravelhos
1677940;1679920;"03";no biscoito
1679920;1680620;"03";ele é crocante.
1681520;1683820;"02, 03";É. Desculpa se você estiver
1683820;1685700;"02";almoçando, jantando enquanto eu ouvi isso.
1686020;1687960;"03, 02";Isso. Coma seus escaravelhos.
1688480;1689380;"03";Próximo comentário.
1689380;1691400;"03";Patrick Buchmann. Nosso querido amigo
1691400;1693360;"03";Tic, doutor Tic, que tem um
1693360;1695100;"03";lendário Vale Aventura
1695100;1697020;"03";Dourado. Único. Edição
1697020;1699320;"03";especial de colecionador. Que é
1699320;1701380;"03";o direito de jogar uma aventura
1701920;1703360;"03";com a Shelly no
1703360;1705280;"03";grupo. Uma vez eu mencionei pra Shelly.
1705480;1706560;"03";Eu fui feliz naquele dia.
1706980;1708920;"03";Pô, é legal. A Shelly é gente boa.
1709280;1711380;"03";Salve Guaxual. Guaxavidágata.
1713300;1713860;"03";Guaxavidágata.
1713960;1714940;"03";É legal. E toda
1714940;1717100;"03";Guaxa... Ninguém jogou a Maldição em ti ainda.
1717100;1718840;"03";Então estamos tranquilos. E toda
1718840;1721140;"03";Guaxa humanidade. Vim deixar apenas
1721140;1723040;"03";uma musiquinha para esse episódio de delícia.
1723440;1725080;"03";Quando o segundo sol... Vamos lá.
1725100;1727020;"04, 03";Quando o segundo
1727020;1729100;"03";sol chegar... Eu não consigo melhorar minha
1729100;1731180;"03";voz aqui, não. É...
1731180;1732880;"03";Para ativar os insetos
1732880;1735340;"03";do planeta. Devorando
1735340;1737460;"03";com a fome exemplar.
1737920;1738720;"03";Todos os velhos
1738720;1741100;"03";queriam falar com
1741100;1743100;"04, 03";o capeta. Socorro.
1743800;1745140;"03";Muito bom. Quero saber qual
1745140;1746800;"03";o nome do food chip
1746800;1749060;"03";da Ágata, da Ju e
1749060;1751060;"03";da Ágata. Beijos a todos.
1751320;1753180;"02, 03";O food chip... Não sei.
1753180;1754360;"02, 03";Elas não falaram.
1755100;1756640;"03, 02";Ah, não quiseram me contar.
1757040;1758860;"03, 02";Pode ir. A Ágata falou que tem que ter
1758860;1760820;"02";outro episódio para elas falarem o nome
1760820;1762480;"02";do food chip.
1762960;1764700;"02";Ah, pronto. Está cavando o episódio.
1765020;1766840;"02";Não. Vamos lá. Depois
1766840;1768880;"02";do Dr. Patrick, a gente tem
1768880;1771280;"02";o Dr. Gabriel. Gabriel Palardino.
1771800;1772540;"02";Olá, Guaxa.
1773320;1774580;"02";Juvidade e
1774580;1776560;"02";ouvintinins. Tudo bem?
1777040;1778240;"02";Tudo bem. Tudo bem.
1778700;1781060;"02";Que delícia ouvir esse episódio e conseguir estar em dia
1781060;1782760;"02";com o RP Guaxa. Muito,
1782760;1784740;"02";muito bom. E ainda mais um
1784740;1786720;"02";episódio com essa equipe. Ju,
1786980;1788380;"02";maravilhosa como sempre.
1788960;1791080;"02";A Ágata divina. E o próprio
1791080;1792880;"02";Telegram jogando. Rizos.
1793260;1794560;"02";Por que eu não recebi
1794560;1796620;"02";um adjetivo? É porque
1796620;1799020;"03, 02";você é assim, ó. A Ju,
1799180;1800740;"03";a Ágata e todo
1800740;1802760;"03";mundo do Telegram representado na sua
1802760;1804960;"02, 03";figura. Você é o homem do povo
1804960;1806900;"03";que representa os
1806900;1808940;"02, 03";padrões. Caraca, eu sou
1808940;1810760;"02";aqueles nomes do
1810760;1812740;"02";do filme
1812740;1814740;"02";que não tem nome. É tipo...
1814740;1816760;"02";É... Eu sou
1816760;1818980;"03, 02";o Vingadores. É...
1818980;1820740;"03";Tu é tipo aquele jogo, sei lá,
1820820;1822800;"03";Mario Tênis. Aí tem, sei lá, o
1822800;1825020;"03";Mario todo detalhado, a Princesa Peach
1825020;1826840;"03";e um Mii, que é só
1826840;1828740;"03";uma, sei lá, uma barriguinha, cabecinha,
1828860;1831020;"02, 03";a mãozinha flutuando que nem gruda no corpo.
1831380;1832840;"02";É isso. Saudade
1832840;1834900;"02";de jogar Mario Tênis. Cada jogador
1834900;1836940;"02";deu uma identidade e uma força incrível.
1837360;1839160;"02";A sua narração foi surpreendente
1839160;1840980;"02";como sempre. E você sabe
1840980;1843060;"02";narrar aventuras maravilhosas.
1843060;1845240;"02";Eu quero, inclusive, soltar o comentário
1845240;1847000;"02";aqui que eu lembro uma vez do Guaxa falando que ele não
1847000;1849080;"02";costumava fazer episódios espaciais porque ele não era
1849080;1851160;"02";bom de... Cyberpunk,
1851680;1853040;"02";de Space Opera, essas coisas.
1853160;1854840;"02";Eu discordo. Obrigado.
1855180;1857040;"02";Os efeitos sonoros do Zorzal permitem
1857040;1858880;"02";a gente viver essa aventura de uma forma
1858880;1860520;"02";bem vívida. Agora,
1860980;1863240;"02";spoilers. O que são as criaturas
1863240;1864460;"02";que haviam naquele planeta?
1865100;1866820;"04, 03, 02";Besouros. Besouro.
1867420;1869200;"02";A partir do novo...
1869200;1871220;"02";da nova coleção de Magic,
1871220;1872120;"02";que só tem bicho.
1873060;1874820;"03";Era um besouro que tinha
1874820;1877380;"03";lâminas nas duas mãos e na boca.
1877540;1879200;"02, 03";Era um besouro. Caraca.
1880300;1881560;"02";Eu juro que eu pensei
1881560;1883460;"02";em Zorro
1883460;1885500;"02";do México
1885500;1886360;"02";na hora, mas ok.
1886920;1888980;"03, 02";Aí, porra, assim...
1888980;1891900;"03";Aí a gente tá de novo voltando ao 40 a mais.
1892400;1893200;"03";Lembro de ver ele
1893200;1895700;"03";todo colorido,
1895800;1897300;"03";né? Porque não sei se eles pintaram.
1897820;1899400;"02, 03";Porra, gostava muito do Zorro. Muito bom.
1899400;1901220;"02";É, que tinha um filme que passava
1901220;1902320;"02";na Globo de vez em quando.
1903060;1905740;"03";Não, não. Porra, eu lembrei da série. A série mais antiga.
1906080;1907660;"02";Ah, não. Eu posso
1907660;1909560;"02";conhecer coisas 40 a mais,
1909640;1910840;"02";mas eu não tenho 40 a mais.
1911820;1913720;"03";Tu vai me deixar sozinho? É isso mesmo?
1914240;1915760;"02";É, eu tô
1915760;1916920;"02";espiritualmente com você.
1917940;1919420;"03, 02";A gente já é alguma coisa.
1919780;1921480;"02";Pela forma como se comportam, me parece
1921480;1922880;"02";que foram bio-armas.
1923460;1925200;"02";Eu acho que eram só seres malditos mesmo.
1925760;1927580;"02";Será que a Federação as usou
1927580;1929540;"02";para matar os povos que viviam ali
1929540;1931460;"03, 02";antes? É uma teoria melhor
1931460;1933040;"03";que a minha.
1933060;1934160;"03";Mas não.
1934640;1937300;"03";Eu já canonizei que não. É um problema.
1937640;1938480;"03";Mas eu segui agora.
1938840;1940440;"03";Esse velho que organizou a missão,
1940620;1942980;"03";ele realmente pensou o ataque terrorista?
1943500;1945300;"03";Eu, assim, a minha ideia inicial,
1945840;1947040;"03";quando juntei vários idosos
1947040;1949060;"03";numa excursão, eu pensei
1949060;1950860;"03";em idoso do Zap Zap.
1951220;1953460;"03";Eu acho que ele não sabia
1953460;1954840;"03";o que ele tava se metendo.
1955140;1956760;"03, 02";E ainda assim deu certo. Quer dizer,
1957060;1959020;"02, 03";pro inseto, né? Não pra nenhum dos idosos que foram.
1959420;1960780;"02";É, então. Mas,
1960780;1962780;"02";estou curioso pelo que virá nessas aventuras
1963060;1965300;"02";espaciais. Um beijo e um abraço
1965300;1965920;"02";para todos.
1966440;1968820;"03";Próxima aventura é...
1968820;1971140;"03";Tempo atual. Depois é
1971140;1972980;"03";medieval. E...
1972980;1974940;"02, 03";Vai voltando, né? Provavelmente
1974940;1976860;"03";depois dela é medieval também.
1977360;1978120;"02";E depois eu não sei.
1978580;1981060;"02";E em algum momento vai ser ela das cavernas.
1982120;1983140;"02";Aí todo mundo só vai falar
1983140;1985160;"02";Ugg. E aí depois vai ser, sei lá,
1985220;1987240;"03, 02";com Plankton. Eu queria dizer
1987240;1989060;"02, 03";que a série do Zorro que eu me lembrei
1989060;1991300;"03";ela é de 57.
1993060;1995060;"unknown";Ahahahahahahaha
1995060;1996580;"03";É...
1996580;1999560;"03";Depois ela foi pintada e relançada.
1999740;2000160;"01, 03";Ah, vai.
2000580;2002680;"03";A cor foi adicionada na versão de 92,
2002880;2004820;"03";que foi a que eu assisti. Eles remasterizaram...
2004820;2007060;"03";Olha só, não, a série de 57. Eles remasterizaram
2007700;2008880;"03";em 92
2008880;2010520;"03";e relançaram.
2010920;2013000;"03";Eu vi a versão remasterizada e
2013000;2014640;"03";daí, pô, vamos adicionar cor?
2015100;2016580;"03";Pô, tirando o Zorro que tava de preto,
2017020;2019220;"03";nossa, era tipo, o cara é um
2019220;2020920;"03";ricaço, roupa colorida.
