0;9460;"05";Se eu pegar essa ilha e esse helicóptero, e aí tudo faz sentido, porque aqui tem um zumbi e ali não tinha, e agora?
10120;15000;"05";É isso! É isso! Eu sabia! Eu sabia! O Guaxaverso existe!
15120;15960;"05";Como assim?
16180;18000;"05";Você entendeu a referência do último episódio?
18240;18980;"00, 05";Olha só, faz tudo!
18980;20020;"00, 05";Não, o Guaxaverso sabe o que faz!
20020;20960;"00, 05";Espera, o que é o Guaxaverso?
21000;22980;"00, 05";Era só uma questão de tempo.
23080;24520;"05";O Guaxaverso sempre existiu!
24520;27180;"00, 05, 03";Eu quero entender o Guaxaverso!
27220;28560;"00, 05";Alguém me explica o que é o Guaxaverso?
28560;32040;"00, 05, 03";É, pessoal, não existe o Guaxaverso.
32080;33720;"05, 03";Eu acredito no Guaxaverso!
33820;36560;"03";Mas supondo que ele exista...
37880;41540;"05";Guaxaverso, onde o que não existe é debatido.
46220;48780;"03";Mas Guaxa, um mês depois tua voz tá uma merda ainda?
49260;49700;"03";Sim.
49920;50860;"03";Guaxa, você não se cuida?
51020;51220;"03";Não.
51660;51960;"03";Vamos lá.
52660;57740;"03";Olá, eu sou Marcelo Guaxinim, narrador, produtor, idealizador, podcast, realidade para Guaxinim e...
57740;58540;"03";Eu estava de férias.
58560;59680;"03";Até hoje.
59740;61160;"03";Hoje é o último dia das minhas férias, inclusive.
61660;63580;"04, 03";No momento da gravação, né?
63980;66800;"03";Pra quem não sabe, o Guaxaverso é o nosso antigo escudo-mestre.
66900;69440;"03";Aqui vamos ler os comentários e discutir as teorias do último episódio.
69880;71820;"03";Que, no caso, foi o Segundo Sol.
72000;73780;"03";Que nada tem a ver com a música da Cáceres.
74360;74880;"03";É...
74880;76980;"03";Episódio 169.
77540;80520;"03";Podia ter usado outros temas pra 169?
81080;81560;"03";Podia.
81840;83220;"03";Mas eu sou pudico.
83380;84320;"03";Essas coisas acontecem.
84320;88320;"03";E falando em ser pudico, tem aqui ele, nosso querido...
88560;89580;"03";Rafael Teller, mano.
89720;90280;"02, 03";Tudo bem, querido?
90420;91900;"03, 02";Eu queria saber o que...
91900;92540;"02";É, boa noite.
92640;92980;"02";Tudo bem.
93280;94780;"02";Eu queria saber o que é essa palavra pudico.
94840;95680;"02";Eu nunca soube, na verdade.
96720;97080;"03";É...
97080;98220;"03";Recatado, sabe?
98280;98900;"03";Deixa eu pegar aqui, ó.
99020;99440;"03";Ah, tá.
99500;101700;"03";Que tem pudor recatado, casto.
102120;102240;"03";É.
102240;103300;"02, 03";Que se mostra...
103300;104240;"02, 03";Essa parte eu não vou concordar.
104260;105060;"02, 03";Ou é tímido, é.
105520;107540;"03";É tímido, acanhado e envergonhado.
107640;107880;"02, 03";É isso.
107880;108660;"02, 03";A gente é pudico.
108680;110760;"02, 03";Mas eu concordo que eu sou belo, recatado e dolar.
111240;111600;"02";Isso.
112120;113160;"02";A gente é casto.
113740;116160;"03";Eu tô casado há tanto tempo que eu já não tô casto, não.
116260;117400;"02, 03";Já venceu, né?
117400;117840;"02";Já...
117840;118740;"03, 02";Já venceu.
120160;122080;"02, 03";Tellerman, como é que as pessoas te acham na internet?
122840;127440;"02";Provavelmente, se vocês colocarem Tellerman no Google, vai aparecer eu ou um primo meu
127440;131240;"02";que, sei lá de qual grau, foi prefeito de Buenos Aires.
131740;133220;"02";Então, quem não foi prefeito sou eu.
133920;134320;"02";É...
134320;137980;"03, 02";Eu botei Tellerman, só aparece gente que não é você, inclusive.
138220;139380;"02";Então, deve ser alguém da família.
139880;143040;"02";Mas o R__Tellerman sou eu em todos os lugares.
143360;145220;"02";Tirando o Instagram, que é Rafael__Tellerman.
145220;147060;"03, 02";E você tem alguma outra coisa na internet?
147400;148560;"03";O Evercast morreu mesmo?
148700;149000;"02, 03";O que aconteceu?
149000;152480;"02";Não, o Evercast tá em Iato...
152480;153320;"02";Há quanto tempo?
153720;154540;"02";Há dois anos.
155060;156220;"03, 02";Mas a gente tá querendo voltar.
156640;157080;"02";Realmente.
157860;159040;"03";Querendo voltar há quanto tempo?
159060;159580;"02, 03";Há dois anos?
160200;161880;"02";Quem sabe daqui a pouco a gente consegue gravar.
162140;162460;"02";Perfeito.
162860;163500;"02";Vai dar bom.
163900;166240;"03";Eu queria pedir pra todos vocês que...
166240;168980;"03";Ah, na verdade, quem tá ao vivo aqui hoje, né?
169100;170560;"03";Não sei se tem alguém da região.
171120;175920;"03";Mas amanhã, sábado e domingo, vai ter a Blumenau Comic Experience.
175920;176760;"03";Eu estarei lá.
177400;177960;"03";É...
177960;180740;"03";O Iaquica, provavelmente.
181080;182260;"03";A Zicaju vai.
183040;185560;"03";Assim, vão alguns padrinhos da região pra lá.
185700;186320;"03";E vai ser bem legal.
186720;187020;"03";E eu vou.
187080;187720;"03";E eu ganho ingresso.
188000;188560;"03";Isso é...
188560;189960;"03";Meu pai ficou admirado, assim.
190300;191280;"03";Por que eles te deram ingresso?
191720;192960;"03";Pô, porque, pô...
192960;196620;"03";Eu falei, ó, sou o Marcelo Guaxininha, são minhas redes sociais, eu tenho esse podcast.
197240;198140;"03";Aí eles me deram ingresso.
198220;199500;"03";Ingresso que eu não enfrento fila.
199980;202960;"03";Eu só, sabe, carteirada e vou.
203720;206120;"03";E deram pra mim, pra Beto e pra Malu.
206680;207080;"03";Chupa.
207080;208660;"03";A Comic Con, que não...
208660;210980;"03";Que me considerou irrelevante nos últimos três anos.
211240;211680;"03";É isso.
212140;216120;"03";Mas se você não considera eu ou este podcast irrelevante,
216540;217620;"03";e quer que ele continue,
218020;220360;"03";tava aqui reclamando antes de começar a gravar,
220480;222600;"03";desligar a gravação,
222960;227400;"03";tava aqui conversando com os meus amigos, patronos desse podcast.
227720;229760;"03";Você poderia estar aqui também pra ouvir isso.
230180;231600;"03";Tava comentando um monte de coisa com eles.
232040;232980;"03";Uma das coisas que eu comentei,
233520;235720;"03";mês que vem tem três episódios,
235720;237000;"03";porque o primeiro sai dia 1,
237080;242760;"03";e daí o último vai sair no dia 29 do 8.
243020;244740;"03";Então são três episódios no mês,
245260;248480;"03";e o nosso querido editor ganha por episódio.
249220;252060;"03";Então, pra ajudar a pagar esses episódios,
252220;253460;"03";eu conto com vocês.
253940;257080;"03";Vai lá em apoia.se barra rpguaxe.
257440;257920;"03";Assina.
258340;259160;"03";A partir de 10 reais,
259800;261720;"03";você doa quanto quiser, quanto puder.
262200;264540;"03";Um real que seja, sei lá, do lanche da escola,
264540;266540;"03";um dia que você come uma...
267080;268580;"03";O real não compra nada, né?
268580;270580;"03";Mas, sei lá, um real.
270580;274580;"03";Que você deixa de botar naquela máquina que dá uns chicletes, bolinha, sabe?
274580;278580;"03";Tu põe, a moeda gira, e ela dá uma bolota, assim, no chiclete,
278580;280580;"03";e o sabor sai em segundos.
280580;283580;"03";Então, ao invés de botar naquela máquina, você pode estar ajudando a gente também.
283580;287080;"03";Mas, a partir de 10 reais, você faz parte do nosso grupo no Telegram,
287080;288080;"03";e não no Telema.
288080;290580;"03";Embora lá tenha o Telema também.
290580;292080;"03";E eles se dividem em vários subgrupos,
292080;294580;"03";a gente conversa sobre anime, sobre videogames,
294580;296580;"03";sobre os spoilers dos episódios,
296580;299080;"03";sobre a vida, sobre o universo, tudo mais.
299080;301580;"03";Tem um grupo pro pessoal Além do Arco-Íris,
301580;303580;"03";tem um grupo só das meninas,
303580;306580;"03";tem um grupo pro pessoal que gosta de marcar jogo, né?
306580;309580;"03";Mesas de RPG, mesas virtuais, né?
309580;311580;"03";Pelo Discord e tal.
311580;313580;"03";De vez em quando rola uns guache-encontro,
313580;315580;"03";o pessoal se encontra, o pessoal é muito bacana.
315580;317580;"03";Muitas amizades surgiram aqui,
317580;319080;"03";alguns amores também.
319080;320580;"00, 03";O Telema tá solteiro, né, Telema?
320580;321580;"03";Eu tô...
321580;322080;"05, 03";Isso.
322080;323080;"05, 03";E tô disponível mesmo.
323080;324580;"03";Tá disponível um parte do...
324580;326580;"03";Porra, casamento...
326580;328580;"03";A Agatha está me lembrando aqui.
328580;332580;"03";Um casamento já surgiu do nosso grupo,
332580;334580;"03";então eu vim fazer parte dele também.
334580;336580;"03";Não prometo que você vai casar,
336580;339580;"03";não prometo que você vai jogar RPG comigo,
339580;342080;"03";mas prometo muitos amigos muito bacanas.
342080;343080;"03";E o principal,
343080;347080;"03";você vai ajudar esse projeto a continuar existindo.
347080;350580;"03";Você vai poder ler ideias de aventuras que eu lanço
350580;352580;"03";lá no grupo de spoiler de vez em quando,
352580;355080;"03";me ajudar às vezes a escolher os jogadores,
355080;356580;"03";as vozes pros episódios,
356580;358080;"03";você pode fazer voz pros episódios.
358080;360080;"03";Nossa, é tanta vantagem
360080;362580;"03";que eu não sei nem por onde começar.
362580;364580;"03";Então seja nosso padrinho.
364580;367580;"03";Não quer usar o Apoia.se por qualquer motivo?
367580;369080;"03";Tem na Aurelo também.
369080;370580;"03";Gosto mais do Apoia.se,
370580;372080;"03";mas tem na Aurelo também.
372080;374080;"03";A Aurelo paga, bonitinho.
374080;376580;"03";É que a Aurelo às vezes demora um pouquinho e tal,
376580;378580;"03";e... não sei.
378580;380580;"03";O esquema dela é mais diferente.
380580;382580;"03";A Aurelo manda um e-mail perguntando,
382580;383580;"03";você quer que eu te pague?
383580;384580;"03";Aí eu tenho que dizer sim.
384580;386580;"03";Enquanto o Apoia.se,
386580;388080;"03";ela só deposita, né?
388080;389080;"03";É porque, assim, é óbvio.
389080;390580;"03";A Aurelo, se eu não fizer nada,
390580;392080;"03";ela não embolsa o dinheiro.
392080;392580;"03";Ela...
392580;395080;"03";Porque tem gente que prefere acumular, né?
395080;395580;"03";Tem gente que pode dizer,
395580;398080;"03";não, paga no próximo e tal, etc.
398080;399580;"03";Mas...
399580;401080;"03";Sei lá, tem as duas opções.
401080;404080;"03";Todas elas comem a mesma porcentagem.
404080;405580;"03";Então vem fazer parte.
405580;407580;"03";Tinham me cobrado já
407580;410580;"03";pra atualizar o nome dos padrinhos lá no post
410580;411580;"03";do último episódio.
411580;413080;"03";Já tá atualizado.
413080;415080;"03";Se teu nome não tá lá,
415080;416380;"03";é porque não apoia.se,
416380;419880;"03";tu pode botar a opção de deixar oculto, né?
419880;420880;"03";Então, se tu deixou oculto,
420880;423880;"03";eu não divulguei que você é nosso padrinho, né?
423880;424880;"03";Mas obrigado, mesmo assim.
424880;426880;"03";Se tu quiser que teu nome apareça,
426880;429380;"03";me manda uma mensagem lá no Telegram.
429380;431880;"03";E falta botar o pessoal que decidiu
431880;433380;"03";apoiar por Pix, né?
433380;435380;"03";O pessoal que já era padrinho velho,
435380;438380;"03";eu autorizei o pessoal a mandar por Pix.
438380;439880;"03";Teve gente até que fez
439880;441880;"03";vários meses de uma vez.
441880;442880;"03";Então, se quiser que ponha teu nome,
442880;444380;"03";me lembra lá no Telegram.
444380;445880;"03";E aos pouquinhos,
445880;447880;"03";eu vou atualizando aquela lista ali
447880;449380;"03";pra vocês também.
449380;450880;"03";E também, assim,
450880;452880;"03";pessoas que estavam, por algum motivo,
452880;455380;"03";devendo, tava lá no apoia.se,
455380;458880;"03";como, sei lá, o cartão não foi aceito,
458880;460380;"03";o boleto não foi pago,
460380;462380;"03";aí eu não botei também, né?
462380;463880;"03";Não sei se você deixou de me amar
463880;466380;"03";ou simplesmente apertou as contas.
466380;467880;"03";Mas sem problema.
467880;469380;"03";Qualquer coisa, me avisa também.
469380;470880;"03";A gente vai adicionando aos pouquinhos.
470880;472380;"03";Daqui a uns 4, 5 anos,
472380;474380;"03";eu devo atualizar aquela lista de novo.
474380;474880;"02, 03";É isso.
474880;475880;"03";Mas já falei demais.
475880;477380;"02, 03";Dois comentários só.
477380;479380;"03, 02";Pediram pra te lembrar de falar que é mais 18.
479380;480380;"03, 02";Ah, sim.
480380;481880;"02, 03";E o meu nome não tá nos apoiadores.
481880;482880;"03";Tu apoia pelo apoia.se?
482880;483880;"02, 03";Pelo Pix.
483880;484880;"03";Ah, tá, então.
484880;486880;"03";Mas lá no final tá, então.
486880;487880;"03";Se tu for até o final.
487880;488880;"03";Falta o pessoal do Pix
488880;490880;"02, 03";e quem colocou o privado como apoia.se.
490880;491880;"03, 02";Beleza.
491880;492880;"02, 03";Isso.
492880;494880;"03";Faltam o pessoal do Pix.
494880;495880;"03";Isso tá errado.
495880;496880;"03";Desculpa, Shelly.
496880;497880;"03";É...
497880;498880;"03";Faltam o pessoal do Pix
498880;500880;"03";e quem colocou como privado no apoia.se.
500880;501880;"03";Tá aqui.
501880;502880;"03";Então, o faltam pessoal
502880;503880;"03";tu é o pessoal do Pix.
503880;504880;"03";Mas vamos arrumar.
504880;505880;"03";Daqui a cinco anos,
505880;506880;"03";como disse a Agatha,
506880;508880;"00, 03";teu nome tá ali, Telemann, tá?
508880;509880;"03";Mas assim, ó.
509880;512880;"03";O teu nome não tá entre os apoiadores,
512880;514880;"03";mas teu nome tá ali em cima, ó.
514880;516880;"02, 03";Jogadores do Episódio.
516880;518880;"04, 02, 03";Agatha, Juleiva,
518880;521880;"03";duas entidades cósmicas do RPG Watcher
521880;523880;"03";e Rafael Telemann.
523880;524880;"01, 03";É.
524880;525880;"03";E tá ali a música,
525880;527880;"03";Morning, do Kane McLeod.
527880;529880;"03";Na verdade, é a Evelyn,
529880;530880;"03";se eu não me engano.
530880;531880;"03";Mas é do mesmo cara,
531880;532880;"03";no mesmo site.
532880;533880;"03";Então, eu tô errado,
533880;534880;"03";mas eu tô errado.
534880;535880;"03";Mas nem tanto.
535880;536880;"03";Vamos lá.
536880;537880;"03";Mas estamos aqui
537880;538880;"03";pra ler os comentários
538880;539880;"03";do último episódio
539880;540880;"03";que, no caso,
540880;542880;"03";foi o Segundo Sol.
542880;543880;"03";Primeiro episódio...
543880;544880;"03";Primeiro episódio...
544880;545880;"03";Primeiro comentário
545880;546880;"03";é do Jorge Marcos Santos Silva.
546880;547880;"03";Nós sabemos que cada episódio
547880;548880;"03";do RPG Watcher
548880;549880;"03";é uma história fechada.
549880;550880;"03";Mas, Watcher,
550880;552880;"03";uma continuação aqui.
552880;553880;"03";Pensa com carinho.
553880;554880;"03";Vou pensar.
554880;556880;"03";Bom dia, senhor Watcher,
556880;557880;"03";convidado e guachol.
557880;558880;"03";Tudo bem, queridos?
558880;559880;"03";Comigo, tudo bem.
559880;560880;"03";Tudo bem com o Diego Telemann?
560880;561880;"03";Bom dia.
561880;562880;"03";Spoilers.
562880;563880;"03";A primeira pergunta é
563880;565880;"03";o quanto os críticos
565880;567880;"03";aceleraram demais a campanha.
567880;568880;"03";Parte da história,
568880;569880;"03";assim, eu sabia,
569880;571880;"03";eu planejei tudo o que ia acontecer
571880;573880;"03";com os idosos ali,
573880;575880;"03";dos bichos e tal,
575880;576880;"03";e que eles iam fugindo.
576880;579880;"03";Mas, tanto a ex-pessoa,
579880;581880;"03";o personagem da Agatha,
581880;583880;"03";a...
583880;584880;"02, 03";Jett.
584880;585880;"02";Porra, eu...
585880;586880;"03, 02";Jett.
586880;588880;"03";Foi a criação da Agatha
588880;589880;"03";ali na hora.
589880;590880;"03";Então, adaptei a aventura
590880;591880;"03";ali em cima.
591880;592880;"03";Eu acho que mais...
592880;593880;"03";A interação dos jogadores
593880;594880;"03";afetou a aventura
594880;595880;"03";do que os críticos em si.
595880;596880;"03";Por exemplo,
596880;597880;"03";o final,
597880;598880;"03";se o...
598880;599880;"03";O...
599880;600880;"03";O...
600880;601880;"03";O...
601880;602880;"03";O...
602880;603880;"03";O...
603880;604880;"03";O...
604880;605880;"03";O...
605880;606880;"03";O...
606880;607880;"03";O...
607880;608880;"03";O...
608880;609880;"03";O...
609880;610880;"03";O...
610880;611880;"00, 03";O...
611880;612880;"00, 03";O...
612880;613880;"03";O...
613880;614880;"03";O...
614880;615880;"03";O...
615880;616880;"03";O...
616880;617880;"03";O...
617880;618880;"03";O...
618880;619880;"03";O...
619880;620880;"03";O...
620880;623880;"03";O...
623880;625880;"03";O...
625880;626880;"03";O...
626880;627880;"03";O...
627880;628880;"03";O...
628880;629880;"03";O...
629880;632880;"03";O...
632880;633880;"03";O...
633880;634880;"03";O...
634880;635880;"03";O...
635880;636880;"03";O...
636880;637880;"03";O...
637880;639880;"03";O...
639880;640880;"03";O...
640880;641880;"03";O...
641880;643880;"03";O...
643880;645880;"03";O...
645880;646880;"03";O...
646880;647880;"03";O...
647880;648880;"03";O...
648880;651220;"03";verdade, isso que pra ele importava.
651640;653100;"03";A proibição foi devida aos insetos
653100;654240;"03";ou à civilização antiga de lá?
654620;656400;"03";Aos insetos. Embora
656400;658720;"03";as notícias que rolavam
658720;661080;"03";no zap zap do futuro
661080;662960;"03";dos idosos, diziam que não,
663100;665060;"04, 03";que era por conta da civilização antiga.
665280;666820;"03";Os insetos seriam
666820;668660;"03";a própria civilização enraivecida,
669180;670760;"03";descendentes ou algo do gênero?
672300;673420;"03";Algo do gênero.
673500;674660;"03";Eu, assim, de novo,
674660;676500;"03";vou deixar em aberto, porque assim como
676500;678140;"03";a aventura a gente vai criando,
678140;680480;"03";se houver uma continuação, talvez eu mude isso.
681040;682600;"03";Mas a minha ideia inicial
682600;684300;"03";era a mesma ideia que
684300;686260;"03";pros aliens, que são como
686260;687820;"03";armas biológicas, sabe?
689220;690660;"03";Algo que foi criado
690660;692420;"03";e que talvez tenha saído do controle.
692800;694360;"03";Pode contar o que ocorreu de fato
694360;696160;"03";naquele lugar antes da proibição
696160;698580;"03";e o porquê dela? O pessoal chegou lá,
698760;700540;"03";ao invés de, sei lá, abraçar
700540;702340;"03";o chão, foi estudar
702340;704180;"03";o planeta, encontrou, sei lá,
704240;705840;"03";os ovos, como é que ficam,
705840;707780;"03";os casulos desses insetos
707780;709760;"03";e não era a época deles
709760;711540;"03";eclodirem, né?
712040;713780;"03";Então eles viram a tempo
713780;716140;"03";a potencial problema
716140;717460;"03";que daria aquele lugar.
717940;719720;"03";Sei lá, decidiram
719720;722100;"03";explodir o planeta, ou botar fogo,
722180;723800;"03";ou discutir, ou pegar pra estudar.
724200;725840;"03";Em algum lugar da galáxia tem um
726440;727680;"03";arquivo gigante
727680;730020;"03";sobre toda a discussão sobre o que fazia com aquele planeta
730020;731880;"03";que acabou se perdendo na burocracia.
732220;733180;"03";É isso que eu imagino.
733180;735120;"03";E o destino do restante
735120;737180;"03";do universo agora? Dependeríamos
737180;738820;"03";de uma continuação do episódio pra saber.
739160;740920;"02";Há alguma esperança? Sempre há uma esperança.
740940;743100;"02";Ótimo, dá pra você fazer o episódio 5 agora
743100;744840;"02";sobre o que aconteceu depois,
745300;747020;"02";o episódio 6 depois,
747600;749080;"03, 02";aí você faz o 1, 2 e o 3
749080;751100;"03, 02";sobre a criação e a descoberta
751100;752720;"03, 02";daquele planeta. Perfeito,
753140;755440;"03";perfeito. Vou anotar mentalmente
755440;757180;"03";que eu vou esquecer. Os insetos
757180;759240;"03";são realmente inteligentes? Possuem algum objetivo maior?
759620;761300;"03";Os insetos trabalham
761300;763040;"03";como uma mente única
763040;765400;"03";com um objetivo maior, sim.
765840;767160;"03";Não ficaria triste com o outro?
767160;769340;"03";Não ficaria triste
769340;771320;"03";com o outro episódio que respondesse algumas perguntas.
771600;772600;"03";Respondi um monte agora.
772980;775080;"03";Que episódio incrível. Jogadores, história, edição, tudo
775080;776900;"04, 03";primoroso. Fico sem palavras
776900;778680;"03";pra essa combinação de outro mundo
778680;780940;"03";ou mundos. Por hoje é isso, biscoito
780940;783020;"03";informado de insetos espaciais a todos, forçaluz
783020;784740;"03";a todos, nós e até mais.
785200;785840;"03";Até mais.
786640;789240;"03";Existem episódios, tipo, sei lá,
790240;791300;"03";não consigo lembrar nenhum,
791380;792180;"03";mas tem episódios que
792180;795100;"03";o peso maior é
795100;797140;"03";da minha mão. A ideia
797140;799140;"03";maior da história, o fio
799140;801240;"03";condutor sai da minha
801240;803180;"03";cabeça, embora obviamente
803180;803820;"03";os jogadores
803820;807040;"03";ajudem a conduzir esse fio
807040;809220;"03";e façam curvas e criam
809220;811140;"03";outras histórias. Esse episódio, como
811140;813420;"03";eu falei, ele tava mais solto.
813940;815160;"03";Poxa, o NPC
815160;817520;"03";que a Agatha criou, ele muda
817520;819440;"03";a dinâmica
819440;820740;"03";até da aventura,
821140;822300;"03";a cena dele entrando
822300;825120;"03";no salão e sacando
825120;827120;"03";a pistola e dizendo que ama,
827140;829160;"03";tudo isso, porra, foi criação
829160;830820;"03";nossa ali na hora. Então,
831300;832860;"03";esse episódio é um
832860;835080;"03";exemplo clássico dos jogadores
835080;836960;"03";que são 50% do episódio. Telemann
836960;839040;"03";podia só ter entrado na cena e ele
839040;840820;"03";escolheu, não, eu vou pegar a nave
840820;843220;"03";e vou, sem pousar,
843400;844580;"03";botar na janela.
845140;847280;"03";Poxa, assim, sabe, criou uma dinâmica
847280;849060;"03";assim que tu consegue ver um filme
849060;851120;"03";dessas coisas acontecendo. Então,
851280;852360;"03";porra, incrível, incrível.
852920;854820;"03";Eu, assim,
855700;857060;"03";esse episódio se bobear,
857140;859120;"03";é 51% dos jogadores.
859160;861080;"03";Boa ideia. Só quem é mais
861080;862980;"03";40 pegou essa piada do Telemann.
863480;865280;"02";É pra conectar com os idosos do episódio.
865540;866960;"02";Pode ir. Depois a gente teve o
866960;868960;"02";Ponto Piron e mandou
868960;871480;"02";Olá, Guaxa e Guaxa Amigos.
871760;872360;"02";Cês tão bom?
872900;874960;"02";É, posso dizer que sim. Cê tá bem, Guaxa?
875220;877240;"02, 03";Tô bem. Rapaz, que episódio ótimo.
877520;878840;"02";Narrador, jogadores
878840;880640;"02";e editor, que são
880640;883180;"02";188% do episódio,
883740;884980;"02";brilharam mais que o segundo
884980;886920;"02";do sol chegando. Eu não entendi essa
887140;888920;"02";temática, mas tudo bem. Eu entendi.
889460;891300;"02";Somente passando pra deixar biscoito
891300;893420;"02";em forma de coleópteros
893420;895360;"02";espaciais. Caraca.
895840;897460;"02";E dizer que falta um biólogo
897460;899140;"02";infectologista nesse grupo.
899700;901120;"02";Porém, no fim, o velhinho tinha um plano
901120;903400;"02";e deu tudo certo. Eu acho. É isso.
903800;905520;"02";Beijo. Um abraço pra vocês.
905920;907380;"02";Pra ele deu certo.
907720;908640;"02";Deu bem certo, né?
909060;911020;"02";Isso de ter biólogo infectologista,
911460;913520;"02";quando a gente tava montando os personagens,
914180;915220;"02";a Agatha
915220;917120;"02";pegou um personagem mais...
917140;919540;"02";mais... morradeiro, mais...
919540;920980;"02";aquela coisa de origem policial.
922080;923540;"02";Aí, acho que depois...
923540;925140;"02";Acho que a primeira foi a Ju, que pegou
925660;927380;"02";uma piloto,
927940;929640;"02";Furry, vale dizer.
930560;931160;"02, 03";E...
931160;933360;"03";Sim, do nada, né? Tipo, não tinha nada
933360;934700;"03";disso no background da aventura.
935080;936180;"04, 03";Ela botou. Eu, ok.
936800;938440;"03";É um alien,
938860;941140;"03";prótese, ela fez tudo aquilo com
941140;943100;"03";cirurgia? Não sei.
943460;945400;"02, 03";Tá lá. Não, então uma parte do episódio
945400;947080;"02";é que ela fala, não, eu não preciso de arma,
947140;948540;"02";dura, meu pelo me protege.
949040;950360;"02";Eu fiquei meio...
950360;953120;"02";meio... curiu. É, estranhando esse momento.
953500;955160;"02";Ela sendo 51% do episódio.
955540;956080;"02";É verdade.
956920;959100;"02";E aí, eu tava
959100;961140;"02";montando e em algum momento eu lembrei...
961680;963120;"02";Sei lá porque eu pensei em fazer o
963120;965140;"02";músico, mas que ao mesmo tempo ele era...
966420;967140;"02";guerreiro
967140;968700;"02";da nave. Aí virou aquilo.
969180;970980;"02";Ok. Deu certo. Acabou?
971380;973160;"03, 02";Pode seguir. Pô, o teu é tão pequenininho,
973240;974880;"03";o meu é só tão grande, que maldade. Vamos lá.
976020;977120;"03";Foi isso que ela disse.
977140;978260;"03";Hahaha.
981920;983300;"03";Próximo comentário
983300;984800;"03";é do Matheus Belo.
985380;987440;"03";Olá, guaxa e guaxa-munidade.
987800;988820;"03";Convidade que se exploda.
989120;991240;"04, 00, 03";Queria dizer que esse episódio juntou
991240;992620;"03";duas paixões minhas.
992980;995460;"03";Arqueologia e exploração espacial.
995940;997400;"03";Como arqueólogo, devo dizer
997400;999200;"03";que fiquei me coçando querendo
999200;1001120;"03";ver o grupo explorar mais das ruínas
1001120;1003080;"03";e ter mais explicações do Orion.
1003520;1005120;"03";E tô bem curioso para ver
1005120;1007120;"03";como funciona essa comunidade galáctica.
1007140;1008640;"03";Agora as perguntas.
1009020;1010760;"03";Esse é o mesmo cenário de sangue no espaço?
1010980;1012500;"03";Eva e episódios espaciais?
1012840;1013640;"03";Não faço ideia.
1014140;1015880;"03";Sim, eu só...
1015880;1018380;"03";Talvez a resposta certa.
