3332900;3334900;;"11";que tá sempre rolando jogo.
3334900;3336900;;"11";Eu já joguei algumas vezes. Eu e minha filha jogamos
3336900;3338900;;"11";Among Us. Aquele jogo do
3338900;3340900;;"11";espacial com padrinhos, né?
3340900;3342900;;"11";Já aconteceu de uma aventura semestrada
3342900;3344900;;"11";exclusivamente pros padrinhos estarem acompanhando.
3344900;3346900;;"11";Pretendo fazer mais uma dessa até
3346900;3348900;;"11";final do ano. Então, vai lá.
3348900;3350900;;"11";Assina. Tem acesso a spoiler.
3350900;3352900;;"11";Episódio antecipado. Pode
3352900;3354900;;"11";gravar. Lá no começo as regras pra
3354900;3356900;;"11";ter tua voz eternizada num episódio.
3356900;3358900;;"11";Ou mesmo fazer a voz de um NPC.
3358900;3360900;;"11";As vantagens são gigantescas.
3360900;3362900;;"11";E siga a gente nas redes sociais.
3362900;3364900;;"11";Arroba Marcelo Guaxinim. Arroba RP Guaxa.
3364900;3366900;;"11";Tanto no Twitter quanto no Instagram.
3366900;3368900;;"11";Pode não parecer, mas isso ajuda muito
3368900;3370900;;"11";receber o carinho de vocês.
3370900;3372900;;"11";Nessas redes sociais.
3372900;3374900;;"11";Quero agradecer aos jogadores. E primeiro a Sinara.
3374900;3376900;;"11";Que faz parte lá do Projeto Drama, né?
3376900;3378900;;"11";Então quero agradecer muito a Sinara.
3378900;3380900;;"11";Quem não conhece o Projeto Drama, vai lá.
3380900;3382900;;"11";Eu já citei ele na semana passada.
3382900;3384900;;"11";No dia 13 eles começaram a nova temporada.
3384900;3386900;;"11";Então dá tempo de acompanhar.
3386900;3388900;;"11";Dá tempo de ouvir a temporada anterior
3388900;3390900;;"11";e acompanhar essa agora. Embora
3390900;3392900;;"11";sejam independentes, né? Tu pode ouvir
3392900;3394900;;"11";como tu quiser. Quero agradecer a Shelly
3394900;3396900;;"11";lá do RPG Next.
3396900;3398900;;"11";Do Contínuo e do Pode Isso.
3398900;3400900;;"11";Ela que sempre tá aqui. É a pessoa
3400900;3402900;;"11";que mais gravou. Que fez uma pequena
3402900;3404900;;"11";operaçãozinha recentemente. Tá afastada
3404900;3406900;;"11";das gravações por um tempo. Então vão lá.
3406900;3408900;;"11";Sigam a Shelly também no Twitter. Mande energias
3408900;3410900;;"11";positivas pra ela pra ela se recuperar logo.
3410900;3412900;;"11";E por último, meu amigo, parceiro.
3412900;3414900;;"11";O Danilo Battistini.
3414900;3416900;;"11";Que trouxe essa loucura pro episódio.
3416900;3418900;;"11";O Danilo tem um contador de histórias.
3418900;3420900;;"11";Que é um podcast de audiodrama maravilhoso.
3420900;3422900;;"11";Pra quem não conhece, o Danilo
3422900;3424900;;"11";ele edita os grandes especiais
3424900;3426900;;"11";do RPG Guaxinim. Cavaleiros do Bicho.
3426900;3428900;;"11";Os episódios de Natal.
3428900;3430900;;"11";Então vão lá. Conheçam o trabalho do Danilo.
3430900;3432900;;"11";Recomendo. Falando de
3432900;3434900;;"11";audiodrama. O editor desse episódio
3434900;3436900;;"11";é um editor novo. É o Gustavo Lorenzon.
3436900;3438900;;"11";Ele é uma recomendação lá do Biel.
3438900;3440900;;"11";Lá da Taverna do Beholder. Como vocês puderam ver.
3440900;3442900;;"11";É um editor maravilhoso. O episódio
3442900;3444900;;"11";ficou curtinho. Porque como eu falei. É um episódio
3444900;3446900;;"11";que a gente gravou
3446900;3448900;;"11";e já mandou pra edição. O tempo era curto pra sair.
3448900;3450900;;"11";Então foi uma aventura mais curta.
3450900;3452900;;"11";Mas ele segurou bem. Botou bem os efeitos.
3452900;3454900;;"11";Deu esse clima maravilhoso
3454900;3456900;;"11";pro episódio. Então só posso
3456900;3458900;;"11";agradecê-lo. E vocês terão mais episódios
3458900;3460900;;"11";editados pelo Gustavo. Aqui.
3460900;3462900;;"11";O Gustavo também tem um audiodrama.
3462900;3464900;;"11";Que é o Redfoot RPG.
3464900;3466900;;"11";Eles estão... Até o momento
3466900;3468900;;"11";da gravação aqui saiu só o prólogo.
3468900;3470900;;"11";Então pra quem quer começar um projeto...
3470900;3472900;;"11";Quem quer começar a acompanhar um projeto novo.
3472900;3474900;;"11";Dá uma olhada lá. Eles também tem PicPay.
3474900;3476900;;"11";Então conheça o Redfoot. Eu vou deixar
3476900;3478900;;"11";aqui na descrição.
3478900;3480900;;"11";As redes sociais dele. Se você quiser aproveitar.
3480900;3482900;;"11";Tá precisando de editor. Procura o Gustavo.
3482900;3484900;;"11";Que não só o Biel recomenda agora.
3484900;3486900;;"11";Eu recomendo também.
3486900;3488900;;"11";Esse episódio foi
3488900;3490900;;"11";revisado pela Deb Cabral mais uma vez.
3490900;3492900;;"11";Maravilhosa. É engraçado que ela tá lá no Reino Unido.
3492900;3494900;;"11";Então normalmente eu faço essas coisas
3494900;3496900;;"11";de podcast depois do meu expediente.
3496900;3498900;;"11";Ou seja, ela já tá dormindo. Quando eu mando
3498900;3500900;;"11";os podcasts pra ela.
3500900;3502900;;"11";E acordar com a análise dela.
3502900;3504900;;"11";Elogios pelas ideias que eu tive.
3504900;3506900;;"11";É sempre maravilhoso. Então agradeço muito a Deb.
3506900;3508900;;"11";Quer economizar? Tem algumas lojas parceiras
3508900;3510900;;"11";no post. Mas como eu já falei
3510900;3512900;;"11";já no episódio passado.
3512900;3514900;;"11";Esse episódio é da Promobit.
3514900;3516900;;"11";Então quer economizar?
3516900;3518900;;"11";Vai na Promobit. Quer conhecer nossas lojas
3518900;3520900;;"11";parceiras? Vai no post.
3520900;3522900;;"11";Quer economizar das duas formas. Isso eu garanto pra você.
3522900;3524900;;"11";Como eu falei antes.
3524900;3526900;;"11";Quem dá voz aos NPCs. Eu gravo
3526900;3528900;;"11";episódios como se fosse um RPG normal.
3528900;3530900;;"11";Com a minha voz. Depois eu peço pros padrinhos
3530900;3532900;;"11";gravarem com as vozes deles.
3532900;3534900;;"11";E o editor substitui. Então quem gravou
3534900;3536900;;"11";vozes pra esse episódio. O próprio
3536900;3538900;;"11";Gustavo Lourençon. Que além de
3538900;3540900;;"11";ser o editor desse projeto.
3540900;3542900;;"11";Ele é padrinho de muito tempo.
3542900;3544900;;"11";Ele fez a voz do rapaz
3544900;3546900;;"11";no WhatsApp. Logo no começo.
3546900;3548900;;"11";Da pessoa que trabalhava na primeira loja.
3548900;3550900;;"11";O Pombo foi feito pelo Rodrigo Azevedo.
3550900;3552900;;"11";A barata foi feita pela
3552900;3554900;;"11";Jéssica Loiana. A nossa Mel.
3554900;3556900;;"11";A menina que fala no final do episódio
3556900;3558900;;"11";foi feita pela minha filha. Pela Malu.
3558900;3560900;;"11";O boneco lixo. O boneco
3560900;3562900;;"11";claramente. Claramente
3562900;3564900;;"11";inspirado. Pra não ser plagiado.
3564900;3566900;;"11";No filme do Toy Story. Ele foi feito
3566900;3568900;;"11";pelo João Pedro Rodrigues.
3568900;3570900;;"11";O Pinóquio foi feito pelo Gilles Azevedo.
3570900;3572900;;"11";O espantalho foi feito pelo
3572900;3574900;;"11";Felipe Xavier. A bailarina de brinquedo
3574900;3576900;;"11";foi feita pela Jujuba.
3576900;3578900;;"11";O Stromboli. O vilão do Pinóquio. Feito pelo
3578900;3580900;;"11";Mateus Araújo. E o Gato Léo.
3580900;3582900;;"11";Foi feito pelo JP Bunch.
3582900;3584900;;"11";Todos eles são madrinhas ou padrinhos
3584900;3586900;;"11";do RP Guaxa. Quer ter sua voz
3586900;3588900;;"11";no próximo? Seja nosso
3588900;3590900;;"11";padrinho também. Embora tenha bastante gente no
3590900;3592900;;"11";grupo. E às vezes demora alguém conseguir fazer
3592900;3594900;;"11";uma voz. Que é a dica. E tem que ter um áudio bom também.
3594900;3596900;;"11";Fica o disclaimer. Por enquanto é isso.
3596900;3598900;;"11";Episódio curtinho.
3598900;3600900;;"11";Mas feito com muito amor e carinho.
3600900;3602900;;"11";Pra você ouvir com suas crianças.
3602900;3604900;;"11";Lembre que
3604900;3606900;;"11";a Black Friday é uma época
3606900;3608900;;"11";de gastar e comprar.
3608900;3610900;;"11";Mas a principal mensagem deste episódio
3610900;3612900;;"11";é que existem coisas
3612900;3614900;;"11";mais importantes a serem lembradas.
3614900;3616900;;"11";Beijo no coração de vocês.
3616900;3618900;;"11";Rolem 6. Rolem 20.
3618900;3620900;;"11";E se tudo é errado rola no chão. Que apaga o fogo
3620900;3622900;;"11";e diverte.
3622900;3624900;;"01, 11";Beijo pra vocês gente.
3640900;3642900;;"01";Tchau.
